sitio_noticias,fecha,seccion,titular,cuerpo,url
Noticias Violeta,2026-06-16,Nacional,"Escasea diesel, 5 mil chóferes están varados y gobierno mantiene negativa a declarar Estado de Sitio|| Rodriguismo conmina al gobierno a reorganizar su gabinete y amenaza con salir a desbloquear.","La Paz, 16 de junio (ANV).- Largas filas por gasolina volvieron a registrarse este martes en La Paz y Cochabamba ante una reducción en el abastecimiento de combustible, mientras más de 5.000 conductores de carga pesada permanecen varados desde hace más de seis semanas en distintos puntos del país, en condiciones que ellos mismos califican como “inhumanas”, sin acceso a alimentos, medicamentos ni servicios básicos, según denunciaron transportistas y la Cámara Nacional de Transporte (CNT). Mientras tanto el gobierno mantiene la negativa a declarar Estado de Sitio.

En La Paz, una extensa hilera de vehículos se formó en un surtidor ubicado entre las avenidas Jaime Freire y Valentin Abecia. Conductores reportaron que la fila se extendía por más de diez cuadras mientras aguardaban la llegada de una cisterna para la descarga del combustible. La espera se prolongó durante varias horas. La situación también se replicó en Cochabamba, donde en distintos surtidores de la zona norte se registraron largas filas. Algunos conductores señalaron que permanecieron toda la noche en los alrededores de las estaciones de servicio.

El transporte pesado de Tarija denunció que desde el 15 de junio se intensificaron las filas en los surtidores para adquirir diésel, a pesar de que en el departamento no se registran bloqueos. Los transportistas consideran que el abastecimiento debería desarrollarse con normalidad. Según reportes del sector comercializador, la reducción en la provisión habría provocado la acumulación de vehículos en diferentes puntos del país, afectando tanto a conductores particulares como a operadores del transporte público y de carga.

Uno de los puntos más críticos para los transportistas varados es la zona de Sayari, en la carretera entre Cochabamba y Oruro, donde sufren por las bajas temperaturas del invierno. El transportista Víctor Garvizu, varado desde inicios de mayo, relató a EFE: “Nuestras condiciones son inhumanas, no tenemos medicamentos, víveres. Estamos secuestrados por los bloqueadores”. Los conductores consumen agua de un riachuelo que deben hervir previamente y se organizaron en pequeños grupos para conseguir alimentos.

El presidente del Comité Nacional Multisectorial, Leonel Codorhuarira, señaló que la población paceña está cansada de los bloqueos y anunció que este miércoles saldrán a desbloquear carreteras. “Oruro también determinó salir a desbloquear”, informó. Señaló que ya son 46 días de bloqueo y que en La Paz la situación es crítica. También consideró que el presidente Rodrigo Paz debe reorganizar su gabinete ministerial y “tomar en cuenta indígenas en su gobierno”.

La Defensoría del Pueblo, la Cruz Roja Boliviana y Cáritas iniciaron una caravana de ayuda humanitaria para llevar alimentos y medicamentos a unos 600 camioneros atrapados entre La Paz y Oruro. Mientras tanto, camioneros paraguayos pidieron ayuda de las autoridades al denunciar que llevan 44 días varados en la frontera entre Perú y Bolivia. “Apelamos a la solidaridad de la gente”, afirmó el conductor Claudio Arrúa. El sector del transporte se declaró en estado de emergencia y advirtió que podría asumir medidas de presión si el Gobierno no atiende sus demandas.

Agencia de Noticias Violeta | Celular 72441200",https://noticiasvioleta.com/escasea-diesel-5-mil-choferes-estan-varados-y-gobierno-mantiene-negativa-a-declarar-estado-de-sitio/
Noticias Violeta,2026-06-16,Nacional,CSUTCB ratifica bloqueo nacional de caminos|| Para el movimiento campesino la movilización nacional posee un “carácter orgánico e inclaudicable”,"La Paz, 16 de junio (ANV).- La Comisión de Justicia de la Confederación Sindical Única de Trabajadores Campesinos de Bolivia (CSUTCB) denunció presuntas vulneraciones a los derechos humanos durante las movilizaciones sociales y cuestionó que una misión internacional de derechos humanos proveniente de Argentina no haya podido ingresar al país para verificar la situación, al tiempo que ratificó la continuidad de los bloqueos hasta lograr la renuncia del presidente Rodrigo Paz.

Durante una conferencia de prensa, los representantes señalaron que varios manifestantes fueron víctimas de discriminación y represión. “Hermanos discriminados, hermanas escupidas, hermanos pateados”, denunciaron al presentar un informe sobre los hechos registrados en las movilizaciones. Asimismo, expresaron su solidaridad con la delegación argentina que fue impedida de realizar su labor de observación. “Lamentamos y repudiamos el accionar del Gobierno central”, señalaron.

La CSUTCB también rechazó versiones sobre un supuesto repliegue de las medidas de presión y aseguró que los bloqueos continúan en diferentes regiones. “No hay ningún levantamiento de bloqueos; más al contrario, nuestros hermanos continúan con más fuerza y están más firmes que nunca”, afirmaron . La organización ratificó que mantiene su demanda de renuncia del presidente Rodrigo Paz y sostuvo que las decisiones adoptadas por las bases serán respetadas y respaldadas por sus dirigentes mientras continúe el conflicto social .

El secretario de la CSUTCB, Severo Marca, fundamentó que la movilización nacional posee un “carácter orgánico e inclaudicable” y arremetió contra la gestión del jefe de Estado, asegurando que el actual mandatario “traicionó la agenda programática presentada durante los comicios generales” . Según Marca, el gobierno de Paz estaría pretendiendo forzar escenarios de negociación y fragmentar la unidad de las organizaciones sociales mediante acuerdos con dirigentes que carecen de representatividad real .

Agencia de Noticias Violeta | Celular 72441200",https://noticiasvioleta.com/csutcb-ratifica-bloqueo-nacional-de-caminos/
Noticias Violeta,2026-06-16,Nacional,Paz apuesta por agotar a los manifestantes mientras bloqueos dejan pérdidas superiores a $us 2.500 millones|| Gobierno opta por el descabezamiento de dirigentes antes que por estado de excepción,"El gobierno de Rodrigo Paz se aleja de la opción de mano dura para poner fin a las protestas que cumplen siete semanas y opta por una estrategia de desgaste de los manifestantes y desarticulación de liderazgos mediante detenciones y cooptación, mientras el conflicto ya deja pérdidas económicas superiores a los 2.500 millones de dólares y afecta a miles de familias, según el Instituto Boliviano de Comercio Exterior (IBCE).

El ministro de Gobierno, Marco Antonio Oviedo, aseguró que el conflicto está entrando en su “fase final”. Los puntos de bloqueo pasaron de 90 a poco más de 50, según la ABC. El vocero José Luis Gálvez afirmó: “La nueva Bolivia se construirá con diálogo, sin dar lugar a la violencia”. Sin embargo, organizaciones campesinas denuncian que dirigentes están siendo cooptados o detenidos.

El alto número de detenciones de ejecutivos sindicales hace pensar en una estrategia de descabezamiento. La COB denunció “arrestos irregulares” por parte de “policías encapuchados”. Algunos líderes como Mario Argollo se han declarado en la clandestinidad. Otros dirigentes han aceptado dialogar, lo que ha generado fracturas internas. “Los violentos les han quemado sus casas y prohibido dialogar”, confesó Gálvez.

El dirigente Severo Marca reprochó: “Las reuniones son con dirigentes que no representan al movimiento. Los que nos mantenemos leales estamos con el pueblo”. Las poblaciones campesinas de La Paz continúan con medidas de presión. Una nueva marcha se dirigió al Palacio de Gobierno. El dirigente Vicente Salazar fue detenido y liberado poco después.

El analista Guido Alejo sostuvo que el Gobierno baraja el despliegue militar como “última opción”. “Sabe que el costo político puede ser contraproducente y acelerar su caída”, afirmó. El periodista Andrés Gómez señaló que la estrategia de desgaste “reduce el número de muertos” pero el “costo político es enorme”. Los bloqueos han provocado la impaciencia de la población paceña.

El gerente del IBCE, Gary Rodríguez, advirtió que “hoy somos un país más pobre que hace dos meses”. El impacto económico supera el 2% del PIB. “Los daños macroeconómicos son enormes, pero en muchos casos los efectos sobre pequeños productores pueden ser irreparables”, alertó. Las exportaciones enfrentan retrasos y las importaciones de insumos registran interrupciones. La crisis combina conflictos sociales y pérdida de confianza.

Agencia de Noticias Violeta | Celular 72441200",https://noticiasvioleta.com/paz-apuesta-por-agotar-a-los-manifestantes-mientras-bloqueos-dejan-perdidas-superiores-a-us-2-500-millones/
Noticias Violeta,2026-06-16,Nacional,Categoría:Nacional,"El gobierno de Rodrigo Paz se aleja de la opción de mano dura para poner fin a las protestas que cumplen siete semanas y opta por una estrategia de desgaste de los manifestantes y desarticulación de liderazgos mediante detenciones y cooptación, mientras el conflicto ya deja pérdidas económicas superiores a los 2.500 millones de dólares y afecta a miles de familias, según el Instituto Boliviano de Comercio Exterior (IBCE). El ministro de Gobierno, Marco Antonio Oviedo, aseguró que el conflicto está entrando en su “fase final”. Los puntos de bloqueo…

La Paz, 16 de junio (ANV).- La Comisión de Justicia de la Confederación Sindical Única de Trabajadores Campesinos de Bolivia (CSUTCB) denunció presuntas vulneraciones a los derechos humanos durante las movilizaciones sociales y cuestionó que una misión internacional de derechos humanos proveniente de Argentina no haya podido ingresar al país para verificar la situación, al tiempo que ratificó la continuidad de los bloqueos hasta lograr la renuncia del presidente Rodrigo Paz. Durante una conferencia de prensa, los representantes señalaron que varios manifestantes fueron víctimas de discriminación y represión. “Hermanos discriminados,…

La Paz, 16 de junio (ANV).- Largas filas por gasolina volvieron a registrarse este martes en La Paz y Cochabamba ante una reducción en el abastecimiento de combustible, mientras más de 5.000 conductores de carga pesada permanecen varados desde hace más de seis semanas en distintos puntos del país, en condiciones que ellos mismos califican como “inhumanas”, sin acceso a alimentos, medicamentos ni servicios básicos, según denunciaron transportistas y la Cámara Nacional de Transporte (CNT). Mientras tanto el gobierno mantiene la negativa a declarar Estado de Sitio. En La Paz,…

La Paz, 15 de junio (ANV).- A una semana del hallazgo de 108 toneladas de droga en Chile, la Cancillería no ha aclarado por qué la esposa del viceministro de Comercio Exterior, Rodrigo Arce, figura como gerente de una naviera vinculada a al menos cinco de los contenedores investigados, mientras el vicepresidente Edmand Lara afirmó que “crecen las dudas sobre una posible protección al narcotráfico desde las más altas esferas del poder” y la oposición anunció una comisión especial en Diputados. La red DTV accedió a documentación que prueba que…

La Paz, 14 de junio (ANV).- El presidente Rodrigo Paz informó este sábado que, «gracias» al diálogo entre distintos sectores, más de 20 puntos de bloqueo fueron levantados en diversas regiones del país durante las últimas 24 horas, sectores campesinos determinaron reforzar las medidas de presión en Cochabamba y la Central Obrera Boliviana (COB) convocó a un ampliado nacional que volvió a aplazarse este domingo.  A través de sus redes sociales, el mandatario destacó que la apertura al diálogo ha contribuido a reducir las medidas de presión y mejorar el…

Tras 45 días de medidas de presión, autoridades y representantes de la provincia Aroma determinaron radicalizar los bloqueos y mantener la movilización contra el Gobierno, mientras que cabildos en Viacha, la provincia Camacho, Caranavi y el punto del km 50 en Yapacaní ratificaron sus protestas indefinidas con una sola exigencia: la renuncia del presidente Rodrigo Paz. En la provincia Aroma, durante un ampliado realizado en la urbanización Vilaque, las centrales agrarias decidieron “masificar el bloqueo indefinido desde las 00:00 horas de este lunes 15 de junio, hasta lograr la renuncia…

La Paz, 11 de junio (ANV).- El vicepresidente Edmand Lara respondió al ministro de Gobierno, Marco Antonio Oviedo, cuestionando la propuesta de conformar delegaciones para investigar el caso de las 108 toneladas de droga camuflada en madera hallada en Chile, y le atribuyó responsabilidad directa: “Falló usted como ministro, falló el comandante general de la Policía, falló el director de la FELCN y falló el exviceministro de Sustancias Controladas, Ernesto Justiniano; fracasó toda la política de Estado en la lucha contra el narcotráfico”. Lara afirmó que “Bolivia no necesita más…

La Paz, 11 de junio (ANV).- Organizaciones afiliadas a la Central de Trabajadores de Bolivia convocaron para este viernes a la “Gran Marcha Ciudadana en Defensa del Pueblo Boliviano”, que partirá desde el Atrio de la UMSA a las 17:30, para exigir al Gobierno medidas urgentes que enfrenten el desabastecimiento de combustible, alimentos y medicamentos que afecta a miles de familias. Los organizadores denunciaron que el país atraviesa una situación crítica y advirtieron que la paralización de carreteras está golpeando severamente la economía nacional. Señalaron que el incremento de precios,…

En la ciudad de El Alto se encendieron las alarmas tras el hallazgo de restos óseos que pertenecerían a canes. El descubrimiento se dio en inmediaciones de la Plaza del Dinosaurio, en la zona de Rio Seco. La intendencia Municipal inició investigaciones tras la sospecha de que esa carne podría haber sido utilizada para elaborar embutidos. El secretario municipal de Seguridad Ciudadana, Elio Pacheco, señaló que se realizarán revisiones a las cámaras de seguridad y las investigaciones correspondientes a las muestras para confirmar la procedencia animal. En caso de confirmar…

La Paz, 10 de junio (ANV).- Una multitudinaria jornada de protesta reunió este miércoles a organizaciones sociales, sindicales, campesinas y vecinales —encabezadas por la COB, la Federación Túpaj Katari, la FEJUVE de El Alto y organizaciones mineras— que marcharon por el centro de La Paz para exigir la renuncia del presidente Rodrigo Paz, en rechazo a la reciente promulgación de la Ley 1740 de Estados de Excepción y a la calificación gubernamental de “narcoterroristas” contra los movilizados. La Federación Túpac Katari concentró a delegaciones de las 20 provincias paceñas en…

Agencia de Noticias Violeta | Celular 72441200",https://noticiasvioleta.com/categor%C3%ADas/nacional/
La Época,2026-06-16,Nacionales,Autoridades de Bolivia impiden ingreso de Misión Humanitaria,"Buenos Aires-.  Autoridades del gobierno del derechista Rodrigo Paz impidió hoy la entrada a Bolivia de la Misión de Veedores de Derechos Humanos de Argentina cuyos miembros fueron detenidos en el aeropuerto de El Alto en La Paz.

Si bien había pasado sin inconvenientes por Santa Cruz de la Sierra, al llegar a la capital boliviana el grupo de observadores argentinos fue devuelto a Santa Cruz, donde lo retuvieron en el avión para deportarlos al aeropuerto internacional de Ezeiza, Buenos Aires, denunciaron sus miembros en un comunicado bajo el título: “La solidaridad internacional no es delito”.

La misión fue convocada por legisladores, organizaciones sociales y población civil de Argentina, con el fin de investigar las incesantes violaciones a los derechos humanos en el marco de la represión estatal que se ejecuta para impedir el legítimo y constitucional derecho a la protesta del pueblo boliviano.

La expulsión de la misión constituye una decisión política violatoria de la Constitución del Estado Plurinacional de Bolivia y de los Tratados de Derechos Humanos, enfatizan los veedores argentinos.

Además, atenta contra los fueros diplomáticos del diputado nacional Juan Marino y las legisladoras de Ciudad de Buenos Aires Vanina Biasi e Ingrid Urrutia.

“Este accionar dictatorial avasalla los derechos de los pueblos a ser observados y relevadas las violaciones de los derechos humanos que se difunden en medios de comunicación y redes sociales desde hace más de 40 días, y que son de público conocimiento”, recalca el comunicado con la denuncia.

La represión estatal y paraestatal que impulsa el gobierno boliviano ya contabiliza una decena de asesinatos, además se denuncian centenares de presos políticos con padecimientos de torturas en los lugares de detención.

Igualmente, hay ausencia de asistencia médica a los heridos; secuestros de dirigentes sindicales, campesinos y pueblos originarios; agresiones a la prensa durante las protestas; estigmatización de los manifestantes; actos de discriminación y racismo, denuncian.

“Llamamos a las organizaciones de Derechos Humanos, políticas y sindicales a estar alertas ante la situación por la que está pasando la Misión humanitaria”, exhortan los observadores rechazados en Bolivia.

Integran la misión el diputado nacional Juan Marino (Unión por la Patria) y las legisladoras de Ciudad de Buenos Vanina Biasi e Ingrid Urrutia (ambas del Frente de Izquierda); Matías Gayol (Partido Piquetero), Soledad Mosquera (Asociación de Docente/Izquierda Socialista) y María José Cano (Central de Trabajadores de Argentina Autónoma).

También la conforman Alejandrina Barry (Centro de Profesionales por los Derechos Humanos), Ailén Beraldo (Pan y Rosas Argentina / Asociación de Docentes), Emmanuel Cuello (Partido comunista de Argentina), Martín Illanez, (Coordinadora Argentina de Derechos Humanos) y Andre Reile (Liga por los Derechos Humanos)

Los otros miembros son Facundo Nahuel, Matías Bohl, César Villca Tupa, María Pomacusi, Leonardo Arias y Maria del Rosario Hasperue.",https://www.la-epoca.com.bo/2026/06/15/autoridades-de-bolivia-impiden-ingreso-de-mision-humanitaria/
La Época,2026-06-16,Internacionales,Pueblo mapuche de Chile rechaza intento de modificar Ley Indígena,"Santiago de Chile-.  Representantes de comunidades mapuche llegaron hoy hasta el Palacio de La Moneda, sede del poder ejecutivo, para rechazar el intento del actual gobierno chileno de modificar la Ley Indígena.

En un encuentro con la prensa, advirtieron que cambiar esta legislación contraviene derechos internacionales, los cuales permiten a los pueblos originarios hacer uso legítimo de las tierras ancestrales.

Afirman que eliminar la protección legal facilitaría el despojo de sus territorios y favorecería la especulación inmobiliaria o el monocultivo, vulnerando su cosmovisión.

Los manifestantes también se oponen a modificar la Ley Lafkenche, que entrega a comunidades la administración de los Espacios Costeros Marinos de Pueblos Originarios para preservar sus tradiciones, pesca, recolección y prácticas espirituales.

En declaraciones a Prensa latina, Francisco Vera Millaquen, de la Coordinadora de Comunidades Mapuche Huilli Lafken Weichan, denunció el intento de despojarlos de los derechos adquiridos de proteger el borde costero y sus recursos.

El werkén (portavoz) afirmó que existen autoridades que intentan echar abajo esta normativa para favorecer a la industria salmonera.

Explicó que su organización abarca desde las regiones sureñas de Los Ríos hasta la de Aysén y nació en 2017 en respuesta a la catástrofe ambiental provocada en 2016 por el vertido de más de nueve mil toneladas de salmón podrido en los canales de Chiloé.

La Coordinadora llamó al Estado chileno, a su presidente, autoridades civiles, militares y a la sociedad en su conjunto a respetar las normas internacionales y aplicar en su cabalidad el Convenio 169 de la Organización Internacional del Trabajo (OIT) sobre pueblos indígenas.

Los representantes de la organización mapuche viajaron a Santiago y la ciudad de Valparaíso para reunirse con distintas autoridades y mañana tienen previsto entrevistarse con Fabiola Campillai, presidenta de la Comisión de Derechos Humanos del Senado.",https://www.la-epoca.com.bo/2026/06/16/pueblo-mapuche-de-chile-rechaza-intento-de-modificar-ley-indigena/
La Época,2026-06-16,Internacionales,Noboa decreta otro estado de excepción en 10 provincias de Ecuador,"Quito-. El presidente de Ecuador, Daniel Noboa, decretó hoy un nuevo estado de excepción por grave conmoción interna en 10 provincias y tres cantones del país donde persiste la inseguridad.

De acuerdo con el Decreto Ejecutivo 432, bajo esa condición de excepcionalidad estarán desde este martes las provincias de Guayas, Manabí, Santa Elena, Los Ríos, El Oro, Esmeraldas, Santo Domingo de los Tsáchilas, Sucumbíos, Azuay y Pichincha, donde se encuentra Quito, la capital nacional.

Además, la disposición, que estará vigente por 60 días, aplicará para los cantones La Maná (Cotopaxi), Las Naves (Bolívar) y La Troncal (Cañar).

El estado de excepción permitirá a la fuerza pública, policías y militares, intervenir en esos territorios con el fin de “precautelar la protección interna, el restablecimiento, mantenimiento y control del orden público y seguridad ciudadana”, indica el decreto.

En todos los territorios anteriormente mencionados se suspenden los derechos de inviolabilidad de domicilio y de correspondencia, con lo cual las Fuerzas Armadas y la Policía pueden realizar allanamientos.

La disposición también contempla la requisición temporal de bienes y servicios lícitos que resulten necesarios para garantizar la operatividad de las fuerzas de seguridad.

En esta ocasión el estado de excepción no incluye toque de queda, aunque el presidente podría disponerlo posteriormente.

El decreto presidencial menciona la existencia de informes reservados del Centro Nacional de Inteligencia sobre la incidencia de hechos violentos y la presencia de estructuras criminales en las provincias y cantones donde se aplicará la medida.

Además, menciona hechos violentos ocurridos en las últimas semanas y que han causado conmoción, como el crimen de la fiscal de Manta, Alexandra Bravo.

El último estado de excepción en Ecuador finalizó el 31 de mayo pasado y hasta esa fecha el país sumaba cerca de 900 días en estado de excepción durante el Gobierno de Daniel Noboa.

Pese a esa medida, las cifras de violencia continúan elevadas.

Ecuador cerró 2025 con la tasa de homicidios más alta de su historia, al registrar 50,9 asesinatos por cada 100 mil habitantes y un total de nueve mil 216 crímenes, según datos oficiales.

Mientras, organizaciones de derechos humanos y organismos internacionales han expresado preocupación por las denuncias de abusos en el contexto de la militarización.",https://www.la-epoca.com.bo/2026/06/16/noboa-decreta-otro-estado-de-excepcion-en-10-provincias-de-ecuador/
