sitio_noticias,fecha,seccion,titular,cuerpo,url
Visión 360,2026-07-17,•La Paz,"Revilla eleva su perfil: realizó viajes a provincias, sostuvo reuniones con representantes de organismos y presidió reunión con gobernadores","Luego de mantener un perfil bajo durante los más de 50 días de bloqueos, el gobernador de La Paz, Luis Revilla, elevó su perfil con viajes a provincias, en los que planteó inversiones en carreteras; sostuvo reuniones con representantes de organismos financieros internacionales y presidió un encuentro con los gobernadores del país para tratar el régimen autonómico.

La autoridad departamental inició su recorrido el 4 de julio, cuando viajó a Yolosita y Coroico. En esta última localidad, Revilla y su equipo inspeccionaron el Hospital General de Coroico. Allí se comprometió a poner en funcionamiento la nueva unidad de Hemodiálisis.

Además, anunció la instalación de una sede del Servicio Departamental de Caminos (SEDCAM) en Coroico. “Vamos a trabajar no solo en la apertura de caminos que no solo es para Coroico, sino es para la región. Hay maquinaria nueva que va a ayudar al municipio”, indicó.

Lee también: Regionalizan la ampliación de la vacación invernal: distritos de La Paz y El Alto volverán a clases el 27 de julio

El 6 de julio, Revilla continuó su recorrido por La Paz. Esta vez visitó el municipio de Caquiaviri, donde, en una audiencia con la ciudadanía, señaló que cumplió con el mantenimiento de vías solicitado por el alcalde de esa región. Además, se comprometió a reconstruir el puente Challajawira, obra que se ejecutará en 2027.

“Está visita es para dar resultados. El equipo del alcalde me planteó varios temas de preocupación del municipio. Vamos a planificar todos los proyectos que se tienen para cumplir. Uno de esos temas es el mantenimiento de vías que ya hemos llevado adelante. En la red departamental, que es desde Comanche pasando por Chaulwani, Intijukira, Jayupata y Aticollo y también se va a programar en su trabajo. El proyecto del puente se cumplirá desde el 2027”, indicó Revilla en su intervención.

El 7 de julio participó, junto con ejecutivos de la Cámara Departamental de Industrias de La Paz (Cadinpaz), en un pódcast. Esa jornada, al ser consultado sobre dónde había estado durante el conflicto, respondió:

“Estaba evitando que la Gobernación sea parte del problema, porque, en medio de un conflicto tan delicado se debe actuar con responsabilidad, porque es fácil salir y decir cosas, cuando eso puede significar meter más leña al fuego y ampliar el conflicto”.

En tanto, el 9 de julio Revilla llegó a las comunidades de Arapata, Trinidad Pampa y Coripata, donde sostuvo una audiencia con la ciudadanía, el alcalde, concejales y representantes de la población.

“Algunos proyectos que nos han presentado se pueden empezar a hacer en esta gestión, algunos otros como los pozos lo vamos a hacer el próximo año. Los otros proyectos que son de mayor envergadura, vamos a tener que planificar para el 2027, 2028 y 2029”, dijo la autoridad.

“Nuestro objetivo es que todas las demandas de la población estén atendidas y la vamos a cumplir”, añadió.

Ese mismo día llegó a la comunidad de Río Blanco, en el municipio de Chulumani, donde, al igual que en los demás lugares que visitó, sostuvo una audiencia ciudadana. En esa oportunidad, Revilla se comprometió a construir un campo deportivo con una inversión cercana a los Bs 5 millones.

“Son casi 5 millones de bolivianos. Tenemos que empezar nuestro proyecto y la Gobernación va a cubrir el costo del enmallado del campo deportivo. Les hago una propuesta: vamos a gestionar esto en la UPRE para financiar el proyecto. La diputada es amiga del presidente y yo soy amigo del presidente, así que podemos convencerlo”, indicó Revilla.

Lee también: EEUU está “muy preocupado” por la expansión de la coca en Bolivia y cooperará para evitar el narcoterrorismo

El 10 de julio, Revilla visitó la comunidad de Callisaya y luego se trasladó al municipio de La Asunta. En la comunidad indicó que priorizará la atención a los accesos camineros junto con el SEDCAM para evitar problemas en la época de lluvias.

Ya en La Asunta, aseguró que los trabajos de mantenimiento de los tramos carreteros se realizarán durante todo este mes. Además, mencionó que se construirán puentes en el municipio.

“Vamos a estudiar y vamos a hacer gestiones para ver cuáles podemos colocarlos en el programa Mi Puente que tiene harto dinero. Aquellos que no podamos incorporarlos en ese programa, los hará la Gobernación, me comprometo”, indicó.

El 13 de julio, el gobernador se reunió con Leopoldo Avellan, representante del Grupo del Banco Interamericano de Desarrollo (BID) en Bolivia. En el encuentro, según Revilla, se acordó iniciar una ruta de trabajo para impulsar proyectos en “beneficio de las familias paceñas”.

Al día siguiente, el 14 de julio, sostuvo una reunión con Jeannette Sánchez Zurita, representante del Banco de Desarrollo de América Latina y el Caribe (CAF).

“Compartimos las prioridades de nuestra gestión y acordamos impulsar una agenda de trabajo conjunta que nos permita concretar proyectos de desarrollo sostenible, fortalecer la gestión institucional y mejorar la calidad de vida de las familias paceñas. Seguimos construyendo alianzas que generen más oportunidades y desarrollo para nuestro departamento”, escribió Revilla en su cuenta de Facebook.

El 16 de julio, Revilla encabezó la reunión nacional de gobernadores para debatir la propuesta de redistribución de recursos denominada “50/50”, que se llevó a cabo en El Alto. El documento de conclusiones plantea cinco puntos: el inicio de la coparticipación 50/50, la armonización normativa, la transferencia de instituciones, la creación de un ente asociativo y perfilar la reunión de agosto.

Al encuentro asistieron los gobernadores de Santa Cruz, Juan Pablo Velasco; de Chuquisaca, Luis Ayllón; de Tarija, María René Soruco; de Beni, Jesús Égüez; de Oruro, Édgar Sánchez; y el anfitrión, Luis Revilla, por La Paz. Por Pando asistió una representante. No participaron los gobernadores de Potosí ni de Cochabamba.",https://www.vision360.bo/noticias/2026/07/17/58543-revilla-eleva-su-perfil-realizo-viajes-a-provincias-sostuvo-reuniones-con-representantes-de-organismos-y-presidio-reunion-con-gobernadores
Visión 360,2026-07-17,•Fútbol Boliviano,Bolívar recibe a Guabirá en busca de volver al triunfo previo a la serie de la Copa Sudamericana,"Sports 360 / La Paz

En el marco de la novena jornada del Torneo Liga de la División Profesional, Bolívar recibirá este viernes a Guabirá (20.00) en el estadio Hernando Siles con la premisa de volver a la senda de la victoria para estar nuevamente entre los tres primeros y, sobre todo, llegar con buenos ánimos a los Play-Offs de la Copa Sudamericana.

Este encuentro abrirá la novena fecha luego de que se cumplieran con todos los encuentros reprogramados que se vieron afectados por los conflictos sociales que hubo en el país.

La Academia protagonizará el primer encuentro de la jornada para que tenga tiempo de preparar la ida de los Pla-Offs del certamen internacional ante el brasileño Gremio que se llevará adelante el jueves 23 de julio en La Paz.

Ese es el encuentro primordial que tienen los dirigidos por Alejandro Restrepo, quienes tampoco quieren dejar de lado el campeonato doméstico y por ello apuntan a hacer respetar la localía ante Guabirá.

Una victoria es necesaria para recuperar el tercer puesto de la tabla de posiciones que perdió ante Aurora. Actualmente es cuarto con 15 unidades, mientras que los cochabambinos tienen 16.

Además, Bolívar no conoce de victorias desde hace siete partidos consecutivos entre todas las competiciones.

La última vez que ganó fue el 3 de mayo en condición de visitante sobre GV San José (1-2).

Luego de ello cosechó cuatro empates y tres derrotas, entre la División Profesional y la Copa Libertadores de América.

Para ello, el DT colombiano piensa poner a sus mejores hombres en este vital compromiso.

El club Azucarero, por su parte, llega con buenos ánimos a este encuentro porque no conoce de derrotas desde hace cuatro encuentros.

Su última caída fue frente a Aurora en el valle (4-2) y luego de ello venció a GV San José (3-0), empató con Oriente Petrolero (2-2), superó a Nacional Potosí (2-1) y a San Antonio Bulo Bulo (1-2).

Actualmente ocupa el undécimo lugar de la clasificación con 11 unidades y un buen resultado hará que mejore su puesto.

Sin embargo, la historia del fútbol boliviano muestra que solo una vez ganó Guabirá a la Academia en condición de visitante.

Ello sucedió hace 27 años, el 14 de abril de 1999, cuando se impuso por 1-3.

Después de ese resultado cosechó 26 derrotas y empató en otra ocasión.

Ante este panorama y su buen presente deportivo, los futbolistas de Guabirá tratarán de dar la sorpresa y volver a conseguir un resultado favorable.",https://www.vision360.bo/noticias/2026/07/17/58462-bolivar-recibe-a-guabira-en-busca-de-volver-al-triunfo-previo-a-la-serie-de-la-copa-sudamericana
Visión 360,2026-07-17,•Polideportivo,Bolivia suma un título y un subcampeonato en el Paraguay Junior Open,"Sports 360 / La Paz

Bolivia cumple con una brillante actuación en el Paraguay Junior Open por la Gira Cosat (Sub-16 y Sub-14) y el ITF World Tennis Tour Juniors (Sub-18) al haber cosechado hasta ahora un título con la dupla de Santiago Gómez y Omar Vargas (en dobles Sub-18) y un subcampeonato con Paulina Del Solar y la brasileña Nicole Martins (dobles Sub-14).

A ello se suma que Bolivia tendrá la gran chance de luchar el sábado por una nueva corona con Rafael Benítez, quien se clasificó a la final de singles Sub-16.

Desde principios de semana, una delegación nacional compite en el vecino país en busca de los primeros puestos.

Los tenistas nacionales, con un gran ímpetu, buen juego y sobre todo mucho esfuerzo, llegaron al podio en tres distintas categorías.

Gómez y Vargas, de los mejores tenistas jóvenes del país en la actualidad y cuartos sembrados en el torneo, superaron cada ronda en dobles Sub-18 hasta quedarse con la corona.

En primera fase vencieron al boliviano Alexandre Bobiere y al argentino Valentino Ancasi (6-2 y 7-5), en cuartos de final ganaron a los brasileños José Nicolau y Pedro Martins (6-2 y 6-3) y en semifinales vencieron a los chilenos Agustín Acevedo y Augusto Barriga (6-1 y 6-2).

Este viernes se disputó la gran final ante los brasileños Fernando Giacomelli y Vitor Longo, a quienes derrotaron en un apretado encuentro por 7-5, 3-6 y 10-6.

Del Solar y Martins lograron un gran segundo lugar en dobles Sub-14, en el que llegaron como las principales favoritas.

Su debut se dio en cuartos de final y ganaron a la mexicana Beatriz De Favre y a la paraguaya Paula Roman (7-6, 4-6 y 10-5) y en “semis” superaron a las bolivianas Irene Cossio y Alexandra Gómez (un doble 6-3).

La lucha por el título fue este viernes, y, tras un parejo encuentro, no pudieron ante las brasileñas y segundas sembradas, Maria Dias y Ana Viscardi (2-6, 6-2 y 10-6).

Bolivia tiene la gran chance de sumar una nueva corona en el torneo juvenil paraguayo con Benítez, quien superó cuatro rondas para llegar a la final.

En primera fase ganó por walkover al brasileño Matheus Moutinho, en octavos de final venció al argentino Agustín Chalabe (6-3 y 6-2), en cuartos de final ganó al paraguayo Rodrigo Oya (6-4 y 6-2) y en semifinales derrotó al boliviano Alejandro Gómez (6-3 y 6-0).

Este sábado definirá el título de su categoría ante el argentino Facundo Oddone.",https://www.vision360.bo/noticias/2026/07/17/58597-bolivia-suma-un-titulo-y-un-subcampeonato-en-el-paraguay-junior-open
Visión 360,2026-07-17,•Patrocinadas,De las filas hospitalarias al análisis de tumores: estudiantes crean soluciones tecnológicas para problemas reales,"Las iniciativas son parte de su formación académica y combinan desarrollo de software, inteligencia artificial e investigación para crear soluciones con potencial aplicación en hospitales y centros médicos.

Uno de los proyectos consiste en un sistema de gestión hospitalaria que permite administrar camas, registrar el ingreso y salida de pacientes, controlar el inventario y la fecha de vencimiento de medicamentos, generar reportes y organizar los turnos del personal médico.

""La iniciativa nace porque acá, en Bolivia, generalmente tenemos el problema de hacer muchas filas para conseguir una ficha de atención en cualquier hospital. Nuestro objetivo es agilizar ese proceso y también ayudar con el control de las camas, viendo cuáles están libres para administrarlas de mejor manera"", explica Adriana Ayllón, estudiante de la carrera.

La plataforma también incorpora un agente conversacional diseñado para orientar a médicos, pacientes y personal de enfermería sobre el funcionamiento del sistema, facilitando su uso y reduciendo dudas durante la gestión de la información.

Para Douglas Aliaga, también integrante del equipo desarrollador, el objetivo fue crear una herramienta que contribuya tanto al trabajo del personal médico como a la atención de los pacientes. ""Esperábamos que el proyecto ayude a optimizar el tiempo y también los costos. Muchas personas pasan meses e incluso años realizando trámites que podrían agilizarse con una mejor gestión"", sostiene.

El desarrollo del sistema tomó todo el semestre. Durante ese tiempo, los estudiantes enfrentaron desafíos como el aprendizaje de nuevas herramientas de programación, entre ellas Flutter y Android Studio, además del diseño del sistema de turnos y del agente conversacional que integra la plataforma.

El segundo proyecto está orientado al análisis de imágenes biomédicas. Se trata de un sistema que utiliza resonancias magnéticas para detectar y visualizar tumores cerebrales, permitiendo medir su volumen y realizar un seguimiento de su evolución como apoyo al trabajo de los especialistas.

""La iniciativa nace para crear una herramienta de apoyo al médico que pueda visualizar cuánto va creciendo un tumor a través del tiempo y analizar qué tan efectivo puede ser un tratamiento"", explica Kevin Rodríguez Leitón, estudiante responsable del proyecto.

Para desarrollar la solución, el universitario trabajó con resonancias magnéticas de pacientes diagnosticados con glioma, para desarrollar un modelo capaz de identificar estas lesiones y generar predicciones sobre su comportamiento. Uno de los principales retos fue obtener imágenes adecuadas para entrenar el sistema y alcanzar un alto nivel de precisión en los resultados.

Rodríguez destacó el acompañamiento recibido durante el proceso. ""El apoyo de mis docentes y de mis tutores fue fundamental. Ellos me inspiraron a seguir investigando y a conectar la medicina con la ingeniería de sistemas para desarrollar una solución con impacto"", afirmó.

Para Milton Calle, docente de la carrera de Ingeniería de Sistemas e Innovación Digital, estas iniciativas surgen a partir de problemáticas reales que pueden abordarse mediante la tecnología. ""Los proyectos nacen de la necesidad de pasar de procesos manuales a procesos automatizados. En áreas como la gestión hospitalaria o el análisis de resonancias magnéticas se requiere un gran apoyo tecnológico para brindar respuestas oportunas a los pacientes"", explica.

El docente destaca que las soluciones desarrolladas pueden tener aplicaciones tanto en hospitales públicos como privados. ""Estos sistemas ayudan a que los procesos de gestión dejen de ser tan burocráticos y sean mucho más automatizados. En el caso de la oncología, hoy existen distintas tecnologías que pueden apoyar el análisis de imágenes y contribuir al trabajo de los especialistas"", señala.

""Los estudiantes primero investigan, luego realizan simulaciones y finalmente desarrollan la solución. Ahí comprenden que no solo la parte práctica es esencial, sino también la parte científica. La universidad se caracteriza por convertir el conocimiento teórico en experiencias prácticas que responden a la realidad del país"", añade el académico.

El modelo “Aprender Haciendo” de Unifranz es una metodología educativa centrada en la experiencia práctica y la resolución de problemas reales. Además, conecta a los estudiantes directamente con el mundo profesional desde el inicio de sus carreras. Así, los estudiantes desarrollan habilidades clave y aumentan su empleabilidad, mediante proyectos, simulaciones y vinculación con empresas, para preparar profesionales más seguros y capaces de generar un impacto en la sociedad.

Ambos proyectos reflejan el enfoque práctico de la formación en Ingeniería de Sistemas e Innovación Digital de Unifranz, donde los estudiantes transforman conocimientos adquiridos en el aula en soluciones tecnológicas que responden a desafíos reales y evidencian el potencial de la innovación para contribuir al desarrollo del sector salud.",https://www.vision360.bo/noticias/2026/07/17/58588-de-las-filas-hospitalarias-al-analisis-de-tumores-estudiantes-crean-soluciones-tecnologicas-para-problemas-reales
Visión 360,2026-07-17,•Seguridad,Paz advierte que los bloqueadores deben ir a la cárcel y que los líderes de los 53 días de protestas deben ser puestos ante la justicia,"Las consecuencias dejadas por el bloqueo de caminos de 53 días marcaron no solo a la población, sino también al propio Gobierno. El presidente Rodrigo Paz aseguró este viernes que los líderes de la prolongada medida de presión deben rendir cuentas ante la justicia y que quienes intenten una acción similar deben ser enviados a la cárcel.

“No ha sido el Estado el que está bajo sospecha por las más de 20 muertes que se han generado en los bloqueos. Son los bloqueadores los que tienen que ir a dar —las cabezas especialmente— cara a la justicia”, advirtió, en alusión a los dirigentes que alentaron la protesta, la cual también dejó un daño económico superior a los 3.000 millones de dólares.

Un informe de la Defensoría del Pueblo da cuenta de que, durante el período de las movilizaciones, ocurrieron 22 decesos, de los cuales 19 correspondieron a terceros afectados por la interrupción de las carreteras. La mayoría no pudo llegar a centros hospitalarios para recibir atención médica especializada o ser auxiliada debido a su delicado estado de salud.

La dirigencia de la Central Obrera Boliviana (COB), encabezada por Mario Argollo, junto con los campesinos liderados por Vicente Salazar y Evo Morales, fue identificada como la principal impulsora de esta extrema medida de presión que exigía la renuncia del presidente Paz. Argollo firmó un acuerdo con el Gobierno y, desde entonces, mantiene un perfil bajo.

Después de la firma del convenio, en la madrugada del 20 de junio se declaró el estado de excepción, lo que terminó por desmovilizar a los campesinos y a las bases de Morales que también estaban en El Alto, una de las ciudades —junto con La Paz— más afectadas por el cierre de sus vías de aprovisionamiento de alimentos, combustibles y medicamentos.

Salazar fue detenido y enviado por seis meses a la cárcel de máxima seguridad de Chonchocoro, en el municipio de Viacha, vecino de El Alto, acusado por los delitos de instigación pública a delinquir, asociación delictuosa, terrorismo, atentados contra la seguridad de los medios de transporte y atentados contra la seguridad de los servicios públicos.

Lee también: ¿Cómo avanzar hacia un régimen autonómico pleno? Analistas sugieren una hoja de ruta

“La gran enseñanza para los bolivianos es que los bloqueos nos han hecho mucho daño”, afirmó Paz, al tiempo de advertir: “Ya no puedes generar bloqueos; el que bloquea tiene que irse a la cárcel”.

Un informe de la Fiscalía da cuenta de que 335 personas son investigadas por los bloqueos, de las cuales 26 cumplen detención preventiva. Sobre la situación de Argollo, uno de los promotores de la medida, el fiscal departamental de La Paz, Luis Carlos Torrez, indicó que se analiza su situación jurídica.

Mientras tanto, Morales permanece atrincherado en el Chapare, de donde no sale desde noviembre de 2024. Sin embargo, negó haber estado detrás de las movilizaciones, pese a que en varias ocasiones pidió adelantar las elecciones y envió a cocaleros a reforzar el cerco en El Alto.

Paz aseguró, en una entrevista con Radio Panamericana, que la protesta en Bolivia es constitucional y está garantizada, siempre y cuando no afecte el derecho de terceros.",https://www.vision360.bo/noticias/2026/07/17/58573-paz-advierte-que-los-bloqueadores-deben-ir-a-la-carcel-y-que-los-lideres-de-los-53-dias-de-protestas-deben-ser-puestos-ante-la-justicia
Visión 360,2026-07-17,•Seguridad,EEUU está “muy preocupado” por la expansión de la coca en Bolivia y cooperará para evitar el narcoterrorismo,"Bolivia y Estados Unidos retomaron con fuerza sus relaciones y el narcotráfico vuelve a ocupar un lugar importante en la agenda. El encargado de Negocios de la legación estadounidense, Erik Martini, expresó este viernes su preocupación por la expansión de los cultivos de coca y aseguró que apoyarán a Bolivia para evitar que el país se convierta en un refugio de narcotraficantes o que se incruste el narcoterrorismo.

“Estamos muy preocupados (por la expansión de cultivos de coca), porque de la coca viene la cocaína. Y eso es malo para Bolivia y para mi país”, aseguró el diplomático, quien afirmó que su nación no desea que ocurra en Bolivia lo mismo que en Ecuador, donde “en unos pocos años, como ha dicho el presidente Daniel Noboa, los narcoterroristas han entrado”.

“La cantidad de coca sí es preocupante en Bolivia, seguro. Y también hemos visto que —no es como Ecuador— pero hemos visto que día a día hay indicios de que tenemos que hacer más para apoyar al gobierno del presidente Paz”, afirmó durate una entrevista en el programa Sin Maquillaje, de Mery Vaca, cuando fue consultado si se podría replicar en el país el fenómeno ecuatoriano.

Según el informe 2025 de la Oficina de las Naciones Unidas contra la Droga y el Delito (UNODC), los cultivos de coca en 2024 alcanzaron las 34.000 hectáreas, lo que representó un incremento del 10% respecto de la gestión 2023. Mientras tanto, el mismo organismo reportó en 2026 la destrucción de 70,05 toneladas de drogas ilegales, de las cuales 65,36 fueron validadas.

Una vez que el presidente Rodrigo Paz asumió el poder, se retomaron las relaciones con Estados Unidos, que estuvieron congeladas desde 2008 durante los gobiernos de Evo Morales y Luis Arce. En materia de lucha contra las drogas, se reactivaron los contactos con la agencia estadounidense DEA, que ya brinda cooperación.

De hecho, el narcotraficante uruguayo Sebastián Marset fue entregado a agentes de la DEA poco después de ser capturado, la madrugada del 13 de marzo, en una de sus lujosas residencias en Santa Cruz. En junio se informó sobre un acuerdo con Washington que contempla un aporte de hasta 20 millones de dólares para entrenar y equipar a las fuerzas bolivianas como parte de una estrategia conjunta de lucha contra el narcotráfico.

El diplomático fue cauto y afirmó que su país confía en que Bolivia no se convertirá en un refugio de narcotraficantes, aunque aclaró que cualquier cooperación se realizará en el marco del respeto a la soberanía nacional.

Lee también: Embajada de Estados Unidos invita a una función gratuita de Lincoln en la Cinemateca Boliviana

“Lo que queremos es que eso no pase (refugio de narcotraficantes), entonces es difícil decir ahorita: estamos entrando en todo con la cooperación del gobierno para ver exactamente qué tenemos que enfrentar y qué podemos brindar para evitar esas circunstancias en Bolivia. Pero sí, lo que tenemos que hacer es apoyar de cualquier manera al gobierno del presidente Paz, bajo su supervisión y bajo su invitación”, precisó el encargado de Negocios, quien ejerce funciones desde el 18 de junio.

La captura y expulsión de Marset provocó una pugna entre grupos de narcotraficantes por el control de esa actividad ilícita.

“Al ser capturado, se ha generado un vacío y es por eso que hay algunas personas del mismo entorno que manejaba Marset que quieren asumir ese rol, al igual que líderes de otras organizaciones que estuvieron operando en nuestro país”, decía en mayo el comandante de la Policía, Mirko Sokol.

Bolivia y Estados Unidos mantuvieron históricamente una relación marcada por la lucha contra el narcotráfico. Durante los gobiernos del MAS, los organismos estadounidenses fueron apartados de esa tarea y ahora vuelven a brindar cooperación.",https://www.vision360.bo/noticias/2026/07/17/58522-eeuu-esta-muy-preocupado-por-la-expansion-de-la-coca-en-bolivia-y-cooperara-para-evitar-el-narcoterrorismo
