sitio_noticias,fecha,seccion,titular,cuerpo,url
Unitel,2026-07-11,Seguridad,DGAC dice que la avioneta carbonizada tiene características de un hecho ilícito,"La Dirección General de Aeronáutica Civil (DGAC) informó este sábado que el caso de la aeronave reportada en el municipio de Villa Montes, departamento de Tarija, corresponde a un “ presunto hecho ilícito”, por lo que debe ser investigado por las autoridades competentes.

Mediante un comunicado, la entidad señaló que, tras verificar la información difundida en redes sociales sobre una aeronave presuntamente siniestrada, se estableció que “ el caso reviste características de un presunto hecho ilícito”.

MIRA AQUÍ: Una avioneta arde a un lado de la ruta internacional Bolivia-Paraguay

Además, recordó que la Reglamentación Aeronáutica Boliviana (RAB) 830 establece que “ las investigaciones técnicas a cargo de la DGAC no comprenden hechos de carácter ilícito , los cuales son de conocimiento e investigación de las autoridades competentes”.

Según imágenes que circulan en redes sociales, l a aeronave quedó completamente destruida dejando solo algunas piezas en medio de las cenizas. El hecho se registró a un costado de la ruta internacional que conecta Bolivia con Paraguay, en el municipio de Villa Montes.

En tanto, el portal Perspectivas Noticias Bolivia difundió un video en el que se ve a la aeronave intacta a un costado de la carretera. Según esas imágenes, la aeronave lleva pintada una bandera boliviana y el número 9.

DGAC dice que colaborará con investigaciones

En ese marco, la institución precisó que “la investigación del presente caso corresponde a las instancias competentes”; sin embargo, expresó su disposición para colaborar en las pesquisas.

“ No obstante, la DGAC manifiesta su plena disposición para coadyuvar con las investigaciones, brindando el apoyo técnico e institucional que sea requerido, en el marco de sus atribuciones y con el propósito de contribuir al esclarecimiento de los hechos”, señala el comunicado.

MIRA AQUÍ: Denuncian custodia armada y trabajos con maquinaria en predios de Santa Rita, avasallados hace 45 días",https://unitel.bo/noticias/seguridad/dgac-dice-que-la-avioneta-carbonizada-tiene-caracteristicas-de-un-hecho-ilicito-HJ22097563
Unitel,2026-07-11,Política,Lara dice que si pudiera reunirse con Paz le diría que “hay que dejar las diferencias de lado y mirar para adelante”,"El vicepresidente Edmand Lara aseguró que si lograra reunirse con el presidente Rodrigo Paz le pediría que miren hacia adelante para seguir gobernando el país.

“Si tuviera la oportunidad de reunirme con el presidente (Paz), lo primero que le diría es ‘ hay que dejar las diferencias de lado y mirar para adelante ’”, aseguró.

MIRA AQUÍ: Paz dice que “el dólar se está estabilizando” tras nueva variación en la cotización oficial de la divisa

La declaración de Lara fue en una entrevista que brindó a Los Tiempos en la que dejó entrever que a ocho meses de que el binomio Paz - Lara asumió el Gobierno aún tienen diferencias, una situación que se evidenció desde finales del año pasado.

Incluso el opositor Jorge ‘ Tuto’ Quiroga en enero de este año les podía limar sus asperezas.

“ Si te casaste con el diablo, aprende a administrar el infierno ”, manifestaba Quiroga, instando a Paz y Lara a sentarse a dialogar y encontrar un punto de acuerdo pues “Bolivia está por encima de las diferencias personales”.

MIRA AQUÍ: “Solo patea la crisis para adelante”: Lara cuestiona decreto que congela seis meses los precios de los hidrocarburos

Lara asegura que hay gente que quiere vivir del Estado

El vicepresidente indicó que cuando ingresó a la función pública se percató que “hay un monstruo de la corrupción, que se ha acostumbrado a vivir del Estado, que está cómodo con el sistema y sigue controlando todo”.

Ante ello aseguró que cuando alguien quiere romper ese sistema, lo empiezan a atacar.",https://unitel.bo/noticias/politica/lara-dice-que-si-pudiera-reunirse-con-paz-le-diria-que-hay-que-dejar-las-diferencias-de-lado-y-mirar-para-adelante-LJ22099299
Unitel,2026-07-11,Seguridad,Se registran dos incendios forestales que provocan alarma en Cochabamba,"En horas de la tarde de este sábado, se registraron dos incendios en inmediaciones del parque Nacional Tunari, en Cochabamba. Ante ello, personal de bomberos se desplegó para sofocar las llamas.

Según el reporte, l os incendios son en inmediaciones del parque Nacional Tunari, uno en la zona de Melga, mientras que el otro es el municipio de Tiquipaya.

MIRA AQUÍ: DGAC dice que camioneta carbonizada tiene características de un hecho ilícito

El fuego y la extensa nube de humo generó preocupación entre la p oblación ante el temor de que las llamas se propaguen.

Personal de bomberos y emergencia se apersonaron hasta la zona para controlar el fuego y sofocar las llamas.

MIRA AQUÍ: Camión cae a barranco con nueve integrantes de una familia que trasladaban papa",https://unitel.bo/noticias/seguridad/se-registran-dos-incendios-forestales-que-provocan-alarma-en-cochabamba-MB22100972
Unitel,2026-07-11,Política,“Hay que cambiar al ministro de Economía”: Edmand Lara cuestiona manejo económico del Gobierno,"“ Hay que cambiar al ministro de Economía , no está a la altura de las circunstancias, lo dije con toda franqueza en el marco de una crítica constructiva”, consideró el vicepresidente Edmand Lara al cuestionar la situación económica del país.

Lara al cuestionar a Gabriel Espinoza alegó que había advirtió que las medidas económicas que asumió el país, como el dólar flexible, provocarían incremento de los precios de los productos; sin embargo, se la aplicó.

MIRA AQUÍ: Choferes dicen que no llegaron a un acuerdo con el Gobierno y exigen compromiso escrito por el combustible

“La moneda se ha devaluado, hay una pérdida del poder adquisitivo y eso es porque no han analizado que nuestras reservas internacionales están muy debilitadas”, remarcó en una entrevista con Los Tiempos.

Lara añadió que en la actualidad no hay dólares en el país para comprar combustible p or lo que la población debe esperar hasta tres días en la fila para poder abastecer su motorizado y se está perjudicando al sector productivo.

”Esas medidas que aplicó el ministro de Economía, yo las he criticado en su momento. Estamos atravesando una crisis, han afectado hasta la alimentación de la población”, sostuvo a tiempo de considerar que se deben reconducir las medidas económicas.

MIRA AQUÍ: Bolivia: Gasto en combustible ronda entre $us 40 y 50 millones a la semana, según ministro",https://unitel.bo/noticias/politica/hay-que-cambiar-al-ministro-de-economia-edmand-lara-cuestiona-manejo-economico-del-gobierno-DB22101288
Unitel,2026-07-11,Seguridad,Dejan libres a las dos mujeres investigadas por el hallazgo de armas en Viru Viru,"La Justicia dispuso que las dos mujeres investigadas por las armas halladas en Viru Viru queden en libertad. Una de ellas debe cumplir medidas cautelares.

El abogado de ambas, Martín Camacho, precisó que la más joven de nombre Susana M. tiene libertad irrestricta pues el fiscal consideró que la mujer desconocía el contenido de las maletas. Agregó que contra la otra investigada, identificada como Flora S., la justicia dictó medidas cautelares; arresto domiciliario de 19:00 a 7:00, arraigo y una multa de Bs 10.000.

Las dos mujeres fueron aprehendidas el jueves, tras hallarse armas dentro de unas maletas en el aeropuerto de Viru Viru, en Santa Cruz. Ante ello, este sábado fueron puestas ante un juez en el Palacio de Justicia por el delito de tráfico de armas.

A mbas mujeres habían llegado el jueves con un poder hasta el aeropuerto de Viru Viru para retirar las maletas; sin embargo, con el scanner se detectó que contenían armas de grueso calibre que estaban desarmadas.

MIRA AQUÍ: Fallece adolescente de 15 años que quedó en terapia intensiva por pelea de boxeo

Según las investigaciones, el 7 de julio, un joven de 19 años llegó desde Miami, Estados Unidos con las maletas que portaban armas; sin embargo, este no las retiró de la terminal, debido a que debía de pagar un arancel pues había declarado que transportaba al país repuestos de vehículos.

La abogada de ambas mujeres, Karla Robledo, aseguraba previo a la audiencia que e llas se dedican al traslado de productos y que no tenían conocimiento del contenido de las maletas.

No obstante, el fiscal del caso, Daniel Ortuño, consideró que hay indicios de la participación de estas mujeres en hechos irregulares.

MIRA AQUÍ: Una avioneta arde a un lado de la ruta internacional Bolivia-Paraguay

Mientras, el joven de 19 años tiene un orden de aprehensión y está siendo buscando por la Policía para que declare respecto a las maletas que ingresaron con partes de armamento de grueso calibre.",https://unitel.bo/noticias/seguridad/dejan-libres-a-las-dos-mujeres-investigadas-por-el-hallazgo-de-armas-en-viru-viru-NI22089163
Unitel,2026-07-11,Sociedad,“Se ha quemado todo”: Madre y sus dos hijos se quedaron sin nada tras el incendio en su casa en El Alto,"La noche del viernes se registró un incendio en una vivienda en la ciudad de El Alto, donde dos niños lograron salvar su vida del siniestro; sin embargo, la familia perdió todo lo que tenía, incluso los ahorros con los que la madre tenía planificado comprar una cocina para vender comida en su vivienda y así evitar dejar a sus hijos solos.

“Yo estaba consiguiendo mis cosas para poder abrirme una broastería. Se ha quemado todo. Aquí estaba mi cocina, igual se ha quemado todo, las ropas, el arroz, lo que había para cocinar”, lamenta Viviana Aguayo, la madre afectada por el incendio.

Además, cuenta que el auto del abuelo de esta familia también quedó incinerado, el cual era la fuente de trabajo.

MIRA AQUÍ: “Todo se ha quemado”: Dos niños se salvan de milagro de un incendio que destruyó su vivienda en El Alto

Los dos niños, de cinco y ocho años, estaban dentro del inmueble cuando ocurrió el incendio, l ograron salvarse y salieron a la calle a alertar a los vecinos para pedir ayuda ante las llamas que se expandían.

“Veo que había fuego, e l fuego era tremendo, y solamente he escuchado que ayúden a los niños, porque había dos niños menores”, relata Daure Iglesias, una vecina que acudió a ayudar.

Los vecinos con baldes con agua l legaron e intentaron controlar el fuego para que no se extienda hasta la llegada de los bomberos. Mientras, la madre estaba en la calle vendiendo productos para conseguir dinero, cuando fue alertada con la noticia del incendio.

MIRA AQUÍ: Avasallamiento en Santa Rita: INRA, Policía y propietarios del predio realizan una inspección ocular

Según la explicación de Beymar Chura, responsable de bomberos en El Alto, el incendio fue causado por una mala manipulación de fósforos.

“La posible causa del incendio habría sido la mala manipulación de los cerillos que habrían estado utilizando los niños de la casa”, indicó.

La familia afectada pide ayuda para poder recuperarse, ya que perdieron todas sus pertenencias en el siniestro, incluido ropa, materiales escolares, muebles y otros objetos.

El número de teléfono para colaboraciones es el 641-74546.",https://unitel.bo/noticias/sociedad/se-ha-quemado-todo-madre-y-sus-dos-hijos-se-quedaron-sin-nada-tras-el-incendio-en-su-casa-en-el-alto-IJ22098415
Unitel,2026-07-11,Seguridad,Un hombre es hallado con 100 kilos de droga en siete bolsas de yute en Cochabamba,"El director de la Fuerza Especial De Lucha Contra el Narcotráfico (Felcn) de Cochabamba, Juan Arnez, informó sobre la captura de un hombre en posesión de siete bolsas de yute que contenían sustancias controladas que equivalen a $us 83.000.

“(Efectivos) e ncontraron sustancias controladas a la altura de Lagunillas , observando a una persona sospechosa (quien) que se dio a la fuga”, indicó sobre el inicio del caso.

MIRA AQUÍ: Se registran dos incendios forestales que provocan alarma en Cochabamba

Según el informe policial, durante la requisa se encontró siete bolsas de yute con marihuana, que tenían el paso de 100.000 gramos (100 kilos), equivalentes a 83.650 dólares.

La autoridad precisó que después de un operativo, se logró la captura del sospechoso, que inicialmente se había dado a la fuga.

“Efectivos antidrogas lograron la captura de un hombre que tenía en su poder siete bolsas de yute, que contenían marihuana, esto en la zona norte de la ciudad de Cochabamba”, confirmó Arnez.

MIRA AQUÍ: DGAC dice que la avioneta carbonizada tiene características de un hecho ilícito",https://unitel.bo/noticias/seguridad/un-hombre-es-hallado-con-100-kilos-de-droga-en-siete-bolsas-de-yute-en-cochabamba-NB22102294
Unitel,2026-07-11,Mundo,"Guardianes iraníes anuncian cierre del estrecho de Ormuz ""hasta nuevo aviso""","Los Guardianes de la Revolución iraníes anunciaron el domingo que el estrecho de Ormuz estará cerrado “hasta nuevo aviso”, tras disparar tiros de advertencia a un barco que tomó una “ruta no autorizada”.

“Varios buques intentaron tomar una ruta no autorizada e ignoraron nuestras advertencias y recordatorios instándolos a corregir su rumbo y seguir la ruta aprobada”, escribieron los Guardianes de la Revolución en un comunicado en Telegram.

“Un buque que había puesto en peligro la seguridad marítima al desactivar sus sistemas, fue alcanzado por tiros de advertencia y se detuvo”, agregó el ejército ideológico iraní.

MIRA AQUÍ: La cifra de muertos por los terremotos en Venezuela sube hasta los 4.333

La acción complica aún más los esfuerzos por revivir las negociaciones de paz entre Estados Unidos e Irán, luego de que las dos partes intercambiaron ataques los últimos días.

El estrecho de Ormuz es una ruta crucial para el tránsito petrolero, con cerca de 20% del crudo mundial pasando por la zona en tiempos de paz.

“Después de este incidente, y teniendo en cuenta la inseguridad generada por la intervención ilegal de extranjeros, el estrecho de Ormuz permanecerá cerrado hasta nuevo aviso y hasta el fin de las intervenciones estadounidenses en esta región; no se permitirá que ningún buque lo atraviese”, insistieron.

MIRA AQUÍ: Encarcelan a dos bolivianos y un brasileño en Francia tras ser sorprendidos con cocaína en el océano Índico

Los guardianes también amenazaron con atacar bases de Estados Unidos en la región del Golfo.

“Si el enemigo agresor comete el error de realizar una nueva agresión contra nosotros con el pretexto de este incidente, que él mismo ha provocado, responderemos con severidad y nuevas bases enemigas de la región serán atacadas”, adviertieron.

Irán bloqueó el estrecho de Ormuz durante la guerra de Oriente Medio, destada el 28 de febrero con los bombardeos de Israel y Estados Unidos contra su territorio.",https://unitel.bo/noticias/mundo/guardianes-iranies-anuncian-cierre-del-estrecho-de-ormuz-hasta-nuevo-aviso-DB22102313
Unitel,2026-07-11,Economía,"La cotización del dólar oficial para este domingo 12 de julio se mantiene en Bs 10,40","El Banco Central de Bolivia (BCB) emitió la cotización del dólar para este domingo 12 de julio que se sitúa en Bs 10,40, el mismo parámetro que se tuvo este sábado.

A las 20:00 de cada día, el BCB difunde la cotización oficial del dólar que estará vigente para el día siguiente.

MIRA AQUÍ: Bolivia: Gasto en combustible ronda entre $us 40 y 50 millones a la semana, según ministro

La cotización que rige para el dólar este fin de semana, tanto sábado como domingo, representa un incremento en relación a lo registrado el viernes 10, cuando el precio estaba fijado en Bs 10,24.

Ante ello, el ministro de Economía y Finanzas, señaló que el incremento se debía a una alta demanda de los dólares y estimaba que en dos o tres semanas el precio se estabilizará.

MIRA AQUÍ: “Se trata de una consideración política”: IBCE cuestiona el decreto que congela los precios de los combustibles hasta enero",https://unitel.bo/noticias/economia/la-cotizacion-del-dolar-oficial-para-este-domingo-12-de-julio-se-mantiene-en-bs-1040-EB22102897
Unitel,2026-07-11,Sociedad,La Paz se llena de arte y cultura este sábado con la Larga Noche de Museos,"Esta sábado 11 de julio, se lleva a cabo la XX Larga Noche de Museos en la ciudad de La Paz, una actividad que reúne a miles de visitantes en museos, galerías, teatros, bibliotecas y centros culturales en el centro paceño.

Durante la jornada, las personas podrán recorrer de manera gratuita museos, galerías y centros culturales donde se exhibirán grandes obras de artistas que dejaron un importante legado en la cultura nacional.

MIRA AQUÍ: Tome sus previsiones: estos serán los cortes de vías por la Larga Noche de Museos en La Paz

Jóvenes, adultos y niños disfrutan las diferentes actividades de la noche cultural más esperada, una actividad que fue postergada debido a los conflictos sociales que afectaron más de 50 días al país.

Esta actividad inició desde las 15:00 horas y los museos estarán abiertos hasta la medianoche.

Además, la Alcaldía de La Paz dispuso el cierre temporal de calles y avenidas de la ciudad, y el servicio municipal de transporte La Paz Bus habilitará un horario especial.

MIRA AQUÍ: “Se ha quemado todo”: Madre y sus dos hijos se quedaron sin nada tras el incendio en su casa en El Alto",https://unitel.bo/noticias/sociedad/la-paz-se-llena-de-arte-y-cultura-este-sabado-con-la-larga-noche-de-museos-AB22103021
Unitel,2026-07-11,Economía,¿Cuándo se normalizará la distribución de combustible? Esto responden desde el Gobierno,"El viceministro de Coordinación Legislativa, Wilson Santamaría, respondió respecto al tema de desabastecimiento de combustible e indicó una fecha para la normalización de la distribución de carburante .

“Yacimientos (YPFB) ha establecido, confiamos en que hasta el día martes, miércoles se vaya regularizando de manera paulatina”, manifestó la autoridad.

Sostuvo que, en un recorrido en la ciudad de La Paz, observó que ya no hay “mayor inconveniente” y que solo hay demora en la entrega a las provincias.

MIRA AQUÍ: La cotización del dólar oficial para este domingo 12 de julio se mantiene en Bs 10,40

Control de calidad

Santamaría aseguró que hay denuncia y especulaciones sobre la calidad del combustible que son innecesarias, y que desde YPFB se aclaró el procedimiento de verificación del crudo, que pertenece a los nuevos estándares de calidad.

“Ese proceso de validación y verificación del ingreso de los diferentes carburantes i mplica un par de horas adicionales que obviamente genera una demora en la logística y la comercialización”, explicó.

Agregó que este combustible e s de “alta calidad” y que no habrán inconvenientes, perjuicios o daños futuros a motorizados.

MIRA AQUÍ: ¿Cuánto está el precio del kilo del pollo este fin de semana en el eje central?",https://unitel.bo/noticias/economia/cuando-se-normalizara-la-distribucion-de-combustible-esto-responden-desde-el-gobierno-MB22103780
Unitel,2026-07-11,Seguridad,“(El adolescente) estuvo sufriendo tantos meses”: Piden que juicio por muerte en pelea de boxeo sea por homicidio,"Tras la muerte del adolescente que estaba en terapia intensiva por una pelea de boxeo, el abogado de la familia , Víctor Camacho pidió que el juicio sea por homicidio.

Explicó que al Ministerio Público le corresponde presentar el certificado de fallecimiento de la víctima ante el juez para que el juicio se instale por homicidio.

MIRA AQUÍ: Se registran dos incendios forestales que provocan alarma en Cochabamba

El abogado explicó que el Ministerio Público ya hizo la acusación contra el entrenador por lesiones gravisimas y contra el contrincante en la pelea por tentativa de homicidio contra dos personas . No obstante, remarcó que tras el deceso se agrava la situación de los investigados porque corresponde acusar por homicidio.

Añadió que por este caso cuatro personas estuvieron detenidos, uno de ellos se favoreció con cesación a la detención preventiva.

“La familia de la víctima v a ir con todo a condenarlos a la máxima pena porque lo han hecho de una manera dolosa. El jovencito estuvo sufriendo tantos meses (en terapia)”, manifestó.

MIRA AQUÍ: Imágenes aéreas captan las actividades de los avasalladores dentro del predio Santa Rita

El hecho se registró el sábado 31 de enero, cuando el adolescente de 15 años terminó en terapia intensiva luego de enfrentarse con Pablo R.M.V., de 25 años durante una presunta práctica de sparring, que está vinculado con el boxeo.

A relato del padre, el menor de edad fue llevado desde su gimnasio habitual hasta otro centro de entrenamiento sin que ellos lo supieran. En el lugar el joven recibió golpe tras golpe, lo que le provocó la caída al piso.

El padre consideró que el principal responsable de la muerte de su hijo es el entrenador que lo llevó a que participe de una pelea de sparring.",https://unitel.bo/noticias/seguridad/el-adolescente-estuvo-sufriendo-tantos-meses-piden-que-juicio-por-muerte-en-pelea-de-boxeo-sea-por-homicidio-FB22102412
Unitel,2026-07-11,Mundo,EEUU lanza una nueva ronda de ataques contra Irán tras un incidente en Ormuz,"Estados Unidos lanzó este sábado una nueva ronda de ataques contra Irán después de que Teherán bombardeara un buque con la bandera de Chipre que transitaba por el estrecho de Ormuz, según informó el Comando Central estadounidense (Centcom).

A las 19:15 hora local (23:15 GMT), las fuerzas estadounidenses iniciaron la tercera ofensiva contra Irán de esta semana.

Según el Centcom, Irán atacó un buque portacontenedores con bandera de Chipre, que provocó un incendio en el barco y daños en la sala de máquinas que obligaron a detener la travesía.

Un miembro de la tripulación está desaparecido. “ A Irán se le brindó una nueva oportunidad para demostrar el cumplimiento del memorando de entendimiento tras haber sido responsabilizado por ataques previos contra buques comerciales, pero nuevamente ha fallado”, aseguró el mando militar en un mensaje en X.

MIRA AQUÍ: La cifra de muertos por los terremotos en Venezuela sube hasta los 4.333

Las fuerzas estadounidenses justificaron el ataque contra la República Islámica en que están “degradando su capacidad” para atacar otras embarcaciones en el estrecho de Ormuz.

Los bombardeos se llevaron a cabo por orden del presidente de EE.UU., Donald Trump.Irán, por su parte, anunció que el estrecho de Ormuz permanecerá cerrado “hasta nuevo aviso”.

La Guardia Revolucionaria aseveró que cualquier interferencia extranjera para abrir una “ruta ilegal” en la región recibirá una respuesta contundente, según informó la radiodifusora estatal iraní IRIB.

Hace unos días, Trump dio por terminado el acuerdo de alto el fuego, vigente entre ambos países, tras la reanudación de los bombardeos en Oriente Medio.

MIRA AQUÍ: Terror en el aire: un pasajero fue succionado tras romperse una ventanilla en pleno vuelo en Europa

EEUU e Irán firmaron el pasado 17 de junio un memorando de entendimiento para poner fin a la guerra, desbloquear el estrecho de Ormuz y abrir negociaciones sobre el programa nuclear iraní.",https://unitel.bo/noticias/mundo/eeuu-lanza-una-nueva-ronda-de-ataques-contra-iran-tras-un-incidente-en-ormuz-JB22104195
Visión 360,2026-07-11,•La Paz,Dockweiler celebra el compromiso de los paceños con su cultura y su patrimonio: “Nos hacía falta reencontrarnos”,"El alcalde de La Paz, César Dockweiler, celebró la noche de este sábado el compromiso de los paceños con su cultura, su patrimonio y su historia. El burgomaestre afirmó que lo que se vive en el marco de la XX Larga Noche de Museos es un reencuentro.

“Felicidades a La Paz por este compromiso con su cultura, con su patrimonio, con su historia, con su gastronomía. Creo que hoy lo que estamos haciendo es justamente un reencuentro, un reencuentro entre todos los ciudadanos paceños, un reencuentro con nuestra cultura, con nuestro patrimonio y nuestra historia, nuestros museos”, expresó el alcalde de La Paz a Visión 360 .

Dockweiler inició el recorrido de la Larga Noche de Museos en el centro de la urbe paceña y destacó la masiva asistencia de la ciudadanía al evento cultural. “Está muy lleno, muy llenas las calles. Lindo. Estamos viviendo una gran fiesta”, manifestó.",https://www.vision360.bo/noticias/2026/07/11/57658-dockweiler-celebra-el-compromiso-de-los-pacenos-con-su-cultura-y-su-patrimonio-nos-hacia-falta-reencontrarnos
