sitio_noticias,fecha,seccion,titular,cuerpo,url
La Razón,2026-07-11,ergías & Negocios,Reforma energética del país apunta a captar inversiones,"El gobierno del presidente  Rodrigo Paz Pereira trabaja en una reforma integral del marco jurídico del sector energético. La mira está puesta en atraer inversiones, tanto nacionales como extranjeras, en hidrocarburos, electricidad, litio y energías renovables. Así lo dio a conocer el pasado jueves el ministro de Hidrocarburos y Energía, Marcelo Blanco Quintanilla.

La autoridad expuso en rueda de prensa que la reforma integral corresponde a una estrategia orientada a reactivar áreas consideradas clave para la economía del país.

Blanco Quintanilla detalló que la reforma contempla cinco proyectos de ley que reemplazarán parte de la normativa vigente. El objetivo es adecuar el sector a las nuevas condiciones del mercado energético. Además, encarar los desafíos de la transición hacia una matriz sustancialmente más diversificada.

«La intención del Gobierno del presidente Rodrigo Paz es crear un nuevo marco jurídico para llevar a la patria a otro destino y no seguir rezagados. Tenemos que crear una nueva Ley de Hidrocarburos, una nueva Ley de Electricidad, una nueva Ley de Inversiones, una nueva Ley del Litio y una nueva Ley de Energías Verdes», afirmó.

El ministro de Hidrocarburos y Energía comentó que la reforma busca mayor seguridad jurídica y fortalecer la competitividad del país. Además, procura crear condiciones que incentiven inversiones en exploración, producción, industrialización y generación de energía.

Según el ministro, las reformas contempladas son parte de una estrategia de largo plazo para impulsar el crecimiento económico.",https://larazon.bo/energias-negocios/2026/07/11/reforma-energetica-del-pais-apunta-a-captar-inversiones/
La Razón,2026-07-11,ergías & Negocios,Bolivia alista paso ‘progresivo y ordenado’ hacia la IA,"El viceministro Fabián Espinoza anuncia un próximo lanzamiento desde el Ministerio de Planificación, impulsa la reforma de la ley sectorial de 2001 y plantea el litio y el clima frío del occidente como ventajas de Bolivia para los centros de datos.

El Viceministerio de Ciencia y Tecnología, dependiente del Ministerio de Planificación del Desarrollo y Medio Ambiente, prepara el despliegue de la inteligencia artificial (IA) en la administración pública boliviana. «Pronto va a haber un lanzamiento específico sobre esta tecnología. Estará acompañado también de un cronograma de capacitaciones e instrucciones al sector administrativo», adelantó el viceministro Fabián Espinoza. La autoridad definió el enfoque de la gestión en tres palabras: una implementación «progresiva, ordenada y multidimensional».

La autoridad advirtió, sin embargo, sobre los riesgos de una adopción apresurada. El uso indiscriminado de estas herramientas de IA puede hacer que «el remedio resulte peor que la enfermedad». Esto porque deprecia la calidad del contenido y genera dependencia. Sobre todo cuando se emplean «versiones gratuitas, que tienen un mayor grado de alucinación». En el ámbito jurídico, ejemplificó, estas herramientas llegan a «inventarse normas que no existen, precedentes que nunca sucedieron». Aun así, el viceministerio ya implementa «plataformas que optimizan la toma de decisiones del ministro y del equipo con inteligencia artificial generativa». Hay una condición de diseño: herramientas open source alineadas a una política de «soberanía tecnológica que se plasma en software libre y estándares abiertos».

En el plano normativo, el anuncio central es la reforma de la ley del Sistema Estatal de Ciencia, Tecnología e Innovación. «Ya estamos llevando adelante un modelo basado en la teoría de las múltiples partes interesadas para arribar a un comité multidisciplinario para la reforma de la ley», explicó Espinoza. El único precedente vigente es la ley del Sistema Nacional de Ciencia y Tecnología de 2001, que «nunca ha merecido un decreto reglamentario». Quedó como «una ley marco muy enunciativa y muy sobrecargada de estructuras» que no produjeron resultados tangibles. La autoridad fijó además un orden de prioridades regulatorias que se aparta de la tendencia de legislar sobre inteligencia artificial. «Estamos carentes de una ley de protección de datos personales y de una ley de acceso a la información, que son temas inminentes», sostuvo. Luego reflexionó sobre «qué necesidad tenemos realmente en este momento» de una ley de IA sin un análisis previo de madurez.

En cuanto a la gestión en curso, el viceministerio estandarizó su estructura metodológica según los parámetros de la Red Iberoamericana de Ciencia y Tecnología. Este ordenamiento identificó 87 líneas doctrinales en ciencia y, en tecnología, 10 rubros y más de 30 subrubros, de la biotecnología a la nanotecnología. En materia de patentes, Espinoza reconoció el rezago del país con franqueza. «Cuando menos no somos los últimos, pero no estamos a la cabeza», dijo.

Para revertirlo, la entidad ejecutará un cronograma anual de capacitaciones junto al Servicio Nacional de Propiedad Intelectual, dirigido a sectores públicos, privados y académicos. Además, trabaja en una reforma normativa para dar a investigadores y emprendedores «alguna forma de incentivos o un régimen especial». El acompañamiento a las startups, en alianza con las cámaras de comercio, completa la agenda. Se trata, dijo, de «un nicho al que en los anteriores años no se le ha dado la atención que correspondía».

La visión de futuro del viceministro descansa en dos ventajas comparativas que, a su juicio, el país aún no dimensiona. «Bolivia tiene la fortaleza del litio, que hace a los centros de procesamiento de datos, específicamente con inteligencia artificial», afirmó. La segunda es climática. «Tenemos espacios geográficos interesantes, con temperaturas en el occidente boliviano que permiten prescindir de las máquinas de acondicionamiento o enfriamiento». El argumento cobra sentido ante el costo energético de la IA, que somete a la generación y redes a un estrés creciente. Ambos potenciales se proyectan hasta 2030 dentro del Plan de Desarrollo Económico, Social y Ambiental, con miras a alianzas con actores internacionales y a mitigar la fuga de cerebros del país.",https://larazon.bo/energias-negocios/2026/07/11/bolivia-alista-paso-progresivo-y-ordenado-hacia-la-ia/
La Razón,2026-07-11,Nacional,Velasco ve un ‘grave error’ mantener congelado el precio de los combustibles,"El gobernador de Santa Cruz, Juan Pablo Velasco, cuestionó la decisión del Gobierno de ampliar por seis meses congelados los precios de los combustibles y advirtió que la medida no solucionará la escasez de diésel y gasolina que enfrenta el país.

El funcionario indicó que la regulación estatal de los precios provoca distorsiones en el mercado y consideró que la decisión, asumida tras la aprobación de los decretos supremos 5652 y 5653, representa un “grave error”.

“Me parece que ese es un grave error. Cuando hay fijación de precios, cuando el Estado se mete a poner fijo algo, es que se vienen las crisis”, afirmó Velasco.

El gobernador señaló que la autorización para que empresas privadas importen y comercialicen combustibles debió entrar en vigencia desde noviembre del año pasado. En su criterio, mientras el precio interno permanezca regulado y por debajo del valor del mercado, el abastecimiento no se normalizará.

“Las colas van a seguir porque el precio está a la mitad. Entonces, no hay un equilibrio ahí”, añadió.

Velasco también expresó preocupación por la continuidad de la falta de combustibles, pese a que el actual Gobierno lleva ocho meses de gestión. Afirmó que la escasez ya afecta a los productores agropecuarios de Santa Cruz.

“Es preocupante que ocho meses después de haber asumido el nuevo Gobierno sigamos con el mismo problema. No hay diésel, no hay gasolina y la producción de los productores del agro de Santa Cruz está empezando a sufrir”, declaró.

El Gobierno aprobó esta semana los decretos supremos 5652 y 5653, que introducen modificaciones en la política de hidrocarburos y en el régimen tributario, entre ellas la extensión del precio regulado de los combustibles por un periodo adicional de seis meses.",https://larazon.bo/nacional/2026/07/11/velasco-ve-un-grave-error-mantener-congelado-el-precio-de-los-combustibles/
La Razón,2026-07-11,Nacional,DGAC deja investigación de aeronave de Villa Montes a la Fiscalía,"La Dirección General de Aeronáutica Civil (DGAC) informó que no abrirá una investigación técnica sobre la aeronave reportada en la comunidad de Ibibobo, en el municipio tarijeño de Villa Montes, debido a que el caso presenta elementos que apuntan a un presunto hecho ilícito.

La entidad señaló que verificó la información difundida sobre el supuesto siniestro y concluyó que las circunstancias del caso exceden el ámbito de las investigaciones aeronáuticas que realiza la institución.

La DGAC explicó que la normativa vigente delimita sus competencias a la investigación de accidentes e incidentes relacionados con la actividad aérea, por lo que situaciones vinculadas a posibles delitos deben ser atendidas por otras instancias del Estado.

En ese sentido, recordó que la Reglamentación Aeronáutica Boliviana (RAB) 830 establece que las investigaciones técnicas tienen como finalidad determinar causas y factores asociados a eventos de aviación civil, sin incluir hechos de carácter ilícito.

La institución indicó que serán las autoridades competentes las encargadas de realizar las indagaciones correspondientes para esclarecer lo ocurrido con la aeronave hallada en Villa Montes.",https://larazon.bo/nacional/2026/07/11/dgac-deja-investigacion-de-aeronave-de-villa-montes-a-la-fiscalia/
La Razón,2026-07-11,Nacional,Las seis claves del éxito  del desarrollo de China,"En el conversatorio por el 105° aniversario del Partido Comunista de China (PCCh) y del 41° aniversario del establecimiento de relaciones diplomáticas entre China y Bolivia, convocado por la embajada de ese país, el embajador Wang Liang destacó que el presidente Xi Jinping sintetizó en seis principios fundamentales las razones que explican el éxito alcanzado por China en su proceso de desarrollo y modernización.

Estas seis cualidades han permitido al Partido Comunista de China conducir la transformación del país, impulsar un crecimiento económico sostenido, erradicar la pobreza extrema, fortalecer la estabilidad social y consolidar a China como una de las principales potencias del mundo.

La primera clave es la dedicación a la búsqueda de la verdad, mediante la renovación permanente de la teoría y la capacidad de adaptar las políticas a las nuevas realidades para garantizar que el país avance siempre en la dirección correcta.

La segunda corresponde al profundo vínculo con el pueblo, manteniendo como prioridad las necesidades y aspiraciones de la población. Según explicó Wang, este principio ha permitido que el Partido conserve una sólida base social y mantenga su vocación de trabajar junto a la ciudadanía.

Como tercer elemento destacó la determinación para asumir las misiones históricas, combinando objetivos de corto y largo plazo mediante políticas coherentes que permitan mantener la iniciativa estratégica frente a los desafíos nacionales e internacionales.

Lea más: China destaca el liderazgo del PCCh y proyecta una nueva etapa de cooperación con Bolivia

La cuarta clave es la capacidad de seguir la tendencia del desarrollo, comprendiendo las condiciones propias de China y los cambios de la época para impulsar permanentemente la innovación y mantenerse a la vanguardia de la transformación económica y tecnológica.

En quinto lugar, Xi Jinping resaltó el coraje y la capacidad para enfrentar dificultades y desafíos, manteniendo la confianza y la determinación frente a cualquier amenaza interna o externa.

Finalmente, el sexto principio es el compromiso con el autofortalecimiento del Partido, fortaleciendo continuamente su disciplina, su capacidad organizativa y sus mecanismos de gobernanza para preservar su vitalidad y responder eficazmente a las demandas del desarrollo.

Wang Liang explicó que estos seis principios constituyen la base del modelo de gobernanza impulsado por el Partido Comunista de China y han permitido que el país alcance logros históricos como la salida de más de 100 millones de personas de la pobreza extrema, el liderazgo en innovación tecnológica y la consolidación de un desarrollo de alta calidad.

El embajador añadió que, en palabras del presidente Xi Jinping, el Partido Comunista de China no solo está comprometido con el desarrollo del pueblo chino, sino también con la construcción de una comunidad de futuro compartido para la humanidad, promoviendo el multilateralismo, la cooperación internacional y el beneficio mutuo como principios para enfrentar los desafíos globales.",https://larazon.bo/nacional/2026/07/11/las-seis-claves-del-exito-del-desarrollo-de-china/
La Razón,2026-07-11,Nacional,Canciller Aramayo plantea una relación de largo plazo con China,"El canciller de Bolivia, Fernando Aramayo, afirmó que la relación entre Bolivia y la República Popular China debe consolidarse como una alianza estratégica de largo plazo sustentada en la confianza política, la cooperación tecnológica y el fortalecimiento del multilateralismo, durante el conversatorio organizado por la Embajada de China para conmemorar los 41 años de relaciones diplomáticas entre ambos países.

El ministro señaló que la decisión adoptada en 1985 de establecer relaciones diplomáticas permitió construir una relación que hoy trasciende el ámbito político para convertirse en una asociación integral que abarca cooperación económica, científica, tecnológica, educativa y cultural.

“Las relaciones diplomáticas verdaderamente sólidas no se definen únicamente por el transcurso del tiempo; se consolidan cuando somos capaces de adaptarnos a las transformaciones del sistema internacional sin perder la confianza que les dio origen”, sostuvo.

Aramayo destacó que ambos países han preservado principios permanentes del derecho internacional como el respeto mutuo, la igualdad soberana, la no injerencia en asuntos internos y la búsqueda de beneficios compartidos.

El canciller afirmó que China constituye uno de los principales socios estratégicos de Bolivia y resaltó el crecimiento de la cooperación en infraestructura, innovación tecnológica, energía, salud, educación, formación de recursos humanos y desarrollo industrial.

Asimismo, destacó el incremento del comercio bilateral y señaló que la agenda conjunta continúa ampliándose hacia sectores como ciencia, tecnología, energías renovables, industrialización, intercambio académico y formación de talento humano.

En ese sentido, expresó el interés del Gobierno boliviano por profundizar la cooperación tecnológica con China para enfrentar los desafíos del desarrollo nacional.

“Queremos aprender mucho de China y aprovechar esa curva de aprendizaje para incorporar tecnología que nos permita resolver los desafíos pendientes de nuestra agenda de desarrollo”, afirmó.

Lea más: Las seis claves del éxito del desarrollo de China

Durante su intervención, Aramayo sostuvo que Bolivia busca construir relaciones internacionales que trasciendan los cambios políticos internos y no respondan a criterios ideológicos.

“Aspiramos a relaciones que no sean simplemente transaccionales, sino relaciones de amistad, de mediano y largo plazo”, indicó.

Añadió que la política exterior boliviana busca fortalecer vínculos estables con socios estratégicos sobre la base del respeto a la soberanía y la defensa de los intereses nacionales.

El canciller afirmó que el contexto internacional exige respuestas cooperativas frente a fenómenos como el cambio climático, la seguridad alimentaria, la transición energética, la revolución digital y el desarrollo de la inteligencia artificial.

En ese escenario, destacó la importancia de fortalecer el multilateralismo y la coordinación entre Bolivia y China en espacios internacionales como Naciones Unidas, CELAC, el G77+China y otros mecanismos de cooperación.

Finalmente, sostuvo que los 41 años de relaciones diplomáticas representan mucho más que una sucesión de acuerdos oficiales.

“Bolivia y la República Popular China pueden afirmar que han construido una relación madura, respetuosa y con una visión compartida del futuro”, afirmó.

El canciller concluyó expresando la voluntad del Gobierno boliviano de continuar fortaleciendo la amistad y la cooperación bilateral, convencido de que el diálogo, el respeto mutuo y la colaboración constituyen la mejor base para enfrentar los desafíos del escenario internacional y promover el desarrollo de ambos pueblos.",https://larazon.bo/nacional/2026/07/11/canciller-aramayo-plantea-una-relacion-de-largo-plazo-con-china/
La Razón,2026-07-11,"Marcas, Mundial 2026",Inglaterra gana 2-1 a Noruega en alargue y avanza a semifinales del Mundial,"Inglaterra selló su clasificación a las semifinales de la Copa Mundial de la FIFA 2026 tras vencer por 2-1 a Noruega en un intenso duelo de cuartos de final. Los ingleses remontaron el marcador gracias a una sobresaliente actuación de Jude Bellingham.

El mediocampista del Real Madrid fue la gran figura del encuentro al convertir un doblete que cambió el rumbo del partido. Su capacidad para aparecer en los momentos decisivos permitió a los ‘Three Lions’ dejar en el camino a una combativa selección noruega.

Con este triunfo, Inglaterra se instaló entre las cuatro mejores selecciones del torneo y ahora espera al ganador del cruce entre Argentina y Suiza para conocer a su rival en las semifinales. El conjunto inglés mantiene intacto su sueño de conquistar el título mundial.",https://larazon.bo/marcas/2026/07/11/bellingham-guia-la-remontada-de-inglaterra-y-la-clasifica-a-semifinales/
La Razón,2026-07-11,Papel_digital,Papel Digital,"LA RAZÓN E-PAPER Julio 11, 2026

LA RAZÓN E-PAPER Julio 10, 2026

LA RAZÓN E-PAPER Julio 09, 2026

LA RAZÓN E-PAPER Julio 08, 2026",https://larazon.bo/papel_digital/papel-digital/
La Razón,2026-07-11,Columna,HURGANDO EL AVISPERO archivos,"Ver toda la sección >

Ver toda la sección >

Ver toda la sección >

Ver toda la sección >

Ver toda la sección >

Ver toda la sección >

Ver toda la sección >

Ver toda la sección >

Ver toda la sección >

Energías & Negocios Animal Político MARCAS Escape Extra Energías & Negocios Ver todo el suplemento > Energías & Negocios Bolivia alista paso ‘progresivo y ordenado’ hacia la IA julio 11, 2026 Energías & Negocios Reforma energética del país apunta a captar inversiones julio 11, 2026 Energías & Negocios El dólar digital se sostiene como alternativa para pagos en Bolivia julio 11, 2026 Energías & Negocios Argentina honra deuda en dólares por $us 4.385 millones julio 11, 2026 Animal Político Ver todo el suplemento > Animal Político Reformas a la CPE: entre urgencias y desconfianzas julio 4, 2026 Animal Político El país en el cruce de caminos: estatismo o neoliberalismo julio 4, 2026 Animal Político La inteligencia artificial no salvará a la justicia boliviana julio 4, 2026 MARCAS Ver todo el suplemento > Marcas Haaland se va del Mundial con goles; Noruega (1-2) Inglaterra julio 11, 2026 Marcas Inglaterra gana 2-1 a Noruega en alargue y avanza a semifinales del Mundial julio 11, 2026 Marcas CDT Real Oruro triunfa ante GV San José en el duelo de orureños julio 11, 2026 Marcas Leonardo Zabala potenciará la defensa de Bolívar julio 11, 2026 Escape Ver todo el suplemento > Escape Harry Styles: la ‘Apertura’ y madurez de un popstar enero 24, 2026 Escape Sandokan: más que una serie, un fenómeno generacional enero 24, 2026 Escape ‘Sinners’ lidera la carrera por los Oscar con 16 nominaciones enero 24, 2026 Escape La melancolía del territorio en la novela ‘Tal vez, un día’ enero 24, 2026 Extra Ver todo el suplemento > Extra Disparan a dos hombres en el ingreso de una licorería diciembre 11, 2025 Extra Jhonny Fernández gana $us 262.000 en la lotería americana diciembre 11, 2025 Extra Rescatan a una adolescente reportada como desaparecida diciembre 10, 2025

Ver todo el suplemento >

Ver todo el suplemento >

Ver todo el suplemento >

Ver todo el suplemento >

Ver todo el suplemento >

Ver toda la sección >

Ver toda la sección >

Ver toda la sección >

Ver toda la sección >

Ver toda la sección >

Ver toda la sección >

Ver toda la sección >

Ver toda la sección >

Ver toda la sección >

Energías & Negocios Animal Político MARCAS Escape Extra Energías & Negocios Ver todo el suplemento > Energías & Negocios Bolivia alista paso ‘progresivo y ordenado’ hacia la IA julio 11, 2026 Energías & Negocios Reforma energética del país apunta a captar inversiones julio 11, 2026 Energías & Negocios El dólar digital se sostiene como alternativa para pagos en Bolivia julio 11, 2026 Energías & Negocios Argentina honra deuda en dólares por $us 4.385 millones julio 11, 2026 Animal Político Ver todo el suplemento > Animal Político Reformas a la CPE: entre urgencias y desconfianzas julio 4, 2026 Animal Político El país en el cruce de caminos: estatismo o neoliberalismo julio 4, 2026 Animal Político La inteligencia artificial no salvará a la justicia boliviana julio 4, 2026 MARCAS Ver todo el suplemento > Marcas Haaland se va del Mundial con goles; Noruega (1-2) Inglaterra julio 11, 2026 Marcas Inglaterra gana 2-1 a Noruega en alargue y avanza a semifinales del Mundial julio 11, 2026 Marcas CDT Real Oruro triunfa ante GV San José en el duelo de orureños julio 11, 2026 Marcas Leonardo Zabala potenciará la defensa de Bolívar julio 11, 2026 Escape Ver todo el suplemento > Escape Harry Styles: la ‘Apertura’ y madurez de un popstar enero 24, 2026 Escape Sandokan: más que una serie, un fenómeno generacional enero 24, 2026 Escape ‘Sinners’ lidera la carrera por los Oscar con 16 nominaciones enero 24, 2026 Escape La melancolía del territorio en la novela ‘Tal vez, un día’ enero 24, 2026 Extra Ver todo el suplemento > Extra Disparan a dos hombres en el ingreso de una licorería diciembre 11, 2025 Extra Jhonny Fernández gana $us 262.000 en la lotería americana diciembre 11, 2025 Extra Rescatan a una adolescente reportada como desaparecida diciembre 10, 2025

Ver todo el suplemento >

Ver todo el suplemento >

Ver todo el suplemento >

Ver todo el suplemento >

Ver todo el suplemento >

El fútbol no se escapa de la realidad. El fútbol es espejo de lo social. O se juega como se ...

Hace un par de semanas atrás, Willy Zeballos, cantante de PK2, desató una ola de críticas: “Las canciones de PK2 ...

En el relato Una muerte anunciada de Gabriel García Márquez se narra la historia del asesinato de Santiago Nasar en ...

La película más premiada de los últimos tiempos en Bolivia es “La Hija del Cóndor” del cineasta, Álvaro Olmos que ...

El olor de los domingos –quizás de los sábados y de los feriados, también—en Apote, municipio de Tiquipaya, al igual ...

Estar en el tren es ingresar a un hábitat singular, especialmente cuando se viaja en el tren metropolitano, aquel que ...

Más allá de las responsabilidades coyunturales del gobierno actual y de su predecesor, hay una cuestión sociológica que opera como ...

Desde aquellos vetustos edificios de estilo republicano --hoy en vía de extinción--, los conventillos, hoy asistimos a construcciones modernas, los ...

El domingo de Carnaval surgió una noticia inaudita asociada a un posible corte de la lengua de un periodista en ...

Mafalda, el entrañable personaje de la historieta concebida por Quino, está en Cochabamba. Con la colaboración del Consulado argentino, junto ...

El giro hacia una política de seguridad más dura de Abelardo De La Espriella amenaza debilitar los avances del acuerdo...

La Razón, medio de comunicación digital líder en noticias de Bolivia y el mundo, conecta a su audiencia a través de todas las plataformas digitales. Con una sólida presencia en redes sociales, programas de streaming innovadores, y el revolucionario e-paper, nuestro periódico digital inteligente, ofrecemos información confiable, ágil y al alcance de todos.

Dirección: Colinas de Santa Rita s/n, Alto Auquisamaña (Galpón de La Razón) La Paz - Bolivia

Correo electrónico:

[email protected]

[email protected]

WhatsApp:

+591 67198163

+591 77220575

© 2021-2025 COMUNICACIONES EL PAÍS S.A ( Desarrollo web Arcadia SRL )",https://larazon.bo/columna/hurgando-el-avispero/
