sitio_noticias,fecha,seccion,titular,cuerpo,url
Éxito Noticias Bolivia,2026-07-11,MUNDO,RD del Congo eleva casos de ébola a 1.830 y 648 muertes,"Éxito Noticias, 11 de julio 2026.- El número de casos confirmados de ébola en la República Democrática del Congo aumentó a 1,830, incluyendo 648 muertes, según datos del gobierno publicados la noche del viernes (10.07.2026).

La tasa de letalidad se sitúa actualmente en el 34,1 %, de acuerdo con las cifras de casos confirmados hasta el jueves y divulgados por el Ministerio de Comunicaciones.

Además, 764 pacientes se encuentran en situación de “aislamiento/hospitalización” y otras 295 personas han logrado recuperarse de la enfermedad.

La tasa de rastreo de contactos asciende al 78,6 %, precisaron las autoridades.

El brote se concentra en las provincias orientales de Ituri (epicentro de la epidemia), Kivu del Norte y Kivu del Sur, si bien “las investigaciones continúan sobre los dos casos detectados en Kisangani” en la provincia de Tshopo, añadió el ministerio.

El brote se declaró oficialmente el 15 de mayo en Ituri, provincia fronteriza con Uganda y Sudán del Sur.

La epidemia se propagó igualmente a Uganda, donde se han detectado 20 contagios confirmados, incluidos 15 casos que se consideran importados de la RDC y entre los que hay dos fallecimientos.

El brote se corresponde con la cepa de Bundibugyo, cuya tasa de letalidad oscila entre el 30 % y el 50 % y para la que no existe vacuna autorizada o tratamiento específico, según la Organización Mundial de la Salud (OMS).

Se trata de la tercera peor epidemia de ébola de la historia registrada hasta la fecha, y es la decimoséptima que afecta a la República Democrática del Congo.

El virus del Ébola se transmite por contacto directo con fluidos corporales de personas o animales infectados y causa fiebre hemorrágica grave, vómitos, diarrea y hemorragias internas.

//DW",https://exitonoticias.com.bo/rd-del-congo-eleva-casos-de-ebola-a-1-830-y-648-muertes/397032/
Éxito Noticias Bolivia,2026-07-11,SOCIAL,Centro de Adiestramiento de la Policía Boliviana jubila con honores a ejemplares caninos,"Éxito Noticias, 11 de julio 2026.- En el marco del LXI aniversario del Centro de Adiestramiento de Canes, este viernes, en La Paz, la Policía Boliviana jubiló con honores a ejemplares caninos que cumplieron una destacada labor al servicio de la institución y de la seguridad de la población.

En la ceremonia “también se realizó el acto de reconocimiento, jubilación y despedida con honores de ejemplares caninos que, con lealtad, disciplina y valentía, cumplieron una destacada labor al servicio de la institución y de la seguridad de la población”, informó la institución verde olivo.

El acto conmemorativo contó con la presencia del comandante general de la Policía Boliviana, Mirko Sokol, quien destacó la invaluable contribución de los canes policiales en las tareas de prevención, búsqueda, rescate y lucha contra el delito.

Uno de los canes jubilados fue Ghina, una perrita que se retira de la institución tras seis años de servicio. Entre sus mayores logros destaca el hallazgo de Bs 6 millones durante un operativo realizado en un aeropuerto del país.

“Con este homenaje, la Policía Boliviana reconoce la entrega y el servicio de nuestros compañeros de cuatro patas, cuyo legado permanecerá como ejemplo de compromiso y vocación institucional”, resaltó la institución.

//ABI",https://exitonoticias.com.bo/centro-de-adiestramiento-de-la-policia-boliviana-jubila-con-honores-a-ejemplares-caninos/397035/
Éxito Noticias Bolivia,2026-07-11,MUNDO,Torre Eiffel y museos de París cierran por ola de calor,"Éxito Noticias, 11 de julio 2026.- La Torre Eiffel y los principales museos de París, como el Louvre y el Orsay, acortarán este fin de semana su horario para hacer frente a la intensa ola de calor que afecta a Francia, informó este sábado (11.07.2026) los gestores los monumentos.

La Torre Eiffel cerrará de forma excepcional a las 16:00 horas tanto el sábado como el domingo, en lugar de su horario habitual de las 00:45, según se informó en el sitio web del monumento. La última entrada para los visitantes posible ha sido fijada a las 12:15 horas y los restaurantes de la torre dejan de admitir clientes a las 13:30.

Las personas que tuvieran entradas para visitas programadas a partir de las 12:00 por las escaleras o de las 12:30 en ascensor recibirán el reembolso automático del importe de sus billetes. La organización a cargo recomendó a los visitantes protegerse del sol, mantenerse hidratados y utilizar los puntos de agua instalados en los accesos a la torre.

Museos más visitados

Por su parte, el Museo del Louvre cerrará de forma anticipada también a las 16:00 horas, con última admisión a las 14:00, hasta el lunes inclusive. Además, el museo más visitado del mundo aconsejó a los visitantes adaptar el ritmo de la visita para minimizar los efectos del calor y recuerda que la reserva previa de entradas es obligatoria.

En la otra orilla del Sena, el cercano Museo de Orsay adelantará su cierre a las 17:00 horas desde este sábado y hasta el miércoles 15 de julio. La última entrada será a las 16:00 y las salas de exposición cerrarán media hora más tarde. El museo reembolsará automáticamente las entradas adquiridas para visitas programadas después de las 15:30 horas.

Estas medidas se enmarcan en el segundo episodio de calor extremo que atraviesa Francia, con temperaturas cercanas a los 40 grados en numerosas regiones y alertas meteorológicas rojas y naranjas activadas en buena parte del país.

//DW",https://exitonoticias.com.bo/torre-eiffel-y-museos-de-paris-cierran-por-ola-de-calor/397038/
Éxito Noticias Bolivia,2026-07-11,"NACIONAL, PORTADA, SOCIAL",Revilla asegura que la falta de presupuesto no será excusa y anuncia mejoramiento de vías en Coripata,"Éxito Noticias, 11 de julio 2026.- El gobernador de La Paz, Luis Revilla, llegó hasta el municipio de Coripata, donde sostuvo una reunión interinstitucional con el alcalde Julio Salinas, concejales y dirigentes. Aseguró que las limitaciones presupuestarias no frenarán las demandas de la región y anunció el mejoramiento de vías y puentes en la zona.

“No utilizaremos la falta de presupuesto como una excusa para frenar las demandas locales, sino que trabajaremos de manera coordinada con el Gobierno Autónomo Municipal para gestionar el financiamiento necesario”, enfatizó el gobernador.

En materia de infraestructura vial, Revilla anunció la reprogramación del mantenimiento del tramo San Félix de Arapata-Villabarrientos para la segunda quincena de julio, debido a que los trabajos fueron retrasados por la escasez de combustible. Asimismo, confirmó que las obras en el puente San Jerónimo concluirán en un plazo de 15 días, para posteriormente trasladar la maquinaria al puente Peri, mientras asambleístas viabilizan la ruta Coripata-Río Blanco-Huancaní.

Al respecto, el alcalde de Coripata, Julio Salinas, destacó las intervenciones viales por su impacto en la economía y la seguridad de la población yungueña.

“Optimizar el estado de las carreteras e impulsar las declaratorias de las redes departamentales constituyen los ejes más críticos de la gestión, dado que unas vías adecuadas garantizan la transitabilidad segura y facilitan el traslado directo de la producción local hacia los mercados”, puntualizó.

En servicios básicos, la Gobernación prevé inaugurar el proyecto de electrificación rural en Chorro Grande el próximo 20 de septiembre. Asimismo, informó que concluyen los estudios para la perforación de pozos profundos en Coscoma, Centro Conchita, Pararáni y Conchita Chico.

//ABI",https://exitonoticias.com.bo/revilla-asegura-que-la-falta-de-presupuesto-no-sera-excusa-y-anuncia-mejoramiento-de-vias-en-coripata/397043/
Éxito Noticias Bolivia,2026-07-11,"ECONOMIA, PORTADA","Dólar oficial sube a Bs 10,40 y mantiene tendencia al alza desde la aplicación del tipo de cambio flexible","Éxito Noticias, 11 de julio 2026.- La cotización oficial del dólar continúa en ascenso y este sábado alcanzó los Bs 10,40 por unidad, de acuerdo con la actualización difundida por el Banco Central de Bolivia (BCB). En el mercado paralelo, la divisa se comercializa en Bs 10,54 para la compra y Bs 10,56 para la venta.

Desde la entrada en vigencia del tipo de cambio flexible, el pasado 29 de junio, cuando el dólar oficial se fijó en Bs 9,73, el valor de la divisa ha registrado incrementos continuos.

En ese contexto, el ministro de Economía, Gabriel Espinoza, aseguró que el mercado cambiario opera con normalidad y atribuyó el comportamiento del tipo de cambio al nuevo esquema implementado por el Gobierno.

La autoridad sostuvo que la anterior política de sostener una cotización que no reflejaba las condiciones del mercado generaba distorsiones y afirmó que el actual mecanismo permitió avanzar en el ordenamiento del mercado cambiario. Según Espinoza, los resultados obtenidos con el nuevo sistema han sido favorables.",https://exitonoticias.com.bo/dolar-oficial-sube-a-bs-1040-y-mantiene-tendencia-al-alza-desde-la-aplicacion-del-tipo-de-cambio-flexible/397041/
Éxito Noticias Bolivia,2026-07-11,"NACIONAL, PORTADA, SOCIAL",Ratifican que niños deberán cumplir 4 años hasta diciembre de 2026 para ingresar al nivel Inicial,"Éxito Noticias, 11 de julio 2026.- El Ministerio de Educación informó que, para la gestión escolar 2027, las inscripciones al primer año de escolaridad del Nivel Inicial (Pre-Kinder) serán aceptadas únicamente para niñas y niños que cumplan cuatro años de edad hasta diciembre de 2026, requisito que será verificado durante el proceso de registro.

La disposición fue comunicada por la cartera de Estado a través de un pronunciamiento difundido en sus redes sociales, en el que explica que la medida se sustenta en evidencia científica y en la experiencia docente sobre los efectos de adelantar el ingreso de los menores al sistema educativo.

Según el Ministerio, el inicio anticipado de la escolaridad puede afectar el desarrollo neurológico y socioemocional de las niñas y los niños, lo que podría dificultar que estén en condiciones de responder a las exigencias del proceso de enseñanza y aprendizaje.

La institución instó a madres, padres y tutores a informarse mediante sus canales oficiales sobre el proceso de inscripciones y el cumplimiento de este requisito para la gestión educativa 2027.

//ABI",https://exitonoticias.com.bo/ratifican-que-ninos-deberan-cumplir-4-anos-hasta-diciembre-de-2026-para-ingresar-al-nivel-inicial/397023/
Éxito Noticias Bolivia,2026-07-11,ECONOMIA,Caso armas: Defensa afirma que las aprehendidas fueron engañadas y desconocían el contenido de las maletas,"Éxito Noticias, 11 de julio 2026. – El abogado Martín Camacho, defensor de las dos mujeres aprehendidas por el caso de las armas encontradas en el aeropuerto internacional de Viru Viru, informó que ambas permanecen a la espera de su audiencia de medidas cautelares, la cual aún no se instaló debido a la carga procesal que registra el juzgado durante el fin de semana.

El jurista aseguró que sus defendidas desconocían el contenido de los bolsos que transportaban, al igual que el joven que arribó desde Estados Unidos a Santa Cruz. Según explicó, las tres personas habrían sido engañadas por un tercero, quien presuntamente organizó el envío del equipaje y actualmente es buscado por las autoridades.

Camacho señaló que las dos mujeres ya prestaron su declaración informativa y colaboraron con la investigación, proporcionando la identidad de la persona que, presuntamente, les encargó trasladar las maletas. Además, remarcó que sus defendidas responderán a todos los requerimientos del Ministerio Público para esclarecer el caso.

“ No se van a abstener y van a declarar, ya que ellas no tenían conocimiento de lo que contenían los bolsos. Vamos a esclarecer todos estos hechos y a dar los nombres de las personas que enviaron el bolso “, afirmó el abogado antes del inicio de la declaración informativa de las aprehendidas, insistiendo en que ellas actuaron sin conocer el contenido del equipaje.",https://exitonoticias.com.bo/caso-armas-defensa-afirma-que-las-aprehendidas-fueron-enganadas-y-desconocian-el-contenido-de-las-maletas/397046/
Éxito Noticias Bolivia,2026-07-11,SOCIAL,Exdirigente campesino exhorta a David Mamani a no ocultarse y presentarse ante la Justicia,"Éxito Noticias, 11 de julio 2026. – El exdirigente campesino Abraham Paco exhortó al exejecutivo de la Federación Túpac Katari, David Mamani, a dejar de ocultarse y presentarse ante la Justicia para responder por las denuncias relacionadas con los bloqueos registrados entre mayo y junio. La Policía informó que existe la posibilidad de que Mamani haya abandonado el país, mientras avanzan las investigaciones por las movilizaciones que afectaron la economía y el tránsito en varias regiones.

Paco afirmó que, si Mamani se considera un verdadero dirigente social, debe afrontar el proceso judicial y no evadir su responsabilidad. “¿Por qué te estás escondiendo? Si te has relacionado con Evo Morales es tu conciencia, pero si no te metiste con política y luchaste por las 20 provincias, no te escapes, no te escondas”, manifestó.

El exdirigente recordó que durante distintos gobiernos los líderes campesinos también fueron perseguidos y enfrentaron procesos judiciales; sin embargo, aseguró que él nunca huyó. Asimismo, evocó la figura del fallecido líder campesino Felipe Quispe, “El Mallku”, como ejemplo de un dirigente que siempre enfrentó las consecuencias de sus decisiones. “¿Acaso se escondía? Él daba la cara”, sostuvo.

Según datos de la Fiscalía, por los bloqueos se abrieron 148 procesos penales en siete departamentos del país, de los cuales 99 fueron iniciados de oficio. La mayor cantidad de casos se concentra en el departamento de La Paz, con 114 investigaciones en curso. Además, los dirigentes Vicente Salazar, Justino Apaza y Alberto Quelali permanecen con detención preventiva, acusados de promover las movilizaciones y los bloqueos.",https://exitonoticias.com.bo/exdirigente-campesino-exhorta-a-david-mamani-a-no-ocultarse-y-presentarse-ante-la-justicia/397049/
Éxito Noticias Bolivia,2026-07-11,ECONOMIA,Choferes y Gobierno no logran acuerdos y el transporte analiza asumir medidas de presión,"Éxito Noticias, 11 de julio 2026 .- La reunión entre el Gobierno y la Confederación de Choferes de Bolivia concluyó sin acuerdos concretos, por lo que el sector anunció que analizará la adopción de medidas de presión si las autoridades no formalizan por escrito los compromisos asumidos para garantizar el abastecimiento de combustibles. Los transportistas señalaron que las promesas verbales ya no son suficientes y que la documentación será presentada a las bases para su evaluación.

Durante el encuentro, en el que participaron el ministro de Hidrocarburos, Marcelo Blanco, el presidente de YPFB, Sebastián Daroca, y otras autoridades, los dirigentes del transporte reclamaron el incumplimiento de acuerdos anteriores relacionados con el suministro de diésel y gasolina. El ejecutivo de la Confederación de Choferes, Lucio Gómez, sostuvo que estas observaciones impidieron alcanzar un consenso.

“Nosotros hemos cuestionado todas las cosas que han incumplido hasta la fecha y, por lo tanto, no se ha podido llegar a ninguna conclusión, sino más al contrario que ellos hagan conocer en forma escrita”, afirmó Gómez. Asimismo, cuestionó que continúan los problemas de desabastecimiento y las denuncias sobre la calidad de los combustibles, por lo que insistió en que el Gobierno debe especificar por escrito los volúmenes de distribución y las acciones que ejecutará para normalizar el suministro.

El dirigente indicó que esperan recibir ese documento entre este sábado y el lunes para remitirlo a los secretarios ejecutivos de las federaciones de todo el país. “No podemos nuevamente creer en la mentira, no podemos creer nuevamente en compromisos”, manifestó, al señalar que serán las bases las que definirán la respuesta del sector una vez analizada la propuesta gubernamental.

Gómez advirtió que, si el Gobierno no entrega el compromiso escrito o este no responde a las demandas del transporte, las federaciones afiliadas evaluarán la aplicación de medidas de presión a nivel nacional. Además, aseguró que el sector mantendrá su postura pese al Estado de Excepción vigente, argumentando que sus demandas responden a una problemática social vinculada al abastecimiento de combustible y a la necesidad de garantizar el trabajo de los transportistas en todo el país.",https://exitonoticias.com.bo/choferes-y-gobierno-no-logran-acuerdos-y-el-transporte-analiza-asumir-medidas-de-presion/397051/
Éxito Noticias Bolivia,2026-07-11,"POLITICA, PORTADA",Paz asegura que planta fotovoltaica en Viacha será la más grande de Bolivia,"Éxito Noticias, 11 de julio 2026.- El presidente Rodrigo Paz Pereira aseguró este sábado que la planta fotovoltaica que se construirá en Viacha será la más grande de Bolivia y señaló que el proyecto permitirá incrementar la generación de energía, además de generar empleos y progreso.

El mandatario realizó el anuncio durante su participación en la celebración religiosa en devoción a la Virgen de Letanías, en el municipio de Viacha.

“Los bolivianos están luchando para salir adelante y ya hemos firmado la ley que va a construir una planta fotovoltaica, la más grande de Bolivia, en Viacha, para aumentar la energía. Y la energía va a significar empleos y progreso”, señaló Paz.

El Presidente destacó que el proyecto forma parte del impulso a las energías renovables y resaltó la importancia de aprovechar la energía solar como una nueva fuente de generación.

“Ya no dependiendo tanto del gas, que vamos a ser un país que vuelva a ser gasífero, pero ya de nuestras propias energías y, sobre todo, una energía que nos ha dado Diosito, que es el sol, porque ahora hay que ir a las energías renovables”, manifestó.

Paz indicó que la planta de energía solar fotovoltaica contribuirá a la zona industrial de La Paz y afirmó que esta o otras normas que serán remitidas a la Asamblea Legislativa estarán orientadas a generar obras, industrias, empleo y desarrollo.

“Estas normas se van a reflejar en obras, se van a reflejar en industrias, se van a reflejar en empleo, en desarrollo”, sostuvo.

Durante su visita al santuario de la Virgen de Letanías, el mandatario también recordó que hace dos años, cuando era senador, impulsó una norma para declarar esta tradición como patrimonio cultural.

“Hace dos años, cuando era senador, traje la ley que hacía oficial a la Virgencita de Letanías y a toda la tradición como parte del patrimonio nacional cultural intangible. Hicimos la norma, la rescatamos y después la hicimos aprobar, aun siendo minoría de oposición, pero se aprobó”, recordó.

Además, expresó su agradecimiento por la participación de la población y destacó la importancia de la fe durante la celebración religiosa.

“Hoy día es la fe, hoy día es la familia viacheña, es la familia paceña, boliviana. Así que agradecido. Me dejan entrar para estar junto a la Virgencita, junto al pueblo boliviano. Se agradece de corazón”, expresó.

//ABI.",https://exitonoticias.com.bo/paz-asegura-que-planta-fotovoltaica-en-viacha-sera-la-mas-grande-de-bolivia/397054/
Éxito Noticias Bolivia,2026-07-11,"ECONOMIA, POLITICA",Diputado Pacheco plantea proyecto de ley para que todos los contratos y créditos se realicen en bolivianos,"Éxito Noticias, 11 de julio 2026 .- El diputado de Alianza Popular, Rolando Pacheco, anunció que la próxima semana presentará un proyecto de ley destinado a “bolivianizar” todos los contratos y créditos en el país, con el propósito de fortalecer el uso de la moneda nacional y reducir la dependencia del dólar en las transacciones económicas.

El legislador cuestionó que en Bolivia todavía se suscriban contratos y se otorguen créditos en dólares, pese a que, según afirmó, la mayoría de la población percibe sus ingresos en bolivianos. Asimismo, sostuvo que la eliminación del tipo de cambio oficial terminó favoreciendo únicamente a determinados sectores con mayor poder económico.

“No debería haber contratos ni créditos en dólares, debería ser en bolivianos. Es por eso que este diputado ha presentado un proyecto de ley para que se bolivianice todo, para que ya no hablemos de dólares. ¿Acaso usted gana en bolivianos?, ¿acaso usted cobra en dólares? No debería haber”, manifestó Pacheco al anunciar la iniciativa legislativa.

El diputado adelantó que solicitará la dispensación de trámite para acelerar el tratamiento de la propuesta en la Asamblea Legislativa Plurinacional. “ La próxima semana voy a pedir que este proyecto de ley se apruebe “, afirmó, al señalar que la medida busca consolidar el uso del boliviano como única referencia en contratos y operaciones crediticias dentro del territorio nacional.",https://exitonoticias.com.bo/diputado-pacheco-plantea-proyecto-de-ley-para-que-todos-los-contratos-y-creditos-se-realicen-en-bolivianos/397053/
Éxito Noticias Bolivia,2026-07-11,SEGURIDAD,Una mujer fue encontrada sin vida en la represa de Incachaca; el caso ya es investigado,"Éxito Noticias, 11 de julio 2026 .- La Fuerza Especial de Lucha Contra el Crimen (Felcc) de La Paz inició una investigación tras el hallazgo del cuerpo sin vida de una mujer en la represa de Incachaca, una de las principales fuentes de abastecimiento de agua potable para la ciudad de La Paz. El cadáver fue encontrado flotando por personas que se encontraban en el sector, quienes dieron aviso inmediato a las autoridades.

El director departamental de la Felcc, coronel Henry Pinto, informó que personal de la División Homicidios realizó el levantamiento legal del cuerpo. “ En horas de la tarde, la División de Homicidios procedió al levantamiento legal de un cadáver que se encontraba en la represa de Incachaca, perteneciente al sector de la empresa Epsas “, señaló la autoridad policial.

De acuerdo con el reporte preliminar, la víctima tendría entre 40 y 45 años de edad. Hasta el momento se desconoce su identidad y las circunstancias en las que llegó hasta la represa, por lo que la Policía activó las investigaciones para esclarecer lo ocurrido y determinar si existió la participación de terceras personas.

El cuerpo fue trasladado a la morgue judicial, donde se le practicará la autopsia médico-legal para establecer la causa exacta de la muerte. Los resultados de ese examen, junto con las diligencias investigativas, permitirán identificar a la víctima y aportar mayores elementos para el esclarecimiento del caso.",https://exitonoticias.com.bo/una-mujer-fue-encontrada-sin-vida-en-la-represa-de-incachaca-el-caso-ya-es-investigado/397058/
Éxito Noticias Bolivia,2026-07-11,SOCIAL,Activistas anuncian que coadyuvarán con el Gobierno para denunciar a responsables de los bloqueos,"Éxito Noticias, 11 de julio 2026 .- Activistas e instituciones cívicas anunciaron que coadyuvarán con el Gobierno en las acciones legales contra los responsables de los bloqueos registrados en el país. El pronunciamiento fue realizado durante el evento “Los derechos humanos y la justicia del país”, desarrollado en la Asamblea Permanente de Derechos Humanos, donde participaron representantes de distintos sectores.

El secretario general del Comité Cívico, Edmar Yana, afirmó que impulsarán denuncias contra los dirigentes que promovieron las movilizaciones, al considerar que los bloqueos vulneraron los derechos de la población paceña y alteña al restringir el acceso a alimentos, servicios de salud y libre circulación. Asimismo, señaló que buscarán coordinar acciones con otras instituciones cívicas del departamento de La Paz.

“Que se tomen cartas en el asunto, mandar y hacer las órdenes de aprehensión contra estos dirigentes que han atentado contra la ciudadanía paceña, coartándonos la salud y la comida. Tenemos muertos por estos últimos acontecimientos que lamentablemente están quedando impunes. Nosotros vamos a exigir y vamos a proceder a levantar las denuncias correspondientes contra estas personas que han atentado contra la ciudadanía paceña y alteña”, manifestó Yana.

Por su parte, la activista Amparo Carvajal expresó que continuará defendiendo los derechos fundamentales de la población y manifestó su deseo de que los hechos registrados durante los días de bloqueo no vuelvan a repetirse. Los participantes del encuentro coincidieron en la necesidad de que las investigaciones avancen y se establezcan responsabilidades por las afectaciones ocasionadas durante las movilizaciones.",https://exitonoticias.com.bo/activistas-anuncian-que-coadyuvaran-con-el-gobierno-para-denunciar-a-responsables-de-los-bloqueos/397060/
