sitio_noticias,fecha,seccion,titular,cuerpo,url
Unitel,2026-07-14,Seguridad,Presidente de YPFB declaró en la Fiscalía como testigo por la calidad de la gasolina,"En el marco de las investigaciones por la calidad de la gasolina, el presidente de Yacimientos Petrolíferos Fiscales Bolivianos (YPFB), Sebastián Daroca, se presentó este martes en oficinas de la Fiscalía de La Paz para brindar su declaración informativa en calidad de testigo.

“Vine a la Fiscalía por el proceso relacionado con la calidad de la gasolina. Llego con el espíritu de transparencia y colaboración para que esta investigación pueda avanzar y tener resultados”, informó Daroca tras salir de las oficinas.

MIRA AQUÍ: Gesta libertaria: Ministerio de Trabajo hace oficial el feriado departamental en La Paz, ¿será doble?

El titular de YPFB señaló que proporcionó información “técnica y operativa” sobre los procesos de adquisición de diésel y gasolina, que fueron cuestionados por el sector del transporte público, cuando sus dirigentes denunciaron que el combustible ha ocasionado daños en los motores de sus vehículos.

“La Fiscalía tiene que determinar, dentro de su investigación, a los responsables. Nosotros hemos venido a brindar información técnica y operativa sobre cómo se fueron desarrollando los acontecimientos”, agregó.

Dentro de este caso, el expresidente de YPFB, Yuseff Akly, se presentó en junio a la Fiscalía de La Paz para presentar su declaración informativa en calidad de testigo.

MIRA AQUÍ: Confirman una semana más de vacaciones de invierno para un departamento del país, ¿cuál es?

Akly era la máxima autoridad de la petrolera estatal cuando se denunció la comercialización de combustible de mala calidad que dañó los motores de los vehículos.

Mientras fue presidente de YPFB, Akly aseguró que el problema era aislado y luego responsabilizó a la gestión de Armin Dorgathen , de la gestión del expresidente Luis Arce, de ser el responsable de la compra de esa calidad de combustible.

Sin embargo, a la fecha al menos tres exgerentes de la actual gestión están en la cárcel por este caso.",https://unitel.bo/noticias/seguridad/presidente-de-ypfb-declaro-en-la-fiscalia-como-testigo-por-la-calidad-de-la-gasolina-FG22178827
Unitel,2026-07-14,Seguridad,Presunto infanticidio en Cochabamba: Bebé de 1 año y seis meses muere y su mamá está en terapia intensiva,"Un bebé de 1 año y 6 meses murió presuntamente por infanticidio este martes en una vivienda de la avenida República, zona sur de Cochabamba. La Policía y la Defensoría de la Niñez realizaron el levantamiento del cuerpo e iniciaron las investigaciones . La mamá del menor está internada en terapia intensiva.

La jefa de la Defensoría de la Niñez y Adolescencia de Cochabamba, María René Morales, indicó que el menor que falleció era hijo de una pareja joven.

MIRA AQUÍ: Presidente de YPFB declaró en la Fiscalía como testigo por la calidad de la gasolina

“Lamentablemente, el bebé tiene un año y seis meses, es bastante pequeñito, se entiende que es el único hijo de esta familia, y tanto madre y padre también son jóvenes. Sin embargo, vamos a hacer todas las investigaciones y valoración”, manifestó.

Señaló que l a madre se encuentra actualmente terapia intensiva, y su pareja está en el hospital cuidando de la mujer. Sin embargo, señaló que el padre también va a declarar por el caso en las próximas horas.

Una vecina de la zona relató que escuchó y vio a la pareja discutir en plena vía pública .

MIRA AQUÍ: Familias denuncian que 10 jóvenes partieron con engaños a la guerra de Rusia contra Ucrania

De manera preliminar, se presume que la madre dio alguna sustancia a su hijo y luego intentó quitarse la vida ; sin embargo, el caso está en plena investigación y se espera el informe oficial de las autoridades.

La Fiscalía también se apersonó al lugar para dar inicio a las investigaciones.",https://unitel.bo/noticias/seguridad/presunto-infanticidio-en-cochabamba-bebe-de-1-ano-y-seis-meses-muere-y-su-mama-esta-en-terapia-intensiva-AJ22180044
Unitel,2026-07-14,Seguridad,Policía investiga de oficio las denuncias del reclutamiento de bolivianos para la guerra de Rusia contra Ucrania,"Tras conocerse denuncias sobre el presunto reclutamiento de bolivianos para ser llevados a Rusia y participar en la guerra contra Ucrania, el subcomandante general de la Policía, Juan Peña, informó que se comenzó una investigación de oficio para establecer la veracidad de esos hechos.

“Es nuestra responsabilidad iniciar las investigaciones de oficio a fin de establecer la verdadera historia de este hecho y determinar si , efectivamente, ciudadanos bolivianos fueron captados”, informó la autoridad.

MIRA AQUÍ: Fiscal general anuncia investigación ante denuncia de bolivianos que fueron llevados a Rusia para la guerra

Peña explicó que, tras conocer las denuncias, la Policía comenzó a recopilar información para esclarecer el caso. La investigación deberá identificar la existencia de bolivianos afectados o personas involucradas en estos hechos, agregó.

“Nos hemos enterado de estos hechos a través de los medios de comunicación y estamos recabando información sobre estos hechos que presuntamente se habrían registrado en otro país”, señaló.

Por su parte, el fiscal general del Estado, Róger Mariaca, anunció que el Ministerio Público ya investiga las denuncias sobre bolivianos que presuntamente fueron reclutados para ser llevados a la guerra.

MIRA AQUÍ: “Los llevan a un búnker, los entrenan un mes y los mandan a combate”: Bolivianos mueren en la guerra Rusia - Ucrania

“Ya hay una investigación. Yo les pido que por favor tengan paciencia conjuntamente con el fiscal que lleve adelante la investigación, se va a informar en su momento”, sostuvo la autoridad al ser consultada por los periodistas.

El pronunciamiento surge luego de que se conocieran denuncias de familias que aseguran que ciudadanos bolivianos fueron captados con la promesa de recibir al menos $us 16.000 por un supuesto entrenamiento militar, pero terminaron en el frente de combate.",https://unitel.bo/noticias/seguridad/policia-investiga-de-oficio-las-denuncias-del-reclutamiento-de-bolivianos-para-la-guerra-de-rusia-contra-ucrania-AJ22180132
Unitel,2026-07-14,Sociedad,El Alto se alista para vivir la entrada folclórica de la zona 16 de Julio en honor a la Virgen del Carmen,"Este miércoles se celebrará la tradicional e ntrada folclórica de la zona 16 de Julio en honor a la Virgen del Carmen. El evento reunirá a más de 60 fraternidades que recorrerán las principales avenidas de la ciudad de El Alto.

La jornada comenzará a las 07:00 con una ceremonia de ofrenda a la Pachamama, en la que participarán autoridades y representantes de los conjuntos folclóricos. Posteriormente, desde las 08:00, se iniciará el recorrido oficial de las fraternidades.

MIRA AQUÍ: ¡Atención! Estos son los cortes de vías para este 15 de julio por el desfile de teas y la verbena en La Paz

La concentración de los danzarines se realizará en inmediaciones de la Universidad Pública de El Alto (UPEA) , sobre la avenida Juan Pablo II. Desde ese punto, la entrada recorrerá las avenidas Chacaltaya, Alfonso Ugarte, La Paz y Libertad.

Las autoridades destacaron que esta festividad constituye un importante motor para la economía local, al beneficiar de manera directa a sectores dedicados a la confección de trajes, salones de peluqueria, gastronomía, transporte y la venta de graderías.

Con el fin de garantizar el desarrollo de la actividad, la Alcaldía de El Alto activó un plan de bacheo de vías, mantenimiento del alumbrado público y un operativo especial de seguridad.

MIRA AQUÍ: Tradición y sabores paceños: estos son los platos infaltables durante las Fiestas Julias

Los cortes de ruta comenzarán en el sector de la estación de servicios Cortez y Cortez de la avenida Juan Pablo II y en la intersección Alfonso Ugarte y Juan Pablo II, más conocido como Chacaltaya. Otros cambios se registrarán en las avenida La Paz y 16 de Julio.",https://unitel.bo/noticias/sociedad/el-alto-se-alista-para-vivir-la-entrada-folclorica-de-la-zona-16-de-julio-en-honor-a-la-virgen-del-carmen-CJ22180626
Unitel,2026-07-14,Seguridad,Cierran comisaría del Parque Arenal y destinan el espacio a la Policía Turística y Ciclística,"Tras las denuncias de presunta corrupción en la Comisaría del Parque Arenal en el centro cruceño, desde el comando departamental han tomado la decisión de cerrar este punto policial y el espacio será destinado a la Policía Turística y Ciclística.

“La comisaría, que anteriormente se le daba comisaría, ese va a ser la unidad de la Policía Turística, y ahorita estamos viendo el tema para que aquí mismo funcione la Policía Ciclística, y así las dos unidades puedan congeniar y coordinar el trabajo de prevención”, explicó Jhonny Ortuño, efectivo de la Policía Turística.

MIRA AQUÍ: Presunto infanticidio en Cochabamba: Bebé de 1 año y seis meses muere y su madre está en terapia intensiva

Pese al cierre de la comisaría, la presencia policial en el parque El Arenal se mantendrá mediante patrullajes preventivos, debido a que este sector continúa siendo considerado una zona de riesgo por las reiteradas denuncias de robos y otros hechos delictivos, principalmente en determinados horarios.

“(Estamos) coordinando, viendo algunos temas con relación a la infraestructura y equipamiento que consta la anterior unidad que estaba a cargo, pero precisamente el tema es el tema de seguridad y brindar ese calidez y seguridad a la población en sí, para que pueda visitar estos lindos lugares”, manifestó Javier Lafuente, oficial de la Policía Ciclística.

MIRA AQUÍ: Familias denuncian que 10 jóvenes partieron con engaños a la guerra de Rusia contra Ucrania",https://unitel.bo/noticias/seguridad/cierran-comisaria-del-parque-arenal-y-destinan-el-espacio-a-la-policia-turistica-y-ciclistica-CJ22180736
Unitel,2026-07-14,Seguridad,Bolivianos en la guerra Rusia- Ucrania: Familias denuncian que reclutador sigue buscando víctimas,"Los familiares de los bolivianos que fueron reclutados para ir a la guerra entre Rusia y Ucrania presentaron una denuncia formal por el presunto delito de trata y tráfico de personas ante la Fuerza Especial De Lucha Contra el Crimen (Felcc) y señalaron que el reclutador es boliviano y continúa buscando víctimas.

“Es boliviano el que lo ha llevado, e s boliviano y también queremos que él dé la cara, porque él ha venido a buscar más gente para llevar”, sostuvo una familiar.

Manifestó que uno de sus sobrinos está recibiendo mensajes de este intermediario, que con engaños intenta reclutarlo para ir a Rusia.

MIRA AQUÍ: Familias denuncian que 10 jóvenes partieron con engaños a la guerra de Rusia contra Ucrania

“El pago se recibe inmediatamente al firmar el contrato: una bonificación por firma de 16.000 dólares y un salario de 2.700 dólares” , es el mensaje del reclutador.

El mensaje también afirma que al llegar a Rusia se firma contrato con el Ministerio de Defensa ruso. Sin embargo, la Embajada de Rusia en Bolivia negó este martes tener relación con el reclutamiento y acusó a Ucrania de llevar bolivianos a la zona de batalla desde 2024.

Dentro de los requisitos previos que los reclutadores piden es una foto del pasaporte, así como pruebas médicas que corroboren un buen estado de salud.

“Queremos que nos lo traigan a ellos, así como estén, vivos o muertos, pero que nos lo traigan”, pidió una familiar de los jóvenes.

MIRA AQUÍ: Fiscal general anuncia investigación ante denuncia de bolivianos que fueron llevados a Rusia para la guerra",https://unitel.bo/noticias/seguridad/bolivianos-en-la-guerra-rusia-ucrania-familias-denuncian-que-reclutador-sigue-buscando-victimas-CJ22180992
Unitel,2026-07-14,Seguridad,Caso armas en Viru Viru: Policía encontró fotografías de autoridades en uno de los allanamientos,"Durante los allanamientos realizados este lunes en un condominio, ubicado en la zona de Equipetrol, en la capital cruceña, y otro en la zona del Urubó, el comandante departamental de la Policía de Santa Cruz, David Gómez, indicó que se encontraron fotos de autoridades dentro de uno de los inmuebles.

En un contacto con los medios, Gómez f ue consultado respecto a las imágenes halladas dentro de un inmueble durante los allanamientos, por lo que contestó que “se encontró unas fotografías y diferentes elementos que son indiciarios”.

Sin embargo, evitó dar más detalle respecto al caso , ya que este continúa en proceso de investigación.

MIRA AQUÍ: Allanan condominios en Equipetrol y el Urubó por caso de fusiles hallados en Viru Viru

El operativo de este lunes se realizó como parte de las investigaciones por el hallazgo de piezas de fusiles AK-47 detectados el pasado jueves en el aeropuerto internacional de Viru Viru.

Se conoció que los efectivos llegaron a este lugar y secuestraron documentación, aunque no se halló a ninguna persona sospechosa, por lo que no hay aprehendidos.

“Ayer (lunes) se han llevado a cabo varios allanamientos en diferentes lugares donde se han colectado diferente documentación e indicios que nos están permitiendo acumular diferentes elementos con la final de poder esclarecer este caso de las armas encontradas en el aeropuerto de Viru Viru”, explicó el jefe policial.

MIRA AQUÍ: Intento de secuestro en San Matías: Seis sujetos irrumpieron en una casa preguntando por marihuana, según la Policía",https://unitel.bo/noticias/seguridad/caso-armas-en-viru-viru-policia-encontro-fotografias-de-autoridades-en-uno-de-los-allanamientos-CG22176985
Unitel,2026-07-14,Seguridad,Viceministro: Se detectó “mayor índice de internación” de autos ‘chutos’ a Bolivia tras anuncio del proyecto de nacionalización,"El viceministro de Lucha Contra el Contrabando, José Castro, informó este martes que se detectó un incremento en el ingreso de vehículos indocumentados al país. Según la autoridad, esta situación estaría relacionada con la presentación de un proyecto de ley que plantea la nacionalización de autos ‘chutos’ en Bolivia.

“Se ha podido advertir una mayor índice de internación de vehículos supuestamente por la posibilidad de la nacionalización; sin embargo el control no ha cesado”, dijo la autoridad a los medios de comunicación.

MIRA AQUÍ: Policía investiga de oficio las denuncias del reclutamiento de bolivianos para la guerra de Rusia contra Ucrania

Ante esta situación, el viceministro señaló que se reforzaron los controles en puntos estratégicos de la frontera para evitar el ingreso de este tipo de motorizados.

“Se vienen desarrollando tareas de control y estos operativos se han incrementado. La función de las Fuerzas Armadas es controlar y ese trabajo no se ha detenido”, afirmó.

Sin embargo, Castro no precisó cuáles son los pasos fronterizos por los que, presuntamente, estaría aumentando el ingreso de vehículos indocumentados al territorio nacional.

MIRA AQUÍ: Fiscal general anuncia investigación ante denuncia de bolivianos que fueron llevados a Rusia para la guerra

La bancada de Libre expresó este jueves su rechazo al proyecto de ley que busca legalizar los vehículos indocumentados y advirtió que, si este llega a ser tratada en la Asamblea Legislativa, no respaldará su aprobación.

“Libre no va a legalizar nunca lo ilegal. Lo decimos ahora y lo hemos dicho en campaña. No vamos a estar fuera de la ley; esto es bastante claro”, afirmó el diputado de Libre, Sergio Vásquez, durante una conferencia de prensa junto a otros legisladores.",https://unitel.bo/noticias/seguridad/viceministro-se-detecto-mayor-indice-de-internacion-de-autos-chutos-a-bolivia-tras-anuncio-del-proyecto-de-nacionalizacion-BJ22181044
Unitel,2026-07-14,Seguridad,"Suspenden sin fecha la audiencia para definir la presidencia del TDJ de Beni, según vocal Mejía","La audiencia que debía realizarse este martes para definir la presidencia del Tribunal Departamental de Justicia de Beni no se instaló y fue suspendida sin fecha , según el vocal beniano Charles Mejía, uno de los accionados en el recurso de amparo.

Según Mejía, el vocal Aldo Quezada, de la Sala Constitucional que debía resolver el recurso, no estuvo presente en la audiencia por un viaje al exterior. Además, señaló que los vocales del Beni, que fueron accionados, no fueron notificados, por lo que tampoco se presentaron.

MIRA AQUÍ: Ávila alude a vocal del TDJ de Beni: “Pretende vulnerar la institucionalidad del Órgano Judicial”

“No se llevó adelante (la audiencia), únicamente se conectó el expresidente del TDJ del Beni, Rafael Saavedra y se suspendió. No se ha señalado fecha nueva”, señaló Mejía.

Cabe recordar que el 23 de junio se conoció que seis vocales del TDJ de Beni se reunieron en una sesión y designaron a Patricia Quinteros para que ocupe la presidencia en lugar de Rafael Saavedra, en una audiencia presuntamente irregular.

En contacto con los medios Saavedra señaló que fue elegido por 11 vocales para un periodo de dos años que aún no se cumplió y señaló que solo existen tres maneras para que deje el cargo: que haya cumplido su mandato, renuncia o enfermedad.

MIRA AQUÍ: Tenso cruce en redes entre el presidente del TSJ y un vocal de Beni

Ante esta situación interpuso un amparo que fue admitido por la Sala Constitucional Segunda de Santa Cruz. La audiencia para resolver este recurso debía realizarse este martes; sin embargo, fue suspendida.",https://unitel.bo/noticias/seguridad/suspenden-sin-fecha-la-audiencia-para-definir-la-presidencia-del-tdj-de-beni-segun-vocal-mejia-GJ22182756
Unitel,2026-07-14,Sociedad,Reclutados para la guerra: Cancillería reporta unos 16 bolivianos en la zona de conflicto entre Rusia y Ucrania,"Tras las denuncias de reclutamiento con engaños a bolivianos para ir la guerra de Rusia contra Ucrania, el viceministro de Gestión Consular e Institucional, Héctor Huanca, indicó este martes que hay alrededor de 16 bolivianos en zona bélicas y manifestó que la investigación comenzó bajo confidencialidad a pedido de los familiares.

“Son datos que estamos por confirmar, de acuerdo a la reunión con los familiares, h ay aproximadamente unos 16 ciudadanos bolivianos que se encontrarían en estos lugares”, indicó Huanca, en entrevista con el canal estatal, y remarcó que no es un dato preciso ni oficial.

MIRA AQUÍ: Embajada de Rusia niega relación con reclutamiento de bolivianos para combatir contra Ucrania

El viceministro señaló que las indagaciones se iniciaron de manera confidencial a pedido de los familiares.

“A solicitud de los propios familiares, nos han pedido llevar el caso de manera confidencial cuidando la seguridad de los posibles bolivianos que se encuentren en combate y ante una posible actitud contraria contra los mimos familiares”, explicó.

Indicó que en los casos hubo presuntos intermediarios que reclutaron “mediante ofertas laborales y económicas que no provenían de canales oficiales”.

Respecto a la denuncia de dos bolivianos fallecidos, Huanca indicó que no tiene datos precisos oficiales sobre los fallecimientos y que aguardan la respuesta a una nota oficial que se ha emitido desde la Embajada.

MIRA AQUÍ: Fiscal general anuncia investigación ante denuncia de bolivianos que fueron llevados a Rusia para la guerra

Señaló que se activaron “mecanismos consulares” y que inclusive apoyaron a un boliviano que decidió no seguir participando en la zona bélica y que apoyaron con la repatriación.

En tanto, la Embajada de Rusia en Bolivia negó relación con el reclutamiento y acusó a Ucrania de llevar bolivianos y otros extranjeros a la guerra desde 2024.",https://unitel.bo/noticias/sociedad/reclutados-para-la-guerra-cancilleria-reporta-unos-16-bolivianos-en-la-zona-de-conflicto-entre-rusia-y-ucrania-BJ22183130
Unitel,2026-07-14,Farándula,El dúo perfecto: Anabel y Kerley listas para la nueva temporada de Yo Me Llamo,"Poco a poco se van revelando más detalles sobre el regreso de Yo Me Llamo , ahora se conoció que Anabel Angus y Kerley Lindenmayr son las presentadoras del reality de canto que se emitirá muy pronto por Unitel .

El pasado 23 de junio se anunció que el programa de canto de imitación más famoso del mundo retorna a las pantallas de Unitel en busca del cantante doble perfecto.

Ahora, en un nuevo adelanto se ve a Anabel y Kerley, deslumbrantes en una amena conversació n, preparándose para la temporada que se viene.

“¿Te acuerdas de estos artistas que desde la primera vez dejaron huella en el escenario?”, le pregunta Kerley a Anabel a lo que ella responde que sí y resalta que durante la competencia estuvieron a un paso de ganar.

MIRA AQUÍ : Yo Me Llamo regresa y trae un nuevo adelanto...el sueño sigue vivo...muy pronto

Encantadoras como siempre, las conductoras dieron más pistas y generaron expectativa sobre lo que está a punto de suceder.

Pero lo que si dejan claro es que están listas para acompañar una nueva temporada de Yo Me Llamo ... El sueño sigue vivo, muy pronto por las pantallas de Unitel.

MIRA AQUÍ: Se viene Yo Me Llamo muy pronto por Unitel el sueño sigue vivo",https://unitel.bo/noticias/farandula/el-duo-perfecto-anabel-y-kerley-listas-para-la-nueva-temporada-de-yo-me-llamo-MF22145854
Noticias Violeta,2026-07-14,Nacional,Ucr4n1anos dan de baja a dos soldados bolivianos enlistados en el ejercito ruso|| En un ataque con dron.,"Sucre, 14 de julio (ANV).- La esposa de un ciudadano boliviano denunció que su esposo y su cuñado, ambos de profesión albañiles, viajaron a Rusia el 24 de abril atraídos por una oferta económica que prometía un bono de 16.000 dólares al llegar y un pago adicional de 28.000 dólares, pero ahora son reportados como presuntos fallecidos en el conflicto bélico.

La mujer relató que la última comunicación con su esposo ocurrió el 3 de junio, y semanas después recibió un mensaje de una persona que se identificó como su comandante informándole que había perdido la vida en un ataque con dron durante una misión militar.

Según el testimonio de la denunciante, ambos hombres partieron de Bolivia con la esperanza de mejorar las condiciones económicas de sus familias. A su esposo le aseguraron que solo cumpliría un año de entrenamiento militar, pero tras aproximadamente un mes de preparación, fue enviado a una misión en zona de conflicto.

La misma versión sobre el fallecimiento alcanzó a su cuñado, quien habría muerto en las mismas circunstancias. La esposa señaló que, a los pocos días de la llegada de su esposo a Rusia, recibió un depósito de 20.000 bolivianos que utilizó para cubrir las necesidades del hogar.

Después de ese envío, no volvieron a recibir recursos económicos. La mujer también afirmó que existen otros bolivianos que viajaron bajo promesas similares y cuyas familias permanecen a la espera de noticias.

La denunciante indicó que mantiene contacto con la Embajada de Rusia en Bolivia, que realiza gestiones para conocer el paradero de ambos ciudadanos y esclarecer las circunstancias de su muerte. Hasta el momento, no se ha emitido un pronunciamiento oficial por parte de las autoridades rusas ni del Gobierno boliviano sobre el caso.

El relato de la esposa coincide con informes previos sobre la presencia de ciudadanos latinoamericanos reclutados para participar en el conflicto en Ucrania, aunque las autoridades bolivianas no han confirmado oficialmente la participación de nacionales en el frente de batalla. La Cancillería boliviana no se ha pronunciado sobre el caso.

Agencia de Noticias Violeta | Celular 72441200",https://noticiasvioleta.com/ucr4n1anos-dan-de-baja-a-dos-soldados-bolivianos-enlistados-en-el-ejercito-ruso/
