sitio_noticias,fecha,seccion,titular,cuerpo,url
La Razón,2026-07-17,Sociedad,Salud entrega matrículas nacionales a 21 prestadores de medicina tradicional en La Paz,"La ministra de Salud y Deportes, Marcela Flores, realizó la entrega de matrículas nacionales a 21 prestadores de medicina tradicional en el departamento de La Paz.

El acto se realizó junto a la Dirección General de Medicina Tradicional y contó con la presencia de autoridades del Servicio Departamental de Salud de La Paz (SEDES).

La clasificación oficial de los prestadores contempló a guías espirituales, parteras y parteros tradicionales, médicos ancestrales, y naturistas.

Este proceso de registro y matriculación fue consolidado mediante el Sistema de Información de Medicina Tradicional (SISMET – RUMETRAB). El mismo cuenta con respaldo normativo a través de la Ley 459 de la Medicina Tradicional.

Con esta acción el consolidado nacional asciende a un total de 2.553 prestadores que cuentan con el registro y la matrícula oficial. Dicha certificación les permite ejercer legalmente sus conocimientos, sabiduría, experiencia y práctica de la medicina tradicional.

Durante su intervención en el la entrega, Flores destacó el avance que realizó el Gobierno para incorporar las prácticas de la medicina tradicional en los establecimientos de salud.

“Hace 26 años empezábamos con esta idea. Ahora ya estamos en la fase de producción de medicamentos naturales y registro sanitario. Una de nuestras prioridades para esta gestión es industrializar los productos para que sean comercializados”, afirmó la ministra.

Destacó que para lograr dicha comercialización es necesario realizar una actualización de la normativa. Además de ampliar los registros con la Agencia Estatal de Medicamentos y Tecnologías en Salud (AGEMED).

“Esto es muy importante ya que gran parte de nuestra población acude a la medicina tradicional», enfatizó la autoridad.

Por su parte el director del SEDES, Martín Carrasco, resaltó la labor de los prestadores y la necesidad de unirla al conocimiento académico.

«Esta entrega es importante dentro de los cuatro pilares básicos de la cosmovisión andina en contacto con la Pachamama. Ustedes tienen sus creencias y sabiduría ancestral que la comparten a través la medicina tradicional, que se complementará con la medicina académica», sostuvo Carrasco.

La cartera de Estado señaló que esta acción permitirá al Ministerio de Salud sostener un control de la práctica médica tradicional dentro de un marco legal, resguardando formalmente la sabiduría y la experiencia ancestral boliviana.",https://larazon.bo/sociedad/2026/07/17/salud-entrega-matriculas-nacionales-a-21-prestadores-de-medicina-tradicional-en-la-paz/
La Razón,2026-07-17,Economía y Empresa,Despachantes aduaneros sugieren reformas a la Ley de Aduanas tras 26 años de vigencia,"La Cámara Regional de Despachantes de Aduana de La Paz (Crdalp) planteó la necesidad de impulsar una reforma a la Ley General de Aduanas, vigente desde 1999, con el objetivo de adecuar el marco normativo a las nuevas dinámicas del comercio exterior y mejorar la competitividad del país.

El planteamiento se presentó durante los actos por el 65 aniversario de la institución, donde sus representantes convocaron a las cámaras empresariales y a los distintos actores vinculados al comercio internacional a construir una propuesta conjunta de actualización de la normativa.

El presidente de la entidad, Wilson Candia, recordó que la institución participó en la elaboración de la Ley General de Aduanas promulgada hace 26 años y consideró que, tras más de dos décadas de vigencia, es necesario revisar su contenido para responder a las actuales exigencias del comercio internacional.

«La institución está abierta a trabajar con todas las demás organizaciones. Convocamos a los despachantes de aduana, no solamente a nivel regional sino también nacional, para aunar esfuerzos y generar una reforma a la Ley General de Aduanas», manifestó.

Candia sostuvo que la actualización de la norma debe construirse de manera participativa, incorporando los aportes de los operadores del comercio exterior, transportistas, importadores, exportadores y demás sectores relacionados con la actividad aduanera.

También lea : En lo que va del año, Aduana destruyó más de 194 toneladas de vehículos y autopartes de contrabando

Durante la presentación también se explicó que la legislación vigente se diseñó en un contexto económico distinto al actual y que, desde entonces, el comercio internacional ha experimentado importantes transformaciones derivadas de la digitalización, la evolución de la logística, los acuerdos comerciales y los nuevos mecanismos de control.

Representantes de la Cámara señalaron que el propósito es conformar una agenda de trabajo con todas las entidades que tienen vínculo para elaborar una propuesta de reforma que responda a las necesidades actuales del sector.

«Es necesario que la ley se amolde a la realidad del comercio con todas sus particularidades. Ese es el objetivo que buscamos junto a todas las cámaras y actores del sector», indicaron.

El sector considera que una modernización de la Ley General de Aduanas podría contribuir a simplificar procedimientos, reducir tiempos y costos en las operaciones de importación y exportación, además de fortalecer la seguridad jurídica para los operadores del comercio exterior.

La iniciativa también apunta a incorporar mecanismos acordes con los procesos de facilitación del comercio promovidos a nivel internacional, favoreciendo una mayor eficiencia en la cadena logística y una mejor articulación entre el sector público y privado.

La Cámara Regional de Despachantes de Aduana anunció que buscará abrir espacios de diálogo con las diferentes cámaras empresariales y organizaciones vinculadas al comercio exterior para consensuar una propuesta técnica que pueda ser presentada a las autoridades competentes como base para una futura reforma de la Ley General de Aduanas.",https://larazon.bo/economia-y-empresa/2026/07/17/despachantes-aduaneros-sugieren-reformas-a-la-ley-de-aduanas-tras-26-anos-de-vigencia/
La Razón,2026-07-17,Nacional,"‘Si vamos a hablar del 50/50, es con efectivo’: Loza rechaza una aplicación gradual del esquema","El gobernador de Cochabamba, Leonardo Loza, afirmó este viernes que la propuesta de distribuir recursos bajo el esquema 50/50 solo tendrá sentido si se garantiza dinero para inversión y no queda en compromisos teóricos.

Además, aseguró que la Gobernación participará en la reunión convocada por el Gobierno cuando reciba la invitación oficial.

Loza señaló que los gobernadores cometerían «un grave error» si el debate sobre el 50/50 se limita a cifras o a una implementación gradual. «Si estamos hablando o vamos a hablar del tema del 50/50 es con efectivo, con plata; no es en papeles, no es en discurso ni en teoría».

En conferencia de prensa, aseguró que cualquier acuerdo debe traducirse en recursos para las regiones.

Lea también. Paz: ‘El que se anime a bloquear ya sabe dónde va a estar: con Vicente Salazar en Chonchocoro’

«Si queremos hablar de 50/50 debemos ser muy claros. No es un tema de que se aplique gradual; tiene que haber dinero, efectivo, inversión, proyectos», dijo.

De ese modo, indicó que la posición de la Gobernación de Cochabamba será exigir una distribución con recursos concretos. «No queremos papeles ni teoría. Aquí es con efectivo, inversión, programas y proyectos; no papeles, ni números, ni teorías».

Respecto a la reunión prevista para el 5 de agosto en Sucre, Chuquisaca, Loza informó que hasta este viernes no recibió una convocatoria oficial. Sin embargo, aseguró que asistirá una vez que sea citado. «Hasta ayer no hemos recibido ninguna invitación. Loza no se va a hacer ningún problema en asistir; estamos esperando a que llegue la fecha».",https://larazon.bo/nacional/2026/07/17/si-vamos-a-hablar-del-50-50-es-con-efectivo-loza-rechaza-una-aplicacion-gradual-del-esquema/
La Razón,2026-07-17,Sociedad,"La Paz, Potosí y Oruro presentan mayor cantidad de infecciones respiratorias","La viceministra de Promoción, Vigilancia Epidemiológica y Medicina Tradicional, Roxana Salamanca, informó que La Paz, Potosí y Oruro presentan la mayor cantidad de casos de Infecciones Respiratorias Agudas (IRAs) del país.

Asimismo, señaló que Santa Cruz registró un incremento acelerado de contagios durante la última semana a causa del ingreso de diferentes frentes fríos registrados en la región.

Aclaró que el comportamiento del clima en el oriente del país generó una variación. Pues en la semana epidemiológica 27 se advirtió un visible incremento de casos en el departamento cruceño, con relación a la semana anterior.

“Hay un incremento que tiene mucho que ver con el comportamiento de las enfermedades ligadas al cambio de la temperatura; temperaturas más frías generan más incremento», explicó la viceministra en entrevista con Urgente.bo.

Salamanca señaló que, según los reportes médicos de las últimas tres semanas, quienes más asistieron a los centros de salud fueron niños y jóvenes.

Lea también: Cinco departamentos decidieron ampliar las vacaciones escolares

“Tenemos afectación sobre todo en lo que respecta a los grupos entre menos de un año hasta los 19 años aproximadamente. En algunos casos también impacta a las personas de la tercera edad”, precisó.

El pasado jueves, la ministra de Salud y Deportes, Marcela Flores, informó la ampliación de las vacaciones invernales por una semana. La medida fue tomada tras realizar una evaluación de las condiciones climáticas y de la situación epidemiológica en los nueve departamentos.

Sin embargo, Santa Cruz, Oruro y Potosí ya habían dispuesto esta ampliación antes del comunicado emitido por el ministerio.

En contraste, La Paz y Cochabamba, aplicaron esta medida de forma diferenciada.",https://larazon.bo/sociedad/2026/07/17/la-paz-potosi-y-oruro-presentan-mayor-cantidad-de-infecciones-respiratorias/
La Razón,2026-07-17,Mundo,Xi advierte que la IA no debe estar dominada por un solo país,"La inteligencia artificial no debe estar dominada por un solo país, alertó este viernes el presidente chino, Xi Jinping, al iniciar la cooperación global para su desarrollo durante su intervención en una importante conferencia sobre esa tecnología en Shanghái.

Los modelos chinos de IA están ganando terreno frente a las ofertas más potentes de Estados Unidos, al tiempo que atraen a usuarios de todo el mundo gracias a sus costos más bajos.

Sin embargo, el modo de regular este sector en auge se ha convertido en un tema clave, a medida que crecen las preocupaciones sobre el uso de la IA en combates militares o su posible uso malintencionado por parte de hackers o terroristas.

«El desarrollo de la IA no debe ser una actuación en solitario de un solo país, sino una sinfonía de cooperación internacional», señaló en la ceremonia de apertura de la Conferencia Mundial de Inteligencia Artificial (WAIC, por sus siglas en inglés).

«Debemos oponernos conjuntamente a la interpretación excesiva del concepto de seguridad nacional en el ámbito de la IA oa anteponer la seguridad de un país a la de los demás», añadió Xi.

Estados Unidos y la Unión Europea han impuesto restricciones a las importaciones de tecnología china por preocupaciones de seguridad nacional, mientras que las recientes disputas entre Washington y los laboratorios estadounidenses de IA han planteado dudas sobre quién controla el acceso a esa tecnología.

La conferencia WAIC es «el evento anual más importante para comprender la dirección de la industria china de la IA», señaló Poe Zhao, fundador de la publicación de análisis Hello China Tech.

«Estados Unidos mantiene una clara ventaja en chips avanzados, infraestructura informática de vanguardia y el desarrollo de modelos que requieren mayor inversión de capital», explicó a la AFP.

Pero «China es su competidor más cercano y completo», añadió Zhao.

La WAIC, de cuatro días de duración, reúne a más de 1.000 empresas tecnológicas del país, junto con funcionarios, investigadores y otras figuras de la industria.

Se exhiben alrededor de 3.000 productos, desde potentes sistemas de semiconductores para la computación con IA hasta un teléfono inteligente capaz de ejecutar aplicaciones de manera autónoma a pedido.

Pero la atención se centró en primer lugar en la visión de Xi sobre el impacto potencial de la IA.

«Debemos establecer leyes y regulaciones, así como sistemas de monitoreo tecnológico, alerta temprana y respuesta ante emergencias, con el fin de (…) garantizar que la IA esté siempre bajo control humano», apuntó Xi en su discurso en la conferencia, al exigir un enfoque «centrado en las personas».

El jueves, el canciller chino, Wang Yi, y representantes de 29 países, entre ellos Rusia, Pakistán e Indonesia, firmaron un acuerdo para establecer un grupo intergubernamental en materia de IA.

La Organización Mundial de Cooperación en Inteligencia Artificial, con sede en Shanghái, tiene como objetivo promover la consulta entre sus miembros para garantizar el desarrollo «saludable y ordenado» de la IA, información medios estatales.

Líderes como el secretario general de la ONU, António Guterres; el primer ministro de Camboya, Hun Manet; y su par tailandés, Anutin Charnvirakul, asisten a la WAIC, que presenta lo más avanzado de la tecnología china.

A primera hora del viernes, la startup Moonshot AI, con sede en Pekín, lanzó un nuevo y potente modelo insignia, el Kimi K3, cuyo rendimiento, según los informes, podría rivalizar con algunas de las mejores ofertas estadounidenses.

Otros aspectos destacados de la WAIC de este año son el modelo M3 de MiniMax, el primer teléfono equipado con un agente autónomo de IA, y el «supernodo» Atlas 950 de Huawei, una arquitectura de IA de vanguardia para el aprendizaje y el razonamiento.

También ocuparán un lugar central para los agentes de IA, herramientas capaces de conversar con los usuarios, pero también de administrar software o realizar tareas complejas.

La IA se ha convertido en un pilar estratégico de la política industrial china, impulsado por una inversión estatal colosal destinada a construir un ecosistema nacional, desde la producción de chips hasta el uso por parte de los consumidores.

El consumo diario en China de «tokens», la unidad utilizada en la industria para medir el uso de la IA, se ha multiplicado por 1.000 en los últimos dos años, según los medios estatales que citan a funcionarios.

El mercado chino se valoró en 1,2 billones de yuanes en 2025 (177.000 millones de dólares), y se espera que crezca más del 30% este año, según datos oficiales.",https://larazon.bo/mundo/2026/07/17/xi-advierte-que-la-ia-no-debe-estar-dominada-por-un-solo-pais/
La Razón,2026-07-17,Mundo,El Petróleo sube por ataques a infraestructuras en Oriente Medio,"Los precios del petróleo se dispararon el viernes ante la intensificación del conflicto en Oriente Medio, donde nuevos bombardeos cruzados golpearon infraestructuras civiles.

El precio del barril de Brent del mar del Norte, para entrega en septiembre, avanzó un 4,60% hasta 88,10 dólares.

El de su equivalente estadounidense, el West Texas Intermediate (WTI), para entrega en agosto, subió un 4,48% hasta 82,49 dólares.

«No hay ningún indicio sólido de que la corrección alcista de los precios haya concluido», subrayó David Morrison, de Trade Nation.

Estados Unidos bombardeó el jueves por sexto día consecutivo a Irán, que respondió con ataques a países del Golfo aliados de Washington.

El ejército estadounidense afirmó haber atacado «decenas de objetivos militares iraníes», mientras que Teherán informó de daños en la red eléctrica en el sur del país.

En Kuwait, una central eléctrica y una planta desalinizadora fueron alcanzadas por un ataque iraní.

Con la reanudación de las hostilidades entre Estados Unidos e Irán el 7 de julio, los precios del crudo han saltado cerca de un 16% en la semana.

El mercado petrolero está atento al estrecho de Ormuz, un paso estratégico por el que antes de la guerra transitaba el 20% del petróleo y del gas licuado consumidos en el mundo.

Un «proyectil no identificado» impactó en un buque frente a las costas de Omán, informó el viernes la agencia británica UKMTO.

Un dron también atacó un navío frente al puerto de Basora, en el sur de Irak, cerca de una terminal petrolera, indicó a la AFP una fuente de seguridad.

Estos incidentes habrían podido impulsar el precio del crudo a más de 100 dólares el barril, opinó John Evans, analista de PVM Energy.

Pero no lo hicieron por dos factores, según el experto: la capacidad de adaptación del suministro mundial de petróleo, y la posibilidad de que el conflicto termine desactivándose.

Además del importante recurso de las reservas estratégicas de crudo, las consecuencias del conflicto se han visto atenuadas por el envío de parte de las exportaciones saudíes a través del estrecho de Bab el Mandeb, que bordea Yemen, destacó Norman Lebke, de Commerzbank.

El repunte de las tensiones entre los rebeldes hutíes, que controlan parte de Yemen, y Arabia Saudita podría sin embargo complicar esta alternativa.",https://larazon.bo/mundo/2026/07/17/el-petroleo-sube-por-ataques-a-infraestructuras-en-oriente-medio/
La Razón,2026-07-17,Economía y Empresa,"OFEP denuncia fallas estructurales en Ecebol Potosí, que encarecen la obra","El director de la Oficina de Fortalecimiento de Empresas Públicas ( OFEP ), Pablo Camacho, cuestionó la planificación y ejecución de la planta de cemento de Ecebol en Potosí, al señalar que el proyecto presenta deficiencias estructurales que elevan significativamente sus costos de operación y puso en duda su capacidad.

Tras presentar el miércoles los resultados sobre la situación de las empresas públicas, Camacho afirmó que la planta se construyó a unos 100 kilómetros del yacimiento de piedra caliza, principal materia prima para la fabricación de cemento, lo que, a su juicio, incrementó innecesariamente los costos logísticos.

«Lo que han hecho es encarecer el costo de elaboración y, además, se olvidaron de construir el camino entre el yacimiento y la planta», sostuvo la autoridad.

Lea: Gobierno plantea cierre de empresas públicas inviables y reestructuración de estratégicas

El director de la OFEP también aseguró que la planta de Ecebol Potosí nunca concluyó el montaje de su horno, por lo que cuestionó el acto de inauguración realizado el 10 de noviembre de 2024 por el entonces presidente Luis Arce.

Según Camacho, durante ese evento se exhibieron bolsas de cemento que, en realidad, se produjeron en la planta de Ecebol Oruro.

«Si el horno no está, ¿cómo pueden fabricar cemento? Esas bolsas eran hechas en Oruro y fueron presentadas como si fueran de Potosí», afirmó.

Para la autoridad, este caso refleja problemas recurrentes en varios proyectos estatales de industrialización. «Planta tras planta, industria tras industria vamos viendo el desastre que nos dejaron», señaló.

Camacho informó además que la OFEP trabaja en el diagnóstico de las empresas públicas, documento que se presentará en un plazo de 39 días, conforme a lo que establece la Ley del Presupuesto General del Estado. El informe se remitirá al Consejo Superior de Empresas Públicas (Cosep) para su aprobación y posteriormente se presentará al gabinete de ministros.

Como parte de este proceso, anunció la realización de una auditoría integral a las empresas públicas con el objetivo de identificar posibles irregularidades y establecer «dónde y cuándo empezó la corrupción», según sus declaraciones.

Un análisis técnico que expone la situación financiera de 15 empresas públicas estratégicas del país. El estudio evidencia pérdidas acumuladas, deterioro patrimonial, elevados niveles de endeudamiento y el importante volumen de recursos públicos, que superan los 26.000 millones de bolivianos, destinados a estas entidades durante los últimos años.

Según datos oficiales, las pérdidas acumuladas de las empresas estatales ascienden a Bs 12,7 millones.

Además, Ecebol se encuentra en alerta roja debido a que las deudesas llegan a Bs 3.985 millones y los montos en mora o cuotas vencideas Bs 492 millones.",https://larazon.bo/economia-y-empresa/2026/07/17/ofep-denuncia-fallas-estructurales-en-ecebol-potosi-que-encarecen-la-obra/
La Razón,2026-07-17,Nacional,Zúñiga paga fianza de Bs 200.000 y espera detención domiciliaria,"El excomandante del Ejército Juan José Zúñiga cumplió con el pago de una fianza de Bs 200.000 y espera que este viernes se haga efectiva la detención domiciliaria que le concedió un tribunal de La Paz dentro del proceso por la asonada militar del 26 de junio de 2024.

La información fue proporcionada por su abogado, Eduardo León, quien explicó que la defensa acreditó el cumplimiento de las medidas cautelares impuestas por la autoridad judicial para sustituir la detención preventiva.

Según el jurista, además de la fianza, Zúñiga deberá cumplir otras restricciones, entre ellas el arraigo y la presentación periódica ante el sistema judicial, mientras continúa el juicio oral por el caso.

León señaló que, una vez verificados los requisitos por la autoridad competente, su defendido podrá abandonar el recinto penitenciario y cumplir la medida cautelar en su domicilio.

Zúñiga fue trasladado esta semana desde el penal de El Abra, en Cochabamba, hasta La Paz para asistir al inicio del juicio oral y a la audiencia de cesación de su detención preventiva.

Mientras se formaliza el cumplimiento de las medidas sustitutivas, permanece de manera temporal en el penal de San Pedro. Eljuicio entró en un cuarto intermedio hasta finales de agosto.

El proceso penal contra el exjefe militar continúa en etapa de juicio oral. La Fiscalía lo acusa de liderar la asonada militar del 26 de junio de 2024, cuando un contingente militar irrumpió en plaza Murillo y un vehículo blindado derribó la puerta del antiguo Palacio de Gobierno.

Zúñiga, por su parte, sostiene que los hechos respondieron a un «autogolpe» y rechaza las acusaciones en su contra.",https://larazon.bo/nacional/2026/07/17/zuniga-paga-fianza-de-bs-200-000-y-espera-detencion-domiciliaria/
