sitio_noticias,fecha,seccion,titular,cuerpo,url
Opinión,2026-06-26,"Bolivia, Política, Economía, Reactivación, Ejecutivo",Oficialistas presionan al Ejecutivo sobre reactivación económica y piden cambiar más ministros,"Este viernes se cumple casi una semana desde que los conflictos comenzaron a apagarse en todo el país tras que Rodrigo Paz lance el estado de excepción.

En ese contexto, legisladores del oficialismo señalaron que presionarán desde la Asamblea Legislativa Plurinacional (ALP) para que el Ejecutivo presente un plan urgente de reactivación económica. Además, exigieron que continúen los cambios de ministros.

“Es necesario establecer un plan de reactivación económica posterior al tema de los conflictos sociales. Este plan deberá ser integral respondiendo a las diferentes necesidades y situaciones en las cuales actualmente viven tanto comerciantes, sector productivo, turismo, transporte y otras áreas para que se pueda responder de mejor manera con diferentes incentivos por parte del Ejecutivo”, dijo Hidelberto Márquez, diputado del Partido Demócrata Cristiano (PDC), a Urgente.bo.

En los últimos días, desde el Gobierno anunciaron la puesta en marcha de un plan de emergencia para reactivar la economía y atender las afectaciones provocadas por los más de 50 días de bloqueos registrados en distintas regiones del país.

Márquez indicó que estas medidas deben activarse cuanto antes ante la complicada coyuntura económica y sostuvo que desde la ALP se ejercerá presión para que sean ejecutadas. “Desde la Asamblea Legislativa se va a presionar al Ejecutivo para que exista un plan de reactivación económica para todos los sectores que han sido afectados por el tema de los conflictos sociales”, puntualizó.

Por su parte, Catherine Pinto, diputada del PDC, afirmó que, al igual que Márquez, se debe trabajar en un plan de reactivación económica que también contemple créditos y normas en favor de los sectores productivos, micro y pequeños empresarios.

“Hay que exigir al Ejecutivo de una vez que empecemos a generar las leyes y que ya no haya susceptibilidad del pueblo y que todas estas normas que van a beneficiar al país van a ser socializadas”, puntualizó.

Sin embargo, Pinto también pidió paciencia a la población debido a que el Gobierno se vio afectado por los bloqueos. “Pediría a la gente un poco de paciencia fueron casi dos meses de bloqueos que igual ha sido un bloqueo al avance del Gobierno”.

Por la mañana, Samuel Doria Medina, empresario y líder de Unidad, afirmó que hasta el momento no se conocen medidas de “reactivación” económica encaradas por el Gobierno tras los conflictos que azotaron al país durante más de 50 días.

“Hasta ahora no se conoce medidas de reactivación. Ojalá que el gobierno no crea, igual que su antecesor, que la economía se arregla sola. La inacción no cobra factura de inmediato, pero sí en los meses posteriores”, dijo Samuel en sus redes sociales.

¿CAMBIO DE MÁS MINISTROS?

Durante los conflictos, el presidente Rodrigo Paz cambió a los ministros de Trabajo, Defensa y Educación. Márquez y Pinto consideran que esos cambios deben continuar y creen que aún habrá nuevas modificaciones en el gabinete.

“Entiendo que sí debería haber cambios (…) hay algunos que han respondido a la altura y otros que han brillado por su ausencia, entonces se hará una evaluación respecto a ellos, pero hay que ver las demás instancias, sean viceministerios y áreas desconcentradas”, puntualizó Márquez.

El legislador añadió que “nosotros como Asamblea Legislativa estamos con la firme convicción de que si aquella autoridad de cualquier ente ministerial no responde a las necesidades deberían dar un paso al costado. Caso contrario, también nosotros tenemos los instrumentos necesarios para poder solicitar ese cambio respectivo”.

En tanto, Pinto mencionó que “tengo entendido que quedan algunas carteras más pendientes y estamos listos (…) hemos decidido exigir de cambiar los ministros; tiene que haber”, finalizó.",https://www.opinion.com.bo/articulo/pais/oficialistas-presionan-ejecutivo-reactivacion-economica-piden-cambiar-mas-ministros/20260626143225992721.html
Opinión,2026-06-26,"El País, Fancesa, Rodríguez Zapatero, Soboce",Arce niega haber intercedido en conflicto Fancesa-Soboce: ´su relación con Zapatero fue institucional y política´,"A través de una carta publicada en sus cuentas en las redes sociales y desde su detención en el penal de San Pedro de La Paz, el expresidente Luis Arce negó haber influenciado o intercedido en el conflicto legal entre Fancesa y Soboce y aseguró que su relación con el exmandatario de España, José Luis Rodríguez Zapatero, fue “institucional y política”.

De acuerdo con publicaciones periodísticas nacionales e internacionales, en España se abrió una investigación contra el expresidente Rodríguez Zapatero por un presunto caso de tráfico de influencias, debido a que habría recibido más de 200.000 dólares para influir ante el entonces Gobierno de Luis Arce en una sentencia que liberó a Soboce de pagar 107 millones de dólares a Fancesa.

En el escrito, Arce recuerda que el conflicto legal no se generó durante su Gobierno y que en su gestión la Procuraduría apeló la decisión judicial que concedió una tutela a Soboce, misma que aún se encuentra en el tribunal Constitucional Plurinacional (TCP) pendiente de sentencia.

“Por lo que, NO se ha realizado ningún tipo de liberación de pago a SOBOCE en relación a este caso con FANCESA, pues la última palabra debe ser emitida por el TCP.Si el TCP revoca la tutela, la condena de Bs 744 millones contra SOBOCE recobra vigencia ejecutoria. Si la confirma, corresponderá al Tribunal Supremo de Justicia (TSJ) emitir nueva resolución” (sic), señala el expresidente.

En ese sentido, Arce aseveró que su relación con el expresidente Rodríguez Zapatero fue “institucional y política”.

“Las últimas conversaciones que sostuve con él fueron en el marco de los esfuerzos realizados por miembros del Grupo de Puebla para mediar en la crisis interna por la que atravesaba el MAS-IPSP. La reunión que sostuve con el expresidente Rodríguez Zapatero en 2024 en La Paz abordó la coyuntura política boliviana, las posiciones intransigentes de Evo Morales, y el planteamiento de unidad del movimiento popular que habíamos planteado junto a organizaciones sociales y sindicales, anteponiendo los intereses del pueblo boliviano a cualquier interés político personal, esto con miras a las elecciones nacionales de 2025”, afirmó.

Y enfatizó que “no se trató ningún litigio judicial de SOBOCE y desconozco la agenda que el expresidente Rodríguez Zapatero llevó adelante en Sucre”.

La Unidad de Delincuencia Económica y Fiscal (UDEF) de la Policía Nacional de España reveló en un nuevo informe que el expresidente José Luis Rodríguez Zapatero cobró 200.000 euros por influir ante el Gobierno de Bolivia en favor de un grupo peruano (Grupo Gloria) que tenía problemas con la justicia del país.

Los agentes creen que Zapatero cobró de forma camuflada por labores de consultoría a través de una empresa interpuesta (Focus Social Research) lo que, en realidad, fue la intermediación para que el grupo peruano no pagara una multa de 107 millones de dólares (unos 93 millones de euros) a la que había sido condenado.

La UDEF sostiene que “la concatenación de hechos acreditados” lleva a inferir la “existencia de una dinámica de intermediación e influencias” orientadas a beneficiar los intereses del Grupo Gloria con un “contrato simulado”. Fuentes del entorno del expresidente aseguran, sin embargo, que se trató de una consultoría legal y que sería “inaceptable” una investigación “prospectiva” de la tarea profesional histórica de Zapatero.

En el documento, revelado por El País de España, investigadores dan cuenta al juez José Luis Calama de nuevos hallazgos encontrados en el móvil de la secretaria de Zapatero, Gertrudis Alcázar, y en la agenda del expresidente que fue incautada en el registro a su oficina. De su examen, la UDEF detalla reuniones y contactos con “altas esferas políticas de Bolivia”, como el propio expresidente, Luis Alberto Arce, y los exministros de Economía y Justicia, Marcelo Montenegro y César Siles, respectivamente, además del procurador general del Estado, Ricardo Condori.

El informe refleja que Zapatero firmó un contrato de consultoría por 200.000 euros en tres plazos cuya finalidad, supuestamente y según los agentes, tenía más que ver con un ejercicio de influencias: resolver los problemas judiciales del Grupo Gloria en Bolivia ―un conglomerado de empresas con base en Lima (Perú) y con inversiones en países de América en múltiples sectores como alimentos, cementos, papeles, cartones o transportes―, donde una de sus empresas, Soboce (Sociedad Boliviana de Cementos S.A.), había sido condenada a pagar unos 107 millones de dólares por competencia desleal. Así, los agentes destacan que, de las conversaciones analizadas, se desprende que los servicios prestados por Zapatero euros “no guardan relación” real con Focus Social Research (la empresa que le paga), que “estaría orientada al marketing”.

La UDEF asegura en el informe que este descubrimiento apuntala “los indicios de la existencia de una organización criminal, liderada por José Luis Rodríguez Zapatero, que, aprovechando sus contactos y ascendencia pública internacional, se dedicaría al ejercicio de influencias de carácter ilícito en beneficio de distintos clientes”. En línea con el patrón que identificaron respecto al rescate de la aerolínea Plus Ultra, los investigadores indican que Gertrudis Alcázar “tendría un papel relevante”, por “su intervención en la gestión de las comunicaciones” y “el intercambio de documentación”, así como por su dominio de la agenda. Fuentes del entorno del que fuera líder del PSOE insisten en que “es un escándalo sin precedentes que se publiquen agendas y conversaciones privadas” de quien ha dirigido el Gobierno español.",https://www.opinion.com.bo/articulo/pais/arce-niega-haber-intercedido-conflicto-fancesa-soboce-relacion-zapatero-fue-institucional-politica/20260626120209992720.html
Opinión,2026-06-26,"El País, Rodríguez Zapatero, Soboce",España: Zapatero pide a la justicia excluir informe sobre sus negocios en Bolivia,"El expresidente español, José Luis Rodríguez Zapatero, solicitó mediante su defensa legal que el informe sobre sus negocios en Bolivia sea excluido de la causa judicial en su contra que se tramita en su país.

La solicitud se realizó por escrito al juez que administra el proceso contra Zapatero, informó eldiario.es.

El informe policial señala que Zapatero recibió 200 mil euros como pago por interceder ante autoridades bolivianas, en favor de la empresa Soboce, filial del conglomerado peruano Gloria, en un litigio millonario con la cementera Fancesa.

La defensa del expresidente español pode excluir el informe porque considera que contiene “hechos ajenos a los investigados”, que salieron de una “investigación prospectiva y no autorizada”.

La investigación contempló agendas, carpetas, discos duros y hasta se clonó el teléfono de la secretaria de Zapatero. En ese marco, la defensa sostiene que hay a un “atropello” a la intimidad del exmandatario español, según la información de eldiario.es.

El caso ha generado repercusiones en Bolivia por la sospecha de que Zapatero usó sus influencias en el Gobierno de Luis Arce con el objetivo de favorecer a Soboce.

En el litigio cementero, Fancesa ganó el juicio de más de 700 millones de bolivianos contra Soboce, pero en mayo 2025 una Sala Constitucional paralizó este proceso. El caso ahora se encuentra en el Tribunal Constitucional.",https://www.opinion.com.bo/articulo/pais/espana-zapatero-pide-justicia-excluir-informe-negocios-bolivia/20260626113914992719.html
Opinión,2026-06-26,"Bolivia, YPFB, Combustible, Precio, Distribucion","""Por ahora"", no se ajustará el precio del combustible y la distribución se regulariza, según YPFB","El presidente de Yacimientos Petrolíferos Fiscales Bolivianos (YPFB), Sebastián Daroca, afirmó que el Gobierno mantendrá la subvención a los combustibles y dijo que no habrá un incremento en los precios de la gasolina y el diésel ""por el momento"". Además, afirmó que la distribución del carburante se está normalizando.

""En este momento la subvención se mantiene, no se va a hacer un ajuste de precios (...) Esperamos que la subvención se vaya a terminar justamente en los próximos meses cuando los precios internacionales empiecen a bajar a los niveles que teníamos estimados"", aseguró Daroca en Unitel.

El presidente explicó que hoy en día el costo de un litro de gasolina puesto en un surtidor de Santa Cruz está entre Bs 11 y 12, mientras que en Bolivia el costo es entre 9 y 10 bolivianos por litro, debido a la logística en cada departamento.

Asimismo, indicó que trabaja en la reducción de los costos logísticos por el transporte de mayores volúmenes de combustible desde Puerto Suárez y la reactivación del transporte ferroviario hacia Santa Cruz, lo que permitirá mejorar los costos de distribución.

Daroca sostuvo que el Estado continúa cubriendo el costo de la importación y el precio de venta mediante la subvención. ""El tema es que la subvención se ha generado, obviamente, debido a que los precios internacionales han subido. Evidentemente, esta es una diferencia de precios que la está cubriendo el Estado boliviano"", afirmó.

De igual forma, añadió que existe la expectativa de que los precios internacionales de los combustibles disminuyan en los próximos meses, reduciendo gradualmente el peso de la subvención.

Por otra parte, la cabeza de YPFB inidcó que quedaron varadas más de 1.600 cisternas; sin embargo, ya llegaron a las plantas de almacenaje donde están en el proceso de control de calidad. “Ya estamos regularizando los volúmenes”, aseguró Daroca.",https://www.opinion.com.bo/articulo/pais/ahora-ajustara-precio-combustible-distribucion-regulariza-ypfb/20260626103505992717.html
Opinión,2026-06-26,"Venezuela, Fallecidos, Desaparecidos, Tragedia, terremotos",Crece la tragedia en Venezuela: 589 fallecidos y más de 50.000 desaparecidos,"Los terremotos registrados en Venezuela dejan, hasta el momento, 589 fallecidos y 2.980 heridos. Además, 50.947 personas permanecen desaparecidas, según el último informe oficial, mientras continúan las labores de búsqueda y rescate en las zonas más afectadas.

El panorama sigue siendo desolador. Cientos de personas continúan atrapadas entre los escombros y el balance no oficial estima que unas 50.000 personas aún no han sido localizadas.

La presidenta interina del país, Delcy Rodríguez, confirmó la actualización de las cifras durante la mañana de este viernes. El anuncio lo realizó acompañada de funcionarios y altos mandos militares, mientras daba la bienvenida a equipos de rescatistas llegados de distintos países. El estado de La Guaira resultó el más afectado por los sismos de magnitud 7,2 y 7,5.

En distintas ciudades del norte de Venezuela, los vecinos se organizan para remover escombros en busca de familiares y sobrevivientes. Las autoridades prevén un aumento en el número de víctimas, debido a la gran cantidad de personas reportadas como desaparecidas y a la complejidad de las labores de rescate, que siguen en marcha.",https://www.opinion.com.bo/articulo/mundo/crece-tragedia-venezuela-589-fallecidos-mas-50000-desaparecidos/20260626101116992715.html
Unitel,2026-06-26,Agencias,"Viernes, 26 de junio de 2026",".

FÚTBOL MUNDIAL 2026

- URUGUAY-ESPAÑA. España y Uruguay cierran su participación en el Grupo H con un partido en Guadalajara (México) este viernes en el que han de sellar su clasificación. Los de Luis de la Fuente llegan al encuentro tras el impulso de golear a Arabia Saudí (4-0), mientras que la selección dirigida por Marcelo Bielsa lo hace con dudas y necesidad tras su segundo empate consecutivo.

(Texto) (Foto)

- CABO VERDE-ARABIA SAUDÍ. La selección de Cabo Verde se mide este viernes en el NRG Stadium de Houston (EEUU) con la de Arabia Saudí con la posibilidad de hacer historia y de clasificarse por primera vez a la fase de eliminación directa, con un ojo puesto en Guadalajara, donde España juega contra Uruguay.

(Texto) (Foto)

- NORUEGA-FRANCIA. La Francia de Kylian Mbappé y la Noruega de Erling Haaland se enfrentarán este viernes en el Gillette Stadium de Foxborough (EEUU) en uno de los duelos más atractivos de la primera fase del Mundial, un choque que decidirá al líder del grupo y en el que sus dos grandes estrellas intentarán dar caza a Lionel Messi en la pelea de goleadores.

(Texto) (Foto)

- SENEGAL-IRAK. Senegal e Irak se enfrentan este viernes en el BMO Field de Toronto (Canadá) en un duelo de supervivencia entre dos selecciones que llegan sin puntos a la última jornada del Grupo I y que solo conservan una vía para seguir en el Mundial 2026: ganar y esperar que la clasificación de los mejores terceros les abra una puerta.

(Texto) (Foto)

- EGIPTO-IRÁN. Con el mismo objetivo, el de pasar por primera vez en la historia a la segunda fase de una Copa del Mundo, las selecciones de Egipto e Irán se enfrentan este viernes en Seattle en un partido por el cierre del Grupo G que, a priori, ha despertado polémica por haber sido designado como el del orgullo LGBTI por parte de las autoridades locales.

(Texto) (Foto)

- NUEVA ZELANDA-BÉLGICA. Ni siquiera el relanzamiento que supuso el giro de seleccionador con Rudi García ni la preparación entusiasta con la que acudió al Mundial han evitado otra situación límite de la selección de Bélgica en la última jornada de la fase de grupos, entre el fiasco o el alivio en 90 minutos contra Nueva Zelanda en partido que se disputa en el BC Place de Vancouver (Canadá).

(Texto) (Foto)

. Además, previas de los partidos del sábado:Jordania-Argentina, gelia-Australia, RD Congo-Uzbekistán, Colombia-Portugal, Croacia-Ghana y Panamá-Inglaterra, y última hora del resto de selecciones.

(Texto) (Foto)

.

TENIS WIMBLEDON

Londres. Los actuales números 1 del mundo, el italiano Jannik Sinner, defensor del título, y la bielorrusa Aryna Sabalenka, parten este jueves como los primeros cabezas de serie en los sorteos de los cuadros masculino y femenino del torneo de Wimbledon, tercer Grand Slam del año y que se juega en Londres entre el lunes 29 de junio y el domingo 12 de julio. Información de Javier Peña Atienza.

(Texto) (Foto)

.

MOTOCICLISMO GRAN PREMIO PAÍSES BAJOS

Redacción Deportes. El Gran Premio Países Bajos, décima cita de los Campeonatos del Mundo de velocidad, comienza este viernes con las primeras sesiones de entrenamientos libres en el circuito de Assen, la 'catedral' del motociclismo.

(Texto) (Foto)

.

AUTOMOVILISMO GRAN PREMIO AUSTRIA F1

Redacción Deportes. Las dos primeras tandas de entrenamientos libres abren este viernes la acción en pista del Gran Premio de Austria, octava prueba del Campeonato del Mundo de Fórmula 1 y que se disputa en el Red Bull Ring de Spielberg.

(Texto) (Foto)

.

BALONCESTO ALEMANIA

Berlín. El español Pedro Calles, técnico del Alba de Berlín desde marzo de 2025, se ha convertido en la gran sorpresa del baloncesto alemán tras conquistar el pasado domingo con el club berlinés la liga germana contra todo pronóstico, después de haber desarrollado el grueso de su carrera en el país centroeuropeo, donde entrenó los equipos de Artland, Vechta, Oldemburgo antes de recalar en la capital teutona. Por Salvador Martínez Mas

(Texto) (Foto) (Vídeo)

--------------------------------------------------------------

AGENDA INFORMATIVA

.

ATLETISMO

- Memorial Boris Hanzekovic, en Zagreb. Categoría continental.

.

AUTOMOVILISMO

- Entrenamientos libres 1 (11:30-12:30 GMT) y 2 (15:00-16:00 GMT) del Gran Premio de Austria, 8ª cita del Mundial de Fórmula 1 y que se disputa en el Red Bull Ring de Spielberg. (FOTO)

- Mundial de Rallys. 8ª prueba: Rally Acrópolis, en Loutraki (Grecia) (hasta 28) (FOTO). Seis tramos, el último a las 13.56 GMT

.

BALONCESTO

- Berlín. El español Pedro Calles, técnico del Alba de Berlín desde marzo de 2025, se ha convertido en la gran sorpresa del baloncesto alemán tras conquistar el pasado domingo con el club berlinés la liga germana contra todo pronóstico, después de haber desarrollado el grueso de su carrera en el país centroeuropeo, donde entrenó los equipos de Artland, Vechta, Oldemburgo antes de recalar en la capital teutona. Por Salvador Martínez Mas (FOTO)(VÍDEO)

.

BALONMANO

- Sorteo de la nueva fase de grupos de la Liga de Campeones 2026-2027 en Viena

.

FÚTBOL

- Mundial 2026 (FOTO) (VÍDEO). Noruega-Francia (21.00 CET/19.00 GMT, en Boston), Senegal-Irak (21.00 CET/19.00 GMT, en Toronto), Cabo Verde-Arabia Saudí (02.00 CET/00.00 GMT, en Houston), Uruguay-España (02.00 CET/00.00 GMT, en Guadalajara), Egipto-Irán (05.00 CET/03.00 GMT, en Seattle), Nueva Zelanda-Bélgica (05.00 CET/03.00 GMT, en Vancouver)

. Previas de los partidos Jordania-Argentina, Argelia-Australia, R.D. Congo-Uzbekistán, Colombia-Portugal, Croacia-Ghana y Panamá-Inglaterra y actualidad del resto de selecciones

.

GOLF

- LIV Golf. Torneo de Luisiana, en el Bayou Oaks at City Park de Nueva Orleans (EE.UU.) (hasta 28).

- DP World Tour. Abierto de Italia, el Circolo Golf Torino, en Fiano, Turín (hasta 28).

.

HOCKEY HIERBA

- Pro Liga masculina: España-Argentina, en Berlín (15.30 GMT).

.

MOTOCICLISMO

- Entrenamientos libres (07.00 a 14.00 GMT) del Gran Premio Países Bajos, 10ª prueba de los Mundiales, en el circuito de Assen. (FOTO)

.

TENIS

- Sorteo de los cuadros del Torneo de Wimbledon, que se juega en Londres entre el lunes 29 de junio y el domingo 12 de julio (11.00 CET). Información de Javier Peña Atienza.

- Torneos ATP 250 sobre hierba de Mallorca e Eastbourne (Reino Unido) (hasta 27).

- Torneos WTA 500 sobre hierba de Bad Homburg (Alemania) e Eastbourne (Reino Unido) (hasta 27).

----------------------------------------------------------------

dep/EFE

Redacción EFE Deportes

(34) 913 467 211

Puede escribir a deportes@efe.com para contactar con nuestra redacción.

En www.efeservicios.com encontrará toda la producción multimedia de la Agencia EFE y su Agenda Mundial, un listado actualizado de actos informativos programados.Para cualquier otro producto o servicio, contacte con clientes@efe.com o llame al +34 913 467 245. Av. de Burgos, 8B, 28036 Madrid, España

https://x.com/EFEdeportes

EFE Deportes

Tel. +34 913 467 211

deportes@efe.com",https://unitel.bo/noticias/agencias/viernes-26-de-junio-de-2026-JN21682478
