sitio_noticias,fecha,seccion,titular,cuerpo,url
Red Uno,2026-07-04,Que dice la orden de aprehension contra vicente salazar 20267417048,¿Qué dice la orden de aprehensión contra Vicente Salazar?,"La orden de aprehensión emitida por el Ministerio Público revela los delitos por los cuales es investigado el dirigente campesino Vicente Salazar Limachi, quien fue capturado este sábado en el marco de las investigaciones por los más de 50 días de bloqueos que paralizaron el departamento de La Paz.

El mandamiento, firmado por una comisión de fiscales de materia y emitido al amparo del artículo 136 del Código de Procedimiento Penal, instruye a la Policía proceder con la aprehensión de Vicente Salazar Limachi , identificado con cédula de identidad 6731624 , dentro del caso con código único CUD 201102012603341 .

De acuerdo con el documento, la investigación fue iniciada por el Ministerio Público a instancia del Ministerio de Gobierno y atribuye al dirigente la presunta comisión de los delitos de instigación pública a delinquir, asociación delictuosa, terrorismo, atentados contra la seguridad de los medios de transporte y atentados contra la seguridad de los servicios públicos , previstos en los artículos 130, 132, 133, 133 Bis, 213 y 214 del Código Penal .

Operativo conjunto de aprehensión

La orden establece además que la aprehensión debe ejecutarse respetando los derechos y garantías constitucionales del investigado, conforme a la resolución fiscal emitida para este caso.

De acuerdo con información oficial del Ministerio de Gobierno, el operativo fue realizado aproximadamente a las 13:10 en la zona Ciudad Satélite de El Alto, a la altura del Hospital Holandés. Salazar se encontraba a bordo de una camioneta Toyota Hilux blanca y, según el reporte, inicialmente cerró las ventanas del vehículo e impidió la intervención policial. Minutos después descendió del motorizado y fue trasladado a dependencias de la Fuerza Especial de Lucha Contra el Crimen (Felcc) de La Paz.

Las autoridades identifican a Salazar como uno de los dirigentes que encabezó la organización y convocatoria de las medidas de presión desarrolladas durante más de 50 días de bloqueos, movilizaciones que provocaron desabastecimiento de alimentos, combustibles e insumos, además de millonarias pérdidas económicas, especialmente en el departamento de La Paz.

El Ministerio de Gobierno señaló que la investigación continuará bajo control del Ministerio Público y aseguró que el proceso se desarrollará con respeto al debido proceso y a los derechos del dirigente aprehendido.

Mira la programación en Red Uno Play",https://www.reduno.com.bo/noticias/que-dice-la-orden-de-aprehension-contra-vicente-salazar-20267417048
Red Uno,2026-07-04,Deportes,Brahim Díaz destaca la mentalidad de Marruecos tras eliminar a Canadá en el Mundial,"Brahim Díaz, centrocampista de la selección marroquí, afirmó este sábado que ""ha sido increíble"" la mentalidad mostrada en la goleada por 0-3 sobre Canadá que les ha clasificado a los cuartos de final del Mundial.

""Muy contento por todo lo que estoy dando, por todo lo que estoy ayudando a mis compañeros, lo más importante es lo que estamos consiguiendo como equipo"", afirmó Brahim tras el partido en el NRG Stadium de Houston.

""La mentalidad que hemos tenido ha sido increíble y esto al final marca la diferencia en este tipo de partidos. Marruecos está ahí, queremos seguir peleando, queremos seguir avanzando. Ahora a celebrar, porque es lo que toca, pero tenemos que preparar el siguiente partido lo antes posible"", añadió.

Tras el 0-0 de la primera mitad, Marruecos goleó con doblete de Azeddine Ounahi y un tanto final de Soufiane Rahimi.

En cuartos, Marruecos podría volver a verse las caras con Francia, que le eliminó en las semifinales del Mundial de Catar.

""No me gusta hablar de revancha porque no soy así, soy un chico humilde y mantengo los pies en el suelo. Veremos cuál es el próximo rival, ahora es el momento de celebrar"", dijo.

A nivel individual, Brahim manifestó su satisfacción.

""Marcha muy bien, la verdad, muy contento de lo que estoy consiguiendo, porque el apoyo que he tenido, el amor que he tenido de todo Marruecos desde mi llegada ha sido increíble. Y ofrecérselo en el campo dando la mejor versión de mí es algo único. Tengo unos compañeros increíbles que lo hacen todo muy fácil"", aseguró.

EFE

Mira la programación en Red Uno Play",https://www.reduno.com.bo/deportes/brahim-diaz-destaca-la-mentalidad-de-marruecos-tras-eliminar-a-canada-en-el-mundial-202674164425
Red Uno,2026-07-04,La paz pide prosperidad tras el conflicto con una pequena feria de los deseos en miniatura 20267416261,La Paz pide prosperidad tras el conflicto con una pequeña feria de los deseos en miniatura,"La Paz, la sede del Gobierno y el Legislativo de Bolivia, pidió este sábado prosperidad y abundancia para empezar a recuperar su economía golpeada por siete semanas de bloqueos de carreteras, con una pequeña versión de la Alasita, la patrimonial feria de los deseos en miniatura que tradicionalmente se efectúa en enero. La 'Jisk'a Alasita' o Pequeña Alasita se instaló en el barrio residencial de San Miguel, en la zona Sur de La Paz, con la participación de artesanos que vendieron miniaturas de billetes, maletas, casas, muebles, víveres y vehículos. Artesanías tejidas, alcancías de yeso y madera, ropa para muñecos y pequeñas figuras con trajes típicos del folclore boliviano también fueron parte de la oferta.

La gastronomía tradicional de la Alasita tuvo un lugar especial, con quioscos atendidos por niños que ofrecían versiones ""mini"" de platos como los anticuchos, unas brochetas con trozos de corazón de res asadas en pequeñas parrillas y servidas con patatas calientes y una 'llajua' o salsa picante de maní. También hubo refrescos de frutas hervidas, gelatina, bollería y el tradicional api, una bebida caliente y espesa hecha de maíz morado que se sirve con empanadas de queso fritas o buñuelos, unos discos de masa frita, todo en miniatura. La 'Jisk'a Alasita' se realizó para mostrar la creatividad de los artesanos, con motivo del próximo aniversario 217 de la gesta libertaria de La Paz, que se conmemora el 16 de julio, explicó a EFE el presidente de la Asociación de Artesanos de Alasitas y Navidad de la Zona Sur, Walter Torrez.

""Aquí está hecho todo a mano (...) Nosotros plasmamos en nuestra obra la abundancia mediante la miniatura"", destacó Torrez. La Alasita, que significa 'cómprame' en aimara, es una de las tradiciones andinas más antiguas, cuando la gente en La Paz bendice al mediodía del 24 de enero las miniaturas que representan sus aspiraciones y deseos para el año. La fiesta celebraba en su origen el solsticio de verano austral el 21 de diciembre, con miniaturas que se colocaban a deidades andinas como las illas para que a lo largo del año los deseos que representan se convirtieran en realidad. Según historiadores bolivianos, la celebración fue trasladada a enero en 1783 por orden del entonces gobernador de La Paz, el español Sebastián Segurola, para conmemorar la victoria de los suyos ante una sublevación indígena ocurrida dos años antes, en la que la ciudad estuvo cercada durante varios meses y sufrió una fuerte carestía de alimentos.

Entre mayo y junio, La Paz fue cercada nuevamente con bloqueos de carreteras realizados por sectores campesinos, sindicatos obreros y grupos afines al exmandatario Evo Morales (2006-2019) que exigieron la renuncia del presidente del país, Rodrigo Paz, una protesta que se extendió a otras regiones. Las siete semanas de conflicto, que acabaron con la declaración del estado de excepción el pasado 20 de junio, ocasionaron desabastecimiento de alimentos, combustibles y oxígeno medicinal, y dejaron 16 fallecidos, 13 por falta de atención médica oportuna por los bloqueos, además de pérdidas económicas por más de 3.000 millones de dólares. Con la feria de este fin de semana, se busca ""motivar"" a la población de La Paz mediante la tradición de las artesanías en miniatura porque ""transmiten la abundancia"", explicó Torrez.

""Lo que queremos transmitir es la abundancia, puesto que tuvimos crisis, tuvimos mucho sufrimiento y tantas cosas que nos ha pasado"", sostuvo. El alcalde de La Paz, César Dockweiler, quien inauguró la pequeña feria, dijo a EFE que los más de 50 días de conflicto han ""empobrecido"" a La Paz, por lo que ahora se busca trabajar junto a la población para la ""reactivación económica, que es tan necesaria"", y que la ciudad recupere su competitividad. ""Durante la fiesta de la Alasita deseamos prosperidad, bendiciones y creo que tiene también ese significado. Al abrir la 'Jisk’a Alasita' aquí en la zona Sur, permite también decir a todos (que) estamos en ese proceso de reactivación económica"", agregó. EFE

Mira la programación en Red Uno Play",https://www.reduno.com.bo/noticias/la-paz-pide-prosperidad-tras-el-conflicto-con-una-pequena-feria-de-los-deseos-en-miniatura-20267416261
Red Uno,2026-07-04,Asi fue el momento en el que capturaron al dirigente vicente salazar en el alto 202674163053,Así fue el momento en el que capturaron al dirigente Vicente Salazar en El Alto,"La Policía Boliviana ejecutó este sábado la aprehensión de Vicente Salazar, principal ejecutivo de la Federación Departamental Túpac Katari, en un operativo realizado en la ciudad de El Alto.

El momento de la captura fue registrado en imágenes, donde se observa a efectivos policiales interceptar al dirigente y trasladarlo bajo resguardo hasta un vehículo oficial para posteriormente conducirlo a dependencias de la Fuerza Especial de Lucha Contra el Crimen (Felcc) de La Paz.

La aprehensión forma parte de la investigación que desarrolla el Ministerio Público por los bloqueos de carreteras que se prolongaron durante más de 50 días y que ocasionaron desabastecimiento de alimentos, combustibles e insumos, además de importantes pérdidas económicas en el departamento de La Paz.

Salazar fue uno de los principales dirigentes que lideró las movilizaciones campesinas durante el conflicto, que además de reivindicaciones sectoriales derivó en demandas políticas, entre ellas la renuncia del presidente Rodrigo Paz.

Las autoridades informaron que el dirigente permanecerá en dependencias policiales mientras se define su situación jurídica y se determina si será puesto ante un juez cautelar dentro del proceso por los hechos investigados.

Mira la programación en Red Uno Play",https://www.reduno.com.bo/noticias/asi-fue-el-momento-en-el-que-capturaron-al-dirigente-vicente-salazar-en-el-alto-202674163053
Red Uno,2026-07-04,Deportes,La afición paraguaya cumple con el ritual de 'Rocky' antes del duelo con Francia,"Igual que hicieron días atrás las aficiones de Ecuador, Brasil o Haití, cientos de paraguayos no faltaron este sábado a la peregrinación hasta la estatua de 'Rocky Balboa' en Filadelfia para conjugarse antes del duelo de octavos de final contra Francia.

Los hinchas paraguayos resistieron las asfixiantes temperaturas que afectan a esta zona del país, con una temperatura prevista superior a los 34 grados para la hora del partido, con más de 42 de sensación térmica.

""Los jugadores están acostumbrados a este clima y le van a dar con todo"", dijo a EFE Lidia, una paraguaya afincada en el distrito neoyorquino de Queens, que tampoco se perdió la histórica eliminatoria de dieciseisavos contra Alemania en Boston.

Antes de esa gesta, consumada el lunes, Adriana, que vive en Asunción, decidió comprar entradas para el partido de este sábado sin saber siquiera si Paraguay estaría en los octavos de final.

Viajó desde la capital paraguaya junto a su esposo, Sebastián, y su hijo, Mauro, solo para vivir ese momento.

""Confiamos en nuestra Albirroja. El lunes, antes del partido, compramos las entradas y dijimos: 'Nos vamos pase lo que pase'. Y la Albirroja nos dio esa alegría"", dijo a EFE esta aficionada paraguaya.

Sebastián pronosticó que, como contra Alemania, este sábado ""Paraguay gana en los penales"" a Francia.

Igual que para todos ellos, esta es la primera Copa del Mundo para Serafino, un paraguayo que vive en Nueva Jersey desde hace 25 años, una experiencia que definió como ""inexplicable, es muy lindo"".

""Mi señora está embarazada y nuestra hija nace a finales de este mes. Prácticamente me dio permiso para venir, así que mi suegra viajó desde Paraguay para quedarse con ella mientras yo estoy acá. Es algo muy especial"", aseguró.

Este paraguayo reconoció que Francia es un rival muy fuerte con los mejores jugadores, pero la victoria frente a Alemania ha llenado a la afición albirroja de esperanza.

""Como Alemania tiene sus lugares frágiles y le vamos a entrar por ahí. El paraguayo es como todo sudamericano, tiene la garra, cuando te toca la piel te toca fuerte"", añadió Serafino.

Los míticos escalones de 'Rocky Balboa', frente al Museo de Arte de Filadelfia, con la estatua de bronce del personaje interpretado por Sylvester Stallone, se han convertido en cita obligada para muchas de las aficiones que pasan por la ciudad, una peregrinación con la que han cumplido todas las hinchadas sudamericanas.

EFE

Mira la programación en Red Uno Play",https://www.reduno.com.bo/deportes/la-aficion-paraguaya-cumple-con-el-ritual-de-rocky-antes-del-duelo-con-francia-202674162523
Red Uno,2026-07-04,Deportes,"""Cuando veas la sombra de un gigante, puede ser la de un pequeño"": Alfaro antes de enfrentar a Francia","Con Gustavo Alfaro al mando, Paraguay ha llegado a los octavos de final del Mundial 2026 tras superar una complicada fase de grupos y eliminar a Alemania, una gesta que refuerza la fama de obrar milagros que el técnico de Rafaela se ha labrado en el fútbol sudamericano.

""Lo peor que me pueden decir a mí es que soy un improvisado, yo no improviso. Antes de tomar una decisión la pienso 1.000 veces, le doy vuelta 100 veces, planteo todas las hipótesis posibles de conflicto y después tomo la decisión"", dijo Alfaro en la víspera del cruce de octavos de final de este sábado frente a Francia.

Alfaro llegó a Paraguay en 2024, cuando la Albirroja naufragaba en las eliminatorias sudamericanas tras una humillante Copa América. En pocos meses la llevó a derrotar a Brasil y Argentina, y a sellar el billete para un Mundial por primera vez desde 2010.

""Este equipo hace un año y nueve meses estaba fuera de todo"", recuerda a menudo el técnico.

No era la primera vez que asumía un reto de este tipo. Logró sus mayores éxitos al frente del modesto Arsenal de Sarandí, al que condujo a conquistar la Copa Sudamericana y el Clausura argentino. Años más tarde también llevó a Ecuador al Mundial de Catar 2022, otra misión imposible cuando asumió el cargo.

""Ellos creyeron desde el primer día, se encolumnaron, fueron pacientes, fueron perseverantes, fueron cazadores de utopías imposibles. Porque nadie creía en Ecuador y hoy Ecuador está en pie"", dijo Alfaro en esa ocasión.

Al 'cazador de utopías imposibles' —sobrenombre que da título a un libro escrito por Alfaro en el que desarrolla su filosofía como entrenador— ni siquiera le inquietó el 4-1 que Paraguay encajó ante Estados Unidos, uno de los anfitriones, en su debut en el Mundial.

Rascó un 1-0 ante Turquía pese a jugar toda la segunda parte con uno menos por la expulsión de Miguel Almirón y selló la clasificación con un 0-0 ante Australia en un partido en el que salió a no perder, lo que le costó muchas críticas.

""Nos van a dar por muertos, pero estamos aquí y vamos a pelear"", dijo tras ese partido.

Un método innegociable

De la escuela de técnicos de largas charlas, carga táctica y una relación muy pedagógica con el grupo, casi de filósofo, Alfaro comparte rasgos con el también santafesino Marcelo Bielsa, que acaba de vivir en Uruguay el desgaste de ese modelo que no convenció al vestuario charrúa.

Bielsa confesó que los jugadores le habían pedido charlas más cortas para ""no sobreexigir la atención de las mentalidades más jóvenes"", pero a Alfaro, su triunfo sobre Alemania, le ha dado crédito suficiente para acallar incluso a los más críticos, liderados por el mítico guardameta José Luis Chilavert.

""Alfaro es un personaje que no sabe nada de fútbol, él lo único que sabe es hablar. En las declaraciones que hace denigra al futbolista paraguayo"", dijo Chilavert. ""Le pusieron una alfombra roja a una persona que en su puta vida vivió el éxito, siempre falló, en San Lorenzo de Almagro, en Boca Juniors"", añadió.

Pero Alfaro tiene una utopía irrenunciable, ""por más que tenga al mundo en contra"".

""Si no, sería como perder dos veces: pierdo el partido y porque traiciono mis convicciones. Y esa es la peor derrota que puede tener un entrenador"".

Este sábado Paraguay tendrá enfrente a la todopoderosa Francia, la gran favorita al título. Aferrado a su utopía, Alfaro afrontará el desafío fiel a la idea que expuso antes de eliminar a Alemania: ""Cuando veas la sombra de un gigante, no te asustes. Fíjate dónde está el sol, porque puede ser la sombra que proyecta un enano"".

EFE

Mira la programación en Red Uno Play",https://www.reduno.com.bo/deportes/cuando-veas-la-sombra-de-un-gigante-puede-ser-la-de-un-pequeno-alfaro-antes-de-enfrentar-a-francia-202674162031
Red Uno,2026-07-04,Economia,"Ministro Espinoza sobre modificaciones al PGE: ""Después de 20 años, un presupuesto fue consensuado""","El ministro de Economía, Gabriel Espinoza , destacó la aprobación del proyecto de ley que modifica el Presupuesto General del Estado (PGE) 2026 en la Cámara de Diputados y aseguró que el tratamiento de la norma marcó un hecho inédito por el nivel de debate y consenso alcanzado entre las distintas fuerzas políticas.

La autoridad señaló que la propuesta fue analizada durante varias horas en el Legislativo, donde recibió observaciones y aportes antes de obtener el respaldo de más de dos tercios de los diputados presentes.

""Después de más de 20 años, un presupuesto ha sido discutido, ha sido presentado y ha sido consensuado con distintas fuerzas políticas"" , afirmó Espinoza.

El ministro sostuvo que la aprobación del proyecto representa una recuperación del debate legislativo en torno al presupuesto nacional y valoró la participación de las diferentes bancadas durante el tratamiento de la iniciativa.

Asimismo, agradeció el respaldo de los legisladores que acompañaron la propuesta y consideró que el consenso alcanzado fortalece la institucionalidad en la discusión de las políticas económicas del país.

El proyecto incorpora ajustes presupuestarios para incrementar los recursos destinados a los gobiernos autónomos municipales y departamentales , además de redistribuir parte del ahorro generado por la reducción del gasto corriente no esencial hacia áreas como salud, educación y seguridad .

Tras su aprobación en la Cámara de Diputados, la iniciativa será remitida al Senado , donde continuará su tratamiento conforme al procedimiento legislativo antes de su eventual sanción.

Mira la programación en Red Uno Play",https://www.reduno.com.bo/economia/ministro-espinoza-sobre-modificaciones-al-pge-despues-de-20-anos-un-presupuesto-fue-consensuado-202674161812
Red Uno,2026-07-04,Deportes,Alfaro sale con defensa de cinco para enfrentar a una Francia con Koné y sin Tchouaméni,"Paraguay sale con tres cambios en el once y una línea defensiva de cinco para enfrentar este sábado a Francia en los octavos de final del Mundial, mientras que Les Bleus solo tienen la novedad de Manu Koné en el lugar de Aurélien Tchouaméni.

En la Albirroja, Gustavo Velázquez y Omar Alderete ingresan a la línea defensiva, de la que sale José María Canale. Además, Diego Gómez regresa al once titular en el puesto de Gabriel Ávalos tras cumplir la sanción por acumulación de tarjetas amarillas.

Gustavo Alfaro ya salió con una defensa de cinco contra Australia en el tercer partido de la primera fase, necesitado en esa ocasión de asegurar el empate para pasar de ronda, y durante el tramo final de la eliminatoria contra Alemania.

Paraguay sale con: Orlando Gill; Gustavo Velázquez, Omar Alderete, Juan Cáceres, Gustavo Gómez, Júnior Alonso; Miguel Almirón, Diego Gómez, Damián Bobadilla, Andrés Cubas, Matías Galarza; y Julio Enciso.

Por su lado, el seleccionador francés, Didier Deschamps, mantiene a Bradley Barcola en la delantera junto a Michael Olise, Ousmane Dembélé y Kylian Mbappé, con Désiré Doué como revulsivo.

En el medio del campo, sin embargo, Koné entra por Tchouaméni, un cambio que Deschamps ya probó contra Irak en la fase de grupos.

Francia sale con: Mike Maignan; Lucas Digne, Dayot Upamecano, William Saliba, Jules Koundé; Manu Koné, Adrien Rabiot; Michael Olise, Ousmane Dembélé, Bradley Barcola y Kylian Mbappé.

EFE

Mira la programación en Red Uno Play",https://www.reduno.com.bo/deportes/alfaro-sale-con-defensa-de-cinco-para-enfrentar-a-una-francia-con-kone-y-sin-tchouameni-202674161241
Red Uno,2026-07-04,Deportes,El hijo de Sidny Cabral emocionó al mundo tras la eliminación de Cabo Verde | Video,"Una de las escenas más emotivas del Mundial 2026 se vivió tras el intenso partido entre Argentina y Cabo Verde, cuando el hijo del futbolista Sidny Cabral consoló a su padre luego de la derrota por 3-2 que significó la eliminación de la selección africana.

Cabral, quien marcó el gol del empate transitorio 2-2 durante el encuentro, terminó visiblemente afectado por el resultado. Al finalizar el partido, mientras el jugador no podía contener las lágrimas, su pequeño hijo se acercó para abrazarlo y darle consuelo, pese a que él también lloraba.

Un gesto de amor

La imagen rápidamente se viralizó en redes sociales y fue compartida por miles de usuarios alrededor del mundo, quienes destacaron el gesto del menor como uno de los momentos más humanos y conmovedores del torneo.

El emocionante encuentro mantuvo la incertidumbre hasta los últimos minutos. Argentina logró imponerse por 3-2 en un duelo muy disputado, mientras Cabo Verde se despidió del campeonato dejando una destacada actuación que fue reconocida por aficionados y analistas.

Más allá del resultado deportivo, el abrazo entre Sidny Cabral y su hijo quedó como una de las postales más emotivas del Mundial, reflejando el lado más humano del fútbol y el valor del apoyo familiar incluso en los momentos más difíciles.

Mira la programación en Red Uno Play",https://www.reduno.com.bo/deportes/el-hijo-de-sidny-cabral-emociono-al-mundo-tras-la-eliminacion-de-cabo-verde-video-202674155749
Red Uno,2026-07-04,Tendencias,¿Eran ladrones? La explicación del video que se volvió viral en redes,"Un video que generó miles de reacciones en redes sociales al mostrar a varios hombres inmovilizados y envueltos con cinta adhesiva como Teletubbies, terminó teniendo un desenlace muy distinto al que inicialmente se difundió. Aunque las primeras publicaciones aseguraban que se trataba de presuntos ladrones capturados por habitantes de una comunidad en Indonesia, posteriormente se aclaró que todo formaba parte de un reto realizado por creadores de contenido.

Las imágenes, grabadas en la provincia de Malang, en Java Oriental, provocaron confusión entre los usuarios debido a la forma en que fueron presentadas en distintas plataformas digitales.

Uno de los detalles que más llamó la atención fue que la cinta fue acomodada sobre la parte superior de sus cabezas para formar una figura similar a la antena de Tinky Winky, personaje de la serie infantil Teletubbies, motivo por el que numerosos usuarios comenzaron a referirse a ellos con ese apodo. Primeras versiones aseguraban que habían sido capturados por robo Las publicaciones que inicialmente acompañaban el video afirmaban que los hombres habían sido sorprendidos mientras presuntamente cometían un robo en una comunidad de la provincia de Malang.

De acuerdo con esa versión, habitantes de la zona los habrían inmovilizado utilizando cinta adhesiva antes de ponerlos a disposición de las autoridades, lo que provocó que las imágenes se difundieran rápidamente en redes sociales.

La historia dio un giro: no eran delincuentes Con el paso de las horas surgió información que desmintió la versión inicial. Se confirmó que las personas que aparecen en el video no habían sido detenidas por ningún delito, sino que forman parte de un grupo de creadores de contenido humorístico que realizaban un reto extremo para su audiencia durante una transmisión en vivo.

La revelación modificó por completo la interpretación del video, que ya acumulaba miles de reproducciones y comentarios en distintas plataformas.

El caso evidencia los riesgos de la desinformación en redes sociales La rápida difusión de la grabación demuestra cómo un contenido puede viralizarse acompañado de información incorrecta antes de que existan verificaciones sobre su contexto.

En este caso, una grabación presentada inicialmente como un acto de justicia por mano propia terminó siendo un reto planeado con fines de entretenimiento, evidenciando la importancia de corroborar el origen y la veracidad de los videos que circulan en redes sociales.

Mira la programación en Red Uno Play",https://www.reduno.com.bo/tendencias/eran-ladrones-la-explicacion-del-video-que-se-volvio-viral-en-redes-202674153535
