sitio_noticias,fecha,seccion,titular,cuerpo,url
Unitel,2026-07-10,Economía,“Se trata de una consideración política”: IBCE cuestiona el decreto que congela los precios de los combustibles hasta enero,"El gerente del Instituto Boliviano de Comercio Exterior (IBCE), Gary Rodríguez, cuestionó el decreto que congela los precios de los combustibles hasta enero del siguiente año, señala que la medida es más política que económica. “No es la solución”, indicó.

“Se trata más de una consideración política en función de la situación que se está viviendo y que por supuesto afecta a la población en su economía. Esa no es la solución ”, manifestó Rodríguez.

Señaló que la consecuencia de haber tenido “productos artificialmente baratos en la economía”, como el azúcar, el GLP y otros combustibles, “ha beneficiado al contrabando”.

“La subvención, más temprano que tarde, tiene que desaparecer, y tenemos que sincerar esta situación”, indicó.

MIRA AQUÍ: Bolivia: Gasto en combustible ronda entre $us 40 y 50 millones a la semana, según ministro

Rodríguez sostuvo que desde un punto de valoración política esta medida tiene una explicación, pero que le costará al país Bs 1.000 millones adicionales.

“Ojalá que aparejado a esto, se hagan los esfuerzos, por una parte de control, de sanción al contrabando, y por otra, que con urgencia tengamos una nueva ley de inversiones, una nueva ley de hidrocarburos, la nueva ley de minería, de energía, etc.”, manifestó.

Este jueves, el Gobierno emitió el Decreto Supremo 5652 en el que amplía por seis meses el precio fijo de los derivados del petróleo y del GNV, además de autorizar Bs 1.000 millones a YPFB para cubrir el diferencial de los costos de importación.

MIRA AQUÍ: Subida del dólar: Ministro estima que en “dos o tres semanas” se estabilice el tipo de cambio en Bolivia",https://unitel.bo/noticias/economia/se-trata-de-una-consideracion-politica-ibce-cuestiona-el-decreto-que-congela-los-precios-de-los-combustibles-hasta-enero-CG22064262
Unitel,2026-07-10,Seguridad,Fiscalía citará a exministra de Evo por presunto daño de más de Bs 400 millones en la construcción de un hospital en Beni,"En el marco de la investigación por un presunto daño económico de más de Bs 400 millones en la construcción de un hospital de tercer nivel en la ciudad de Trinidad, departamento del Beni, la Fiscalía citará a declarar en calidad de testigo a la exministra de Salud, Ariana Campero, quien presuntamente firmó los contratos con las dos empresas constructoras.

“Se tiene como antecedente que en 2016 quien habría firmado el contrato con estas dos empresas sería la exministra Ariana Campero. Posteriormente, se la va a convocar para que manifieste cómo se realizó la contratación de estas empresas que habrían generado un daño económico”, informó el fiscal Miguel Cardozo.

MIRA AQUÍ: Denuncian presuntas irregularidades en la construcción de un hospital de tercer nivel en Beni

El fiscal precisó que la exministra de Evo Morales, será convocada inicialmente en calidad de testigo y que posterior a su declaración “su situación jurídica puede modificarse”.

“Estos hechos han generado un daño económico al Estado que está siendo investigado por el Ministerio Público por un monto aproximado de Bs 400 millones” , precisó.

Cardozo también informó que la exdirectora de la Agencia de Infraestructura en Salud y Equipamiento Médico (Aisem), Casablanca Villca, prestó declaración el miércoles y posteriormente se retiró ; sin embargo, continúa en calidad de investigada.

“La señora Casablanca Villca ha declarado el miércoles y se ha retirado. Ella continúa siendo investigada y se están recolectando elementos para determinar su grado de responsabilidad ”, señaló.

Además, indicó que 42 personas son investigadas por su presunta participación en las distintas etapas de contratación de las empresas constructoras.

MIRA AQUÍ: Sin hacer filas: Mira los tres pasos para obtener una ficha digital de atención en el Hospital San Juan de Dios

“Son 42 personas que están siendo investigadas y que han fungido en diferentes etapas de la contratación de las empresas . Estamos hablando de directores, fiscales de obra y, en función de sus declaraciones, también se convocará a los viceministros de ese entonces”, afirmó.

En abril de este año y mediante un video, la directora general ejecutiva de la Agencia de Infraestructura en Salud y Equipamiento Médico (Aisem), Daniela Quiroga, denunció presuntas irregularidades en la construcción del hospital.

La denuncia señala que durante la construcción del hospital se registraron varias irregularidades y que algunos ambientes fueron edificados sin considerar las dimensiones de los equipos médicos que debían instalarse.

“La infraestructura está construida, pero no contamos con el acelerador lineal instalado. Para traer el equipamiento tendríamos que tumbar las paredes ”, dijo.",https://unitel.bo/noticias/seguridad/fiscalia-citara-a-exministra-de-evo-por-presunto-dano-de-mas-de-bs-400-millones-en-la-construccion-de-un-hospital-en-beni-FG22062263
Unitel,2026-07-10,Insólito,Fallece influencer tras caer del piso 27 de un rascacielos en Dubái,"La modelo e influencer brasileña Kauana Bilhar murió a los 26 años tras caer desde el piso 27 de un rascacielos en Dubái , en los Emiratos Árabes Unidos. La Policía local investiga el caso y no descarta que se trate de un asesinato.

Kauana se dedicaba al modelaje y compartía contenido de sus viajes a Europa y Medio Oriente. Recientemente se comprometió con su novia Barbara Abrantes.

La noticia fue confirmada por la madre de la víctima mediante una publicación en redes sociales, luego salió información en diferentes medios de comunicación sobre las presuntas circunstancias de los hechos, según la investigación policial.

MIRA AQUÍ: Imágenes fuertes: Un policía jubilado mata a un hombre que intentaba asaltarlo y que agredió a su esposa

Al momento del crimen, la novia de la víctima se encontraba dentro de la habitación y fue quien llamó a la familia para contar sobre la muerte, según información de Daily Mail.

La Policía de Dubái maneja varias hipótesis, desde el homicidio hasta el accidente, pasando, incluso, porque la propia influencer hubiera querido quitarse la vida.

”No existen palabras capaces de expresar el tamaño del vacío que dejaste. H oy ya no estás a mi lado como soñaba, pero vivirás para siempre dentro de mí. Te amo infinitamente, mi niña, hasta el día en que podamos reencontrarnos”, escribió la madre de la víctima, Darla Bilhar, en un mensaje en redes sociales.

MIRA AQUÍ: Impactante deslizamiento de tierra en India arrasa una carretera y se lleva vehículos",https://unitel.bo/noticias/insolito/fallece-influencer-tras-caer-del-piso-27-de-un-rascacielos-en-dubai-AG22068585
Unitel,2026-07-10,Seguridad,"Adolescente de 15 años sufrió graves agresiones por su padrastro durante cinco años, reporta la Fiscalía","Una adolescente de 15 años rompió el silencio y contó a su madre que durante cinco años fue víctima de graves agresiones por parte de su padrastro. La Fiscalía de La Paz informó este viernes que se investiga el delito de violación.

“Se trata de una víctima adolescente y de acuerdo con las investigaciones, habría sido agredida desde sus 10 años. Se cuenta con la declaración de la progenitora de la menor y con el certificado médico forense”, informó la fiscal María Limachi.

MIRA AQUÍ: La Paz: Hallan el cuerpo sin vida de una mujer en la represa de Incachaca

El reporte de la Fiscalía señala que las agresiones comenzaron cuando la víctima tenía apenas 10 años y que, después de varios años, la adolescente decidió denunciar el hecho.

Tras conocer el caso, la madre de la víctima presentó la denuncia ante las autoridades policiales , que procedieron de inmediato con la aprehensión del acusado.

El padrastro fue llevado ante una audiencia de medidas cautelares, en la que un juez determinó su detención preventiva por seis meses en la cárcel de San Pedro, en La Paz.

MIRA AQUÍ: ¡Atención familias! Esta es la edad que deben tener los niños para ser inscritos al primer año del nivel inicial

“ Se ha dispuesto la imputación y la autoridad judicial ha determinado la detención en San Pedro”, agregó la fiscal.",https://unitel.bo/noticias/seguridad/adolescente-de-15-anos-sufrio-graves-agresiones-por-su-padrastro-durante-cinco-anos-reporta-la-fiscalia-OG22065902
Unitel,2026-07-10,Mundo,Asciende a 4.118 la cifra de personas fallecidas por los sismos en Venezuela,"Venezuela sumó este viernes otros 229 muertos y hay al menos 4.118 fallecidos por los devastadores terremotos del pasado 24 de junio, mientras que la cifra de heridos se mantiene en 16.740, según el balance oficial.

La cifra de personas sin vivienda sigue en 17.907 y la de familias atendidas en 86.794, indicó el presidente del Parlamento, el chavista Jorge Rodríguez, en su canal de Telegram.

El también hermano de la mandataria encargada, Delcy Rodríguez, aseguró que 17.266 personas se encuentran en un total de 89 campamentos transitorios.

MIRA AQUÍ: Terror en el aire: un pasajero fue succionado tras romperse una ventanilla en pleno vuelo en Europa

El balance señala que se mantiene en 856 el número de edificios afectados y en 190 el de colapsados.

El diputado afirmó que 9.766 toneladas de alimentos han sido distribuidos, así como 13,9 millones de litros de agua.

Además, hay 30.076 efectivos militares y de fuerzas de seguridad desplegados y 29.843 voluntarios registrados.

Según el balance oficial, han ocurrido 1.171 réplicas desde el 24 de junio, entre ellas la de magnitud 3,9 que sacudió este viernes zonas del norte del país, sin que hasta el momento se haya informado de daños o víctimas.

MIRA AQUÍ: Juicio a Marset en EEUU: Fiscalía presentará 40 testigos para el juicio que iniciará en enero

EFE pudo constatar que cientos de personas bajaron de los edificios comerciales en Caracas tras este nuevo temblor.

En las redes sociales, los usuarios reportaron desalojo de los edificios en sectores como La Candelaria, Los Ruices, Plaza Venezuela o Chacao en Caracas.

Por seguridad, los administradores de los edificios piden a las personas desalojar tras un temblor y permanecer un tiempo en las calles.",https://unitel.bo/noticias/mundo/asciende-a-4118-la-cifra-de-personas-fallecidas-por-los-sismos-en-venezuela-OG22067090
Unitel,2026-07-10,Economía,El dólar oficial registra un nuevo incremento para este sábado 11 de julio,"El Banco Central de Bolivia (BCB) difundió este viernes la cotización oficial del dólar que estará vigente para este sábado 11 de julio y que tiene un incremento en comparación con el precio del viernes.

MIRA AQUÍ: Subida del dólar: Ministro estima que en “dos o tres semanas” se estabilice el tipo de cambio en Bolivia

Para el sábado, la cotización oficial del dólar es de 10,40 bolivianos, lo que significa 16 centavos más en comparación con el precio de este viernes que estaba fijado en Bs 10,24.

Si se toma en cuenta que la cotización oficial del dólar aplicando el régimen flexible inició el 29 de junio con un precio de Bs 9,73, hasta el sábado se habrá registrado un incremento de 67 centavos de boliviano.

Todos los días a las 20:00, el BCB difunde la cotización oficial del dólar que estará vigente para el día siguiente.

MIRA AQUÍ: Exportadores se declaran en emergencia y piden atención del Gobierno para la recuperación sectorial

Este viernes, el ministro de Economía señaló que el incremento se debía a una alta demanda de los dólares y estimaba que en dos o tres semanas el precio se iba a estabilizar.",https://unitel.bo/noticias/economia/el-dolar-oficial-registra-un-nuevo-incremento-para-este-sabado-11-de-julio-KG22069773
Unitel,2026-07-10,Economía,Choferes dicen que no llegaron a un acuerdo con el Gobierno y exigen compromiso escrito por el combustible,"El secretario ejecutivo de la Confederación de Choferes de Bolivia, Lucio Gómez, informó este viernes que el sector no llegó a ningún acuerdo con las autoridades de Gobierno durante la reunión en la que se abordó la distribución de combustible, las filas en las estaciones de servicio y la calidad del carburante.

El dirigente señaló que los transportistas esperan un compromiso escrito por parte de las autoridades sobre los informes de abastecimiento y la distribución de combustible.

MIRA AQUÍ: Bolivia: Gasto en combustible ronda entre $us 40 y 50 millones a la semana, según ministro

“Hoy ya nadie puede ocultar las filas. Las fallas que existen en la calidad y el abastecimiento del combustible esperamos que sean informadas por escrito, que nos plasmen en un documento”, declaró Gómez tras salir de la reunión.

El sector del transporte exige a las autoridades presentar un informe detallado y un compromiso formal sobre la distribución del carburante.

“Ellos se han comprometido a hacernos llegar los informes. No nos interesa que estemos en un Estado de excepción, estamos pidiendo algo justo para poder trabajar; si no lo hacen, van a tener problemas con el transporte nacional”, advirtió el dirigente.

Este viernes, representantes de los choferes y autoridades del Ministerio de Hidrocarburos, Yacimientos Petrolíferos Fiscales Bolivianos (YPFB) y la Agencia Nacional de Hidrocarburos (ANH) sostuvieron una reunión en oficinas estatales de La Paz.

MIRA AQUÍ: Policías de Bolivia y Perú coordinan operativos en la frontera contra el contrabando y autos indocumentados

“En sus manos está cumplir con la obligación. Esperamos que nos hagan llegar el informe en estos días. Hemos escuchado la explicación, pero no podemos caer en la mentira ni en compromisos que no se cumplan; por eso no se ha firmado ningún acuerdo”, afirmó Gómez.",https://unitel.bo/noticias/economia/choferes-dicen-que-no-llegaron-a-un-acuerdo-con-el-gobierno-y-exigen-compromiso-escrito-por-el-combustible-BG22068823
Unitel,2026-07-10,Farándula,Los tiktokers bolivianos Grecia Añez y Kako van rumbo al altar: mira cómo fue la pedida de mano,"Grecia Añez y Juan Carlos Loza, más conocido en las redes sociales como Kako, se casan, así lo confirmaron a sus seguidores, tras la pedida de mano que se realizó durante un concierto.

La pedida de mano se realizó durante un concierto de los Kakones, agrupación musical conformada por Juan Carlos Loza y dos de sus hermanos.

“Yo no me veo sin ti ¿Quieres casarte conmigo?”, le preguntó de rodillas Kako a Grecia a tiempo de mostrar un anillo de compromiso.

La cruceña se emocionó hasta las lágrimas y recibió el anillo e inmediatamente se funden en un abrazo y beso para celebrar el momento saltando, cantando y bailando.

Tras ese momento comenzaron las dudas si la pedida de mano era real o se trataba de un contenido más. Días después, Kako respondió en las redes confirmando el noviazgo y la realización de la “boda del año”.

“A todas las personas les puedo decir que estoy feliz, estoy tranquilo, es lo que quiero”, dijo Kako en su transmisión por TikTok.

En otra transmisión, Grecia y Kako dieron detalles del día más importante de sus vidas. Mencionaron que algunos amigos se brindaron para ser padrinos y revelaron que buscan un lugar donde puedan convivir tranquilos, mientras avanzan con la planificación del matrimonio.",https://unitel.bo/noticias/farandula/los-tiktokers-bolivianos-grecia-anez-y-kako-van-rumbo-al-altar-mira-como-fue-la-pedida-de-mano-PG22061871
Unitel,2026-07-10,Seguridad,Envían a la cárcel al fiscal de Tupiza acusado de liberar a un investigado por narcotráfico,"El fiscal general del Estado, Roger Mariaca, informó sobre la determinación del juez que dictó medidas cautelares para el fiscal de Tupiza que fue aprehendido por favorecer la liberación de un sujeto que fue hallado con media tonelada de marihuana en un minibús.

”No vamos a tolerar ningún hecho de corrupción” , señaló Mariaca a tiempo se presentó lo necesario para que el juez cautelar del municipio de Potosí determine la detención preventiva en Cantumarca.

MIRA AQUÍ: Armamento hallado en Viru Viru: Cinco claves que hacen de los fusiles AK 47 muy peligrosos y letales

El sujeto es investigado por los delitos de prevaricato fiscal e incumplimiento de deberes. Además, la Fiscalía señaló que se logró demostrar indicios del peligro de fuga y obstaculización.

“Este fiscal d ebió pedir la medida extrema de detención preventiva para una persona que estaba llevando en un minibús más de media tonelada de marihuana y no lo hizo. ¿Eso qué se llama? Prevaricato fiscal e incumplimiento de deberes” , enfatizó.

El fiscal detenido es acusado favorecer para la liberación de un hombre que, entre el 3 y 4 de julio, fue sorprendido en poder de más de 500 kilos de marihuana en Tupiza. Al momento de la audiencia cautelar, pidió medidas sustitutivas para el imputado, pese a la cantidad de droga con la que fue hallado en flagrancia.

MIRA AQUÍ: La Paz: Hallan el cuerpo sin vida de una mujer en la represa de Incachaca",https://unitel.bo/noticias/seguridad/envian-a-la-carcel-al-fiscal-de-tupiza-acusado-de-liberar-a-un-investigado-por-narcotrafico-NG22069217
Unitel,2026-07-10,Mundo,Bolivia y el resto de los países del Escudo de las Américas piden respetar las elecciones en Colombia,"Bolivia suscribió la declaración conjunta de los países miembros del Escudo de Las Américas, a la cabeza de EEUU, que hace un llamado a respetar los resultados oficiales de las elecciones en Colombia y advirtieron que cualquier intento de deslegitimar el proceso electoral o de obstaculizar la transición de gobierno supone un desconocimiento de la voluntad popular.

El comunicado compartido por el Departamento de Estado de EEUU y suscrito también por Argentina, Chile, Costa Rica, República Dominicana, Ecuador, El Salvador, Guyana, Honduras, Panamá, Paraguay y Trinidad y Tobago, expresa su “profunda preocupación” por declaraciones y acciones que, “sin fundamentos debidamente justificados”, ponen en duda la integridad del proceso electoral y generan incertidumbre sobre la transición institucional en Colombia.

Los firmantes rechazaron cualquier acción o decisión que busque desacreditar a las autoridades electorales, desconocer el mandato otorgado por los ciudadanos u obstaculizar el proceso de empalme entre gobiernos, e instaron a las autoridades colombianas a garantizar una transición pacífica, ordenada y transparente, en estricto apego a la Constitución, la ley y los principios democráticos.

El pronunciamiento surge en el cierre de la semana en la que el presidente colombiano, Gustavo Petro, declaró que se negaba a reconocer la victoria de Abelardo de la Espriella en la segunda vuelta de las elecciones presidenciales del 21 de junio sobre el candidato oficialista, el senador Iván Cepeda, alegando fraude sin aportar pruebas.

Posteriormente, De la Espriella, públicamente respaldado por el presidente de EEUU, Donald Trump, afirmó en un video que Petro y Cepeda habían puesto en marcha un plan para “aferrarse al poder a toda costa” mediante un supuesto “golpe de Estado”.

Este viernes, Petro, ante su homólogo brasileño, Luiz Inácio Lula da Silva, se comprometió a dejar del cargo el próximo 6 de agosto y a promover una transición pacífica de Gobierno, informó este jueves la presidencia brasileña en un comunicado.

MIRE AQUÍ: Asciende a 4.118 la cifra de personas fallecidas por los sismos en Venezuela

Tras indicar que dejará el cargo el 6 de agosto, Petro “reafirmó su compromiso con la democracia y con una transición pacífica en el país”, afirmó la Presidencia brasileña en una nota en la que informó sobre la conversación telefónica que los dos mandatarios sostuvieron en la mañana de este jueves.

D e la Espriella fue proclamado presidente electo tras imponerse en la segunda vuelta del 21 de junio con cerca del 52% de los votos frente al candidato oficialista, Iván Cepeda, según los resultados oficiales de la Registraduría Nacional.

El abogado y presidente electo asumirá el cargo el próximo 7 de agosto para un mandato de cuatro años.

MIRE AQUÍ: Juicio a Marset en EEUU: Fiscalía presentará 40 testigos para el juicio que iniciará en enero",https://unitel.bo/noticias/mundo/bolivia-y-el-resto-de-los-paises-del-escudo-de-las-americas-piden-respetar-las-elecciones-en-colombia-NH22070368
Unitel,2026-07-10,Economía,“Las filas son tremendas”: Choferes denuncian escasez de combustible en los Yungas de La Paz,"Transportistas que llegan de los Yungas a La Paz reportaron largas filas en los surtidores de municipios del norte del departamento debido al desabastecimiento de diésel y gasolina.

“No hay diésel, (en los Yungas) tampoco hay diésel. Las filas son tremendas; llevo cerca de una hora esperando”, relató un transportista que arribó desde esa región.

MIRA AQUÍ: Choferes dicen que no llegaron a un acuerdo con el Gobierno y exigen compromiso escrito por el combustible

Otro conductor denunció que las filas para cargar combustible también son largas en el municipio de Caranavi . Debido a que debía retornar a La Paz, decidió abastecerse en una estación de servicio ubicada en el sector de La Cumbre.

“Estaba llegando de Caranavi y allá las filas por gasolina y diésel están tremendas”, señaló el transportista de carga pesada.

Otro chofer pidió al Gobierno solucionar el desabastecimiento de diésel en las comunidades del norte paceño, ya que la falta de carburante afecta el trabajo del sector.

MIRA AQUÍ: Bolivia: Gasto en combustible ronda entre $us 40 y 50 millones a la semana, según ministro

“Nos perjudica y no nos deja trabajar. Sin combustible no se puede viajar y el camino está inestable”, afirmó.

Ante este problema, el secretario ejecutivo de la Confederación de Choferes de Bolivia, Lucio Gómez, informó este viernes que el sector no llegó a ningún acuerdo con las autoridades de Gobierno durante la reunión en la que se abordó la distribución de combustible, las filas en las estaciones de servicio y la calidad del carburante.

El dirigente señaló que los transportistas esperan un compromiso escrito por parte de las autoridades sobre los informes de abastecimiento y la distribución de combustible.",https://unitel.bo/noticias/economia/las-filas-son-tremendas-choferes-denuncian-escasez-de-combustible-en-los-yungas-de-la-paz-BG22069866
Unitel,2026-07-10,Política,“Solo patea la crisis para adelante”: Lara cuestiona decreto que congela seis meses los precios de los hidrocarburos,"El vicepresidente Edmand Lara se pronunció respecto al Decreto Supremo 5652 que congela el precio de los hidrocarburos por seis meses y autoriza Bs 1.000 millones a YPFB para cubrir la diferencia de los costos de importación. Sostuvo que la medida no soluciona la crisis actual, sino que la pospone.

“Tenemos que decirlo claro, esta medida no soluciona nada, sólo patea la crisis para adelante. ¿Qué significa esto en la vida real? El ministro ha decidido que la diferencia entre lo que cuesta traer gasolina y el diésel del exterior y lo que usted paga en el surtidor, la pagamos todos desde el Tesoro General de la Nación”, manifestó el vicepresidente.

MIRA AQUÍ: Choferes dicen que no llegaron a un acuerdo con el Gobierno y exigen compromiso escrito por el combustible

Lara criticó la medida, señalando que el problema es que las causas de la crisis continúan, la producción es poca y no hay suficientes dólares. “Subvencionar sin resolver, eso es como echar agua a un balde roto”, remarcó.

“Financiar a sí el subsidio es como pagar la casa con tarjeta de crédito, más deuda para usted y para sus hijos, menos dólares en el país, más inflación”, agregó.

Por ello, pidió al ministro de Economía, José Gabriel Espinoza, que se sincere la economía y “se ponga a trabajar en lo difícil” , además de señalar que se necesita explorar más, producir gas y petróleo y recuperar dólares.

MIRA AQUÍ: “Se trata de una consideración política”: IBCE cuestiona el decreto que congela los precios de los combustibles hasta enero",https://unitel.bo/noticias/politica/solo-patea-la-crisis-para-adelante-lara-cuestiona-decreto-que-congela-seis-meses-los-precios-de-los-hidrocarburos-NH22070278
