sitio_noticias,fecha,seccion,titular,cuerpo,url
Unitel,2026-07-04,Mundo,“EEUU es la nación más libre y más fuerte de la historia”: Trump por los 250 años de independencia,"El presidente de Estados Unidos, Donald Trump, afirmó este viernes desde el Monumento Nacional del Monte Rushmore (Dakota del Sur) que el país es “la nación más libre, fuerte y excepcional de la historia”, en el arranque de las celebraciones por el 250 aniversario de la independencia estadounidense.

“Somos el pueblo más libre del mundo, tenemos la Constitución más justa y duradera del mundo y somos la nación más poderosa del mundo”, sostuvo Trump en tono patriótico en este acto por el aniversario de la emancipación estadounidense de 1776 que incluyó homenajes a las Fuerzas Armadas y sobrevuelos militares.

MIRA AQUÍ: Kast cierra la unidad que investiga adopciones ilegales y causa indignación en víctimas

El mandatario presentó la fundación de EEUU como “un acontecimiento único en la historia de la humanidad” y reivindicó el legado de los Padres Fundadores y la Declaración de Independencia de 1776.

El Monte Rushmore es uno de los símbolos más reconocibles de Estados Unidos porque en su fachada están esculpidos los rostros de cuatro presidentes fundamentales en la historia del país: George Washington, Thomas Jefferson, Theodore Roosevelt y Abraham Lincoln.

Trump ya eligió este lugar para celebrar el Día de la Independencia en 2020, durante su primer mandato, cuando defendió los monumentos históricos frente a las protestas del movimiento Black Lives Matter. Entonces aseguró que Rushmore “nunca será profanado”.

En su discurso de hoy, Trump, apoyado en el simbolismo del lugar, realizó un amplio y deslavazado recorrido histórico del país, desde la Guerra de Independencia hasta la expansión hacia el oeste, la Guerra Civil, la industrialización y las guerras mundiales, en el que trató de enmarcar su mensaje en la continuidad de los cuatro presidentes esculpidos.

Trump advirtió además en tono ideológico de lo que considera “intentos de cambiar el carácter excepcional de Estados Unidos” y de “alienar a los ciudadanos de su propia historia”.

“Este país no es la norma, es la excepción. Es raro, es precioso y es milagroso”, señaló, e insistió en que la identidad nacional fue “clave para preservar la libertad a lo largo de dos siglos y medio”.

El mandatario pasó después a vincular su mensaje a su agenda política, y citó la Segunda Enmienda, que garantiza el derecho a portar armas: “Hemos salvado vuestra Segunda Enmienda y seguiré haciéndolo”, aseveró.

También lanzó una dura crítica ideológica contra el “resurgimiento del comunismo” en Estados Unidos , al que definió como “el enemigo de la libertad, la Constitución y el 4 de julio de 1776”, y aseguró: “No permitiré su expansión”.

En el plano internacional, Trump reivindicó la “fortaleza” de Estados Unidos ensalzando el poder militar y la capacidad de disuasión estadounidense.

MIRA AQUÍ: “La fiesta se acabó”: gobierno electo de Colombia anuncia recortes

“Derrotamos a Venezuela en un día y le dimos una paliza tremenda a Irán. Se mueren por llegar a un acuerdo, tienen muchísimas ganas de pactar. Les dimos una semana de tregua por un funeral”, expresó.

El discurso combinó referencias históricas y promesas de futuro, en las que proyectó una nueva “edad dorada” para el país basada en el liderazgo tecnológico, la independencia energética y la expansión de la exploración espacial, entre otros.

“Esto no es un final, es el comienzo de la edad dorada de América”, concluyó",https://unitel.bo/noticias/mundo/eeuu-es-la-nacion-mas-libre-y-mas-fuerte-de-la-historia-trump-por-los-250-anos-de-independencia-NK21909455
Unitel,2026-07-04,Seguridad,Bomberos: Sube a nueve la cifra de fallecidos por la caída de un minibús a un barranco y cuatro son menores de edad,"Tras un informe preliminar que alertaba de dos fallecidos, Bomberos realizó trabajos para el rescate de las víctimas y se actualizó la cifra víctimas fatales a nueve e igual cantidad de heridos.

MIRA AQUÍ: Aprehendidos por falsificación de dinero en La Paz son miembros de una misma familia

El reporte señala que el accidente se produjo cerca de las 13:00 de este sábado, en la carretera que conecta a la ciudad de Cochabamba con Morochata, cerca de la localidad de San Miguel.

Se informó que los heridos fueron trasladados en ambulancias a diferentes centros de salud del municipio de Quillacollo.

MIRA AQUÍ: Policías acusados de pedir Bs 7.000 serán procesados por la vía penal y disciplinaria, confirma comandante

La información preliminar señalaba que el minibús estaba brindando el servicio de transporte de pasajeros cuando se embarrancó, cayendo al menos 200 metros.

PERSONAS SIN SIGNOS VITALES

1. Olimpio Guzmán Antezana 62 años

2. Wilmer Campos Ascencio 28 años

3. Aida Ríos Pérez 35 años

4. Licia C. R. 11 años

5. Josué Claros Rojas 22 años

6. Domitila Laura Poma 54 años

7. Cristofer M. R. 14 años

8. Jhair N. B. 6 años

9. Belén N. B. 8 años",https://unitel.bo/noticias/seguridad/bomberos-sube-a-nueve-la-cifra-de-fallecidos-por-la-caida-de-un-minibus-a-un-barranco-y-cuatro-son-menores-de-edad-JL21910328
Unitel,2026-07-04,Política,"Tras la aprehensión de Salazar, los campesinos Túpac Katari exigen que sea liberado y se declaran en emergencia","La aprehensión de Vicente Salazar, líder de los campesinos Túpac Katari motivó que esta organización difunda un comunicado en el que exigen que el hombre acusado por los 53 día de bloqueos sea liberado.

“ Exigimos la liberación inmediata del hermano Vicente Salazar, quien en su calidad de Ejecutivo de la Federación solo fue el portavoz de los pedidos de las bases, quien según estatuto debe cumplir con los pedidos de las 20 provincias”, señala una parte del pronunciamiento.

MIRA AQUÍ: Salazar es “el eslabón más débil”, también se debe aprehender a Evo y Argollo, señalan cívicos

La captura Salazar se produjo cerca de las 13:00 de este sábado. La Fiscalía informó que su aprehensión se produce por una denuncia por los bloqueos que realizó el Ministerio de Gobierno en mayo.

En otra parte del comunicado, los campesinos piden unidad a las 20 provincias y responsabilizan al Gobierno en caso de que Salazar sufra algún “daño físico, psicológico o jurídico”.

MIRA AQUÍ: Aprehenden a Vicente Salazar, ejecutivo de la Federación Túpac Katari, por los bloqueos de 53 días

“Nos declaramos en estado de emergencia en las 20 provincias, con el fin de defender la integridad física y jurídica de nuestros dirigentes, la autonomía de nuestra organización y los derechos de nuestras bases”, señala el comunicado.

En principio, Salazar intentó evitar su aprehensión; sin embargo, terminó saliendo de la camioneta en la que se encontraba y fue aprehendido por uniformados que lo trasladaron a dependencias policiales.",https://unitel.bo/noticias/politica/tras-la-aprehension-de-salazar-los-campesinos-tupac-katari-exigen-que-sea-liberado-y-se-declaran-en-emergencia-HL21910623
Unitel,2026-07-04,Sociedad,Exgobernadora Ruth Lozada denuncia robo de equipaje en un vuelo de BoA que partió de Viru Viru con destino a España,"La exgobernadora de Santa Cruz y expresidenta cívica, Ruth Lozada, denunció que víctima de robo en su equipaje en un vuelo con destino a Madrid, España, que salió desde el aeropuerto Viru Viru.

“Estoy llegando a Madrid en un vuelo de BoA. Todo el mundo me decía que es la peor línea y a la que a los pasajeros siempre le roban.. Puej ahora me tocó vivirlo en carne propia ”, relató Lozada.

Según expuso en sus redes sociales, introdujo su maleta de mano dentro de una maleta más grande y rellenó por fuera con detalles para su hija y sus nietos.

MIRA AQUÍ: Aprehendidos por falsificación de dinero en La Paz son miembros de una misma familia

“Fueron robados. Y muestro la foto de mi maleta como me la dejaron... Son unos ladrones, siguen en lo mismo”, denunció en un mensaje en el que adjunto una fotografía de su equipaje.

Lozada convocó a otras personas que hubieran sufrido robos en el aeropuerto a organizarse y exigir políticas y acciones que frenen este tipo de delitos y se descubra “la cara de estos maleantes para mostrarlos públicamente y ver que la empresa , o quien los contrató, les inicie un proceso por ladrones y sinvergüenzas”.

“Creo que es importante que todos quienes hemos sufrido robos y faltas a nuestros derechos ciudadanos por funcionarios de la repartición que sean, pero que trabajan en el aeropuerto Viru Viru de Santa Cruz, nos reunamos y presentemos juntos nuestra denuncia”, apuntó.

MIRA AQUÍ: Aprehenden a un micro traficante que escondía droga en sus zapatos para evitar los operativos en El Alto",https://unitel.bo/noticias/sociedad/exgobernadora-ruth-lozada-denuncia-robo-de-equipaje-en-un-vuelo-de-boa-que-partio-de-viru-viru-con-destino-a-espana-KK21909102
Unitel,2026-07-04,Seguridad,Bomberos difunde la lista de fallecidos y heridos del minibús que cayó a un barranco en Cochabamba,"Tras el informe que brindó Bomberos de la Policía sobre el accidente en el que nueve personas fallecieron y existe una similar de heridos, desde esta institución se brindó la lista de las víctimas.

MIRA AQUÍ: Bomberos: Sube a nueve la cifra de fallecidos por la caída de un minibús a un barranco y cuatro son menores de edad

Cabe recordar que el accidente se produjo cuando un minibús repleto de pasajeros se trasladaba desde Cochabamba a Morochata; sin embargo, por un motivo que aún se desconoce cayó a un barranco cerca de la zona conocida como San Miguel.

“En el lugar se verificó y constató un embarrancamiento de un vehículo tipo minibús”, señala el reporte de los Bomberos.

MIRA AQUÍ: Queda en libertad la mamá del bebé que murió tras caer de un ‘torito’ y buscan al conductor que lo atropelló

Los heridos fueron trasladados a un centro de salud en Quillacollo para recibir atención médica.

El informe también agrega a los heridos y a las víctimas fatales:

PERSONAS SIN SIGNOS VITALES

1. Olimpio Guzmán Antezana 62 años

2. Wilmer Campos Ascencio 28 años

3. Aida Ríos Pérez 35 años

4. Licia C. R. 11 años

5. Josué Claros Rojas 22 años

6. Domitila Laura Poma 54 años

7. Cristofer M. R. 14 años

8. Jhair N. B. 6 años

9. Belén N. B. 8 años

PERSONAS HERIDAS

1. Juan Ayala Cáceres 40 años

2. ⁠Ninfa Villarroel Rojas 68 años

3. ⁠Dayana A. G. 10 años

4. ⁠Dilan A. R. 9 años

5. ⁠Naylin B. V. 16 años

6. ⁠Ana Rosa H. L. 11 años

7. ⁠Cesia L. H. 3 años

8. Melani C. H. 10 años

9. ⁠Maritza G.",https://unitel.bo/noticias/seguridad/bomberos-difunde-la-lista-de-fallecidos-y-heridos-del-minibus-que-cayo-a-un-barranco-en-cochabamba-LL21911578
Unitel,2026-07-04,Sociedad,Retornó a Bolivia la misión humanitaria que viajó a Venezuela para brindar ayuda a víctimas del doble terremoto,"Pasadas las 22:30 de este sábado, arribó el contingente compuesto por 20 personas que viajaron a Venezuela como parte de una misión para ayudar en tareas de rescate e identificación de las víctimas del doble terremoto que azotó a Venezuela. Los uniformados fueron recibidos por el ministro de Defensa, Ernesto Justiniano.

MIRA AQUÍ: Milagroso rescate: Así fue cómo un hombre sobrevivió 8 días bajo los escombros en Venezuela

Los rescatistas bolivianos desarrollaron tareas de búsqueda, rescate e identificación de personas fallecidas que se encontraban entre los escombros, en coordinación con las autoridades venezolanas y los equipos internacionales de respuesta, señala un reporte de la Dirección de Comunicación del Gobierno.

Otra tarea que efectuaron fue la evaluación técnica de la estructura del edificio Costa Brava, apoyaron en tareas de apertura y apuntalamiento para garantizar condiciones seguras de trabajo.

Durante el acto de recepción, el ministro de Defensa expresó su reconocimiento y a gradecimiento al contingente boliviano por el trabajo realizado, destacando su profesionalismo, disciplina y compromiso con la misión encomendada.

Asimismo, resaltó que la participación de Bolivia refleja el espíritu solidario del país y la capacidad de respuesta de sus equipos especializados ante situaciones de emergencia internacional.

CONDECORACIÓN EN VENEZUELA

Al momento de su regreso a Bolivia, el contingente de bolivianos fue distinguido con la medalla “Héroe de Venezuela”, en reconocimiento a la labor que desarrolla en las operaciones internacionales de búsqueda, rescate y asistencia humanitaria en las zonas afectadas por los terremotos que golpearon el estado de La Guaira.

MIRA AQUÍ: Los fallecidos por los terremotos en Venezuela rozan los 3.000 y los heridos ya son 16.592

La condecoración fue entregada durante un acto en el campamento de las delegaciones internacionales, con la presencia de la presidenta de Venezuela, Delcy Rodríguez, quien destacó el trabajo de los equipos de rescate que participan en la atención de la emergencia y reconoció el compromiso de las misiones internacionales desplegadas en el país.",https://unitel.bo/noticias/sociedad/retorno-a-bolivia-la-mision-humanitaria-que-viajo-a-venezuela-para-brindar-ayuda-a-victimas-del-doble-terremoto-EL21911162
Noticias Violeta,2026-07-04,Nacional,Gobierno inicia persecución contra lideres obreros y campesinos del paro indígena de 53 días|| El dirigente indígena Vicente Salazar fue nuevamente aprehendido este sábado.,"Sucre, 4 de julio (ANV).- El Gobierno formalizó una denuncia penal contra los lideres obreros y campesinos que encabezaron la resistencia popular contra el gobierno con una medida que se extendieron durante 53 días en Bolivia. La acción fue presentada de manera conjunta por los ministerios de Gobierno y de Defensa ante el Ministerio Público, como parte de las investigaciones por los hechos registrados durante las movilizaciones de mayo y parte de junio.

«Ya hemos presentado y es parte de las 44 denuncias que se hicieron llegar a la Fiscalía», informó el ministro de Gobierno, Marco Antonio Oviedo, en declaraciones a EL DEBER durante su visita a Tarija.

Según Oviedo, las denuncias buscan que los responsables respondan ante la Justicia por las muertes y los daños ocasionados durante los 53 días de bloqueos que afectaron el abastecimiento, el transporte y la actividad económica en distintos puntos del país.

El ministro de Defensa, Ernesto Justiniano, ratificó que el Ejecutivo dará seguimiento al proceso judicial para evitar que los involucrados queden en la impunidad.

«Hay todo un proceso que se les va seguir por el Ministerio de Gobierno y el Ministerio de Defensa. Además, esperamos que se sumen denuncias penales de la sociedad organizada», afirmó Justiniano tras participar en la reunión de gabinete y en los actos protocolares por el aniversario de Tarija.

La autoridad precisó que entre las personas incluidas en la querella figuran Mario Argollo y Vicente Salazar, además de otros presuntos responsables.

En ese contexto, Salazar fue aprehendido este sábado y trasladado a dependencias de la Fuerza Especial de Lucha Contra el Crimen (Felcc) de La Paz, donde continuará el proceso investigativo.

Agencia de Noticias Violeta | Celular 72441200",https://noticiasvioleta.com/gobierno-inicia-persecucion-contra-lideres-obreros-y-campesinos-del-paro-indigena-de-53-dias/
Noticias Violeta,2026-07-04,Nacional,Categoría:Nacional,"Sucre, 4 de julio (ANV).- El Gobierno formalizó una denuncia penal contra los lideres obreros y campesinos que encabezaron la resistencia popular contra el gobierno con una medida que se extendieron durante 53 días en Bolivia. La acción fue presentada de manera conjunta por los ministerios de Gobierno y de Defensa ante el Ministerio Público, como parte de las investigaciones por los hechos registrados durante las movilizaciones de mayo y parte de junio. «Ya hemos presentado y es parte de las 44 denuncias que se hicieron llegar a la Fiscalía»,…

Sucre, 2 de julio (ANV).- El presidente de la junta vecinal del Distrito 6, Limber Velarde, informó que se ha presentado una solicitud formal para que el Concejo Municipal sesione en su jurisdicción con el fin de exponer las necesidades locales y viabilizar la creación de un nuevo distrito. Velarde explicó que actualmente el Distrito 6 es una zona mixta, compuesta por 84 comunidades rurales y 114 juntas vecinales urbanas, la cual cuenta con el presupuesto más bajo a nivel municipal. Ante esta situación, los representantes vecinales buscan impulsar la…

La Directora de Educación Técnica de la Gobernación de Chuquisaca, Ana Silva, anunció el lanzamiento del programa «Becas sin Límites», una iniciativa conjunta con la institución Gold Master que otorgará 100 becas con una cobertura del 85% para la formación de jóvenes chuquisaqueños. Se conoce que el costo para los jóvenes sería de Bs 444.00. Este programa buscaría abrir el acceso a idiomas como inglés, francés o portugués, además de brindar herramientas complementarias en liderazgo e inteligencia artificial, con el objetivo de mejorar las capacidades de los estudiantes frente a…

Sucre, 30 de junio (ANV).-El dirigente de la Federación de Juntas Vecinales (FEDJUVE) de Chuquisaca, Bruno Coa, manifestó la profunda preocupación de su sector ante el posible impacto del incremento de precios en la canasta familiar y en los pasajes del transporte interprovincial, debido a la situación del diésel y el dólar. Respecto a la situación económica, el dirigente vecinal señaló que existe una gran inquietud en las juntas vecinales periurbanas por el encarecimiento de la canasta familiar. Ante este escenario, Coa anunció que la federación, la cual representa a…

La Paz, 30 de junio (ANV).- El vocero presidencial, José Luis Gálvez, informó este lunes que las largas filas de vehículos en los surtidores de la ciudad de La Paz disminuyeron notoriamente al inicio de esta semana y afirmó que se espera que desaparezcan por completo durante la jornada del martes. La escasez de combustibles se generó durante y después de los 53 días de bloqueo que afectaron al país, según declaraciones del portavoz. «Hay suficiente producto de gasolina y diésel; el problema es logístico y de control de calidad.…

El Ministerio de Economía y Finanzas Públicas emitió la Resolución Ministerial N° 245, mediante la cual dispone el tránsito hacia un régimen cambiario flexible, dejando atrás el esquema de tipo de cambio fijo que rigió en el país durante los últimos años. La medida, que será ejecutada por el Banco Central de Bolivia (BCB), se fundamenta en la reducción de divisas, la caída de las Reservas Internacionales Netas (RIN) y la necesidad de preservar la estabilidad macroeconómica. La resolución establece en su parte resolutiva: «Establecer un régimen cambiario flexible, a…

Sucre, 25 de junio (ANV).- El presidente de la Federación de Empresarios Privados de Chuquisaca, Ernesto Poppe, manifestó la necesidad de implementar un plan de emergencia y salvataje por parte del Gobierno para recuperar los empleos y las empresas perdidas tras 50 días de afectación económica. El representante señaló la dificultad de recuperar el tiempo perdido, sugiriendo la adopción de dobles turnos de trabajo y la unificación de criterios dentro del sector empresarial en una reunión nacional programada en Cochabamba para presentar propuestas conjuntas al Ejecutivo. Respecto a las pérdidas…

Sucre, 25 de junio (ANV).- En el marco de las gestiones para subsanar las deficiencias de personal de salud en el departamento de Chuquisaca, el director del Servicio Departamental de Salud (SEDES), Franco Calvimontes, y la alcaldesa del municipio de Camargo, Marcela Mendoza, informaron sobre la asignación y distribución de nuevos ítems médicos gestionados ante el Ministerio de Salud, así como la necesidad de coordinar técnicamente la designación de las jefaturas médicas locales para reestructurar el funcionamiento de los hospitales de la región. Franco Calvimontes explicó que, tras realizar un…

La Paz, 25 de junio (ANV).- El economista Gonzalo Colque advirtió que Bolivia arrastra una deuda superior a los 500 millones de dólares por la importación de gasolina y diésel realizada entre enero y mayo de este año, una situación que vincula directamente con la falta de divisas en el país y el generalizado desabastecimiento de combustibles. Según Colque, quien basó su análisis en datos de salida de divisas y en declaraciones recientes del ministro de Hidrocarburos, el Banco Central de Bolivia solo ha cubierto un 8% del valor importado…

La Paz, 25 de junio (ANV).- Dirigentes del transporte pesado y urbano de Cochabamba, La Paz y Santa Cruz denunciaron este jueves que la falta de combustible, especialmente diésel, se mantiene a pesar del levantamiento de los bloqueos que afectaron al país durante más de 50 días. Los conductores reportan filas que se extienden por varias cuadras y esperas de hasta 48 horas para abastecerse, lo que ha generado pérdidas económicas millonarias y el riesgo de nuevas medidas de presión. En Cochabamba, el dirigente del Transporte Pesado, Juan Quispe, cuestionó…

Agencia de Noticias Violeta | Celular 72441200",https://noticiasvioleta.com/categor%C3%ADas/nacional/
Radio Panamericana,2026-07-04,nacional,"Policía aprehende a Vicente Salazar, máximo dirigente de la federación ""Túpac Katari"", acusado de terrorismo por los 53 días de bloqueos","La Paz, 4 de julio de 2026 (Panamericana).– La advertencia lanzada recientemente por el Órgano Ejecutivo de no dejar en la impunidad el cerco carretero que paralizó al país parece haber comenzado a materializarse. La tarde de este sábado, efectivos de la Policía Boliviana, en una operación coordinada por la Dirección Nacional de Inteligencia (D.N.I.), aprehendieron a Vicente Salazar Limachi, secretario ejecutivo de la Federación Departamental Única de Trabajadores Campesinos de La Paz ""Túpac Katari"".

El operativo en Ciudad Satélite

De acuerdo con el reporte oficial del Ministerio de Gobierno emitido aproximadamente a las 18:00 horas del día 4 de julio del 2026, la intervención policial se ejecutó al promediar las 13:10 en la avenida Satélite, a la altura de la calle Diego de Portugal y en inmediaciones del Hospital Holandés, en la ciudad de El Alto.

Los agentes de Inteligencia interceptaron una camioneta Toyota Hilux de color blanco en la que se desplazaba el dirigente sindical. El parte oficial señala que, durante los primeros instantes de la intervención, Salazar opuso resistencia pasiva al cerrar las ventanas del motorizado, impidiendo momentáneamente el trabajo de los uniformados. Tras ser reducido y obligado a descender del vehículo, fue trasladado bajo fuerte resguardo hasta las dependencias de la Fuerza Especial de Lucha Contra el Crimen (FELCC) en la ciudad de La Paz.

Graves cargos penales tras la crisis

Las instancias jurisdiccionales identifican a Salazar como uno de los principales autores intelectuales y materiales en la organización y convocatoria de las medidas de presión extremas que mantuvieron aislada a la sede de Gobierno y otras regiones durante 53 días, provocando desabastecimiento de alimentos, combustibles y un severo daño a la economía nacional.

Por estos hechos, el dirigente se enfrenta a un abanico de graves delitos penales. El Ministerio Público lo investiga formalmente por instigación pública a delinquir, asociación delictuosa, terrorismo, y atentados contra la seguridad de los medios de transporte y de los servicios públicos . La figura de ""terrorismo"" se enmarca en la narrativa del Gobierno, que ha catalogado las tácticas de bloqueo y el uso de violencia durante el conflicto como actos destinados a subvertir el orden constitucional.

A pesar de la gravedad de los cargos, el Ministerio de Gobierno ha asegurado mediante un comunicado que se ha instruido un ""absoluto respeto a los derechos humanos y al debido proceso"" durante el desarrollo de las investigaciones y las próximas audiencias cautelares.

La captura de Vicente Salazar no es un hecho aislado. Se enmarca en la declaratoria del reciente Estado de Excepción con el que el Gobierno recuperó el control de las carreteras y marca el inicio de la judicialización de la protesta violenta.

Esta aprehensión ocurre apenas 24 horas después de que el presidente Rodrigo Paz Pereira, durante un encendido discurso en la Escuela de Cóndores de Sanandita, responsabilizara a los líderes radicales por la muerte de más de 20 personas en ambulancias varadas en los bloqueos. En ese acto, el primer mandatario exigió públicamente al Ministerio Público y a la justicia castigar a los culpables por los 53 días de daño causado, trazando una clara distinción entre la demanda social legítima y las acciones de ""conspiradores"".

Se espera que en las próximas horas se fije la fecha y hora para la audiencia de medidas cautelares, donde la Fiscalía definirá si solicita la detención preventiva del líder de los ""Túpac Katari"".",https://www.panamericana.bo/articulo/nacional/policia-aprehende-vicente-salazar-maximo-dirigente-federacion-tupac-katari-acusado-terrorismo-53-dias-bloqueos/20260704204402016406.html
