sitio_noticias,fecha,seccion,titular,cuerpo,url
Red Uno,2026-07-19,Deportes,¡Ya rueda la pelota! El gigante de Nueva Jersey recibe la final entre Argentina y España,"La Copa del Mundo de la FIFA 2026 ha llegado a su gran epílogo. Tras un mes de intensas batallas, emociones al límite y sorpresas históricas, el torneo deportivo más importante del planeta define a su campeón en el imponente estadio de Nueva York / Nueva Jersey, el colosal escenario elegido para albergar el choque final entre España y Argentina.

Este majestuoso recinto, que cuenta con una impresionante capacidad para 82 566 espectadores, se vestirá con sus mejores galas para un partido inédito, ya que tanto la Albiceleste como la Furia Roja pisarán por primera vez este terreno de juego en lo que va de la competición, jugándose el todo por el todo.

Un camino repleto de grandes batallas

Aunque para los dos finalistas este césped es territorio inexplorado, el coloso estadounidense ya ha sido testigo de momentos memorables a lo largo del certamen. Durante la fase de grupos, el estadio albergó cinco encuentros de alto calibre:

El electrizante empate entre Brasil y Marruecos .

La contundente victoria de Francia sobre Senegal .

El triunfo de Noruega ante los denominados Leones de Teranga .

La apasionante y sorpresiva victoria de Ecuador sobre Alemania .

La sólida conquista de Inglaterra ante Panamá .

Escenario de sorpresas en las eliminatorias

La intensidad aumentó en la fase de eliminación directa, donde el estadio ratificó su jerarquía mundialista. En los dieciseisavos de final, presenció el triunfo de Francia sobre Suecia por 3-0. Posteriormente, en los octavos de final, se convirtió en el escenario de uno de los grandes impactos del torneo: la eliminación de Brasil a manos de Noruega por 2-1.

Ahora, con el historial de grandes hazañas impregnado en sus tribunas, el gigante de Nueva Jersey se reporta listo para el último acto. España y Argentina saltan a la cancha con la historia en sus pies, listos para consagrar a un nuevo monarca en uno de los templos más imponentes del deporte moderno.

Mira la programación en Red Uno Play",https://www.reduno.com.bo/deportes/ya-rueda-la-pelota-el-gigante-de-nueva-jersey-recibe-la-final-entre-argentina-y-espana-202671915950
Red Uno,2026-07-19,Del ventarron al frio bolivia se prepara para un brusco cambio del clima 202671915459,Del ventarrón al frío: Bolivia se prepara para un brusco cambio del clima,"El Servicio Nacional de Meteorología e Hidrología (Senamhi) activó dos avisos de prioridad naranja debido a vientos moderados temporalmente fuertes de dirección noroeste que golpean al país. ""Está afectando principalmente al departamento de Santa Cruz con las velocidades entre 60 a 90 kilómetros por hora"", detalló la pronosticadora Jimena Pancata.

Esta condición climática dará un giro a mediados de semana debido al cambio en la dirección de las corrientes de aire.

Al respecto, Pancata señaló que ""este aviso queda vigente hasta el día martes y ya por la tarde tenemos flujo sur, es decir, que el día miércoles probablemente tenemos un ingreso de frente frío, que estaría causando descenso de temperaturas y también inestabilidad atmosférica en la parte norte integral de Santa Cruz, también el Trópico, la parte del sur de Beni y los Yungas"".

Heladas y el impacto de El Niño

Por otro lado, el occidente boliviano cumplió un ciclo de ráfagas intensas, mientras que el comportamiento global del clima muestra indicadores preocupantes. ""Respecto al occidente también tenemos un aviso, igual por vientos, pero es hasta el día de hoy; en el altiplano, sigue con heladas por la madrugada. Actualmente estamos ya en el fenómeno del niño, estamos con valores de 1.3, se prevé que para el último trimestre de este año tengamos un ingreso, estamos en el fenómeno más fuerte"", concluyó la experta.

Mira la programación en Red Uno Play",https://www.reduno.com.bo/noticias/del-ventarron-al-frio-bolivia-se-prepara-para-un-brusco-cambio-del-clima-202671915459
Red Uno,2026-07-19,Deportes,La Scaloneta va por la eternidad: Argentina busca el bicampeonato y su cuarta estrella,"La ilusión del bicampeonato late con fuerza en el corazón de millones de argentinos. La selección albiceleste está a solo un paso de alcanzar la gloria eterna y bordar su cuarta estrella en el escudo en una nueva final de la Copa del Mundo. En la previa del crucial encuentro en Nueva York, el director técnico Lionel Scaloni y el arquero Emiliano Martínez compartieron sus sensaciones, reflejando la mentalidad de un grupo que juega por el orgullo de toda una nación.

Al analizar al rival, Scaloni señaló que existe un patrón claro entre ambas selecciones: tanto Argentina como España basan su juego en el dominio absoluto del balón. Sin embargo, el estratega confía plenamente en las armas de su equipo y reveló la fórmula mental para afrontar la presión del partido más importante del año.

""Pensamos que es un partido, no nos ponemos en la cabeza que es una final del mundo porque si no te puedes desviar la atención. Al final lo preparamos al máximo como todos los partidos y después ya veremos qué pasa. La selección argentina juega por su gente, por su país, por su familia, por esa gente que está esperando ver a la selección"" , afirmó el DT en la conferencia de prensa.

La identidad de un plantel humilde y trabajador

Más allá de la pizarra táctica, si algo ha caracterizado a este ciclo es el compromiso inquebrantable y el espíritu de sacrificio de sus futbolistas. Esta identidad no es casualidad; responde a las raíces y a la esencia del pueblo que representan, tal como lo describió con emoción el portero Emiliano ""Dibu"" Martínez.

""Los chicos que están hoy en día, desde que yo estoy en la selección, vienen de familias bajas, de padres trabajadores como todo argentino, que tienen que trabajar el hombre y la mujer. Quiero que nos recuerden como cualquier argentino: que somos trabajadores, que nunca nos damos por vencidos y que, aunque las cosas nos cuesten, siempre salimos adelante como lo estamos viviendo en este mundial"" , sentenció el guardameta.

Con la humildad de sus orígenes y el fútbol que los llevó a la cima del planeta, la vigencia de la campeona del mundo se pondrá a prueba esta tarde en los Estados Unidos, decidida a escribir otra página dorada en la historia del fútbol internacional.

Mira la programación en Red Uno Play",https://www.reduno.com.bo/deportes/la-scaloneta-va-por-la-eternidad-argentina-busca-el-bicampeonato-y-su-cuarta-estrella-20267191521
Red Uno,2026-07-19,Deportes,Kempes e Iniesta presentan la Copa del Mundo en una emotiva ceremonia antes de la final,"La gran final del Mundial 2026 comenzó a vivirse con una ceremonia inolvidable en el MetLife Stadium de Nueva Jersey. Las leyendas Mario Alberto Kempes , campeón del mundo con Argentina en 1978, y Andrés Iniesta , autor del gol que le dio a España su único título mundial en 2010, fueron los encargados de presentar la Copa del Mundo ante miles de espectadores.

En medio de un espectáculo cargado de música, luces y efectos especiales, el trofeo hizo su ingreso al campo de juego acompañado por dos de los futbolistas más emblemáticos de la historia de ambos países finalistas.

El primero en tomar la Copa del Mundo fue Andrés Iniesta , quien la levantó entre los aplausos de los aficionados españoles presentes en el estadio. Instantes después, el trofeo pasó a manos de Mario Alberto Kempes , desatando una nueva ovación de los seguidores argentinos que sueñan con ver nuevamente a la Albiceleste en lo más alto del fútbol mundial.

La presencia de ambos campeones simbolizó el legado y la grandeza de dos selecciones que buscan escribir un nuevo capítulo en la historia de la Copa del Mundo. Tras la presentación del trofeo, la copa fue ubicada junto al campo de juego, donde espera al nuevo campeón que se coronará al término del encuentro entre Argentina y España.

La ceremonia elevó aún más la expectativa de los miles de aficionados presentes en el MetLife Stadium y de millones de espectadores alrededor del mundo, que aguardan el inicio de una final que promete quedar en la historia del fútbol.

Mira la programación en Red Uno Play",https://www.reduno.com.bo/deportes/kempes-e-iniesta-presentan-la-copa-del-mundo-en-una-emotiva-ceremonia-antes-de-la-final-2026719145648
Red Uno,2026-07-19,Deportes,"Robbie Williams, Laura Pausini y Nicole Scherzinger encienden la clausura mundialista","Minutos antes de que rodara el balón en el partido más esperado del planeta, el MetLife Stadium se convirtió en un gigantesco escenario musical. En la previa de la gran final del Mundial, los reconocidos artistas Robbie Williams, Laura Pausini y Nicole Scherzinger unieron sus voces para interpretar en directo ""Desire"", el himno oficial de la FIFA, desatando la euforia de los miles de fanáticos presentes en el recinto.

Este espectacular estreno global se dio en el marco de la ceremonia de clausura de la Copa del Mundo 2026, celebrada este domingo 19 de julio, sirviendo como el preámbulo perfecto para el choque futbolístico.

La historia de este éxito musical comenzó a gestarse en junio de 2025, cuando el cantante inglés Robbie Williams fue elegido oficialmente como Embajador Musical de la FIFA. Poco después, lanzó la primera versión de “Desire” junto a la italiana Laura Pausini, convirtiéndose de inmediato en el primer himno oficial respaldado por el órgano rector del fútbol mundial.

Sin embargo, para la gran cita del domingo, Williams decidió elevar la apuesta con una renovación total del tema. Mientras que la entrega original solo contaba con su voz y la de Pausini, para este gran cierre sumaron el talento y la potencia de la exintegrante de las Pussycat Dolls, Nicole Scherzinger.

El dato: Los tres artistas interpretaron esta renovada versión juntos en directo por primera vez en la ceremonia de clausura, logrando una fusión perfecta que unió el pop británico, la emotividad italiana y el ritmo estadounidense.

Con una puesta en escena imponente, efectos visuales de última generación y la energía de las tres superestrellas, el show previo de la Copa del Mundo 2026 cumplió con creces las expectativas, dejando el ambiente encendido para el inicio del partido definitivo.

Mira la programación en Red Uno Play",https://www.reduno.com.bo/deportes/robbie-williams-laura-pausini-y-nicole-scherzinger-encienden-la-clausura-mundialista-2026719145535
Red Uno,2026-07-19,Deportes,Rodri lanza la advertencia: “Quien controle el medio tendrá más opciones”,"La mesa está servida para el partido más importante del año. España se encuentra a las puertas de una hazaña histórica: buscará bordar su segunda estrella mundialista en el pecho frente a la vigente campeona del mundo, Argentina. En la antesala de este vibrante choque, los protagonistas de la Furia Roja comparecieron ante los medios en la Gran Manzana, dejando en claro que la final se definirá por detalles mínimos y por el control de una zona clave: el medio sector.

Durante la conferencia de prensa oficial de los finalistas de la Copa del Mundo, celebrada en Nueva York, el director técnico de España, Luis de la Fuente, analizó la paridad del encuentro y llenó de elogios el trabajo de su colega en el banquillo albiceleste.

""Tanto Lionel Scaloni como yo, coincidimos en muchos conceptos, en valores, en ciertos principios, que son los que mueven a estos equipos, tanto al suyo como al mío. Entonces, en eso tenemos mucha similitud. Y entonces, al final, en esa igualdad, pues hay que intentar ganar por detalles, por ser cada vez más fieles a nuestra idea"" , afirmó De la Fuente ante los medios internacionales.

La batalla por el control del juego

Más allá de las pizarras de los entrenadores, las miradas expertas apuntan a que el destino de la Copa del Mundo se decidirá en la sala de máquinas de ambos conjuntos. La batalla futbolística se centrará con fuerza en el medio sector del campo de juego, una teoría que comparte uno de los máximos referentes del seleccionado español, Rodri Hernández.

El mediocampista ibérico no ocultó la enorme responsabilidad que recaerá sobre sus hombros y los de sus compañeros en esa zona del terreno.

""Creo firmemente en la importancia de la figura del medio centro y del centro del campo para llevar a los equipos a ganar. Creo que el fútbol de los equipos pasa por ahí, y más en el fútbol moderno. Ellos tienen un gran centro del campo, nosotros también. Así que será una batalla importante. No creo que sea definitorio, pero sí que el que salga con el control tendrá más opciones"" , sentenció Rodri.

Con dos propuestas que apuestan por la posesión, el equilibrio y la fidelidad a sus respectivos estilos, España y Argentina prometen un espectáculo táctico de alto nivel. La mesa está lista en Nueva York, donde la gloria eterna espera al equipo que logre imponer sus condiciones en el corazón de la cancha.

Mira la programación en Red Uno Play",https://www.reduno.com.bo/deportes/rodri-lanza-la-advertencia-quien-controle-el-medio-tendra-mas-opciones-2026719144228
Red Uno,2026-07-19,Alerta en santa cruz fuego provocado en porongo activa respuesta departamental 2026719143712,Alerta en Santa Cruz: fuego provocado en Porongo activa respuesta departamental,"A raíz de los múltiples incendios desatados en Santa Cruz, la Gobernación cruceña se pronunció detallando la situación en cada caso.

Al respecto, el vocero departamental Rolando Schrupp denunció que “tenemos un incendio que ha sido provocado en el municipio de Porongo, en la zona de Techo 2, y un nuevo incendio también en Porongo, por la zona del gasoducto, que lo estamos siguiendo con el mismo protocolo”.

Este atentado ecológico se ejecutó violando de forma flagrante la prohibición vigente por condiciones climáticas extremas y ráfagas de viento peligrosas.

Ante esta situación, Schrupp advirtió que “hemos emitido la alerta roja por los fuertes vientos de 90 a 120 kilómetros por hora, lo cual quiere decir que no se debía haber empezado a hacer ningún tipo de quema; es una irresponsabilidad absoluta y que tendrá las consecuencias durante esta semana con la emisión de los informes legales”.

El panorama general del departamento se complica con un incendio de magnitud en Otuquis que se originó en territorio brasileño y ya ha arrasado miles de hectáreas de pastizales. “Otuquis al momento tiene una superficie afectada de 2.538 hectáreas, este incendio empieza en el lado del Brasil y por los fuertes vientos de norte cruza la frontera”, detalló la autoridad sobre el avance del fuego.

Monitoreo técnico y activación de comandos

El mapa de contingencia se completa con tareas de patrullaje en el kilómetro 50 de Pailón y el seguimiento a un foco de calor detectado en el municipio de San Matías. Con el fin de mitigar los daños y centralizar la logística, Schrupp concluyó: “Por eso estamos activando el Comando de emergencias departamentales este lunes para toda la articulación, inventariado y protocolo"".

Mira la programación en Red Uno Play",https://www.reduno.com.bo/noticias/alerta-en-santa-cruz-fuego-provocado-en-porongo-activa-respuesta-departamental-2026719143712
Red Uno,2026-07-19,vian a palmasola a dos investigados por el feminicidio de una mujer en santa cruz 2026719215438,Envían a Palmasola a dos investigados por el feminicidio de una mujer en Santa Cruz,"Tras la audiencia de medidas cautelares celebrada hoy, la justicia determinó enviar a la cárcel con detención preventiva a dos de las tres personas aprehendidas por el asesinato de una mujer de 46 años en Santa Cruz. La Fiscalía ha tipificado el caso oficialmente como delito de feminicidio , tras colectar suficientes elementos indiciarios que comprometen a los acusados.

Seis meses de reclusión en Palmasola

El fiscal de materia, Alejandro Justiniano, informó que el Ministerio Público fundamentó la existencia del hecho y los riesgos procesales ante la autoridad jurisdiccional, logrando una medida severa para los principales implicados.

""Se ha optado por la tipificación del delito de feminicidio en el cual se han reunido los elementos indiciarios que acreditan la existencia del hecho y la participación de ambos imputados en él. De ser evidente se ha fundamentado los riesgos procesales tanto de peligro de fuga como de obstaculización y se ha solicitado y se ha ordenado la detención preventiva por 180 días en el penal de Palmasola "", detalló la autoridad fiscal.

Un crimen por encargo motivado por dinero

De acuerdo con el avance de las investigaciones, la víctima falleció a causa de un disparo de arma de fuego a la altura de la cabeza . Las indagaciones apuntan a que los móviles del crimen son estrictamente económicos y apuntan al entorno más cercano de la víctima.

El principal autor intelectual ha sido identificado como el esposo de la mujer , quien contrató a terceras personas para acabar con su vida a cambio de una fuerte suma de dinero.

El pago por el crimen: El cónyuge de la víctima ofreció y pagó cerca de 50.000 bolivianos a los sicarios.

Declaraciones clave: Testigos clave informaron a las autoridades que, días antes del crimen, el sospechoso buscaba activamente a personas para realizar un ""trabajito"".

El objetivo: ""Evidentemente ese es el fin, eso es lo que las investigaciones arrojan, de que se quería pagar un dinero por hacer desaparecer a la víctima"", complementó el fiscal Justiniano.

La policía y el Ministerio Público continúan investigando el grado de participación de una tercera persona aprehendida en este hecho que consterna a la población cruceña.

Mira la programación en Red Uno Play",https://www.reduno.com.bo/noticias/envian-a-palmasola-a-dos-investigados-por-el-feminicidio-de-una-mujer-en-santa-cruz-2026719215438
Red Uno,2026-07-19,Internacional,Un menor de 13 años fallece durante las celebraciones mundialistas en España,"Los festejos por la conquista del Mundial 2026 terminaron en tragedia en la localidad española de Ciudad Rodrigo, provincia de Salamanca, después de que una fuente se derrumbara sobre varias personas que celebraban el título conseguido por la selección española.

El incidente ocurrió a las 00:33 de la madrugada de este lunes en la Glorieta del Árbol Gordo, uno de los puntos tradicionales de reunión para las celebraciones deportivas de la localidad. La sala de operaciones del servicio de emergencias 1-1-2 de Castilla y León recibió varias llamadas que alertaban del colapso de la estructura.

Un menor perdió la vida

Los equipos sanitarios atendieron a dos personas afectadas por el derrumbe y las trasladaron hasta el centro de salud de Ciudad Rodrigo.

Una de las víctimas falleció posteriormente en el establecimiento sanitario. Aunque el primer reporte de emergencias no reveló información sobre su identidad, una actualización publicada por un medio local confirmó que se trataba de un menor de 13 años.

La otra persona sufrió una fractura en una pierna, según la información conocida después del accidente. No se difundieron más detalles sobre su identidad ni sobre su evolución médica.

Amplio despliegue de emergencia

Después de recibir las llamadas de auxilio, el 1-1-2 movilizó a la Policía Local de Ciudad Rodrigo, la Guardia Civil de Salamanca, los Bomberos de la Diputación y Emergencias Sanitarias-Sacyl.

Los equipos acudieron al lugar para auxiliar a las personas afectadas, asegurar el área y evitar nuevos riesgos alrededor de la infraestructura derrumbada.

Las autoridades también activaron al Grupo de Intervención Psicológica en Desastres y Emergencias para acompañar y prestar apoyo especializado a los familiares de la víctima.

Celebraban el título mundial de España

En la glorieta se había concentrado un grupo de aficionados para celebrar la victoria de la selección española en la final del Mundial.

La fuente del Árbol Gordo es conocida como uno de los espacios utilizados habitualmente por los vecinos de Ciudad Rodrigo para festejar triunfos deportivos. En 2024 también recibió a numerosos aficionados después de la conquista española de la Eurocopa.

La celebración se desarrollaba durante la madrugada cuando la estructura colapsó sobre las personas que se encontraban reunidas a su alrededor.

No se conocen todavía las causas

Las autoridades no comunicaron de manera oficial qué provocó el derrumbe ni si las personas afectadas estaban sobre la fuente o situadas alrededor de ella.

Tampoco se informó inicialmente sobre posibles daños anteriores en la estructura, la cantidad de personas que se encontraban en el lugar o si existían restricciones para acceder a la fuente durante la celebración.

Estos elementos deberán ser establecidos mediante la inspección de la infraestructura, las declaraciones de los testigos y la revisión de las imágenes que pudieran haberse registrado durante el festejo.

Una noche de alegría marcada por el luto

Mientras miles de aficionados celebraban en diferentes ciudades el segundo título mundial de España, Ciudad Rodrigo quedó conmocionada por la muerte del menor.

La euforia se transformó en una emergencia en cuestión de segundos. Bomberos, policías y sanitarios ocuparon el lugar en el que poco antes se escuchaban cánticos por la victoria de La Roja.

La investigación deberá determinar por qué colapsó la fuente y si existían condiciones que pudieran haber permitido anticipar el peligro.

Por el momento, la celebración mundialista deja en esta localidad salmantina un saldo doloroso: un menor de 13 años fallecido, una persona herida y una familia que recibe asistencia psicológica después de una noche que terminó en tragedia.

Mira la programación en Red Uno Play",https://www.reduno.com.bo/internacional/un-menor-de-13-anos-fallece-durante-las-celebraciones-mundialistas-en-espana-2026719215259
Red Uno,2026-07-19,Investigan la muerte de un trabajador dentro de un circo en santa cruz 2026719213845,Investigan la muerte de un trabajador dentro de un circo en Santa Cruz,"La Fuerza Especial de Lucha contra el Crimen (Felcc) y el Ministerio Público han iniciado una investigación tras el hallazgo del cuerpo sin vida de un hombre en el interior de un circo, ubicado en la zona norte de la capital cruceña. El caso se encuentra bajo la tipificación provisional de ""muerte de persona"".

El lamentable hecho movilizó este domingo al personal de la división Homicidios de la Felcc, que se trasladó hasta las instalaciones del circo para realizar el levantamiento legal del cadáver. De acuerdo con los primeros informes, la víctima es un hombre de entre 30 y 35 años de edad .

Tras los procedimientos de rigor en el lugar, los restos fueron trasladados a la morgue judicial de La Pampa de la Isla , donde se le practicará la autopsia de ley para determinar con precisión científica las causas del fallecimiento.

Hipótesis: Posible descarga eléctrica por vientos fuertes

Datos extraoficiales apuntan a que el fallecido era un trabajador del circo que se encontraba realizando labores de mantenimiento o reparaciones en el sistema eléctrico del recinto.

Se presume que las fuertes ráfagas de viento registradas este domingo en Santa Cruz provocaron que la víctima entrara en contacto accidental con un cable de alta tensión expuesto en el interior de las instalaciones.

Esta hipótesis será confirmada o descartada en las próximas horas por las autoridades, una vez que el médico forense emita el dictamen oficial y se colecten los indicios en la escena. La Fiscalía y la policía continúan tomando declaraciones para esclarecer las circunstancias exactas de esta tragedia.

Mira la programación en Red Uno Play",https://www.reduno.com.bo/noticias/investigan-la-muerte-de-un-trabajador-dentro-de-un-circo-en-santa-cruz-2026719213845
