sitio_noticias,fecha,seccion,titular,cuerpo,url
Red Uno,2026-06-16,Organizaciones campesinas envian demandas para iniciar dialogo con el gobierno 2026616194115,Organizaciones campesinas envían demandas para iniciar diálogo con el gobierno,"Las organizaciones en el día 47 de bloqueos en el departamento de La Paz, enviaron una carta al presidente Rodrigo Paz en la que piden atender demandas vinculadas a combustibles, obligaciones financieras y decretos supremos. Sus planteamientos son presentados como requisito para avanzar en una mesa de diálogo.

La Federación Departamental Única de Trabajadores Campesinos Túpac Katari y la organización Bartolina Sisa enviaron una carta al presidente Rodrigo Paz, en la que plantean una serie de condiciones para instalar un diálogo con el Gobierno y buscar una salida al conflicto que atraviesa el país.

Entre los principales pedidos, las organizaciones solicitan la creación de una comisión que verifique la calidad del combustible importado, además de la anulación de contratos con proveedores que no cumplan con los estándares técnicos establecidos.

También plantean una compensación económica para los sectores afectados por daños ocasionados a vehículos y maquinaria, en medio de las denuncias por presuntos problemas en la calidad de los carburantes.

Petición en sistema financiero

Otro de los puntos expuestos es el congelamiento temporal de intereses y cargos por mora en obligaciones financieras, medida que estaría dirigida a distintos sectores productivos y sociales afectados por la actual coyuntura.

Las organizaciones también exigen la abrogación de varios decretos supremos que, según consideran, afectan a los sectores populares y son contrarios a la Constitución Política del Estado.

Estos planteamientos fueron presentados como condiciones para concretar un encuentro con el mandatario y avanzar en una mesa de diálogo destinada a abordar la situación nacional.

El pedido se da en medio de la conflictividad que afecta al país, donde distintos sectores sociales exigen respuestas del Gobierno y una salida pacífica a las medidas de presión.

Mira la programación en Red Uno Play",https://www.reduno.com.bo/noticias/organizaciones-campesinas-envian-demandas-para-iniciar-dialogo-con-el-gobierno-2026616194115
Red Uno,2026-06-16,Este es el pliego petitorio que la cob envio al gobierno para buscar la pacificacion del pais 2026616192144,Este es el pliego petitorio que la COB envió al Gobierno para buscar la pacificación del país,"Tras 47 días de conflictos y bloqueos, la Central Obrera Boliviana conminó al Gobierno a instalar un Gran Diálogo Nacional. El documento plantea ocho ejes centrales para pacificar el país y atender demandas sociales, económicas, laborales y políticas.

La Central Obrera Boliviana (COB) envió al Gobierno nacional una conminatoria y un planteamiento para buscar la pacificación y recuperación del país, en medio de 47 días de conflictos y bloqueos que afectan a diferentes regiones de Bolivia.

El documento, denominado “Agenda mínima para un Gran Diálogo Nacional”, plantea la instalación inmediata de una mesa de diálogo con participación del presidente Rodrigo Paz, y distintas instituciones nacionales.

Puntos del pliego

El primer punto del pliego está referido a derechos humanos, garantías orgánicas y pacificación. La COB rechaza la criminalización de la protesta, cuestiona los proyectos de ley antibloqueos y exige suspender, abrogar o archivar toda norma que restrinja de manera desproporcionada el derecho a la movilización.

El segundo eje plantea el cumplimiento de compromisos y control social. En este punto, la COB pide que la Asamblea Legislativa trate con prioridad un proyecto de ley para exigir el cumplimiento estricto de los programas de gobierno y propuestas de gestión pública de autoridades electas, como presidente, vicepresidente, gobernadores y alcaldes.

En el tercer punto, la Central Obrera Boliviana plantea la defensa de la soberanía económica y de las empresas públicas. El documento rechaza cualquier privatización, capitalización, concesión encubierta o entrega directa o indirecta de empresas estratégicas a intereses privados nacionales o extranjeros.

El cuarto eje está vinculado a transparencia, fiscalización e investigación soberana. La COB pide conformar una comisión especial mixta en la Asamblea Legislativa para investigar los casos denominados “narcomaderas” y “narcomaletas”, con el objetivo de establecer fallas de control estatal y posibles redes de corrupción.

En el quinto punto, referido a hidrocarburos, la COB exige estabilidad en los precios de los combustibles de consumo nacional. También plantea una compensación para los afectados por carburantes defectuosos y una auditoría técnica sobre la importación, almacenamiento y control de calidad de los combustibles.

El sexto eje plantea la socialización legislativa y la democracia participativa. La COB pide que antes de aprobar leyes, decretos supremos o medidas macroeconómicas, estas sean socializadas de manera obligatoria con sectores afectados, organizaciones sociales, trabajadores, juntas vecinales y pueblos indígena originarios campesinos.

El séptimo punto está relacionado con la canasta familiar, derechos laborales y seguridad social. La Central Obrera demanda medidas urgentes para proteger el bolsillo popular, frenar la especulación, controlar el incremento de precios, garantizar el salario real y preservar el empleo estable.

Finalmente, el octavo eje aborda medioambiente y política internacional pacifista. La COB plantea la protección de áreas protegidas y rechaza el uso de parques nacionales o reservas naturales para explotación minera, petrolera o cualquier otra actividad considerada destructiva.

En su declaración final, la Central Obrera Boliviana sostiene que la paz social en Bolivia no se logrará mediante la imposición, la estigmatización o la persecución jurídica, sino a través de un diálogo real, transparente, con actores legítimos en la mesa y con voluntad política para cumplir los compromisos asumidos ante el pueblo.

Mira la programación en Red Uno Play",https://www.reduno.com.bo/noticias/este-es-el-pliego-petitorio-que-la-cob-envio-al-gobierno-para-buscar-la-pacificacion-del-pais-2026616192144
Red Uno,2026-06-16,Tendencias,¿Real o IA? El escalofriante video de una muñeca que se mueve sola desata el pánico en las redes,"Un inquietante video grabado en un mercado callejero de México ha levantado polémica en el entorno digital tras mostrar a un juguete que se mueve de forma inexplicable. Las plataformas TikTok y X se inundaron de reacciones ante el material audiovisual que expone una situación aparentemente de otro mundo.

A primera vista, el objeto de cabello negro y vestimenta roja reposa completamente inerte sobre un tablón de ventas junto a mercancía común. No obstante, al momento en que el lente de la cámara se fija en ella, la figura eleva el rostro paulatinamente hasta clavar una mirada siniestra y una mueca perturbadora.

Debate entre la edición y lo paranormal

La velocidad con la que se propagó el contenido lo posicionó de inmediato entre las principales tendencias globales de la jornada. Miles de internautas manifestaron su profunda incomodidad y temor ante el realismo de las imágenes que circulan en la red.

Mientras un sector de la audiencia busca fundamentos técnicos basados en la manipulación digital o efectos visuales sofisticados, otros sugieren que se trata de una manifestación sobrenatural genuina. La falta de consenso mantiene el video bajo el escrutinio público, alimentando el eterno mito de los objetos 'malditos' en la era moderna.

Mira la programación en Red Uno Play",https://www.reduno.com.bo/tendencias/real-o-ia-el-escalofriante-video-de-una-muneca-que-se-mueve-sola-desata-el-panico-en-las-redes-202661619026
Red Uno,2026-06-16,Deportes,Argentina debuta ante Argelia y lo vivirás por las pantallas de Red Uno,"En el estadio Kansas City, Argentina espera por Argelia desde las 22:00 (hora Argentina), para disputar el encuentro correspondiente por la fecha 1 del grupo J del Mundial.

El duelo que inaugura el Grupo J tendrá un condimento especial en los bancos: Vladimir Petković y Lionel Scaloni vuelven a cruzarse tras compartir etapa en la Lazio, donde el técnico de Argelia dirigió al actual seleccionador argentino.

Argentina llega al Mundial 2026 como la vigente campeona y será su decimonovena edición en el torneo. Encadena 14 presencias consecutivas y en 13 de ellas logró superar la fase de grupos, con la eliminación en 2002 como única excepción.

La Albiceleste levantó el máximo trofeo en 1978, 1986 y 2022 y va por un desafío de dimensiones históricas: revalidar el título de forma consecutiva, una hazaña que sólo Italia y Brasil han conseguido.

Argelia, por su parte, regresa a la máxima cita tras 12 años de ausencia y disputará su quinta Copa del Mundo (1982, 1986, 2010, 2014 y 2026).

La mejor actuación del conjunto africano se dio en su última participación, en Brasil 2014, cuando alcanzó los octavos de final y llevó a Alemania a la prórroga en un duelo que quedó en su historia.

Argentina y Argelia protagonizarán un choque inédito en Mundiales. Su único antecedente se remonta a un amistoso en 2007, cuando la Albiceleste se impuso por 4-3 en Barcelona. Ambos integran el Grupo J junto a Austria y Jordania.

El encargado de impartir justicia en el partido será Szymon Marciniak.

Mira la programación en Red Uno Play",https://www.reduno.com.bo/deportes/argentina-debuta-ante-argelia-y-lo-viviras-por-las-pantallas-de-red-uno-2026616184752
Red Uno,2026-06-16,Canciller senala que el gobierno asistira al dialogo de la cob pero pide que sea sin condiciones 2026616183334,"Canciller señala que el Gobierno asistirá al diálogo de la COB, pero pide que sea sin condiciones","El canciller de Bolivia, Fernando Aramayo, se refirió al llamado al diálogo realizado por la Central Obrera Boliviana (COB) y aseguró que el Gobierno nacional está dispuesto a participar en cualquier escenario que permita resolver el conflicto que atraviesa el país.

La autoridad señaló que el Ejecutivo valora que se abra una posibilidad de diálogo y consideró que este momento puede representar una señal de “madurez política y democrática” en medio de la coyuntura nacional.

“Felicitamos que estemos frente a un momento en el que empezamos a ver que se empieza a actuar con madurez política y democrática”, afirmó Aramayo.

El canciller sostuvo que, desde el inicio de las movilizaciones, el Gobierno insistió en que el diálogo debe ser el mecanismo para resolver contradicciones y atender las demandas sociales.

“Este Gobierno, desde el día cero de las movilizaciones en este país, ha insistido de manera enfática en hacer del diálogo el mecanismo para poder resolver contradicciones, para poder atender demanda social”, señaló

Aramayo recordó que el Ejecutivo fue cuestionado por mantener abierta la vía del diálogo y no optar por medidas de fuerza frente a los bloqueos.

“Ustedes son testigos que incluso nos han tildado de débiles al momento de insistir en el diálogo de manera permanente”, manifestó.

La autoridad indicó que el presidente Rodrigo Paz y sus ministros asistieron a diferentes espacios de conversación con sectores sociales cuando fueron convocados. Sin embargo, denunció que, como respuesta, el Gobierno recibió “chantaje, violencia y amedrentamiento”.

“El presidente Rodrigo Paz ha atendido cuanto espacio de diálogo se le ha planteado. Al lugar al que se le ha invitado asistir a él y a sus ministros se ha ido con vocación dialógica”, sostuvo.

Sin condiciones

El canciller remarcó que el Gobierno acudirá al diálogo convocado por la COB, pero pidió que este sea honesto, transparente, realista y centrado en las demandas sociales.

“Qué bueno que la COB esté llamando a un diálogo, el Gobierno va a asistir naturalmente, pero que sea un diálogo honesto, transparente, realista”, afirmó.

Aramayo también sostuvo que el diálogo no debe estar condicionado únicamente a la presencia del presidente, sino que deben participar los ministros responsables de cada área, debido a que las demandas involucran diferentes competencias del Estado.

“No solamente como muchas veces se plantea: si no está el presidente, no diálogo. Tienen que estar los ministros de Estado porque hay responsabilidades en cada cartera”, explicó.

Mira la programación en Red Uno Play",https://www.reduno.com.bo/noticias/canciller-senala-que-el-gobierno-asistira-al-dialogo-de-la-cob-pero-pide-que-sea-sin-condiciones-2026616183334
Red Uno,2026-06-16,Internacional,Chile destruye un puente clandestino construido sobre la zanja fronteriza con Bolivia en Colchane,"Las autoridades chilenas derribaron este martes un puente clandestino que se había construido para saltar una zanja en la frontera norte, que había sido creada por el Gobierno de José Antonio Kast para tratar de frenar la migración irregular.

""Es algo que esperábamos desde un comienzo. Se han construido kilómetros y kilómetros de zanja que dificultan el contrabando y tráfico y, por supuesto, es un negocio muy lucrativo. Era esperable una reacción y no es la primera vez que pasa"", dijo en declaraciones a los periodistas el ministro de Seguridad, Martín Arrau.

La imagen de una retroexcavadora derribando el puente levantado de manera clandestina para sortear la franja de tres metros de profundidad se hizo viral en redes sociales.

Según las autoridades, el puente fue construido con sacos de arena y piedras y estaba ubicado en la zona de Colchane, en la frontera con Bolivia.

""Estamos aumentando los niveles de vigilancia en términos generales. Esto es una batalla constante en cuanto a poner orden en nuestras fronteras"", agregó Arrau.

La construcción de zanjas en la frontera con Perú y Bolivia fue una de las principales promesas de campaña del líder ultraderechista , junto con la expulsión masiva de inmigrantes irregulares.

Pocos días después de asumir el cargo, en marzo pasado, Kast se trasladó al norte para supervisar la construcción de zanjas y lanzar oficialmente su controvertido ""Plan de Escudo Fronterizo"", que contempla también la instalación de vallas de 5 metros de altura, cercos perimetrales electrificados y torres de vigilancia.

EFE

Mira la programación en Red Uno Play",https://www.reduno.com.bo/internacional/chile-destruye-un-puente-clandestino-construido-sobre-la-zanja-fronteriza-con-bolivia-en-colchane-2026616182813
Red Uno,2026-06-16,Economia,El costo del bloqueo en Bolivia: Cainco exige liberar las rutas tras 47 días de parálisis económica,"A 47 días de un bloqueo que mantiene paralizadas las principales rutas del país, la Cámara de Industria y Comercio, Servicios y Turismo de Santa Cruz (Cainco) emitió una postura institucional sobre el impacto de la crisis. La entidad empresarial denunció el cierre de pequeñas empresas, inversiones frenadas en seco y cadenas logísticas colapsadas que asfixian directamente a las familias bolivianas.

El impacto en el sector productivo

La organización lamentó profundamente la pérdida de cosechas y el severo daño al capital de quienes asumieron el riesgo de emprender en territorio nacional.

De acuerdo con el pronunciamiento, los corredores humanitarios fracasaron debido a una ""ideología política que antepone sus beneficios a costa del desarrollo del país"".

Frente a un escenario de desabastecimiento e interrupción de la carga, la institución aclaró que las empresas enfrentan una condición de fuerza mayor que requiere respaldo legal y flexibilidad inmediata.

""Cada día que la plena normalidad se posterga suma una factura que hoy pagan miles de familias bolivianas y sus empresas"", sentenció el comunicado de la organización.

Rutas abiertas para el futuro

La prioridad absoluta para el sector privado radica en desbloquear de forma definitiva las carreteras para garantizar el derecho a la libre transitabilidad de medicamentos, alimentos y suministros.

El documento concluye advirtiendo que ""no habrá abastecimiento sin combustible, no habrá empleo sin producción y no habrá futuro mientras trabajar sea una carrera de obstáculos"".

Mira la programación en Red Uno Play",https://www.reduno.com.bo/economia/el-costo-del-bloqueo-en-bolivia-cainco-exige-liberar-las-rutas-tras-47-dias-de-paralisis-economica-202661618201
Red Uno,2026-06-16,El alto recibira inversion para enlosetados vias salud y educacion 2026616181755,"El Alto recibirá inversión para enlosetados, vías, salud y educación","El presidente Rodrigo Paz informó que, tras la primera evaluación del acuerdo firmado la semana pasada con la Alcaldía de El Alto, se identificaron proyectos por más de Bs 217 millones para obras destinadas a diferentes distritos de esa ciudad.

El mandatario explicó que, luego del acuerdo alcanzado con el alcalde alteño, se conformó una comisión especial de obras para hacer seguimiento a las demandas priorizadas por el municipio y coordinar acciones con diferentes instancias del Gobierno.

“La semana pasada, cuando se cerró el acuerdo con el señor alcalde para poder trabajar por la ciudad de El Alto, se creó una comisión especial de obras. Esa comisión ha venido trabajando sobre diferentes temáticas y hoy es la primera reunión para generar una primera evaluación”, señaló Paz.

Inversión millonaria

De acuerdo con el presidente, la primera evaluación permitió establecer una cartera de proyectos que supera los Bs 217 millones, aunque posteriormente precisó que, con otras obras incorporadas, el monto podría elevarse por encima de los Bs 260 millones.

“Son 217 millones de bolivianos trabajándose en diferentes proyectos”, afirmó.

Paz detalló que cerca de Bs 134 millones serán destinados a enlosetados en diferentes barrios de El Alto, con 34 proyectos iniciales y otros 13 adicionales que fueron incorporados en la evaluación técnica.

“Se van a establecer cerca de 134 millones de bolivianos en losetas para diferentes barrios de la ciudad”, indicó.

En el área social, Paz informó que se evaluaron proyectos de infraestructura educativa, tinglados deportivos, obras de salud, la habilitación de una planta de oxígeno y un nuevo diseño de atención sanitaria para El Alto.

También anunció un proyecto de alcantarillado en el Distrito 7, con una inversión cercana a Bs 38 millones.

“Estamos con el proyecto de alcantarillado en el Distrito 7, que es una inversión de cerca de 38 millones de bolivianos”, precisó.

Educación

En educación, el mandatario recordó la instalación de 300 antenas Starlink para unidades educativas, con el objetivo de mejorar la conectividad de los estudiantes y agilizar el trabajo educativo. El acuerdo previo entre el Gobierno y sectores alteños también contemplaba internet satelital para colegios, además de viviendas sociales y proyectos viales.

“Las 300 antenas Starlink para las unidades educativas, para que tengan los chicos una mejor conexión y se pueda generar un trabajo educativo mucho más ágil”, sostuvo Paz.

Finalmente, el mandatario sostuvo que el trabajo con El Alto será replicado con otras ciudades, comunidades y departamentos del país, con el objetivo de impulsar obras, conectividad y desarrollo.

“Vamos a sacar a la ciudad de El Alto adelante, vamos a sacar al departamento de La Paz adelante”, concluyó.

Mira la programación en Red Uno Play",https://www.reduno.com.bo/noticias/el-alto-recibira-inversion-para-enlosetados-vias-salud-y-educacion-2026616181755
Red Uno,2026-06-16,Economia,Así cierra el dólar paralelo y el referencial este martes 16 de junio en Bolivia,"El mercado cambiario en Bolivia registró ligeras fluctuaciones durante la jornada de este martes. Tanto la cotización en el mercado informal (paralelo) como el valor referencial emitido por el Banco Central de Bolivia (BCB) mostraron una tendencia a la baja en comparación con las primeras horas del día y la jornada previa.

Ligero descenso del dólar paralelo a lo largo del día

Según el monitoreo en tiempo real del portal especializado dolarboliviahoy.com , la divisa estadounidense cerró la tarde de este martes cotizándose en Bs 9.88 para la compra y Bs 9.88 para la venta .

La cotización informal mostró un descenso paulatino con el paso de las horas. A las 6 de la mañana, el billete verde inició la jornada en Bs 9.91 para la compra y Bs 9.89 para la venta. Hacia el mediodía, se percibió una leve variación al situarse en Bs 9.90 para la compra y Bs 9.89 para la venta, terminando de consolidar su descenso al final de la tarde.

El Banco Central de Bolivia reduce su valor referencial

Por su parte, el ente emisor también actualizó las cifras oficiales. El Banco Central de Bolivia (BCB) fijó el valor referencial del dólar estadounidense en Bs 9.74 para la compra y Bs 9.94 para la venta .

Este ajuste representa una disminución respecto a los valores registrados el día de ayer, cuando el referente estatal se situaba en Bs 9.81 para la compra y Bs 10.02 para la venta, alineándose así a la dinámica de descompresión de la jornada.

Mira la programación en Red Uno Play",https://www.reduno.com.bo/economia/asi-cierra-el-dolar-paralelo-y-el-referencial-este-martes-16-de-junio-en-bolivia-202661618344
