sitio_noticias,fecha,seccion,titular,cuerpo,url
Red Uno,2026-07-14,Gobierno afirma tener listo el paquete de 12 leyes las entregara gradualmente 2026714191111,Gobierno afirma tener listo el paquete de 12 leyes; las entregará gradualmente,"El vocero gubernamental, José Luis Gálvez , informó que el Gobierno ya tiene listas las 12 leyes estructurales destinadas a reformar la administración del Estado boliviano.

Sin embargo, aclaró que los proyectos no serán enviados todos al mismo tiempo, sino de manera gradual a la Asamblea Legislativa Plurinacional , en función del ritmo de análisis, debate y aprobación que establezca el Legislativo.

“Las leyes están listas para ser entregadas, se irán entregando paulatinamente en función del tratamiento, cada una requiere un tratamiento específico”, afirmó Gálvez.

Serán debatidas en la Asamblea

El vocero señaló que las propuestas elaboradas por el Ejecutivo no son documentos cerrados, ya que deberán pasar por el debate legislativo y podrán recibir aportes de los asambleístas.

“Las propuestas ya están, pero eso no significa que son exactamente las que se tienen que aprobar. Es nuestra propuesta, es nuestra iniciativa y el resultado final será fruto del debate en la Asamblea Legislativa”, explicó.

Gálvez sostuvo que el objetivo es que las nuevas normas expresen un horizonte común y consensuado para transformar el país.

Apuntan a transformar el Estado

Gálvez afirmó que el Gobierno busca desmontar lo que denominó un “Estado tranca”, al que describió como pesado, lento y lleno de trabas burocráticas.

“El Estado que hemos heredado está hecho a imagen y semejanza de Evo Morales y Luis Arce, no es el Estado que merecemos los bolivianos”, sostuvo.

Según el vocero, la transformación del Estado será un proceso complejo, ya que las actuales estructuras administrativas dificultan la gestión pública y la atención de las necesidades de la población.

“Tenemos un Estado que complica las cosas, y desarticularlo, desarmarlo, hacerlo útil para el país va a ser un reto que nos va a llevar más tiempo todavía”, concluyó.

Mira la programación en Red Uno Play",https://www.reduno.com.bo/noticias/gobierno-afirma-tener-listo-el-paquete-de-12-leyes-las-entregara-gradualmente-2026714191111
Red Uno,2026-07-14,Deportes,Oyarzabal: “Es una auténtica barbaridad y una alegría inmensa”,"Mikel Oyarzabal, delantero de la selección española, valoró este martes que llegar a la final del Mundial 2026 “es una auténtica barbaridad y una alegría inmensa”, tras ganar por 0-2 a Francia en la semifinal jugada en Dallas.

“Es una auténtica ilusión. Cuando eres pequeño y ves un Mundial o viajar con toda tu familia a ver un Mundial hace muchos años no te hubieras imaginado estar donde estás hoy. Una alegría inmensa”, declaró a TVE al término del encuentro.

“Nosotros, a lo nuestro. Ahora mismo, disfrutar de este momento, que para muchos de los que estamos aquí es un sueño vivir todo esto, disfrutarlo con toda la familia y todos los amigos y descansar al máximo, porque tenemos un único objetivo en mente. Ya sólo queda uno”, explicó.

“Estamos a un pasito de conseguir algo histórico, pero igual de tranquilos que después del partido ante Cabo Verde. Nos queda el último esfuerzo. Hay que disfrutar hoy y descansar para llegar en las mejores condiciones al domingo, que es lo que queremos”, añadió más tarde en zona mixta.

Oyarzabal está “bien” para la final. “Golpes y cansancio del momento, pero feliz, orgulloso de todos, del grupo, de la unión, porque al final esto se trata de los 26, de lo que hay dentro. Tenemos un ambiente excepcional, una vida maravillosa y fácil y eso luego te lo hace más fácil todo”, dijo.

El delantero fue el autor del 0-1, de penalti, y explicó cómo vivió el momento durante unas semifinales del Mundial.

“Ayer y antes de ayer vas probando cosas y haciéndote a la idea de lo que puede ser. Luego tienes en mente algo que ha salido bien. Tenía la idea clara, meterme en mi mundo y mi película para estar centrado y, por suerte, ha ido bien”, explicó.

Además, Oyarzabal destacó la actitud del equipo de no “conformarse” con el primer gol.

“Si nos conformábamos con el 0-1 íbamos a sufrir y quizá no nos daba lo suficiente para ganar. Haciendo el trabajo sin balón que tocaba iban a haber momentos para atacar y hacerles daño”, señaló.

EFE.

Mira la programación en Red Uno Play",https://www.reduno.com.bo/deportes/oyarzabal-es-una-autentica-barbaridad-y-una-alegria-inmensa-202671418590
Red Uno,2026-07-14,Deportes,De la Fuente tras llegar a la final del Mundial con España: “Es un orgullo ser español”,"Luis de la Fuente, seleccionador español, afirmó este martes que “es un orgullo ser español”, tras la clasificación para la final del Mundial 2026 después de imponerse por 0-2 a Francia, y remarcó que su conjunto es “el mejor equipo del mundo”.

“Agradecimiento por las muestras de afecto y ánimo que nos transmiten. Es un orgullo ser español”, expuso en declaraciones a TVE, en las que destacó el “vínculo de todo un país” y expresó: “Juntos se consiguen cosas muy importantes”.

“Es difícil describir ahora lo que uno siente. Entiendo que tiene que ser algo parecido a la felicidad. Orgullo que reitero de dirigir a un grupo de jugadores tan excepcional como este. Todavía queremos seguir haciendo mejor las cosas y nos queda un paso más. Vamos a intentar conseguirlo”, señaló.

“Ahora hay mucha tensión acumulada. Es una responsabilidad. Estar en la final del Mundial es un lujo, es sólo para los elegidos. Uno tiene que sumar todo esto a allá cuando empezamos hace casi cuatro años con una idea y esta idea, que hemos sido fieles a ella, nos ha traído hasta aquí”, añadió.

“Nos enfrentábamos a una de las mejores selecciones del mundo, pero enfrente tenían al mejor equipo del mundo. Es diferente, eso es un plus. Estos jugadores se merecen todo, porque su compromiso, su generosidad, su talento es maravilloso. Verles jugar hoy ha sido un espectáculo. Orgulloso y feliz”, subrayó.

EFE.

Mira la programación en Red Uno Play",https://www.reduno.com.bo/deportes/de-la-fuente-tras-llegar-a-la-final-del-mundial-con-espana-es-un-orgullo-ser-espanol-2026714184655
Red Uno,2026-07-14,Economia,Mañana inicia la devolución de dólares: ¿hasta cuánto puedes retirar?,"Desde este miércoles 15 de julio se habilita el retiro para ahorristas con depósitos de entre $us 1.001 y $us 3.000, como parte del cronograma gradual definido para devolver recursos en dólares del sistema financiero.

La devolución programada de depósitos en dólares ingresa este miércoles 15 de julio a una nueva etapa. A partir de esa fecha, las personas naturales que tengan saldos de entre $us 1.001 y $us 3.000 podrán solicitar la devolución de sus recursos en entidades financieras.

El cronograma difundido por el Banco Central de Bolivia establece que el proceso será gradual y avanzará según el monto depositado. Para este primer tramo se prevé una devolución total de $us 48 millones .

¿Hasta cuánto se puede retirar desde mañana?

Desde este miércoles, el monto habilitado corresponde a ahorristas con depósitos de hasta $us 3.000 , siempre que se encuentren dentro del tramo establecido de $us 1.001 a $us 3.000 .

Esto no significa que todos los usuarios puedan retirar cualquier monto, sino que cada ahorrista podrá solicitar la devolución de acuerdo con el saldo que tenga en su cuenta y la etapa que le corresponda.

Los retiros serán voluntarios y se realizarán a través de las entidades financieras, según el cronograma definido por el BCB.

Cómo será el procedimiento

El ahorrista deberá acudir a la entidad financiera donde tiene su cuenta en dólares y solicitar el retiro de sus depósitos, de acuerdo con el tramo habilitado.

La devolución se realizará en dólares y de manera escalonada. El Ministerio de Economía informó anteriormente que el proceso busca permitir a los ahorristas retirar sus recursos en las mismas condiciones en las que fueron depositados.

Cronograma para personas naturales

Después del primer tramo que inicia este 15 de julio, la devolución continuará de la siguiente manera:

De acuerdo con la información divulgada por el BCB, se prevé devolver a personas naturales un total de $us 1.028 millones hasta agosto de 2027.

También aplica para empresas

El cronograma también contempla la devolución progresiva de depósitos en dólares para personas jurídicas hasta diciembre de 2028. En ese caso, se prevé devolver $us 1.056 millones .

Recomendación a los ahorristas

Las personas que tengan cuentas en dólares deben verificar el saldo de sus depósitos y revisar desde qué fecha les corresponde solicitar el retiro.

Para evitar confusiones, se recomienda acudir directamente a la entidad financiera donde se encuentra la cuenta y consultar requisitos, horarios y modalidad de atención.

Mira la programación en Red Uno Play",https://www.reduno.com.bo/economia/manana-inicia-la-devolucion-de-dolares-hasta-cuanto-puedes-retirar-2026714184454
Red Uno,2026-07-14,Economia,¿Aún no apareces habilitado para cobrar el bono PEPE? Conozca cómo consultar su caso ante la Gestora,"Con el propósito de facilitar la realización de trámites y resolver de manera directa cualquier duda respecto al Programa Extraordinario de Protección y Equidad (PEPE), el Ministerio de Economía y Finanzas Públicas y la Gestora Pública recordaron a la población los canales oficiales de atención vigentes. Los usuarios que requieran asistencia personalizada, verificar su habilitación o regularizar la actualización de sus datos disponen de cuatro vías de comunicación seguras para evitar contratiempos en su proceso.

Para una gestión ágil y ordenada, las autoridades detallaron los siguientes puntos de contacto autorizados:

Avance del ""Contador de Pagos"" alcanza el 94.4% a nivel nacional

De manera paralela a la asistencia al usuario, el proceso de desembolsos económicos muestra un ritmo constante en todo el territorio. De acuerdo con el reporte estadístico oficial del ""Contador de Pagos"" del Programa PEPE, con corte técnico consolidado al 13 de julio de 2026 , el beneficio social registra un avance del 94.4% en su ejecución presupuestaria. Esta métrica equivale a 2.190.645 beneficiarios alcanzados que ya retiraron sus fondos, sobre un universo total de 2.320.057 personas habilitadas para el cobro en el sistema financiero.

La distribución técnica de la cobertura por cada sector social prioritario detalla las siguientes cifras oficiales de cumplimiento acumulado:

Plazos de cobro y seguridad de los aportes jubilatorios

El Ministerio de Economía y Finanzas Públicas ratificó que el plazo final e impostergable para que la ciudadanía rezagada acuda a cobrar este incentivo económico vence el próximo 31 de julio de 2026 . La ampliación del cronograma inicial mediante decreto supremo busca que todas las familias afectadas por observaciones documentales o por las dificultades de traslado debido a los bloqueos de carreteras en el país logren recibir su dinero.

Las autoridades recordaron que los recursos empleados para sostener este programa provienen del Tesoro General de la Nación (TGN) y de créditos externos. Por tanto, la normativa legal certifica que este beneficio temporal NO compromete los aportes de los jubilados ni afecta los fondos administrados para el régimen de pensiones de largo plazo, garantizando la total estabilidad de los ahorros de la clase pasiva.

Parámetros para el cobro seguro en la banca privada

Para hacer efectivo el retiro del beneficio económico acumulado de hasta Bs. 450 de forma segura y sencilla, la Gestora recordó que los ciudadanos pueden aproximarse a la entidad financiera de su preferencia con su Carnet de Identidad original y su certificado de Sufragio . El proceso operativo en ventanilla se aplica bajo los siguientes lineamientos flexibles:

Mira la programación en Red Uno Play",https://www.reduno.com.bo/economia/aun-no-apareces-habilitado-para-cobrar-el-bono-pepe-conozca-como-consultar-su-caso-ante-la-gestora-2026714183921
Red Uno,2026-07-14,Deportes,"Deschamps: ""Para ganar a España había que dar el máximo y no fue el caso""","El seleccionador francés Didier Deschamps afirmó que, para derrotar a España en la semifinal del Mundial (0-2), tendrían que ""haber dado el máximo y no ha sido el caso"".

Deschamps se mostró decepcionado con la actuación de su equipo, en la conferencia de prensa posterior a la derrota por 0-2 en la semifinal disputada en el estadio AT&T de Arlington.

""Sabíamos que España defiende bien, dejó poco espacio y, si el nivel técnico es más bajo que en otros partidos no podíamos ganar. Si a nivel técnico y defensivo no estamos a la altura no podemos ganar"", dijo.

""Se han podido cometer errores por el contexto, para algunos jugadores es su primera semifinal. No dominamos el juego que queríamos desplegar. No hay que echar por la borda lo que hicimos, pero teníamos que habérselo puesto más difícil a España y dar el 100 por ciento del nivel técnico y físico"", añadió el seleccionador francés, que dijo que no fue falta de ambición, pero que hubo cosas que no se hicieron bien.

Deschamps se quejó del arbitraje del salvadoreño Iván Barton. ""El cuarto y el quinto árbitro eran magníficos. ¿Creen que el árbitro estaba a la altura?"", se preguntó. Al ser requerido por EFE si podía ampliar sus quejas, admitió que no le gustó el penalti que pitó de Lucas Digne sobre Lamine Yamal, pero no quiso especificar con qué otras decisiones no estuvo de acuerdo.

Deschamps, que dejará la selección francesa tras el Mundial, afirmó: ""Estoy contento de todo lo que hemos hecho con la selección para llegar al título mundial y mantenerla al nivel más alto. He tenido momentos muy felices, pero hoy el sentimiento es que no estoy contento"".

EFE.

Mira la programación en Red Uno Play",https://www.reduno.com.bo/deportes/deschamps-para-ganar-a-espana-habia-que-dar-el-maximo-y-no-fue-el-caso-2026714183737
Red Uno,2026-07-14,Este es el dinero que envio ivan valdivia reclutado para la guerra en rusia 2026714181930,Este es el dinero que envió Iván Valdivia desde Rusia antes de perder contacto,"La Fiscalía General de Bolivia inició una investigación de oficio para esclarecer el reclutamiento ilegal de ciudadanos en el país para viajar a la guerra en Rusia. En este contexto, se conoce que uno de ellos, Iván Valdivia, recibió pagos en Rusia y los envió a su familia en Bolivia.

Las autoridades activaron los protocolos penales este martes tras recibir denuncias públicas de familiares de dos jóvenes que presuntamente fueron reclutados por Rusia para la guerra contra Ucrania y que se cree que fallecieron.

Las remesas del engaño y la desaparición

Este esquema de captación económica también golpeó con fuerza al hogar de Esther Nogales, quien relató con angustia que su padre recibió pagos similares antes de desaparecer por completo en el frente europeo.

“Perdí contacto con él hace dos meses; me enviaba mensajes por WhatsApp, que estaba en Rusia, me envió dinero también, pero no supe más de él”, detalló con pesar al recordar el enganche financiero con el que los reclutadores se llevan a las personas.

El flujo de recursos monetarios desde el exterior estaba acompañado de insistentes promesas de legalidad, estatus civil y bienestar a largo plazo en territorio ruso. “Él me decía que iba a participar en la guerra y que yo también tenía ciudadanía rusa porque él también, asegurando que íbamos a tener beneficios”, recordó compungida la joven, quien ahora enfrenta la total incertidumbre de no conocer su paradero actual ni tener pistas sobre dónde buscarlo.

Mira la programación en Red Uno Play",https://www.reduno.com.bo/noticias/este-es-el-dinero-que-envio-ivan-valdivia-reclutado-para-la-guerra-en-rusia-2026714181930
Red Uno,2026-07-14,Economia,Supera a la cotización oficial: Así cierra el dólar paralelo este martes 14 de julio,"El mercado cambiario informal en Bolivia vivió una jornada de intensa actividad y volatilidad este martes 14 de julio. Tras registrar oscilaciones constantes a lo largo del día, el dólar paralelo cerró sus operaciones cotizándose en Bs 10.52 para la compra y Bs 10.56 para la venta , de acuerdo con el reporte especializado del portal dolarboliviahoy.com .

Con este último movimiento, el mercado paralelo superó la cotización oficial publicada por el Banco Central de Bolivia (BCB), que para esta misma jornada era de Bs 10.50 .

La cotización de la divisa estadounidense en las calles no dio tregua y mostró variaciones en tres momentos clave. A las 6:00 de la mañana, la jornada arrancó con una cotización de Bs 10.51. Hacia el mediodía, el panorama cambió levemente al registrarse un descenso en la compra, que se situó en Bs 10.49, mientras que la venta subió a Bs 10.52. Finalmente, al cierre de la tarde, el billete verde retomó su fuerza alcista para terminar el día en su punto más alto.

El dinamismo del mercado informal de este martes refleja la constante pulseada entre la oferta y la demanda de divisas, manteniendo una brecha estrecha pero visible respecto al tipo de cambio oficial del Estado.

Mira la programación en Red Uno Play",https://www.reduno.com.bo/economia/supera-a-la-cotizacion-oficial-asi-cierra-el-dolar-paralelo-este-martes-14-de-julio-202671418102
Red Uno,2026-07-14,Fiscal general afirma que aun no hay prueba contundente de droga en el caso narcomadera 202671418919,Fiscal general afirma que aún no hay prueba contundente de droga en el caso “narcomadera”,"El fiscal general del Estado, Roger Mariaca , se refirió al caso denominado “narcomadera” y afirmó que el Ministerio Público actuará con responsabilidad antes de asumir cualquier determinación contra las personas investigadas.

Mariaca explicó que, hasta el momento, no existe una prueba contundente que confirme que en las maderas se transportaban sustancias controladas, especialmente cocaína.

“Se tiene que tener la certeza, la prueba contundente de que en las maderas efectivamente se transportaba sustancias controladas, en especial cocaína”, manifestó.

Pericias dieron falso positivo

La autoridad indicó que diferentes reportes, informes y pericias realizadas hasta ahora dieron como resultado un falso positivo .

Según explicó, esto significa que no se pudo determinar, ni en Bolivia ni en otras diligencias realizadas en el exterior, que efectivamente haya existido tráfico de sustancias controladas en la madera.

“No se ha podido determinar tanto en nuestro país como en otras diligencias que se están realizando en otros países que sí efectivamente hubo tráfico de sustancias controladas en las maderas”, señaló.

Defiende responsabilidad con empresarios madereros

Mariaca sostuvo que la Fiscalía no puede actuar de manera irresponsable contra empresarios madereros que tienen trayectoria y aportan al país, si no existen indicios sólidos o pruebas suficientes.

“No queremos ser irresponsables con aquellas personas que ponen el hombro al país, aquellos empresarios madereros que tienen tradición de más de 30 o 20 años”, afirmó.

La autoridad remarcó que no se puede destruir la reputación o el trabajo de años de personas o empresas únicamente con presupuestos o indicios que, hasta la fecha, no han sido confirmados.

Declaraciones en varios departamentos

El fiscal general informó que el caso continúa en investigación y que se están tomando declaraciones a diferentes personas en Cochabamba, Pando y Santa Cruz , departamentos donde se abrieron procesos relacionados con este caso.

También señaló que se enviaron pericias al IDIF y se solicitó cooperación a organismos internacionales para esclarecer los hechos.

Fiscalía respetará informes de otros países

Mariaca indicó que Bolivia respeta la independencia de los ministerios públicos de otros países, como Chile o Brasil, pero aclaró que el Ministerio Público boliviano continuará con su propia investigación.

“Lo que digan los chilenos, lo que digan los brasileños, ellos son independientes de lo que puedan resolver o manifestar”, expresó.

No descartan imputaciones ni rechazo del caso

El fiscal general afirmó que, si se encuentran indicios o pruebas suficientes, se procederá con imputaciones o aprehensiones. Sin embargo, también señaló que, si no se demuestra la existencia de tráfico de sustancias controladas, la Fiscalía podría rechazar la denuncia.

“Si se tiene que imputar a las personas, vamos a imputar. Si se tiene que aprehender a las personas con indicios o pruebas correspondientes, vamos a aprehender”, afirmó.

Pero añadió que, si corresponde, también se determinará el rechazo del caso.

“Si se tiene que rechazar este caso porque no existió el tráfico de sustancias controladas, tengan la seguridad de que vamos a determinar el rechazo de denuncia”, sostuvo.

Investigación delicada

Mariaca reiteró que se trata de una investigación delicada y que el Ministerio Público tiene la obligación de esclarecer los hechos con base en pruebas y no en especulaciones.

Mira la programación en Red Uno Play",https://www.reduno.com.bo/noticias/fiscal-general-afirma-que-aun-no-hay-prueba-contundente-de-droga-en-el-caso-narcomadera-202671418919
Red Uno,2026-07-14,Perdi contacto hace dos meses una hija relata como su padre fue reclutado para la guerra de rusia 2026714175815,“Perdí contacto hace dos meses”: Una hija relata cómo su padre fue reclutado para la guerra de Rusia,"La desesperación se ha apoderado de Esther Nogales, quien descubrió por redes sociales que su padre se encuentra desaparecido en el frente de batalla ruso, tras perder el rastro de su padre hace dos meses. La joven relató con profunda angustia el engaño que sufren muchas víctimas:

“Lo de mi padre no es la única situación en la que desaparece una persona y no se sabe de su paradero, son mercenarios que se llevan a personas reclutándolos con promesas de dinero y que, por su ingenuidad o falta de dinero, estas personas acceden a llevárselos a Rusia para la guerra”.

Antes de perder toda comunicación, el hombre llegó a enviarle remesas y mensajes de texto donde le aseguraba que su participación en el conflicto le traería grandes beneficios y la ciudadanía rusa. Sin embargo, la realidad de la trinchera cortó abruptamente el contacto y ahora su familia vive en la total incertidumbre. “Me enteré por redes sociales que mi padre está desaparecido junto a varias personas más; quisiera tener contacto con otros familiares también y saber su ubicación, pero no sé por dónde buscar”, lamentó Nogales.

La inacción y el vacío legal

La afectada acudió a las instancias diplomáticas correspondientes en busca de auxilio para dar con el paradero de su padre.

Lamentablemente, la respuesta oficial apagó rápidamente sus expectativas de un pronto reencuentro: “Hablé con la embajada de Bolivia en Rusia y me dijeron que las esperanzas de saber algo de él son mínimas porque son muchas las personas que están pasando por esto”.

En este contexto, la afectada indicó que “postularse en Rusia no es ilegal, quienes están llevando a las personas desde aquí son quienes están cometiendo esos delitos, por lo que quisiera que las autoridades averigüen quiénes son los que se llevan a personas de aquí con promesas falsas y engaños”.

Mira la programación en Red Uno Play",https://www.reduno.com.bo/noticias/perdi-contacto-hace-dos-meses-una-hija-relata-como-su-padre-fue-reclutado-para-la-guerra-de-rusia-2026714175815
