sitio_noticias,fecha,seccion,titular,cuerpo,url
Red Uno,2026-07-17,Tragedia en el alto tres trabajadores mueren aplastados 2026717215959,Tragedia en El Alto: tres trabajadores mueren aplastados,"Tres hombres perdieron la vida la tarde de este viernes al interior de una empresa importadora ubicada en la ciudad de El Alto , luego de ser presuntamente aplastados por material de acero. Las víctimas tenían 27, 33 y 53 años .

Tras el accidente, los afectados fueron evacuados hasta la clínica Fides ; sin embargo, ingresaron sin vida al centro médico.

Familiares llegaron al lugar

Luego de conocerse el hecho, familiares de los fallecidos llegaron hasta el centro médico y rechazaron inicialmente que los cuerpos fueran trasladados a la morgue para los procedimientos legales correspondientes.

Ante esta situación, la Policía solicitó apoyo de otras unidades para restablecer el orden y concretar el traslado de los cadáveres.

FELCC abre investigación

Con el refuerzo policial, las autoridades lograron trasladar los cuerpos para que se practiquen los exámenes forenses correspondientes.

La Fuerza Especial de Lucha Contra el Crimen (Felcc) inició las investigaciones para establecer qué provocó el accidente y determinar si existieron fallas en las condiciones de seguridad o posibles responsabilidades.

Aún no hay informe oficial

Hasta el momento, las autoridades no emitieron un informe oficial sobre las causas del hecho. Las diligencias continúan para esclarecer las circunstancias en las que murieron las tres personas.

Mira la programación en Red Uno Play",https://www.reduno.com.bo/noticias/tragedia-en-el-alto-tres-trabajadores-mueren-aplastados-2026717215959
Red Uno,2026-07-17,Economia,Anapo gestiona abastecimiento de diésel para garantizar la cosecha en Santa Cruz,"La Asociación de Productores de Oleaginosas y Trigo (Anapo) intensifica las gestiones con YPFB para garantizar el abastecimiento de diésel durante la cosecha de invierno, una etapa considerada clave para el sector agropecuario de Santa Cruz.

El gerente general de Anapo, Jaime Hernández, afirmó que la falta de combustible sigue siendo una preocupación para los productores y recordó que hace semanas el sector ya había advertido sobre los riesgos que representaba el desabastecimiento.

""El tema del combustible es una preocupación constante. Hace un par de semanas habíamos alertado sobre esta situación, preocupados por cómo se venía dando la provisión y más aún porque ya prácticamente estábamos comenzando la cosecha, que en estos momentos ya se ha iniciado"", señaló Hernández.

El representante explicó que, tras las reuniones con el Gobierno, se acordó garantizar el volumen de diésel programado para julio, que en el caso de Santa Cruz asciende a aproximadamente 72 millones de litros, con una distribución diaria estimada entre 2,6 y 3 millones de litros.

""También hemos hablado de implementar sistemas móviles que nos ayuden a entregar de forma directa el combustible a los pequeños productores y asegurar la provisión para los clientes directos, que son los grandes consumidores agropecuarios que retiran el diésel desde la refinería y lo llevan a los campos productivos"", indicó.

Hernández expresó su confianza en que los compromisos asumidos se cumplan y permitan desarrollar la cosecha sin inconvenientes. ""Esperemos que, en el marco de la coordinación que tenemos, estas medidas se puedan ir concretando"", concluyó.

Mira la programación en Red Uno Play",https://www.reduno.com.bo/economia/anapo-gestiona-abastecimiento-de-diesel-para-garantizar-la-cosecha-en-santa-cruz-2026717213953
Red Uno,2026-07-17,Aprehenden a david quispe maximo dirigente de la csutcb 202671721345,"Aprehenden a David Quispe, máximo dirigente de la CSUTCB","El dirigente campesino fue trasladado a dependencias de la Felcc en La Paz, donde se aguarda que preste su declaración dentro de las investigaciones por los bloqueos registrados en el país.

El dirigente de la Confederación Sindical Única de Trabajadores Campesinos de Bolivia (CSUTCB) , David Quispe Machaca , fue aprehendido este viernes en la ciudad de El Alto por efectivos de la Unidad de Inteligencia de la Policía Boliviana.

Tras su aprehensión, Quispe fue trasladado a dependencias de la Fuerza Especial de Lucha Contra el Crimen (Felcc) en la ciudad de La Paz.

Investigado por los bloqueos

De acuerdo con el reporte preliminar, el dirigente es investigado por su presunta participación en la promoción de los bloqueos que se extendieron por más de 50 días en diferentes puntos del país.

En mayo, el Ministerio Público ya había emitido una orden de aprehensión contra Quispe Machaca y otros dirigentes, dentro de una investigación por presuntos delitos como instigación pública a delinquir, asociación delictuosa, financiamiento al terrorismo y otros vinculados a las movilizaciones y bloqueos.

Fue llevado a oficinas de la Felcc

Según la información conocida, Quispe llegó hasta dependencias policiales en La Paz y posteriormente fue conducido a oficinas de la fuerza anticrimen, donde se aguarda que brinde su declaración informativa.

En las próximas horas se espera que el Ministerio Público defina si presenta la imputación formal y que un juez determine su situación jurídica.

Mira la programación en Red Uno Play",https://www.reduno.com.bo/noticias/aprehenden-a-david-quispe-maximo-dirigente-de-la-csutcb-202671721345
Red Uno,2026-07-17,Inteligencia artificial y liderazgo marcaron el cierre de exma bolivia 2026 2026717212550,Inteligencia artificial y liderazgo marcaron el cierre de Exma Bolivia 2026,"Con la participación de reconocidos conferencistas internacionales, Exma Bolivia 2026 concluyó en Santa Cruz consolidándose como uno de los encuentros de marketing, innovación y negocios más importantes de la región.

Durante las dos jornadas, los especialistas compartieron experiencias y estrategias sobre liderazgo, comunicación, inteligencia artificial y transformación empresarial, haciendo énfasis en que la tecnología debe servir para fortalecer el vínculo con las personas.

Ronan Mazzees destacó que, en medio de los avances tecnológicos y los desafíos económicos, las empresas no deben perder de vista el factor humano.

""Tenemos que regresar al humano, porque alejarnos del humano nos hace perder relevancia en los mercados. Si volvemos a poner a las personas en el centro, volvemos también al crecimiento"", señaló durante su conferencia.

El especialista explicó que las organizaciones deben pensar en tres actores fundamentales: los colaboradores, los consumidores y los inversionistas.

Otra de las conferencias estuvo a cargo de Steph Daguer, entrenadora internacional en comunicación, quien remarcó la importancia de desarrollar esta habilidad para destacar profesionalmente. ""Si no sabes comunicar lo que vales, vales madre. Así que entrena tu comunicación"", expresó ante los asistentes.

Por su parte, otros conferencistas coincidieron en que la inteligencia artificial representa una oportunidad para potenciar tanto el desarrollo profesional como el crecimiento de las empresas, siempre que se utilice como una herramienta complementaria y no como un reemplazo del talento humano.

Los invitados internacionales también resaltaron la calidez del público boliviano y el interés de los asistentes por adquirir nuevos conocimientos.

La edición 2026 reunió a miles de participantes entre empresarios, ejecutivos, emprendedores y estudiantes, quienes asistieron a conferencias y actividades enfocadas en las principales tendencias del marketing, la comunicación, el liderazgo y la transformación digital.

Mira la programación en Red Uno Play",https://www.reduno.com.bo/noticias/inteligencia-artificial-y-liderazgo-marcaron-el-cierre-de-exma-bolivia-2026-2026717212550
Red Uno,2026-07-17,Felcc investiga ataque armado a pareja en el tropico el varon tiene antecedentes por narcotrafico 202671721242,Felcc investiga ataque armado a pareja en el Trópico: El varón tiene antecedentes por narcotráfico,"Una pareja fue víctima de un violento intento de homicidio y presunto secuestro en la localidad de Isarzama, municipio de Entre Ríos, en el Trópico de Cochabamba. Tras el ataque, la Fuerza Especial de Lucha Contra el Crimen (Felcc) reveló un dato clave: el hombre herido cuenta con antecedentes penales por la Ley 1008 (narcotráfico) , lo que abre nuevas hipótesis sobre los móviles del hecho.

El ataque: Emboscada y forcejeo en Isarzama

De acuerdo con el informe brindado por el Comandante Regional del Trópico, el hecho se registró cuando las víctimas —una mujer de 27 años y un hombre de 32— se transportaban a bordo de su camioneta. En ese momento, fueron interceptados por una vagoneta Toyota tipo Noah, de la cual descendieron entre 5 y 6 sujetos encapuchados y fuertemente armados .

Los delincuentes intentaron hacer bajar a la pareja con la presunta intención de secuestrarlos o robarles el motorizado. Al resistirse, las víctimas comenzaron a pedir auxilio a gritos, lo que alarmó a los comunarios de la zona. Ante el riesgo de ser descubiertos, los encapuchados abrieron fuego a quemarropa antes de darse a la fuga con rumbo desconocido.

El informe médico y los impactos de bala

El director de la Felcc, Erick Peralta, detalló el estado de salud de los afectados, quienes se encuentran internados en un centro médico hospitalario:

El varón (32 años): Recibió dos impactos de bala , uno en el abdomen y otro en la pierna, ambos con orificio de entrada y salida.

La mujer (27 años): Presenta una herida por proyectil de arma de fuego en el brazo .

Nexos con el narcotráfico y ""pacto de silencio"" en la zona

El giro principal de la investigación radica en el historial de la víctima masculina. El director de la Felcc confirmó el vínculo con sustancias controladas:

""Una de las primeras indagaciones que se ha hecho es de que el varón cuenta con antecedentes por la Ley 1008"", informó Peralta.

Asimismo, la autoridad policial lamentó la falta de cooperación de los vivientes del sector, señalando que existe una notoria negativa por parte de la gente del lugar para brindar testimonios o detalles de lo ocurrido. Pese a este obstáculo, personal de laboratorio y de la FELCC se desplazó a la escena para colectar los casquillos y buscar indicios materiales.

Inmediatamente después de conocerse el crimen, la Policía Boliviana activó el ""Plan Z"" en todo el Trópico de Cochabamba, ejecutando intensos operativos de tranca y rastrillaje para dar con el paradero de los seis implicados y la vagoneta Noah. Las autoridades aseguran que no descartan ninguna hipótesis, incluido un posible ajuste de cuentas.

Mira la programación en Red Uno Play",https://www.reduno.com.bo/noticias/felcc-investiga-ataque-armado-a-pareja-en-el-tropico-el-varon-tiene-antecedentes-por-narcotrafico-202671721242
Red Uno,2026-07-17,Gobernacion crucena emite alerta roja por vientos de hasta 120 km h estas son las zonas de riesgo 2026717212134,Gobernación cruceña emite alerta roja por vientos de hasta 120 km/h; estas son las zonas de riesgo,"La Gobernación de Santa Cruz difundió información urgente mediante sus redes sociales oficiales para alertar a la población sobre las condiciones climáticas actuales. Las autoridades declararon alerta roja debido a la presencia de vientos moderados a temporalmente fuertes en el departamento.

Zonas afectadas y dirección del viento

La información detalla que los vientos tienen una dirección específica desde el noroeste, alcanzando velocidades de 90 a 120 km/h. El reporte oficial identifica con precisión las siguientes zonas con posibles riesgos:

Vigencia del reporte y contacto

Las fechas de vigencia establecidas para este aviso comprenden desde el viernes 17 al sábado 18 de julio del 2026. Ante cualquier situación de emergencia provocada por este fenómeno, las autoridades habilitaron una línea gratuita de atención: 800-148139.

Mira la programación en Red Uno Play",https://www.reduno.com.bo/noticias/gobernacion-crucena-emite-alerta-roja-por-vientos-de-hasta-120-km-h-estas-son-las-zonas-de-riesgo-2026717212134
Red Uno,2026-07-17,Gremiales anuncian reunion con el gobierno para la proxima semana 202671721226,Gremiales anuncian reunión con el Gobierno para la próxima semana,"La Confederación de Gremiales anunció desde Santa Cruz que sostendrá reuniones con el Gobierno nacional para plantear soluciones a la situación del sector. El ejecutivo nacional, César Gonzáles, adelantó que exigirán créditos blandos equitativos y un plan tras haber soportado los perjuicios de 53 días de bloqueos.

En los próximos encuentros, el sector demandará reducir el aparato estatal retirando a 20 de cada 100 funcionarios administrativos de las instituciones públicas.

""De esa manera se va a poder invertir más y gastar menos"", argumentó Gonzáles, señalando que esta medida ahorraría entre 7.000 y 11.000 millones de bolivianos.

Renovación del gabinete y crisis de divisas

Con miras al 6 de agosto, los comerciantes solicitarán formalmente al presidente del Estado que posesione un ""gabinete de lujo"" que conozca el territorio. Asimismo, plantearán impulsar con urgencia las exportaciones de todo tamaño para contrarrestar de forma inmediata la constante y preocupante subida del dólar.

El cronograma de diálogo se desarrollará en La Paz los días martes y jueves con el Viceministerio de Política Tributaria y la Aduana Nacional. Los gremiales buscarán frenar la sobrevaloración de mercancías importadas y reducir el Impuesto al Consumo Específico (ICE) para evitar el encarecimiento de los productos, de acuerdo a lo que indicaron.

Política exterior y tratados comerciales

Finalmente, los representantes alistan una mesa de trabajo con el Ministerio de Relaciones Exteriores para exigir que las embajadas abran mercados exteriores competitivos. Criticaron que Bolivia solo posea entre cuatro y cinco tratados internacionales vigentes frente a los 28 que tiene Perú, lo que indican que encarece los costos.

Mira la programación en Red Uno Play",https://www.reduno.com.bo/noticias/gremiales-anuncian-reunion-con-el-gobierno-para-la-proxima-semana-202671721226
Red Uno,2026-07-17,Ultimo juan jose zuniga deja el penal de san pedro 2026717203419,Último: Juan José Zúñiga deja el penal de San Pedro,"El excomandante del Ejército Juan José Zúñiga abandonó el penal de San Pedro , en La Paz, y fue trasladado al domicilio donde cumplirá detención domiciliaria mientras continúa el proceso judicial en su contra.

La salida se produjo por la puerta principal del recinto penitenciario, en medio de un operativo de seguridad instalado en inmediaciones del penal.

Breve declaración

Antes de abandonar el penal, Zúñiga dio una breve declaración en la que afirmó que “se había hecho justicia”, luego de haber permanecido recluido en el penal de El Abra, en Cochabamba, y posteriormente en San Pedro.

Cumplirá detención domiciliaria

Zúñiga se dirigió a un domicilio fijado en la ciudad de La Paz, donde deberá permanecer bajo detención domiciliaria, conforme a la determinación judicial.

La medida se ejecuta después de que el tribunal emitiera el mandamiento correspondiente y se cumplieran los requisitos exigidos, entre ellos el pago de la fianza y otros trámites administrativos.

El juicio continuará

Aunque Zúñiga dejó el recinto penitenciario, el proceso judicial en su contra continuará. El juicio ingresó en cuarto intermedio y será retomado en el mes de agosto.

Desde ahora, el excomandante ya no permanecerá en un penal, sino bajo medidas sustitutivas mientras se desarrolla el proceso.

Mira la programación en Red Uno Play",https://www.reduno.com.bo/noticias/ultimo-juan-jose-zuniga-deja-el-penal-de-san-pedro-2026717203419
Red Uno,2026-07-17,Boliviano en el frente de batalla en ucrania la guerra es miedo bombardeos y companeros heridos y muertos 2026717202543,"Boliviano en el frente de batalla en Ucrania: “La guerra es miedo, bombardeos y compañeros heridos y muertos”","El sargento junior boliviano Luis Herbas, quien combate en las Fuerzas Armadas de Ucrania, mediante sus redes sociales, lanzó una advertencia a sus compatriotas ante los reportes de reclutamientos en el país.

El uniformado describió el horror del frente de batalla y enfatizó de forma directa que “la guerra es miedo, es bombardeos, es compañeros heridos y muertos”.

Herbas detalló que su testimonio se basa estrictamente en las vivencias acumuladas desde su llegada a territorio ucraniano el pasado 1 de marzo de 2025. El combatiente remarcó que la realidad de las trincheras implica un desgaste físico y mental constante, además de la posibilidad real de perder la vida.

Investigación por captación ilegal

Esta declaración surge mientras el Ministerio Público de Bolivia investiga a una red criminal que captó a más de una decena de ciudadanos para enviarlos al conflicto armado. La Fiscalía busca esclarecer las condiciones bajo las cuales estos civiles bolivianos fueron trasladados hacia las zonas de combate en Rusia y Ucrania.

Respecto a estas indagaciones, Herbas aclaró que su caso es diferente porque él planificó, financió y asumió el viaje por cuenta propia y con plena consciencia del peligro. Sin embargo, el sargento advirtió que sería profundamente injusto si las investigaciones judiciales demuestran que otros compatriotas fueron llevados mediante engaños laborales.

Desmitificación del conflicto armado

El militar boliviano exhortó a la población a no ver este escenario internacional como una aventura, un videojuego o una vía rápida para obtener grandes sumas de dinero. Asimismo, admitió haber presenciado errores, desorganización y situaciones de corrupción dentro de la experiencia directa que afronta en el terreno de operaciones.

Finalmente, Herbas pidió a los ciudadanos investigar absolutamente todo y desconfiar de las simples promesas económicas antes de aceptar cualquier oferta vinculada a este conflicto. El uniformado instó a comprobar cada detalle y hablar con personas expertas, asegurando que una guerra cambia la vida de cualquiera y exige saber a qué se dice que sí.

Mira la programación en Red Uno Play",https://www.reduno.com.bo/noticias/boliviano-en-el-frente-de-batalla-en-ucrania-la-guerra-es-miedo-bombardeos-y-companeros-heridos-y-muertos-2026717202543
Red Uno,2026-07-17,Accidente de paracaidista militar cuerpo del teniente continua en el hospital de punata tras examen forense 2026717201658,Accidente de paracaidista militar: Cuerpo del teniente continúa en el hospital de Punata tras examen forense,"El curso de la investigación en torno a la trágica muerte del Teniente de Caballería, José Raúl Colodro Mercado (30), sumó un avance clave en las últimas horas. Así, se llevó a cabo la autopsia correspondiente en el hospital del municipio de Punata, en la región del Valle Alto cochabambino.

Según reportes obtenidos directamente desde el nosocomio de Punata, una médico forense se trasladó hasta el lugar para realizar el examen pericial al cuerpo del instructor del Regimiento de Infantería Aerotransportada 18 “Victoria”. El estudio médico-legal es fundamental para que la Fuerza Especial de Lucha contra el Crimen (Felcc) y el Ministerio Público puedan corroborar científicamente si el militar sufrió una descompensación física en pleno vuelo o si el deceso se debió netamente al impacto tras fallar el despliegue de sus paracaídas a 3.000 metros de altura.

Espera de los familiares

Hasta el cierre de este reporte , los restos del teniente de 30 años continúan bajo resguardo en dicho centro hospitalario. El personal médico confirmó que el cuerpo aún permanece en el sector a la espera del arribo de los familiares directos, quienes deben completar los trámites administrativos indispensables para recoger tanto el certificado médico de defunción como el cadáver.

Fuentes cercanas al caso indicaron que el plan de la familia es realizar el traslado inmediato de los restos hacia la ciudad de Cochabamba una vez concluidos los papeleos en Punata. Se tiene previsto que las honras fúnebres den inicio formal este sábado, brindándole al joven oficial el último adiós y la cristiana sepultura.

Las pesquisas técnicas continúan

Mientras la familia atraviesa las horas más difíciles del duelo, las comisiones periciales de la Policía y la auditoría interna del Ejército prosiguen de manera paralela en el sector de la Laguna El Carmen (San Benito). Las autoridades buscan recolectar la mayor cantidad de evidencia física del equipo de salto utilizado en este fatal séptimo descenso para esclarecer por qué los sistemas principal y de auxilio no operaron de forma óptima.

Mira la programación en Red Uno Play",https://www.reduno.com.bo/noticias/accidente-de-paracaidista-militar-cuerpo-del-teniente-continua-en-el-hospital-de-punata-tras-examen-forense-2026717201658
Red Uno,2026-07-17,Deportes,Scaloni: “La selección argentina juega por su gente”,"“La selección argentina juega por su gente, por su país y por su familia”, afirmó el director técnico Lionel Scaloni durante la conferencia de prensa previa a la final del Mundial ante España .

El entrenador argentino sostuvo que la emoción del plantel y del cuerpo técnico se mantiene intacta porque sienten el respaldo de los hinchas en cada partido.

“Ves a tu gente de la manera que festeja, la manera en que está feliz. Eso te llega y es imposible que no te toque el corazón”, expresó.

La unión como valor principal

Scaloni remarcó que uno de los mayores logros del proceso fue recuperar la identificación de la gente con la selección.

El técnico destacó que la camiseta argentina logró unir a hinchas de distintos clubes.

“Que un hincha de Newell’s se abrace con uno de Central, uno de Boca con uno de River, ese es el valor más grande que podemos tener”, señaló.

Argentina llega bien a la final

Sobre el presente futbolístico del equipo, Scaloni aseguró que Argentina llega en buenas condiciones al partido decisivo, aunque reconoció que siempre hay aspectos por mejorar.

“El equipo está bien y jugamos contra un gran rival. Intentaremos ganar la final”, sostuvo.

También recordó que Argentina es una selección conocida por sus rivales, por lo que valoró aún más haber llegado a esta instancia.

Una final con protagonismo de la pelota

El entrenador argentino también se refirió a España y señaló que ambos equipos tienen similitudes futbolísticas, especialmente por la intención de jugar a través del balón.

“Los dos, con algunos matices, intentamos hacernos fuertes con la pelota”, explicó.

Scaloni dijo que espera una final atractiva para el público y un buen espectáculo futbolístico.

Último entrenamiento antes del partido

Consultado por el lateral derecho, donde alternaron Nahuel Molina y Gonzalo Montiel , el DT indicó que evaluará a los jugadores en el último entrenamiento.

Argentina y España cerrarán este sábado su preparación para disputar la final este domingo.

La transmisión será por Red Uno de Bolivia , con la previa desde las 13:00 y el partido desde las 15:00 .

Mira la programación en Red Uno Play",https://www.reduno.com.bo/deportes/scaloni-la-seleccion-argentina-juega-por-su-gente-2026717201628
Red Uno,2026-07-17,Economia,Sigue subiendo: El BCB fija el tipo de cambio oficial que regirá este fin de semana,"En la noche de este viernes, el Banco Central de Bolivia (BCB) publicó la nueva cotización oficial del dólar estadounidense que regirá en todo el territorio nacional a partir de las 00:00 horas de este sábado 18 de julio. La entidad financiera matriz determinó fijar el valor de la divisa extranjera en Bs 10,85 , en el marco del nuevo régimen flexible implementado recientemente en el país.

Según el reporte oficial del BCB, esta cotización no solo aplicará para la jornada sabatina, sino que estará vigente para el sábado 18, domingo 19 y lunes 20 de julio de 2026 , dando previsibilidad al mercado financiero durante el fin de semana e inicio de la próxima semana.

Balance semanal: Una tendencia al alza

El nuevo valor de Bs 10,85 consolida la tendencia alcista que ha marcado el comportamiento de la moneda estadounidense a lo largo de los últimos días. A continuación, repasamos la evolución cronológica de la tasa oficial durante esta semana:

Lunes 13 de julio: La semana arrancó con el dólar oficial ubicado en Bs 10,40 .

Martes 14 de julio: La divisa registró su primer movimiento con un incremento de diez centavos, subiendo a Bs 10,50 .

Miércoles 15 de julio: El valor oficial escaló de forma más pronunciada, sumando veinte centavos para posicionarse en Bs 10,70 .

Jueves 16 de julio: El BCB determinó mantener la tasa en Bs 10,70 , marcando una breve pausa en las subidas.

Viernes 17 de julio: La tendencia alcista se reanudó para el cierre de la semana laboral, fijándose la cotización en Bs 10,75 .

Sábado 18 de julio: Se establece el nuevo máximo semanal de Bs 10,85 .

Los agentes económicos y la población en general deberán tomar en cuenta esta tasa de Bs 10,85 para todas las operaciones oficiales y bancarias que se realicen hasta el final del día lunes, cuando el ente emisor publique una nueva variación.

Mira la programación en Red Uno Play",https://www.reduno.com.bo/economia/sigue-subiendo-el-bcb-fija-el-tipo-de-cambio-oficial-que-regira-este-fin-de-semana-202671720455
