sitio_noticias,fecha,seccion,titular,cuerpo,url
Unitel,2026-06-26,Economía,Filas por combustible: Dirigente del transporte cuestiona controles del Gobierno y dice que carburantes llegan certificados,"El dirigente del transporte pesado internacional, Pedro Quispe, señaló este viernes que el combustible importado ya llega al país con certificación y que aparentemente no requiere mayores análisis en los laboratorios de Yacimientos Petrolíferos Fiscales Bolivianos (YPFB).

“Señor presidente de Yacimientos, de la refinación ya tiene certificado, y hay otro certificado de la refinación a los buques. Cuando llega a los puertos peruanos y chilenos, hay otra certificación. No hay que mentir”, dijo Quispe a UNITEL.

MIRA AQUÍ: “Pedimos a YPFB cumplir con su compromisos”, dice dirigente de los choferes ante las filas por combustible

Las declaraciones surgen luego de que el Gobierno manifestara que la logística para verificar la calidad del combustible requiere tiempo debido a las pruebas que se realizan en los laboratorios de las plantas de YPFB. Por tal razón, aseguran que esta acción está provocando demoras en la distribución.

“El dilema es operativo. La capacidad de descarga de gasolina es de 238.000 litros por hora y la de diésel alcanza a 306.000 litros por hora. Todas las cisternas deben pasar pruebas de calidad en laboratorio y en eso estamos trabajando. Esa logística nos toma un poco más de tiempo”, dijo hace días el vocero presidencial, José Luis Gálvez.

Ante la posición del Gobierno, el dirigente insistió en que el combustible importado ya no necesita mayores análisis en las plantas de YPFB.

“ ¿El producto lo van a analizar en Senkata? Cuando el producto terminado ya tiene una certificación, basta de mentir al pueblo boliviano”, dijo.

Ante esto, el jefe de Planta de YPFB Logística en Palmasola, Mauricio Sainz, explicó que el proceso contempla cuatro etapas fundamentales: la verificación documental del origen del combustible por parte de YPFB y su corroboración por YPFB Logística, la toma de muestras por lote de importación, los análisis de laboratorio y la certificación final de los tanques antes de su despacho.

MIRA AQUÍ: Ministro Espinoza dice que crédito de $us 500 millones del BID permitirá reponer recursos usados en bonos sociales

“Sin certificado de origen, las cisternas no pueden descargar en la planta, ya sea que provengan de Paraguay, Argentina o de cualquier otro origen”, dijo Sainz, según una nota de prensa de la estatal petrolera.",https://unitel.bo/noticias/economia/filas-por-combustible-dirigente-del-transporte-cuestiona-controles-del-gobierno-y-dice-que-carburantes-llegan-certificados-GF21716099
Unitel,2026-06-26,Política,"Tras el fallecimiento de su alcalde, Ascensión de Guarayos realizará una nueva elección, anuncia el TED de Santa Cruz","El presidente del Tribunal Electoral Departamental (TED) de Santa Cruz, Marco Antonio Monasterio, informó que tras e l fallecimiento del alcalde de Ascensión de Guarayos, Pablo Guaristi, se realizará un nuevo proceso electoral en ese municipio de manera extraordinaria.

“ De acuerdo al reglamento que ha aprobado el TSE en la gestión 2022, por el fallecimiento de dos alcaldes en el departamento de Santa Cruz, aprobó el reglamento para la elección extraordinaria de la máxima autoridad ejecutiva de los Gobiernos Autónomos departamentales, regionales y municipales”, informó la autoridad.

Monasterios explicó que en la normativa aprobada, en su artículo 4, establece la obligación del Consejo Municipal o del Órgano Legislativo correspondiente de comunicar el fallecimiento de manera oficial al Tribunal Supremo Electoral para que se inicie todo el procedimiento presupuestario y se establezca el cronograma electoral.

MIRA AQUÍ: Fallece el alcalde de Ascensión de Guarayos tras meses de luchar con una enfermedad

Además, aclaró que “el Gobierno Municipal de Guarayos debe, de su presupuesto, cubrir con ese monto y en caso de que no lo cubra tenemos que ejecutar el débito automático con el Ministerio de Economía y Finanzas ”.

Agregó que, al ser un proceso extraordinario, no debe ser cubierto por el TSE ni por el Tesoro General del Estado (TGN).

La Alcaldía de Ascensión de Guarayos, en Santa Cruz, confirmó este viernes el fallecimiento de su alcalde Pablo Guaristi y lamentaron que el deceso se registra después de meses en que la autoridad edil estuvo luchando por su vida contra una enfermedad. Debido a esta situación, la Alcaldía de Ascensión de Guarayos declaró tres días de luto.

En mayo de 2025, Guaristi fue operado a raíz de problemas intestinales. No obstante, meses después su salud se complicó y tuvo que ser hospitalizado en una clínica privada, donde falleció.

MIRA AQUÍ: Piden ayuda para repatriar el cuerpo de Runy Callaú desde Brasil y darle el último adiós en Santa Cruz",https://unitel.bo/noticias/politica/tras-el-fallecimiento-de-su-alcalde-ascension-de-guarayos-realizara-una-nueva-eleccion-anuncia-el-ted-de-santa-cruz-LF21717950
Radio Panamericana,2026-06-26,economia,Fin del tipo de cambio fijo: El Gobierno flexibiliza la cotización del dólar y el BCB lo calculará diariamente según el mercado financiero,"El Estado Plurinacional de Bolivia ha modificado oficialmente su política monetaria. El Ministerio de Economía y Finanzas Públicas, en coordinación con el Banco Central de Bolivia (BCB), dispuso el abandono del tipo de cambio fijo para transitar hacia un régimen cambiario flexible. La medida busca sincerar el precio del dólar estadounidense frente al boliviano basándose en las dinámicas de oferta y demanda del sistema financiero.

Las causas estructurales de la flexibilización

A través de la Resolución Ministerial N° 245, emitida este 26 de junio de 2026, el Ministerio de Economía argumenta que la acumulación de Reservas Internacionales Netas (RIN), impulsada desde 2005 por las exportaciones de hidrocarburos de YPFB, se ha reducido de manera significativa.

El documento gubernamental admite que, debido al bajo nivel de disponibilidad de las RIN, la cantidad de divisas que el BCB vende al sistema financiero resulta insuficiente para cubrir la demanda de dólares en la economía. Esta escasez determinó la insostenibilidad del régimen de tipo de cambio fijo y propició la aparición de un tipo de cambio paralelo, variable y superior al oficial, generando una brecha cambiaria que afecta las finanzas públicas.

Con la flexibilización, el Ejecutivo busca corregir estos desequilibrios, fomentar las exportaciones, frenar la inflación y contribuir al equilibrio de la balanza de pagos.

El nuevo mecanismo: ¿Cómo se calculará el precio del dólar diario?

Para ejecutar esta política, el Directorio del BCB aprobó la Resolución N° 88/2026, poniendo en vigencia el nuevo Reglamento de Operaciones Cambiarias. Esta normativa establece una estricta metodología técnica para fijar el precio de la divisa norteamericana:

Promedio ponderado: El nuevo Tipo de Cambio Oficial (TCO) se calculará diariamente como resultado del promedio ponderado de las operaciones de compra de dólares con bolivianos.

Actores financieros: Se tomarán en cuenta únicamente las operaciones que realicen los Bancos Múltiples, los Bancos PymE y el Banco Público con sus clientes, excluyendo del cálculo las operaciones interbancarias.

Horarios y publicación: Las entidades financieras tendrán la obligación de reportar estas compras realizadas entre las 00:00 y las 17:00 horas de cada día hábil. Con esta información, el BCB publicará el nuevo TCO en su página web a horas 20:00, valor que entrará en vigencia para las operaciones y registros contables del día hábil siguiente.

Límite para la venta de dólares y régimen de sanciones

Una de las disposiciones más importantes del nuevo reglamento busca evitar la especulación desmedida en las ventanillas de los bancos. El BCB ha establecido la figura del ""Valor Referencial de Venta"", el cual resulta de sumar exactamente 10 centavos de boliviano al Tipo de Cambio Oficial (TCO) fijado para ese día. La norma prohíbe terminantemente a las Entidades Financieras vender dólares por encima de ese tope referencial.

Para garantizar la transparencia de este nuevo mercado flexible, el BCB y la Autoridad de Supervisión del Sistema Financiero (ASFI) realizarán inspecciones periódicas a las entidades bancarias. La normativa advierte que cualquier suministro de información falsa o la omisión selectiva de operaciones será procesada y sancionada como infracción.",https://www.panamericana.bo/articulo/economia/fin-tipo-cambio-fijo-gobierno-flexibiliza-cotizacion-dolar-bcb-calculara-diariamente-mercado-financiero/20260626220035016353.html
Radio Panamericana,2026-06-26,nacional,Denuncian que el contrabando de combustibles ha resurgido y que afecta al suministro,"La diputada paceña Julieta Jiménez se pronunció la mañana de este viernes acerca de los desafíos en el suministro de combustibles, señalando que ha identificado un resurgimiento del contrabando como factor clave que contribuye a la escasez.

Jiménez alertó que prácticas irregulares se están registrando en distintas estaciones de servicio y manifestó la necesidad urgente de que las autoridades tomen medidas más estrictas para controlar el fenómeno.

""Se debe reforzar el control en las fuentes de distribución para evitar que la problemática se agrave"", indicó la legisladora, quien también expresó su esperanza de que estos problemas no se conviertan en pretexto para incrementar la conflictividad, considerando que actualmente está vigente un estado de excepción.

La diputada enfatizó en la importancia de garantizar el acceso continuo y seguro al combustible, destacando que la salud y estabilidad social pueden verse afectadas si persisten las interrupciones en el suministro.

El llamado de Jiménez se produce en un momento sensible para el país, dado que el contrabando no solo limita la disponibilidad de productos estratégicos, sino que también genera impactos económicos y sociales negativos que requieren atención inmediata de las autoridades competentes.",https://www.panamericana.bo/articulo/nacional/denuncian-que-contrabando-combustibles-ha-resurgido-que-afecta-suministro/20260626145050016351.html
Radio Panamericana,2026-06-26,nacional,Vocero de Sol.Bo pide sanciones por consecuencias de bloqueos,"El vocero de Sol.Bo, José Luis Bedregal, resaltó la urgencia de definir responsabilidades y aplicar sanciones tras más de 50 días de bloqueos que afectaron al país, provocando daños que deben ser reparados.

Bedregal enumeró las consecuencias públicas derivadas de estas protestas prolongadas y enfatizó que corresponde asumir medidas para identificar a los responsables y sancionarlos conforme a la ley.

Durante el conflicto, el dirigente destacó que se presentaron actividades que entran en el ámbito penal, incluyendo secuestros, lo que agrava la situación y demanda un accionar riguroso.

El representante de Sol.Bo subrayó que las acciones deben ajustarse estrictamente a lo establecido en la Constitución, llamando a las autoridades a garantizar justicia y evitar impunidad en estos hechos.

Este pronunciamiento se da en un contexto de búsqueda de reparación de los daños causados por los bloqueos, mostrando la postura de Sol.Bo respecto a la necesidad de responsabilidad y sanciones que contribuyan a la restauración del orden y la paz social.",https://www.panamericana.bo/articulo/nacional/vocero-sol-bo-reclama-sanciones-consecuencias-bloqueos/20260626144018016350.html
Radio Panamericana,2026-06-26,nacional,Fundación en Bolivia inicia ayuda a familias venezolanas damnificadas,"La Fundación Equipo Solidario, con sede en Santa Cruz, ha lanzado una campaña para recolectar ayuda destinada a las familias venezolanas afectadas por los recientes sismos en su país. Omayrú Hernández, presidenta de la organización, anunció el inicio de esta iniciativa que busca sumar donaciones para integrarlas a los envíos comprometidos por el gobierno boliviano.

El principal punto de acopio está ubicado en la capital oriental del país, sin embargo, la fundación cuenta con delegados voluntarios en diversas regiones que también recogen medicamentos, alimentos no perecederos y otros insumos esenciales para los sectores más vulnerables.

Hernández agradeció la generosidad demostrada por la población boliviana en un contexto marcado por la crisis, y aseguró que los detalles para realizar donaciones están accesibles en las redes sociales oficiales de Equipo Solidario.

Este esfuerzo humanitario se suma a la reflexión del analista venezolano Luis Felipe Honor, quien destacó las deficiencias previas en materia de preparación y seguridad ante desastres naturales en Venezuela, y subrayó la importancia de aprender de esos errores para evitar futuras tragedias.",https://www.panamericana.bo/articulo/nacional/fundacion-inicia-ayuda-familias-venezolanas-damnificadas/20260626135026016345.html
Radio Panamericana,2026-06-26,nacional,Abogado Jeria señala mayor profundidad en caso del autogolpe de 2024,"El jurista Daymo Jeria Del Río, encargado de la defensa de efectivos militares procesados por la intentona de autogolpe del 26 de junio de 2024, expresó su preocupación por la evolución del caso al cumplirse dos años del suceso.

Jeria Del Río señaló que, a pesar del tiempo transcurrido, aún persisten numerosas dudas, lo que evidencia cómo el sistema judicial boliviano ha sido profundamente afectado por influencias políticas. ""Es reprochable que muchas interrogantes sigan sin resolverse"", manifestó.

El abogado advirtió que la complejidad y gravedad del caso podrían ser mayores de lo que aparentan en un primer momento. Además, previó que las consecuencias podrían extenderse más allá de Bolivia, afectando el ámbito internacional con eventuales acciones legales promovidas por los afectados.

Este caso, descrito originalmente como una asonada militar contra el gobierno, se ha convertido en un tema de interés nacional e internacional, y las investigaciones continúan en curso para esclarecer responsabilidades y hechos.

Desde su posición de defensor, Jeria Del Río enfatizó la necesidad de transparentar el proceso judicial para garantizar justicia en concordancia con los hechos investigados.",https://www.panamericana.bo/articulo/nacional/abogado-jeria-senala-mayor-profundidad-caso-autogolpe-2024/20260626135019016349.html
Radio Panamericana,2026-06-26,nacional,Viceministra Prado detalla plan para reactivar sector gastronómico,"La Paz, 26 de junio de 2026 - Sumaya Prado, viceministra de Gastronomía, ofreció detalles en Panamericana sobre las acciones emprendidas para recuperar el sector gastronómico tras las pérdidas ocasionadas por un extenso bloqueo que afectó al 90% de los restaurantes en el departamento de La Paz.

Prado explicó que la interrupción prolongada redujo significativamente la disponibilidad de alimentos e insumos esenciales, lo que a su vez provocó un aumento en los costos que impactó directamente en los negocios del sector.

Ante esta situación, el Ministerio de Turismo Sostenible, Culturas, Folklore y Gastronomía activó un plan de salvataje destinado a mitigar las consecuencias económicas.

La viceministra destacó que dentro de este plan se incluyen medidas específicas de alivio financiero que ya han sido anunciadas por el gobierno nacional. Además, adelantó que se implementarán nuevas estrategias de recuperación gradual para favorecer una estabilización económica sostenida.

Asimismo, Prado resaltó la importancia de mantener reuniones permanentes con representantes del ámbito gastronómico para escuchar sus necesidades y ajustar las acciones de apoyo en tiempo real.

Estas acciones buscan no solo la recuperación económica sino también la estabilidad laboral dentro del sector, afectado considerablemente por el bloqueo reciente que redujo la operatividad de la mayoría de los establecimientos gastronómicos en La Paz.",https://www.panamericana.bo/articulo/nacional/viceministra-prado-detalla-plan-reactivar-sector-gastronomico/20260626134655016348.html
Radio Panamericana,2026-06-26,nacional,MiTeleférico reporta daños por prolongados bloqueos sociales,"El gerente de MiTeleférico, Christian Eduardo Rojas, comunicó que la empresa enfrenta las consecuencias de más de 50 días de bloqueos y protestas sociales en La Paz. A pesar de las dificultades, destacó el compromiso del personal para atender a la población afectada mediante la activación de un ""plan de día atípico"".

Este plan contempla diversas medidas para garantizar el servicio durante la emergencia, como el aumento de la velocidad de transporte, la incorporación de cabinas adicionales y el ordenamiento de las filas para optimizar la atención de los usuarios.

Christian Rojas anunció que próximamente se emitirá un informe oficial que detallará los daños y perjuicios ocasionados a la empresa por estas contingencias. Este reporte permitirá diseñar e implementar planes de mantenimiento, reparación y mitigación para restablecer y mejorar la infraestructura del sistema de transporte por cable.

La situación ha generado un impacto significativo en la operatividad de MiTeleférico, servicio esencial para la movilidad urbana en La Paz, y el gerente manifestó la necesidad de contar con datos precisos para tomar decisiones que beneficien a los usuarios y aseguren la continuidad del servicio en condiciones óptimas.",https://www.panamericana.bo/articulo/nacional/miteleferico-evalua-danos-prolongados-bloqueos-sociales/20260626134407016346.html
Visión 360,2026-06-26,•La Paz,Asamblea de la Paceñidad estima daño millonario a la urbe y crea siete comisiones en busca de reactivar la economía de La Paz,"La Asamblea de la Paceñidad se reunió para tratar la situación de la ciudad de La Paz que, debido a los bloqueos de carreteras —que duraron más de 50 días—, quedó aislada del resto del país y, por tanto, sufrió un agudo desabastecimiento de alimentos, medicinas e insumos. La instancia interinstitucional, que estimó que la urbe sufrió un daño económico de entre $us 500 y $us 600 millones, creó siete comisiones con el fin de reactivar la economía del municipio.

“La Paz se encuentra frente a una de las crisis mayores. Algunos la han calificado peor a la del COVID, imagínense esa crisis a la que hemos llegado. Más de 50 días de bloqueo paralizaron nuestra ciudad. La pérdida de la ciudad equivale aproximadamente a 500 a 600 millones de dólares que se han perdido en estos 50 días”, indicó el alcalde paceño, César Dockweiler, durante el evento.

Además, el burgomaestre expresó que, al margen del daño económico, hubo un perjuicio al prestigio de la ciudad, porque los empresarios comenzaron a migrar a otros departamentos y los turistas optaron por cancelar las visitas que estaban previstas desde enero.

“Por tanto, tenemos una pérdida más allá de lo económico, una pérdida en lo reputacional”, dijo el alcalde y se refirió a los daños que sufrió el sector turístico, como la Cámara Hotelera, que reportó grandes pérdidas económicas y, además, registró cancelaciones durante todo el mes de junio.

Para ello, la Asamblea de la Paceñidad decidió crear siete comisiones con el fin de garantizar el cumplimiento de los acuerdos. Seis de estas comisiones están integradas por representantes del sector privado, micro y pequeños empresarios, gremiales, transportistas, artesanos, la academia y los gobiernos municipal y departamental. La séptima comisión coordinará directamente con el Gobierno nacional para canalizar financiamiento y alivios económicos destinados a los sectores más afectados.

Las comisiones son:

- Comisión de Producción, Comercio, Mercados y Ferias. - Comisión de Empleo e Inclusión Productiva. - Comisión de Producción y Seguridad Alimentaria. - Comisión de Turismo, Gastronomía y Cultura. - Comisión Metropolitana de Abastecimiento y Logística. - Comisión de Infraestructura, Riesgos y Resiliencia. - Comisión de Financiamiento y Agenda Nacional.

Además, la autoridad paceña indicó que el Gobierno central brindará su apoyo y que cuenta con una cartera preliminar de más de Bs 2.000 millones para invertir en la sede de gobierno.

Asimismo, la estrategia planteada por la Asamblea de la Paceñidad cuenta con un cronograma estricto de evaluación de resultados, que contempla cortes a los 30, 60 y 90 días.

Lee también: YPFB despachará 80 millones de litros de combustible para responder a la alta demanda en La Paz y Santa Cruz

“En 90 días, se deberá presentar un informe contundente con los primeros resultados y la normalización de la actividad económica”, señaló Dockweiler.

En un año se deberá lograr una economía totalmente reactivada y superior a los niveles previos. En un plazo de cinco años, el plan es posicionar a La Paz como la ciudad más competitiva e importante de Bolivia.

“Estamos convencidos de que si trabajamos de la mano el Gobierno Nacional, Departamental y Municipal, junto a los privados, gremiales, transportistas y toda la ciudadanía, vamos a superar este duro momento. No solo recuperaremos la economía, sino que la proyectaremos hacia un futuro promisorio”, manifestó el alcalde.",https://www.vision360.bo/noticias/2026/06/26/55132-asamblea-de-la-pacenidad-estima-dano-millonario-a-la-urbe-y-crea-siete-comisiones-en-busca-de-reactivar-la-economia-de-la-paz
