sitio_noticias,fecha,seccion,titular,cuerpo,url
Éxito Noticias Bolivia,2026-07-19,"NACIONAL, PORTADA",Justiniano: “Los incendios en Tarija fueron provocados por la mano del hombre y no quedarán impunes”,"Éxito Noticias, 19 de julio 2026.- El ministro de Defensa, Ernesto Justiniano Urenda, afirmó este domingo que los incendios forestales registrados en las comunidades de Quirusillas, Erquis y Tucumillas fueron provocados por la mano del hombre y advirtió que quienes resulten responsables no quedarán en la impunidad.

Tras el sobrevuelo de evaluación realizado junto al ministro de Obras Públicas, Mauricio Zamora; el viceministro de Defensa Civil, Roberto Rivero; y el comandante de la Unidad Militar de Emergencia y Ecología (UMEE), coronel DAEN Ángel Raúl López Estrella, las autoridades ofrecieron una conferencia de prensa en la que informaron sobre el estado de la emergencia, las acciones ejecutadas para combatir el incendio y las medidas que se asumirán para identificar y sancionar a quienes provocaron los focos de calor.

“Hemos visto varios focos de incendio, principalmente originados por chaqueos. Decirle a la gente que, por favor, evite la quema de pastizales; evite que la mano del hombre esté ocasionando todos estos problemas de incendios, porque con los fuertes vientos que tenemos en este momento son muy difíciles de controlar”, manifestó Justiniano.

La autoridad explicó que, gracias al trabajo desplegado durante los últimos tres días, los incendios se encuentran bajo control y, por el momento, no existen comunidades en riesgo inmediato. Sin embargo, advirtió que las labores continuarán hasta extinguir completamente los focos de calor.

En la misma línea, el comandante departamental de la Policía de Tarija, coronel Roger Roca Saavedra, informó que la institución ya abrió investigaciones de oficio para identificar a las personas que provocaron los incendios.

“La Policía, por intermedio del sistema de inteligencia e investigación, ya ha abierto de oficio una investigación para aquellas personas que estén realizando estas quemas de forma malintencionada o intencionada para generar zozobra en la sociedad. Tenemos casos abiertos con requerimiento del Ministerio Público y vamos a continuar con las investigaciones”, señaló.

El ministro Justiniano respaldó las investigaciones y fue enfático al señalar que los responsables deberán responder ante la justicia. “Se va a hacer la investigación correspondiente y se va a sancionar a aquellas personas que han iniciado los fuegos. Esto no puede quedar en la impunidad tampoco”, enfatizó.

El jefe policial también exhortó a la población a evitar cualquier quema y denunciar de inmediato la presencia de humo o nuevos focos de calor para permitir una respuesta oportuna de los equipos de emergencia.

Gobierno actúa con anticipación

Durante la conferencia de prensa, el ministro de Obras Públicas, Mauricio Zamora, destacó que el Gobierno nacional cambió la forma de enfrentar este tipo de emergencias, actuando antes de que la situación se salga de control.

“A diferencia del pasado, no estamos actuando hoy; estamos actuando hace días. No hemos esperado a que esto se desborde. Estamos trabajando con anticipación y en equipo bajo la línea de nuestro presidente Rodrigo Paz”, afirmó.

Zamora destacó que la coordinación entre el Ministerio de Defensa, Defensa Civil, las Fuerzas Armadas, la Policía Boliviana, los gobiernos subnacionales, los bomberos voluntarios y las comunidades permitió contener el avance del fuego antes de que alcanzara mayores dimensiones y afectara a la población.

Más de 200 personas continúan combatiendo el incendio

El comandante de la Unidad Militar de Emergencia y Ecología (UMEE), coronel Ángel Raúl López Estrella, informó que el incendio se encuentra controlado, aunque continúan las tareas de enfriamiento y liquidación de los focos de calor.

Precisó que alrededor de 200 personas permanecen desplegadas en la emergencia, entre 120 efectivos de las Fuerzas Armadas y 80 bomberos voluntarios, quienes trabajan de manera coordinada con la Policía Boliviana, el Servicio de Salvamento y Rescate de la Fuerza Aérea Boliviana (SAR-FAB) y las unidades militares acantonadas en Tarija.

Asimismo, indicó que las Fuerzas Armadas mantienen capacidad de respuesta inmediata para incrementar el operativo con 80 efectivos adicionales del Comando Estratégico del Chaco y, de ser necesario, movilizar personal y equipos especializados del Batallón de Bomberos Forestales de San Ignacio de Velasco, que podrían llegar a Tarija en un plazo aproximado de seis horas.

Las autoridades reiteraron el llamado a la población a evitar las quemas, denunciar cualquier foco de calor y colaborar con las tareas de prevención, al recordar que las condiciones climáticas, caracterizadas por fuertes vientos y vegetación seca, favorecen la rápida propagación del fuego y ponen en riesgo a las comunidades y al patrimonio natural del departamento de Tarija.",https://exitonoticias.com.bo/justiniano-los-incendios-en-tarija-fueron-provocados-por-la-mano-del-hombre-y-no-quedaran-impunes/397765/
Éxito Noticias Bolivia,2026-07-19,SOCIAL,Chuquiago Marka abre sus puertas gratis este domingo para disfrutar la final del Mundial 2026,"Éxito Noticias, 19 de julio 2026.- El Campo Ferial Chuquiago Marka abre sus puertas este domingo para que todos los fanáticos e hinchas del fútbol puedan ver de manera gratuita la gran final del Mundial 2026.

“Este domingo vive la gran final del Mundial 2026: Argentina versus España, en el Chuquiago. Disfruta toda la emoción del partido en una pantalla gigante de más de 100 m², además de gastronomía, juegos, fútbol tenis y actividades para compartir con la familia y los amigos”, invitó la institución mediante sus redes sociales.

Las puertas del campo ferial abrieron a las 12.00 de esta jornada con hinchas que ya hacían fila para poder ubicarse en un buen lugar, vestían las camisetas de Argentina y España mostrando el apoyo a sus equipos preferidos.

El director general ejecutivo de la Unidad de Coordinación de Programas y Proyectos, Rodny Miranda, detalló que son 2.000 sillas instaladas, también está el patio de comidas con emprendimiento gastronómicos para poder comer algo y puntos de hidratación.

“Realmente estamos con todo, ultimando todos los detalles. Hoy vamos a tener la presencia de mucha gente, de autoridades, van a venir ministros y viceministros, embajadores a vivir esta gran final, una final histórica”, señaló Miranda en contacto con Bolivia Tv, quien destacó que esta actividad es una iniciativa del Estado con empresas privadas para que la población paceña puede vivir esta cita deportiva.

La gran final del Mundial 2026 se jugará este domingo a las 15.00 entre España y Argentina, en un partido que promete mucho, ya que se conocerá si el equipo suadamericano logra ser bicampeón o el equipo español sale victorioso y gana su segundo título.

//ABI.",https://exitonoticias.com.bo/chuquiago-marka-abre-sus-puertas-gratis-este-domingo-para-disfrutar-la-final-del-mundial-2026/397769/
Opinión,2026-07-19,"Agua, Semapa, Alza, UFV, aumento, factura",¿Por qué aumentó mi factura de agua? Semapa responde si el alza se debe a las UFV,"“¿Por qué aumentó mi factura de agua?”. Ciudadanos en Cochabamba perciben la elevación en el costo del servicio de agua potable. El gerente general del Servicio Municipal de Agua Potable y Alcantarillado (Semapa), Luis Prudencio, responde sobre el alza y la relación que existe con las unidades de fomento a la vivienda (UFV).

Prudencio participó en entrevista en el programa ‘Opinión, Miradas y Gente - OMG’, y explicó las modificaciones de las tarifas del servicio de agua debido a la indexación a las unidades de fomento a la vivienda (UFV) y las categorías vigentes para los usuarios.

Durante las semanas recientes surgieron observaciones a las tarifas del servicio. Algunas autoridades advirtieron de la posibilidad de un ”tarifazo”, debido a los incrementos en los costos.

El gerente remarcó que la estructura tarifaria que se utiliza en la actualidad es de hace 25 años y que la estructura “por consumo” rige desde 2019.

Aclaró que, respecto a las UFV, existen resoluciones nacionales desde 2007. Antes, dijo, en el país la referencia era el dólar. Pero, luego, el Gobierno determinó que se indexe a las UFV (que existen desde 2001), que dependen de la inflación y que se enfocan, además, en la sostenibilidad de las instituciones. “La aplican para todos los servicios básicos, electricidad, gas, agua, alcantarillado”.

El Gerente de Semapa expresó que “hemos estado viviendo en una burbuja económica”, haciendo referencia a que el dólar se mantuvo en 6.96 bolivianos y las UFV entre 1.61 y 1.80 bolivianos.

“Entonces, hemos empezado a vivir una realidad en la que el tipo de cambio de 6.96 ha subido a 10 y la UFV ha subido hasta 3.30 más o menos”, sostiene, y asegura que la “crisis” de la UFV comenzó ya durante el Gobierno de Luis Arce, con la escasez de gasolina, el dólar y las bajas en inversiones, lo que deriva en la subida de las UFV.

Aseveró que esto repercute en que el poder adquisitivo sea menor en las familias.

“Yo creo que el análisis de las UFV no es un análisis que se tiene que hacer en un solo sector. Están tratando de satanizar. Veo declaraciones que dicen que va a incrementarse en 100%, en 50%, el 15%, 30%, como si fuese un tarifazo. Hay cosas que son internas, que las administramos nosotros; y las externas, que vienen del mercado. Las cosas internas, que vienen de nosotros, no tienen ningún incremento; no hemos hecho ningún tarifazo”, enfatiza.

Aclaró que, de no haber indexación a las UFV, la sostenibilidad de la empresa tampoco sería tarea fácil, debido a los incrementos de costos y la necesidad de inversiones, haciendo referencia a la compra de tuberías, renovación de colectores, entre otros.

“Tenemos que entender que este no es problema de una institución o de un servicio. Este problema de la indexación, mientras tu veas tu factura más elevada vas a decir ‘Semapa me está cobrando más’. Pero, lamentablemente, no es Semapa; es la inflación por la indexación a las UFV que te está generando esta situación”.

La autoridad reconoció que existen subidas para el bolsillo de los ciudadanos. “Como se ha incrementado la compra de carne, como nos ha incrementado la compra del pollo, como nos ha incrementado la compra de las verduras. O sea, no es una situación exclusiva de Semapa”.

Aseguró que no se trata de “armar” una estructura tarifaria para cobrarle más al vecino.

Sin embargo, para una familia promedio, en este caso usuaria de Semapa, hubo incrementos de “10 a 15 bolivianos” en los meses recientes. “tampoco es que incrementa al doble o al triple; tampoco es que incrementa al 100%. Se incrementa en proporción de las UFV”, explica, y agrega que puede aumentar o disminuir, dependiendo de “la economía de Bolivia”.

CATEGORÍA NO INDEXADA A LAS UFV El Gerente de Semapa manifestó que la categoría doméstica solidaria no está indexada a las UFV y que las familias que pertenecen a este grupo pagan de acuerdo al consumo de agua, siempre y cuando no sobrepase los 10 metros cúbicos al mes, como una forma de ‘premiar’ a quienes consumen menos agua.

Esta tarifa corresponde a 1.50 bolivianos por metro cúbico.

Afirmó que un 80% de vecinos de la zona sur se encuentran en esta categoría. En el centro y norte, se trata de entre un 10% y 15%.

El Gerente explicó que los vecinos que quieran estar en esta categoría solo deben hacer la solicitud a Semapa.

“Esa categoría, dentro su acápite, te permite que, si tu tienen menos de metros cúbicos de consumo, pagues a 1.50 (bolivianos). Hay que solicitar y hay que consumir menos de 10 metros cúbicos”.

Quienes pasan los 10 metros cúbicos mensuales, pasan de la categoría doméstica solidaria a la categoría doméstica.

En distritos como el 3, 4 y el 2, explica que existen “consumos más elevados” porque existen casas en las que viven varias familias. En esos casos, están categorizados en R1, R2, R3 y R4.

“24/7” Prudencio informó que un 80% de los usuarios de Semapa ya recibe agua las 24 horas del día durante los site días de la semana.

Recordó que antes, como ejemplo, en los distritos 1 y 2, en el norte de la ciudad, no existía el servicio las 24 horas, sino solo dos o tres veces a la semana. En la actualidad, sostiene, sí ocurre.

Acotó que en el centro también mejoró la dotación y que al sur llega el agua desde 2022 y que el caudal aumentó con agua de Misicuni.

Asevera que la cobertura ya llegó a un 91% de los usuarios de Semapa y que el 9% restante son viviendas de las zonas periféricas de diferentes distritos.",https://www.opinion.com.bo/articulo/cochabamba/que-aumento-factura-agua-semapa-responde-alza-debe-ufv/20260719195906993588.html
Opinión,2026-07-19,"España, Argentina, Mundial, Campeón, Mundial 2026",España venció a una Argentina sin respuestas y es campeona del Mundial por segunda vez,"La Furia Roja minimizó por completo a la Albiceleste y vuelve a conquistar el Mundial tras 16 años de espera (1-0).

Con un dominio de inicio a fin, España aplastó tácticamente a Argentina que en ningún momento encontró respuestas.

El esfuerzo defensivo de la escuadra sudamericana le permitió llevar la final hasta el alargue, pero con un jugador menos por la expulsión de Enzo Fernández y sin rematar ni una sola vez al arco, el muro argentino terminaría por ser derrotado.

Ferrán Torres liquidó todo al minuto 106 y sentenció el triunfo y alegría española que ahora es monarca de Europa y de todo el Mundo al igual que en la época gloriosa del 2008, 2010 y 2012.

Por su parte, Argentina culmina la Copa del Mundo siendo subcampeona y habiendo sobrevivido a varias eliminaciones cercanas en la previa.",https://www.opinion.com.bo/articulo/deportes/espana-vencio-argentina-respuestas-es-campeona-mundial-segunda-vez/20260719181832993593.html
Opinión,2026-07-19,"España, Deportes, Campeón, Mundial 2026",España derrota a Argentina y se proclama campeón del Mundial 2026,"España hizo historia en el Mundial 2026 al proclamarse campeón del mundo tras derrotar a Argentina con un gol en los últimos instantes del partido gracias a Ferrán Torres, disputado en el MetLife Stadium de Nueva Jersey.

En una final llena de emoción y tensión, ambas selecciones protagonizaron un duelo muy cerrado, donde los detalles marcaron la diferencia. Cuando el encuentro parecía encaminado a definirse en tiempo extra, la Roja encontró el gol de la victoria que le permitió levantar por segunda vez en su historia la Copa del Mundo, gracias Ferrán Torres.

El conjunto español volvió a tocar la gloria mundialista 16 años después de su primera conquista en Sudáfrica 2010, sumando una nueva estrella a su escudo y confirmando una generación que volvió a colocar a España en lo más alto del fútbol internacional.

Argentina, vigente campeona del mundo tras su título conseguido en Catar 2022, luchó hasta el final en busca de una nueva consagración, pero no pudo repetir la hazaña y terminó quedándose con el subcampeonato.

Con este triunfo, España se une nuevamente al grupo de selecciones que han logrado conquistar el máximo trofeo del fútbol, en una final que quedará marcada por la emoción, la intensidad y un gol que llegó en el momento decisivo para cambiar la historia del Mundial 2026.",https://www.opinion.com.bo/articulo/deportes/espana-derrota-argentina-proclama-campeon-mundial-2026/20260719181241993591.html
Opinión,2026-07-19,"El País, maletas",Las 31 maletas fueron internadas a Bolivia por una empresa aérea diferente a la que logró el permiso,"El ingreso a Bolivia de 31 maletas, por el aeropuerto de Viru Viru y su posterior desaparición, es un caso que literalmente se puede graficar como la punta de un iceberg desconocido y gigantesco. Grandes interrogantes no tienen respuesta hasta ahora, por ejemplo, qué es lo que contenía y quién pertenecía dichas valijas. Sin embargo, aparecen algunos datos. Uno de ellos es que el equipaje de la exdiputada Laura Rojas fue internado por un operador de aeronave que no corresponde con la que logró la autorización para el viaje desde California, Estados Unidos.

Una indagación del diputado Rolando Pacheco permitió establecer ese dato del vuelo del 29 de noviembre del año pasado y que estalló en esta gestión tras una denuncia pública. El periódico digital Urgente.bo accedió a ese documento.

“El 29 de noviembre, el vuelo charter Gulfstream G-550, con matrícula  N585JC, parte de Burbank, (California (Estados Unidos), con destino al aeropuerto internacional de Viru Viru. Conforme a la Declaración General presentada a las autoridades viajan a bordo la exdiputada Laura Rojas Ayala, el ciudadano italiano Gabriel Giuliano Leoni y dos menores de edad. La autorización de ingreso-salida fue a favor del operador Southern Cross Aircraft LLC. Sin embargo, el vuelo operó y presentó su declaración general bajo el nombre de una empresa distinta, Proflite LLC. Ninguna de las dos empresas registra entrada en el sistema Suma de la Aduana Nacional”, dice una nota enviada por el legislador de Alianza Popular a la Comisión Especial de Investigación del caso Maletas.

El dato fue obtenido por el diputado Pacheco a partir de una serie de peticiones de informe escrito con el fin de contribuir al esclarecimiento de un caso en el que se sospecha que las maletas contenían dinero para la compra de droga, según el propio documento.

De hecho, el informe precisa que a las 13.27 del 29 de noviembre, “el oficial de enlace de la Policía Federal de Brasil, Fernando Augusto Battaus, acreditado ante el CERIAN Santa Cruz, alerta al teniente Marvin Manzaneda, de la FELCN, que la aeronave transporta maletas con dinero presuntamente al pago de droga sobre la base de información previa de la agencia Homeland Security (HSI) de Estados Unidos”.

El caso se hizo público el 22 de enero y desató controversia nacional pues a partir de la denuncia mediática las instituciones públicas tomaron medidas. Se conoció que la exdiputada Rojas uso un pasaporte diplomático anulado para el retiro de las 31 maletas. Otro dato fue que la alerta emitida por el policía brasileño no provocó reacción alguna de la Policía Boliviana.

El dato del cambio de operador que internó a Bolivia las 31 maletas fue confirmado por el presidente de la Aduana en un informe solicitado por el diputado Pacheco.

“Finalmente se aclara que la autorización de ingreso – salida N° DGAC/ING/509/2025 de 29 de noviembre de 2025 emitida por la Dirección General de Aeronáutica Civil, la aeronave tipo Gulfstream V, con matrículo N585JC, estaba registrada a nombre del operador Southern Cross Aircraft LLC. Sin embargo, al momento del arribo de dicha aeronave el 20 de noviembre de 2025, la declaración general estaba registrada a nombre del operador Proflite LLC, diferente a la autorización emitida”, dice Alberto Soto De la Vía.",https://www.opinion.com.bo/articulo/pais/31-maletas-fueron-internadas-bolivia-empresa-aerea-diferente-que-logro-permiso/20260719160331993589.html
