sitio_noticias,fecha,seccion,titular,cuerpo,url
Radio Panamericana,2026-06-25,nacional,Desde LIBRE tomarán acciones legislativas que abordarán el caso ‘FANCESA-SOBOCE’ vinculado a Zapatero,"El diputado Santiago Ticona, representante del partido político “Libre” y parlamentario por Chuquisaca, informó sobre nuevas acciones legislativas para abordar el caso denominado “FANCESA-SOBOCE”. Este anuncio surge tras un informe presentado por la Unidad de Delincuencia Económica y Fiscal de España, el cual menciona gestiones presuntamente realizadas por el expresidente José Luis Rodríguez Zapatero ante autoridades bolivianas.

El caso refleja posibles interferencias en el sistema judicial boliviano y pone en evidencia falencias institucionales de la Procuraduría en Bolivia. Ticona señaló que existen varios implicados y enfatizó la preocupación de los legisladores chuquisaqueños ante esta situación.

El parlamentario no descartó la conformación de una comisión especial investigadora que convoque a autoridades actuales y anteriores, entre ellos el exprocurador general, Ricardo Condori, así como al actual Canciller, dada la relevancia de su rol en este contexto.

Las acciones legislativas buscan esclarecer responsabilidades y fortalecer la transparencia institucional frente a irregularidades que, de confirmarse, afectarían la confianza pública en la justicia boliviana.",https://www.panamericana.bo/articulo/nacional/acciones-legislativas-abordaran-caso-fancesa-soboce-bolivia/20260625131015016337.html
Visión 360,2026-06-25,•La Paz,Agricultura urbana: la UMSA enseñará a cultivar alimentos en casa como alternativa ante los desafíos de las ciudades,"Cultivar alimentos en espacios reducidos como terrazas, patios, balcones o macetas es una alternativa que la Universidad Mayor de San Andrés (UMSA) busca impulsar a través de una jornada gratuita de agricultura urbana, reciclaje y alimentación saludable, donde enseñará a la población técnicas para producir sus propios alimentos en la ciudad.

Sin reemplazar el papel de la producción agrícola del país, la agricultura urbana se presenta como una alternativa para complementar la alimentación del hogar y desarrollar mayor autonomía frente a situaciones difíciles, como el desabastecimiento y el encarecimiento de alimentos por los recientes conflictos sociales.

Durante la jornada, especialistas de la UMSA y profesionales invitados compartirán experiencias sobre el aprovechamiento de pequeños espacios para cultivar alimentos, el manejo responsable de residuos y la importancia de una alimentación saludable.

Lee también: Intensa granizada en Huajchilla provocó daños en cultivos de hortalizas y flores

El evento es gratuito, se realizará este viernes de 08:00 a 17:00 en el Paraninfo Universitario, en el Monoblock Central, y está dirigido a toda la población interesada en aprender prácticas que pueden aplicarse en patios, jardines, terrazas, balcones o incluso en macetas dentro de la casa.

“Queremos mostrar que sí es posible producir buenos alimentos en la ciudad y enseñar las técnicas para que las personas puedan replicarlas en sus hogares desde el conocimiento que tenemos”, explicó el Ing. Wilfredo Blanco, docente investigador de la Estación Experimental de Patacamaya, de la Facultad de Agronomía de la UMSA.

El especialista en cultivos de altura anunciará también un curso especializado de tres días y un programa gratuito de interacción social que se desarrollará entre julio y diciembre para formar a la población en agricultura urbana.

Blanco adelantó que, como parte de esta propuesta, presentará un proyecto para habilitar un huerto en la Facultad de Agronomía que permita, a futuro, enseñar de manera permanente técnicas de cultivo adaptadas a las condiciones de ciudades de altura como La Paz y El Alto.

La iniciativa busca que el conocimiento generado en la universidad llegue también a los hogares y contribuya a construir ciudades más sostenibles y familias mejor preparadas para enfrentar los desafíos del futuro.",https://www.vision360.bo/noticias/2026/06/25/54997-agricultura-urbana-la-umsa-ensenara-a-cultivar-alimentos-en-casa-como-alternativa-ante-los-desafios-de-las-ciudades
Visión 360,2026-06-25,•Polideportivo,Team femenino derrota a Argentina y suma su primer triunfo en el Sudamericano Sub-12,"Sports 360 / La Paz

La selección femenina de tenis obtuvo este jueves su primer triunfo en el Sudamericano Sub-12 que se desarrolla en Santa Cruz, al derrotar con una impecable remontada sobre Argentina (2-1).

“En la pasada jornada, los chicos sumaron su primera victoria en el certamen internacional al superar a Venezuela (2-1) por el Grupo A”, informó la Federación Boliviana de Tenis en un comunicado.

Para esta ocasión le tocó a la selección femenina, integrada por María Victoria Aguirre, Alexandra Gómez y Maite Chávez, con la capitana Belinda Marín.

Enfrentaron a Argentina en las canchas del Club de Tenis Santa Cruz, donde las visitantes se pusieron en ventaja por ganar en el primer single.

Pero después llegó la reacción del plantel nacional con dos triunfos seguidos. El segundo single lo ganó Aguirre a Emilia Dellavedova (6-3 y 6-4).

Mientras que el encuentro de dobles fue para Aguirre y Gómez ante Dellavedova y Morella Stancanelli: 0-6, 7-6(4) y 10-6.

El equipo masculino, compuesto por Sebastián Suárez, Matías Donoso y Rafael Pabón, además del capitán Javier Vidal, lucharon palmo a palmo con Perú, que al final salió vencedor por 2-1.

El único triunfo de Bolivia fue en parejas con Donoso y Suárez sobre Miguel Checa y Facundo Llerena: 6-0, 5-7 y 10-5.

Por el Grupo A de damas vencieron, Uruguay a Chile (2-1) y Ecuador a Paraguay (3-0); en tanto que, por el B, Perú derrotó a Venezuela (3-0).

Por el lado masculino del Grupo A, Venezuela ganó a Chile (2-1) y por el B, Ecuador superó a Uruguay (3-0) y Argentina se impuso sobre Paraguay (3-0).

Los encuentros de la quinta jornada son estos: por el Grupo A femenino, Paraguay vs. Uruguay y Brasil vs. Ecuador (descansa Chile); mientras que, por el B, Venezuela vs. Argentina y Colombia vs. Perú (descansa Bolivia).

Los duelos del masculino en el Grupo A son: Bolivia vs. Chile y Brasil vs. Perú (descansa Venezuela); en tanto que, por el B, Paraguay vs. Ecuador y Colombia vs. Argentina (descansa Uruguay).",https://www.vision360.bo/noticias/2026/06/25/55045-team-femenino-derrota-a-argentina-y-suma-su-primer-triunfo-en-el-sudamericano-sub-12
Visión 360,2026-06-25,•Polideportivo,Unos 100 ajedrecistas participarán este domingo en el Intercolegial Casa Argentina,"Sports 360 / La Paz

Con la participación de aproximadamente 100 ajedrecistas, este domingo se llevará adelante la sexta edición del Torneo Intercolegial Casa Argentina 2026 en La Paz, donde estarán en disputa dos modalidades: Rapid y Blitz.

Este certamen, que ya se volvió tradicional en la sede de Gobierno y es organizado de forma conjunta entre el Club Blitz y Casa Argentina, entregará como premio principal un trofeo rotativo para la unidad educativa ganadora.

“Para este torneo esperamos tener unos 100 ajedrecistas entre todas las categorías”, dijo el Maestro Nacional (MN) Kevin Celis, representante del Club Blitz.

Habrá dos modalidades de competencia: Rapid (a 7 rondas de 10 minutos) y Blitz (a 9 rondas de 5 minutos).

Estarán habilitadas seis categorías: Baby Chess (de kínder a primero de Primaria), Primaria A (segundo y tercero de Primaria), Primaria B (de cuarto a sexto), Secundaria A (de primero a tercero), Secundaria B (de cuarto a sexto) y Magistral (para jugadores con Elo Fide),

El torneo se disputará en instalaciones de Casa Argentina: zona de Sopocachi, avenida 6 de Agosto, casi esquina Pedro Salazar #2535.

El costo de inscripción es de 55 bolivianos para el torneo Rapid, 40 para el Blitz y 70 por ambos.

Los interesados en registrarse deberán llamar a Celis: 77428019.

Como premios, aparte del trofeo rotativo, también se entregarán copas a los ganadores de cada categoría, además de medallas y diplomas a los tres primeros de cada grupo.

Serán repartidos en total 14 trofeos, 100 medallas y el trofeo rotativo para el campeón.",https://www.vision360.bo/noticias/2026/06/25/55033-unos-100-ajedrecistas-participaran-este-domingo-en-el-intercolegial-casa-argentina
Visión 360,2026-06-25,•Polideportivo,La Liga Superior Femenina vuelve con la disputa de cuatro partidos en Tarija,"Sports 360 / La Paz

Este fin de semana, en la ciudad de Tarija, se llevarán adelante cuatro partidos del XXIX Campeonato Liga Superior Femenina de Voleibol, que regresa a la actividad.

“Cuatro clubes participarán en estos encuentros: el local Universitario, el orureño América y los cochabambinos Albert Einstein y San Martín”, informó la Federación Boliviana de Voleibol en una nota de prensa.

Los partidos, que se llevarán adelante en el coliseo La Pampa, son los siguientes: el sábado se enfrentarán América vs. Albert Einstein (18.00) y Universitario vs. San Martín (19.30).

Mientras que el domingo los encuentros serán en horario matutino: San Martín vs. América (10.00) y Albert Einstein vs. Universitario (11.30).

En esta edición de la Liga Superior, en la que participan ocho clubes —en lugar de los seis que habitualmente estaban— los cuatro primeros de la Fase Regular avanzarán a la Fase Final, en tanto que los cuatro últimos lucharán por no descender, ya que dos clubes perderán la categoría.

En la Fase Regular cada club jugará un total de siete partidos y esa es la cantidad que ya disputaron Olympic y San Simón, que ocupan las dos primeras plazas de la tabla de posiciones y que ya aseguraron su pase a la siguiente ronda.

Olympic terminó primero con puntaje perfecto al imponerse en los siete partidos que jugó y por ello tiene 14 puntos, mientras que San Simón lo escolta con 12.

San Martín se ubica tercero con nueve unidades en cinco partidos, lo que significa que le quedan dos encuentros más por jugar y en el peor de los casos llegará a 11 si pierde ambos partidos.

Pero ello no es suficiente para instalarse en la Fase Final, ya que mínimo debe llegar a 13 para ser inalcanzable por el resto.

El paceño Olympic (seis puntos en cinco partidos), el también paceño San Antonio Galas (seis en cinco), Albert Einstein (seis en cinco), el tarijeño Universitario (dos en dos) y el orureño América (dos en dos), siguen en competencia y lucharán por los dos últimos cupos a la Fase Final.",https://www.vision360.bo/noticias/2026/06/25/54994-la-liga-superior-femenina-vuelve-con-la-disputa-de-cuatro-partidos-en-tarija
Visión 360,2026-06-25,•Seguridad,Cocaleros retoman el control del retén antidrogas de El Castillo y bloquean el paso tras retiro de Umopar,"Sectores movilizados de Villa Tunari retomaron este miércoles el control del retén antidrogas de El Castillo e instalaron un bloqueo en la zona, pocas horas después de que efectivos de la Unidad Móvil de Patrullaje Rural (Umopar) retornaran al lugar tras más de un mes de repliegue, según reporte de Unitel desde el lugar.

La presión de los movilizados, que detonaron petardos e instalaron un punto de bloqueo, obligó a los uniformados a retirarse nuevamente hacia Chimoré para evitar enfrentamientos.

La tensión se generó luego de que los efectivos retornaran este jueves a las instalaciones, que habían permanecido sin presencia policial desde el 18 de mayo, cuando campesinos de los sindicatos del Chapare forzaron el repliegue para evitar incidentes.

Tras conversaciones con pobladores del sector, Umopar había logrado reocupar el retén; sin embargo, los movilizados que mantenían una vigilia en la zona se reorganizaron y avanzaron nuevamente sobre el punto de control, reinstalando el bloqueo que impide el paso de vehículos y personas.

El puesto de control de El Castillo, ubicado en el municipio de Villa Tunari, es considerado estratégico para las tareas antidrogas en la región.",https://www.vision360.bo/noticias/2026/06/25/55039-cocaleros-retoman-el-control-del-reten-antidrogas-de-el-castillo-y-bloquean-el-paso-tras-retiro-de-umopar
Visión 360,2026-06-25,•Seguridad,Magistratura revisará proceso del fallo que favoreció a Soboce tras revelarse gestiones de Zapatero,"Después de denunciarse presuntas influencias del expresidente español José Luis Rodríguez Zapatero en un fallo judicial que liberó de un pago millonario a la empresa Soboce, el Consejo de la Magistratura intervendrá para determinar si hubo irregularidades en el proceso de resolución de la Sala Constitucional Segunda del Tribunal Departamental de Justicia de La Paz.

El presidente de la Magistratura, Carlos Spencer, informó que se fiscalizará este proceso, que volvió a la palestra pública en las últimas horas tras revelarse en España las gestiones hechas por Rodríguez Zapatero ante el gobierno del expresidente Luis Arce para influir en el fallo que, finalmente, liberó a Soboce de pagar 107 millones de dólares a Fancesa.

“Vamos a hacer un levantamiento técnico y a determinar responsabilidades a través de Control y Fiscalización y de la Unidad de Transparencia. Si amerita procesos penales, también los vamos a iniciar. Pero primero se hacen los levantamientos técnicos para verificar todo el proceso que se haya podido suscitar en ese juzgado o sala, y así determinar responsabilidades”, explicó.

Lee también: Senadores de Libre proponen que una comisión investigue tráfico de influencias que involucra a Rodríguez Zapatero y al Gobierno de Arce

Fancesa acusó a Soboce de competencia desleal y el caso terminó en los tribunales bolivianos. En febrero de 2025, la Sala Civil del Tribunal Supremo de Justicia ratificó una sentencia que obligaba a Soboce a pagar 744.315.432 bolivianos a Fancesa.

Sin embargo, el 30 de mayo de 2025, la Sala Constitucional Segunda del Tribunal Departamental de Justicia de La Paz declaró procedente una acción de amparo presentada por Soboce y dejó sin efecto la sentencia y el pago, aunque la última palabra está en manos del Tribunal Constitucional Plurinacional.

La Unidad Central de Delincuencia Económica y Fiscal (UDEF) de España realizó la investigación y reveló que el expresidente recibió 200.000 euros por las gestiones realizadas ante el Gobierno de Arce y otras autoridades bolivianas en favor del conglomerado peruano Grupo Gloria, propietario de Soboce.

Lee también: Investigación revela que Rodríguez Zapatero usó su influencia en Bolivia para librar a Soboce del pago de $us 107 millones a Fancesa

En la investigación se mencionan contactos con la exministra de la Presidencia María Nela Prada y la exembajadora de Bolivia en España, Carmen Almendras, quien además es identificada como el vínculo entre el conglomerado empresarial y Rodríguez Zapatero.

Según la UDEF, los pagos fueron canalizados mediante un contrato de asesoría con la empresa peruana Focus Social Research, firma que los investigadores consideran una “sociedad interpuesta” utilizada para justificar transferencias que estarían vinculadas a gestiones en favor del Grupo Gloria y de la Sociedad Boliviana de Cemento (Soboce).

Spencer aclaró que el trabajo del Consejo de la Magistratura en este caso no anula ni revisa la sentencia, sino el procedimiento aplicado hasta llegar al fallo.",https://www.vision360.bo/noticias/2026/06/25/54985-magistratura-revisara-proceso-del-fallo-que-favorecio-a-soboce-tras-revelarse-gestiones-de-zapatero
Visión 360,2026-06-25,•Seguridad,Ministro Justiniano asegura que Morales “no se resigna” a que su ciclo político acabó cuando habla de “guerra civil”,"Cuando Evo Morales habla de una “guerra civil” si se intenta intervenir en el Chapare, devela que “no se resigna” a que su ciclo político acabó; como expresidente, debiera someterse a la justicia y evitar mayores conflictos, aseguró el ministro de Defensa, Ernesto Justiniano.

“Está en el imaginario de Evo Morales; no se resigna a que ha sufrido una especie de... podríamos decir —no me gustaría hablar de la derrota— pero sí, creo que ya, si bien los tiempos de los políticos nunca fenecen normalmente, creo que él no se da cuenta de que su ciclo ha terminado”, afirmó.

Durante una entrevista con la agencia internacional de noticias AP en el Chapare, el expresidente y dirigente de los cocaleros aseguró que “no hay motivo para intervenir, no hay bloqueos” en esta región y que, de darse algún intento, “están forzando que haya una guerra civil”.

“El que negocia su sobrevivencia no es digno. Yo nunca negocié. Defender la hoja de coca es defender la soberanía, la dignidad del pueblo. La guerra de la coca es mucho más que la guerra por el agua o por el gas. Cualquier intervención militar o policial la van a resistir”, advirtió.

Lee también: En los 200 años de la Policía, Paz asegura cárcel para responsables de los bloqueos y el fin de los ""dueños de territorios""

Según Justiniano, Morales, como expresidente, debiera evitar cualquier posibilidad de conflicto en el país y cumplir con su obligación de acudir a la justicia, donde tiene un proceso abierto por la denuncia de haber mantenido una relación con una menor de edad.

Desde noviembre de 2024 se encuentra “autoexiliado” en el Chapare para evitar su captura por el juicio que tiene abierto en Tarija. Periodistas de medios internacionales que llegaron hasta su reducto revelaron que cuenta con varios anillos de seguridad y una celosa vigilancia.

“Entonces, que trate de impedir la presencia del Estado en territorios del Trópico de Cochabamba realmente es algo que no corresponde, y vamos a hacer lo necesario para que esto no continúe”, aseguró el ministro, quien antes se desempeñó como viceministro de Defensa Social.

En un modesto acto por los 200 años de la Policía, el presidente Rodrigo Paz advirtió que se recuperará todo el territorio nacional, en clara alusión al Chapare.

“Acuérdense de lo que está diciendo este presidente hoy en día: en estos cinco años, cuatro y poco más que nos quedan, vamos a recuperar cada uno de los territorios que hoy día no nos pertenecen, porque algunos creen que es territorio no boliviano, que es territorio de algunas organizaciones o que es territorio que no pertenece a la soberanía nacional”, advirtió.",https://www.vision360.bo/noticias/2026/06/25/54943-ministro-justiniano-asegura-que-morales-no-se-resigna-a-que-su-ciclo-politico-acabo-cuando-habla-de-guerra-civil
Visión 360,2026-06-25,•Matices,"Tras dos postergaciones, definirán la suerte de la Larga Noche de Museos en una reunión a finales de junio","La suerte de la Larga Noche de Museos será definida en una reunión entre la Alcaldía y artistas, colectivos e instituciones culturales este próximo 30 de junio, tras las dos suspensiones que sufrió el evento. Inicialmente debía realizarse el 16 de mayo, pero fue postergado debido a los bloqueos y movilizaciones que afectaban a la urbe paceña.

Fuentes allegadas a la Alcaldía de La Paz confirmaron a Visión 360 que la reunión con los sectores que forman parte de la Larga Noche de Museos está prevista para el próximo martes 30 de junio, cuando se definirá el futuro del evento.

La confirmación va en línea con lo acordado el pasado 9 de junio, cuando la Alcaldía reprogramó por segunda vez la actividad. “En relación con la Larga Noche de Museos, por consenso, las y los participantes acordaron reprogramar nuevamente el evento (…) estableciendo el 30 de junio de 2026 para evaluar las condiciones existentes y definir una nueva fecha”, señalaba un comunicado.

Lee también: La Alcaldía suspende la “Larga Noche de Museos” y la reprograma para el 13 de junio

La primera postergación ocurrió el 9 de mayo, cuando la Alcaldía paceña suspendió el evento y lo reprogramó para el 13 de junio. En ambas ocasiones, la decisión estuvo motivada por los bloqueos de carreteras que, en el caso del departamento de La Paz, aislaron a las ciudades de La Paz y El Alto del resto del país.

En la última reunión entre la Alcaldía y los gestores culturales, se acordó activar de manera gradual 23 circuitos culturales durante los fines de semana, en el marco del Plan de Emergencia Municipal destinado a reducir el impacto de la situación sobre la actividad artística y cultural del municipio.",https://www.vision360.bo/noticias/2026/06/25/55006-tras-dos-postergaciones-definiran-la-suerte-de-la-larga-noche-de-museos-en-una-reunion-a-finales-de-junio
Visión 360,2026-06-25,•Mundo,"Caos y desolación en La Guaira, una ciudad destrozada por los derrumbes en Venezuela","EFE / La Guaira (Venezuela)

Se cuentan por miles las personas que este jueves se encuentran fuera de las edificaciones en La Guaira, donde la desesperación se siente en el aire ante la poca presencia de autoridades y cuerpos de rescate tras los terremotos del miércoles en Venezuela, que han causado al menos 164 fallecidos y 971 heridos. Los bomberos no dan abasto y la maquinaria pesada para levantar escombros es también escasa. Madres, hermanas, tíos, esposos lloran por sus seres queridos que quedaron atrapados entre los edificios derrumbados, mientras que otros no salen del shock y no tienen idea de qué harán ahora. Tampoco tienen claro dónde hay refugios. Patrullas de los organismos de seguridad transitan por las calles, pero no dan instrucciones. En la avenida 'El Ejército' de la ciudad de Catia La Mar casi todos los edificios están afectados. Sale humo de algunos edificios y un mercado municipal fue consumido por las llamas. Durante la mañana de este jueves un grupo de personas se aglomeraba en una panadería esperando recibir comida, después de que en la madrugada hubo saqueos en algunos comercios. ""No se puede explicar (lo que pasó). Es una cuestión de segundos, se te paraliza todo"", relató a EFE Ana Echeverría, una comerciante de 45 años, que vio desplomarse su negocio producto de los terremotos. ""Yo pude evacuar mi personal porque en el momento tenía mi teléfono en la mano y me dijo: sismo Curazao, Caracas, alerta (…) Logramos salir, gracias a Dios no hubo personas heridas"", agregó. Pero inmediatamente después de pasar los terremotos llegó gente a saquear la comida de su negocio. ""La gente quería comida, porque no tenían nada. Eso fue horrible, horrible"", detalló la mujer, sentada en una silla al frente de su negocio, junto a su hija adolescente. La ciudad no tiene electricidad ni tampoco señal telefónica. Está prácticamente aislada porque las vías de acceso además han empezado a ser cerradas. La presidenta encargada de Venezuela, Delcy Rodríguez, ha confirmado hasta ahora 164 muertos y 971 heridos a causa de los dos potentes terremotos que sacudieron este miércoles el país, donde aseguró se han contabilizado 30 réplicas en las últimas horas. Rodríguez ratificó que La Guaira, un estado costero en el norte del país y vecino a Caracas, es el estado más afectado por los terremotos e indicó que ha sido declarado ""zona de desastre natural por la cantidad de edificios que colapsaron"", cuya cantidad no precisó de inmediato. El Caribe venezolano fue sacudido este miércoles por dos fuertes terremotos con apenas 39 segundos de diferencia, de magnitud 7,2 y 7,5, respectivamente. El Centro Nacional de Alerta de Tsunamis de Estados Unidos explicó que ambos temblores conformaron un ""doblete sísmico"", un fenómeno en el que dos terremotos de gran magnitud ocurren con pocos segundos de diferencia en la misma zona.",https://www.vision360.bo/noticias/2026/06/25/55030-caos-y-desolacion-en-la-guaira-una-ciudad-destrozada-por-los-derrumbes-en-venezuela
